Title,Author,Original Price,Discounted Price,URL,Image,Summary,Book_Title,Book_Author,Translator,Editor,Publisher,ISBN,Edition,Number Of Pages,Country,Language
অপরূপকথা,ফণিভূষণ রায়,TK. 36,"",https://rokomari.com//book/168452/oporupkotha,https://ds.rokomari.store/rokomari110/ProductNew20190903/130X186/book_av.png,"",অপরূপকথা,ফণিভূষণ রায়, , ,শাণ্ডিল্য প্রকাশন (ভারত), ,2009, ,ভারত,বাংলা
ভক্তবলয়,শ্রীগুরুপ্রসন্ন ভট্টাচার্য,TK. 225,"",https://rokomari.com//book/168457/voktoboloy,https://ds.rokomari.store/rokomari110/ProductNew20190903/130X186/book_av.png,"",ভক্তবলয়,শ্রীগুরুপ্রসন্ন ভট্টাচার্য, , ,শাণ্ডিল্য প্রকাশন (ভারত), ,2009, ,ভারত,বাংলা
শ্রীশ্রী ঠাকুর অনুকূলচন্দ্রের বাকসুধা: শ্রীশ্রী ঠাকুরেরে সংক্ষিপ্ত বাণীগ্রন্থ,ফণিভূষণ রায়,TK. 108,"",https://rokomari.com//book/168458/shreeshree-thakur-onukulchondraer-baksudha--shreeshree-thakurer-songkipto-banhigronto,https://ds.rokomari.store/rokomari110/ProductNew20190903/130X186/book_av.png,"",শ্রীশ্রী ঠাকুর অনুকূলচন্দ্রের বাকসুধা: শ্রীশ্রী ঠাকুরেরে সংক্ষিপ্ত বাণীগ্রন্থ,ফণিভূষণ রায়, , ,শাণ্ডিল্য প্রকাশন (ভারত), ,2011, ,ভারত,বাংলা
শীর্ষেন্দু- সাহিত্যে ঠাকুর- অনুকুলচন্দ্র,ফণিভূষণ রায়,TK. 180,"",https://rokomari.com//book/168459/shirshendhu-sahitya-thakur-onukulchonra,https://ds.rokomari.store/rokomari110/ProductNew20190903/130X186/book_av.png,"",শীর্ষেন্দু- সাহিত্যে ঠাকুর- অনুকুলচন্দ্র,ফণিভূষণ রায়, , ,শাণ্ডিল্য প্রকাশন (ভারত), ,2011, ,ভারত,বাংলা
ভক্তবলয়: শ্রীশ্রীঠাকুর অনুকুলচন্দ্রের আদি ও মধ্যযুগের লীলা-পার্ষদ্-চরিত,ফণিভূষণ রায়,TK. 234,"",https://rokomari.com//book/168461/voktoboloy--shreeshreethakur-onukulchondraer-adi-o-modyajuger-lila-parshad-chorito,https://ds.rokomari.store/rokomari110/ProductNew20190903/130X186/book_av.png,"",ভক্তবলয়: শ্রীশ্রীঠাকুর অনুকুলচন্দ্রের আদি ও মধ্যযুগের লীলা-পার্ষদ্-চরিত,ফণিভূষণ রায়, , ,শাণ্ডিল্য প্রকাশন (ভারত), ,2012, ,ভারত,বাংলা
বিংশোত্তর শতদীপালোকে শ্রীশ্রীঠাকুর অনুকুলচন্দ্র [শ্রীশ্রীঠাকুর বিষয়ক একশ কুড়িটি নিবন্ধ ও টিকাসহ গ্রন্থ,ফণিভূষণ রায়,TK. 288,"",https://rokomari.com//book/168464/bingshottor-shotodipaloke---shreeshreethakur-onukulchondro---shreeshreethakur-bishoyak-eksho-kurhiti-nibondho-o-tikasoho-grontho-,https://ds.rokomari.store/rokomari110/ProductNew20190903/130X186/book_av.png,"",বিংশোত্তর শতদীপালোকে শ্রীশ্রীঠাকুর অনুকুলচন্দ্র [শ্রীশ্রীঠাকুর বিষয়ক একশ কুড়িটি নিবন্ধ ও টিকাসহ গ্রন্থ,ফণিভূষণ রায়, , ,শাণ্ডিল্য প্রকাশন (ভারত), ,2012, ,ভারত,বাংলা
ঠাকুর অনুকূলচন্দ্র বিষয়ক প্রফুল্ল- নিবন্ধাবলী ও শতবর্ষ স্মরণিকা,শিখা রায়,TK. 243,"",https://rokomari.com//book/168467/thakur-onukulchondro-bishoyk-profullo-nibandhabali-o-shatoborsho-smronikha,https://ds.rokomari.store/rokomari110/ProductNew20190903/130X186/book_av.png,"",ঠাকুর অনুকূলচন্দ্র বিষয়ক প্রফুল্ল- নিবন্ধাবলী ও শতবর্ষ স্মরণিকা,"শিখা রায়,ফণিভূষণ রায়", , ,শাণ্ডিল্য প্রকাশন (ভারত), ,2012, ,ভারত,বাংলা
শ্রী শ্রী ঠাকুর-কথিত গল্পকথা,শীর্ষেন্দু মুখোপাধ্যায়,TK. 108,"",https://rokomari.com//book/168455/shree-shreethakur-kotito-golpokota,https://ds.rokomari.store/rokomari110/ProductNew20190903/130X186/book_av.png,"",শ্রী শ্রী ঠাকুর-কথিত গল্পকথা,শীর্ষেন্দু মুখোপাধ্যায়, , ,শাণ্ডিল্য প্রকাশন (ভারত), ,2009, ,ভারত,বাংলা
