Title,Author,Original Price,Discounted Price,URL,Image,Summary,Book_Title,Book_Author,Translator,Editor,Publisher,ISBN,Edition,Number Of Pages,Country,Language
ভুল দরোজা এবং পুরনো অসুখ,নাজনীন খলিল ,TK. 125,TK. 119,https://rokomari.com//book/98185/bhul-doroja-ebong-purono-osukh,https://ds.rokomari.store/rokomari110/ProductNew20190903/130X186/9b73c580b_98185.jpg,"""ভুল দরোজা এবং পুরনো অসুখ"" বইয়ের ফ্ল্যাপের লেখা:

তুমি মেঘমল্লার হতে চেয়েছিলে ; অথচ বর্ষা। তােমার প্রিয় ঋতু ছিলনা । তােমার কড়ে আঙ্গুলে এই প্রবল সত্য। বারবার ফুটে উঠেছে আর তুমি লুকিয়ে ফেলেছাে তােমার। আঙ্গুল, নখরসুদ্ধ । তারও বহু আগে আমি ছুঁয়ে ফেলেছি তােমার হাত বিষনখ এবং আগুন।
পুড়ছে অথবা বিষিত --
'মেঝেতে পড়ে থাকা আপাতঃনিরীহ। পােকাটাই। একদিন কিলবিলে শরীর বেয়ে ঠিক পৌঁছে। যাবে মগজের প্রগাঢ়প্রকোষ্ঠে । নীলব্যথায় কাতরাতে কাতরাতে তুমি ছুঁতে চাইবে এক বিষন্ন বরফ।
একদিন তুমি ঠিকই জানবে আকাশ এক প্রখর হাহাকারের শূন্যশব্দ ছাড়া। আর কিছু নয়..",ভুল দরোজা এবং পুরনো অসুখ,নাজনীন খলিল, , ,মুক্তগদ্য, ,"1st Published,2015",64,বাংলাদেশ,বাংলা
