Title,Author,Original Price,Discounted Price,URL,Image,Summary,Book_Title,Book_Author,Translator,Editor,Publisher,ISBN,Edition,Number Of Pages,Country,Language
Alice in Wonderland,ইয়োং লার্নার,TK. 180,"",https://rokomari.com//book/173001/alice-in-wonderland,https://ds.rokomari.store/rokomari110/ProductNew20190903/130X186/2ada9bf1f_173001.jpg,"",Alice in Wonderland,Young Learner, , ,Young Learners,9788188370009,"1st Edition,2014",16,India,English
Encyclopedia of Science Projects ,প্যাম রবসন,TK. 891,"",https://rokomari.com//book/50591/encyclopedia-of-science-projects,https://ds.rokomari.store/rokomari110/ProductNew20190903/130X186/5895ba9d18a4_50591.jpg,"Every project in this ENCYCLOPEDIA is interesting to do and intriguing to watch. Each uses readily available, everyday materials and includes detailed instructions and diagrams to ensure your success, as well as helpful suggestions for exhibition. Whether you want to discover how things work or investigate about Air, Water, Electricity, Magnetism, Sound, Light and many more, you will find a surefire science-fair winner to satisfy your curiosity.

Be sure to follow the instructions carefully while performing a project under the supervision of an adult.",Encyclopedia of Science Projects,Pam Robson, , ,Young Learners,9788188370702,"1st Editon,2012",288,India,English
The Charismatic Guru Nanak ,মি. রুনগিন সিং,TK. 306,"",https://rokomari.com//book/53031/the-charismatic-guru-nanak,https://ds.rokomari.store/rokomari110/ProductNew20190903/130X186/rokimg_2111_53031.GIF,"",The Charismatic Guru Nanak,Mrs Rungeen Singh, , ,Young Learners,9788189852436,"1st Edition,2012",160,India,English
"Childrens Reference Encyclipedia-Sports, Arts and Entertainment ",ফ্রাঙ্ক এম হোয়াইট,TK. 230,"",https://rokomari.com//book/50521/childrens-reference-encyclipedia-sports--arts-and-entertainment,https://ds.rokomari.store/rokomari110/ProductNew20190903/130X186/book_av.png,"","Childrens Reference Encyclipedia-Sports,Arts and Entertainment",Frank M White, , ,Young Learners, , , ,Bangladesh,English
The Best of Tenali Raman ,মি. রুনগিন সিং,TK. 306,"",https://rokomari.com//book/52939/the-best-of-tenali-raman,https://ds.rokomari.store/rokomari110/ProductNew20190903/130X186/rokimg_2111_52939.GIF,"",The Best of Tenali Raman,Mrs Rungeen Singh, , ,Young Learners,9788189852498,"1st Edition,2011",160,India,English
