Title,Author,Original Price,Discounted Price,URL,Image,Summary,Book_Title,Book_Author,Translator,Editor,Publisher,ISBN,Edition,Number Of Pages,Country,Language
The Art of the Start,গুয়ে কাওয়াসাকি,"TK. 1,438","",https://rokomari.com//book/90855/the-art-of-the-start,https://ds.rokomari.store/rokomari110/ProductNew20190903/130X186/rokimg_20140931_90855.gif,"Summary Of The Book

A new idea is what drives anyone who wishes to make the world a better place. An idea is what seeds the next big thing, a new company or a killer app. But what does it take to turn that idea into action and reality?

The Art Of The Start: The Time-Tested, Battle-Hardened Guide For Anyone Starting Anything gives the reader the answer to this question. It is a helpful guide for anyone wishing to introduce a new product or service in the market. With answers to important questions such as turning one's dream into a reality, acquiring the right talent and funds for it, launching, positioning and branding a product or service, this book is a must-read for budding entrepreneurs. Backed by over twenty years of experience as one of the business world's best known strategist and serial entrepreneur, Guy Kawasaki gives the reader profound insights into beginning anything new, be it a billion dollar company or a not for profit organization.

With personal excerpts from his days at Apple and Garage Technology Ventures, he gives the reader time-tested and proven techniques on raising funds, selling, brand building and recruiting. He also talks about some unconventional ways of building companies and attracting customers.

From raising the required funds to start a new venture to attracting the right talent to run it, and creating a brand to creating the right amount of buzz around it, The Art Of The Start: The Time-Tested, Battle-Hardened Guide For Anyone Starting Anything takes the reader on a journey that promises to be more art than science.

About Guy Kawasaki

Guy Kawasaki is an author, speaker, business advisor and investor.

A few books that he has authored are APE: Author, Publisher, Entrepreneur - How To Publish A Book, How To Drive Your Competition Crazy, The Computer Curmudgeon and Reality Check.

Kawasaki was born on August 30, 1954 in Honolulu, Hawaii. He completed his schooling from the Iolani School. In 1976, he graduated from Stanford University with a B.A. in Psychology and earned his MBA from the UCLA Anderson School of Management in the following year. He has worked for companies like Nova Stylings, Apple and ACIUS. Kawasaki is also the founder and co-founder of various companies like Fog City Software, Garage Technology Ventures, Truemors and Alltop.",The Art of the Start,Guy Kawasaki, , ,Portfolio,9781591840565, , ,Abroad,English
Greed ,এলফ্রিডে ইয়েলিনেক,"TK. 1,610","",https://rokomari.com//book/84639/greed,https://ds.rokomari.store/rokomari110/ProductNew20190903/130X186/rokimg_20140716_84639.gif,"Kurt Janisch is an ambitious, but frustrated, country policeman. Things are not going right in his life - at least not fast enough. But a country policeman gets talking to a lot of people in the line of duty - particularly women. Lonely, middle-aged women, women with a bit of property perhaps ... Matters go from bad to worse: for Kurt Janisch, for the women who fall for him. Someone sees too much, knows too much. Soon there's a body in a lake and a murderer to be caught.

Set amid the mountains and small towns of southern Austria, Greed is a powerful reflection on ageing. As always, Jelinek gives the reader a lot to think about: the ecological costs of affluence, the inescapable burden and inadequacy of everyday words, the exploitative nature of relations between men and women, the impossibility of life without relationships. In Greed Jelinek expresses her love/hate relationship with Austria: it is a mesmerising portrait of evil.

About the Author
Elfriede Jelinek was born in Austria in 1946 and grew up in Vienna where she attended the renowned Music Conservatory. The leading Auatrian writer of her generation, she has been awarded the Heinrich Boll Prize for her contribution to German Literature, the Georg Buchner Prize, and in 2004 she was awarded the Noble Prize for Literature. The film by Michael Haneke of The Piano Teacher won the three main prizes at Cannes in 2001.",Greed,Elfriede Jelinek, , ,Portfolio,9781846686665,"1st Edition,2011",352,India,English
Lust ,এলফ্রিডে ইয়েলিনেক,"TK. 1,643","",https://rokomari.com//book/84641/lust,https://ds.rokomari.store/rokomari110/ProductNew20190903/130X186/aae4e4c180e4_84641.jpg,"",Lust,Elfriede Jelinek, , ,Portfolio,9781852421830,"1st Edition,1992",208,India,English
Women as lover,এলফ্রিডে ইয়েলিনেক,"TK. 1,440","",https://rokomari.com//book/84642/women-as-lover,https://ds.rokomari.store/rokomari110/ProductNew20190903/130X186/rokimg_20140716_84642.gif,"The setting is an idyllic Alpine village where a woman?s underwear factory nestles in the woods. Two factory workers, Brigitte and Paula, dream and talk about finding happiness, a comfortable home and a good man. They realize that their quest will be as hard as work at the factory. Brigitte subordinates her feelings and goes for for Heinz, a young, plump, up-and-coming businessman. With Paula, feelings and dreams become confused. She gets pregnant by Erich, the forestry worker. He?s handsome, so they marry. Brigitte gets it right. Paula gets it wrong. Using the conventions and language of romantic fiction, Elfriede Jelinek has written a moving tragedy whose power lies in its refusal to take at face value its characters? dreams and aspirations.",Women as lover,Elfriede Jelinek, , ,Portfolio,9781852422370,"1st Edition,1995",208,India,English
Wonderful wonderful time ,এলফ্রিডে ইয়েলিনেক,TK. 711,"",https://rokomari.com//book/84643/wonderful-wonderful-time,https://ds.rokomari.store/rokomari110/ProductNew20190903/130X186/rokimg_20140716_84643.gif,"It is the late 1950s. A man is out walking in a park in Vienna. He will be beaten up by four teenagers, not for his money or anything he may have done to them, but because the youths are arrogant and very pleased with themselves. This arrogance is their way to reacting to the decaying corpse that is Austria, where everyone has a closet in which to hide their Nazi histories, their sexual perversions, and their hatred of the foreigner.

In fierce, exhilarating prose, Elfriede Jelinek shows in Wonderful, Wonderful Times how the present is corrupted by the crimes of the past.

About the Author
Elfriede Jelinek was born in the Austrian alpine resort of Murzzuschlag and grew up in Vienna, where she attended the famous Music Conservatory. The leading Austrian writer of her generation, her other works include Women as Lovers, Lust, and The Piano Teacher, now a prize winning film (all published by Serpent?s Tail), as well as plays and essays. In 1986 she was awarded the Heinrich Boll prize for her contribution to German language literature, and in 1998 she received the prestigious Georg Buchner Prize for the entirety of her work. In 2004, she was awarded the Nobel Prize for Literature for her musical flow of voices and counter-voices in novels and plays that with extraordinary linguistic zeal reveal the absurdity of society?s clich?s and their subjugating power.",Wonderful wonderful time,Elfriede Jelinek, , ,Portfolio,9781852421687,"1st Edition,1990",256,India,English
The Automatic Customer: Creating a Subscription Business in Any Industry,জন ওয়ারলিও,"TK. 2,275","",https://rokomari.com//book/118268/the-automatic-customer--creating-a-subscription-business-in-any-industry,https://ds.rokomari.store/rokomari110/ProductNew20190903/130X186/d31ff3e84514_118268.gif,"",The Automatic Customer: Creating a Subscription Business in Any Industry,John Warrillow, , ,Portfolio,9781591847465,"1st Edition,2015",224,India,English
I Know How She Does It: How Successful Women Make the Most of Their Time,লরা ভ্যান্ডারকাম ,"TK. 1,339","",https://rokomari.com//book/131978/i-know-how-she-does-it--how-successful-women-make-the-most-of-their-time,https://ds.rokomari.store/rokomari110/ProductNew20190903/130X186/28f88f22f704_131978.jpg,"",I Know How She Does It: How Successful Women Make the Most of Their Time,Laura Vanderkam, , ,Portfolio,9780143109723,"Reprint edition,2017",320,India,English
Angel Customers and Demon Customers: Discover Which is Which and Turbo-Charge Your Stock,ল্যারি সেল্ডন,"TK. 3,784","",https://rokomari.com//book/135766/angel-customers-and-demon-customers--discover-which-is-which-and-turbo-charge-your-stock,https://ds.rokomari.store/rokomari110/ProductNew20190903/130X186/141ab7d20de4_135766.jpg,"",Angel Customers and Demon Customers: Discover Which is Which and Turbo-Charge Your Stock,"Larry Selden,Geoff Colvin", , ,Portfolio,9781591840077,"1st Edition,2003",256,India,English
Humans Are Underrated: What High Achievers Know That Brilliant Machines Never Will,জিওফ কলভিন,"TK. 1,463","",https://rokomari.com//book/135862/humans-are-underrated--what-high-achievers-know-that-brilliant-machines-never-will,https://ds.rokomari.store/rokomari110/ProductNew20190903/130X186/0f3a799d12f4_135862.jpg,"",Humans Are Underrated: What High Achievers Know That Brilliant Machines Never Will,Geoff Colvin, , ,Portfolio,9780143108375,"Reprint edition,2016",272,India,English
All the Money in the World: What the Happiest People Know About Wealth,লরা ভ্যান্ডারকাম ,"TK. 1,507","",https://rokomari.com//book/135889/all-the-money-in-the-world--what-the-happiest-people-know-about-wealth,https://ds.rokomari.store/rokomari110/ProductNew20190903/130X186/f3c4927c9b34_135889.jpg,"",All the Money in the World: What the Happiest People Know About Wealth,Laura Vanderkam, , ,Portfolio,9781591846253,"1st Edition,2013",288,India,English
Go-Givers Sell More,জন ডেভিড ম্যান,"TK. 2,549","",https://rokomari.com//book/134842/go-givers-sell-more,https://ds.rokomari.store/rokomari110/ProductNew20190903/130X186/459fad685754_134842.jpg,"",Go-Givers Sell More,"John David Mann,Bob Burg", , ,Portfolio,9781591843085,"1st Edition,1994",208,India,English
The Go-Giver Leader: A Little Story About What Matters Most in Business,জন ডেভিড ম্যান,"TK. 2,837","",https://rokomari.com//book/134846/the-go-giver-leader--a-little-story-about-what-matters-most-in-business,https://ds.rokomari.store/rokomari110/ProductNew20190903/130X186/169db1afeb44_134846.jpg,"",The Go-Giver Leader: A Little Story About What Matters Most in Business,"John David Mann,Bob Burg", , ,Portfolio,9780399562945,"1st edition,1995",176,USA,English
It's Not About You: A Little Story About What Matters Most in Business,জন ডেভিড ম্যান,"TK. 2,239","",https://rokomari.com//book/134853/it-s-not-about-you--a-little-story-about-what-matters-most-in-business,https://ds.rokomari.store/rokomari110/ProductNew20190903/130X186/d8cc1e6e6c54_134853.jpg,"",It's Not About You: A Little Story About What Matters Most in Business,"John David Mann,Bob Burg", , ,Portfolio,9781591844198,"1st Edition,2000",144,India,English
Total Focus: Make Better Decisions Under Pressure,জন ডেভিড ম্যান,"TK. 2,240","",https://rokomari.com//book/134859/total-focus--make-better-decisions-under-pressure,https://ds.rokomari.store/rokomari110/ProductNew20190903/130X186/2dfcccd9c9a4_134859.jpg,"",Total Focus: Make Better Decisions Under Pressure,"John David Mann,Brandon Webb ", , ,Portfolio,9780735214514,"1st Edition,2002",288,USA,English
Making Ideas Happen,স্কট বেলস্কাই,"TK. 2,156","",https://rokomari.com//book/140595/making-ideas-happen,https://ds.rokomari.store/rokomari110/ProductNew20190903/130X186/076d2dc50ae4_140595.jpg,"",Making Ideas Happen, ,Scott Belsky, ,Portfolio,9781591843122,"1st Published,2010",242,USA,English
One Mission: How Leaders Build a Team of Teams,ক্রিস ফুসেল,TK. 976,"",https://rokomari.com//book/150180/one-mission--how-leaders-build-a-team-of-teams,https://ds.rokomari.store/rokomari110/ProductNew20190903/130X186/e03dd9266_150180.jpg,"",One Mission: How Leaders Build a Team of Teams,Chris Fussell, , ,Portfolio,9780735211353,"1st Edition,2017",304,India,English
Driving Honda: Inside the World’s Most Innovative Car Company,জেফ্রি রোথফেদার,"TK. 1,618","",https://rokomari.com//book/150392/driving-honda--inside-the-world-s-most-innovative-car-company,https://ds.rokomari.store/rokomari110/ProductNew20190903/130X186/9c9ff3d0d_150392.jpg,"",Driving Honda: Inside the World’s Most Innovative Car Company,Jeffrey Rothfeder, , ,Portfolio,9780670920563,"1st Edition,2014",320,India,English
"The Art of the Start 2.0: The Time-Tested, Battle-Hardened Guide for Anyone Starting Anything",গুয়ে কাওয়াসাকি,"TK. 1,006","",https://rokomari.com//book/152615/the-art-of-the-start-2-0--the-time-tested--battle-hardened-guide-for-anyone-starting-anything,https://ds.rokomari.store/rokomari110/ProductNew20190903/130X186/d5edb5f94_152615.jpg,"","The Art of the Start 2.0: The Time-Tested,Battle-Hardened Guide for Anyone Starting Anything",Guy Kawasaki, , ,Portfolio,9781591847847,"Reissue edition,2015",336,India,English
Finish: Give Yourself the Gift of Done,জন কাফ,"TK. 2,291","",https://rokomari.com//book/151824/finish--give-yourself-the-gift-of-done,https://ds.rokomari.store/rokomari110/ProductNew20190903/130X186/a52dff2b1_151824.jpg,"",Finish: Give Yourself the Gift of Done,Jon Acuff, , ,Portfolio,9781591847625,"1st Edition,2017",208,India,English
One Mission: How Leaders Build a Team of Teams,সি ডব্লিউ গুডিয়ার,"TK. 1,940","",https://rokomari.com//book/151907/one-mission--how-leaders-build-a-team-of-teams,https://ds.rokomari.store/rokomari110/ProductNew20190903/130X186/8f3203879_151907.jpg,"",One Mission: How Leaders Build a Team of Teams,C. W. Goodyear, ,General Stanley McChrystal,Portfolio,9780735211353,"1st Edition,2017",304,India,English
Turn Your Ship Around!: A Workbook for Implementing Intent-Based Leadership in Your Organization,হিথার গ্রানাদার,"TK. 1,341","",https://rokomari.com//book/151922/turn-your-ship-around---a-workbook-for-implementing-intent-based-leadership-in-your-organization,https://ds.rokomari.store/rokomari110/ProductNew20190903/130X186/d2cb7f5e1_151922.jpg,"",Turn Your Ship Around!: A Workbook for Implementing Intent-Based Leadership in Your Organization,"Heather Granader,L. David Marquet", , ,Portfolio,9781591847533,"1st Edition,2005",192,India,English
Captivate: The Science of Succeeding with People,ভ্যানেসা ভ্যান এডওয়ার্ডস,"TK. 2,925","",https://rokomari.com//book/151997/captivate--the-science-of-succeeding-with-people,https://ds.rokomari.store/rokomari110/ProductNew20190903/130X186/a18b6f16a_151997.jpg,"",Captivate: The Science of Succeeding with People,Vanessa Van Edwards, , ,Portfolio,9780399564482,"1st Edition,2017",320,India,English
Denial: Why Business Leaders Fail to Look Facts in the Face - and What to Do About It,রিচার্ড এস টেডলো,"TK. 1,280","",https://rokomari.com//book/152799/denial--why-business-leaders-fail-to-look-facts-in-the-face---and-what-to-do-about-it,https://ds.rokomari.store/rokomari110/ProductNew20190903/130X186/23913fefa_152799.jpg,"",Denial: Why Business Leaders Fail to Look Facts in the Face - and What to Do About It,Richard S. Tedlow, , ,Portfolio,9781591843917,"1st Edition,2001",288,USA,English
