Title,Author,Original Price,Discounted Price,URL,Image,Summary,Book_Title,Book_Author,Translator,Editor,Publisher,ISBN,Edition,Number Of Pages,Country,Language
Transport Processes and Separation Process Principles (Includes Unit Operations),ক্রিস্টি জন জিয়ানকপলিস,"TK. 1,069","",https://rokomari.com//book/119868/transport-processes-and-separation-process-principles--includes-unit-operations-,https://ds.rokomari.store/rokomari110/ProductNew20190903/130X186/ce5905441044_119868.gif,"",Transport Processes and Separation Process Principles (Includes Unit Operations),Christie John Geankoplis, , ,Prentice Hall India Learning Private Limited,9789332549432,"4th Edition,2015",1040,India,English
Economic Theory and Operaions Analysis,উইলিয়াম জে বামল,TK. 794,"",https://rokomari.com//book/119875/economic-theory-and-operaions-analysis,https://ds.rokomari.store/rokomari110/ProductNew20190903/130X186/67b90d969844_119875.gif,"",Economic Theory and Operaions Analysis,William J Baumol, , ,Prentice Hall India Learning Private Limited,9789332549586,"4th Edition,2015",720,India,English
Discrete Mathematical Structures,বার্নার্ড কোলম্যান,TK. 752,"",https://rokomari.com//book/119876/discrete-mathematical-structures,https://ds.rokomari.store/rokomari110/ProductNew20190903/130X186/be673c60a344_119876.gif,"",Discrete Mathematical Structures,Bernard Kolman, , ,Prentice Hall India Learning Private Limited,9789332549593,"6th Edition,2015",544,India,English
Business Forecasting,জন ই হ্যাঙ্ক,TK. 747,"",https://rokomari.com//book/119877/business-forecasting,https://ds.rokomari.store/rokomari110/ProductNew20190903/130X186/f23811baf594_119877.gif,"",Business Forecasting,John E Hanke, , ,Prentice Hall India Learning Private Limited,9789332549609,"9th Edition,2015",512,India,English
Linear Algebra,স্টিফেন এইচ ফ্রাইডবার্গ,TK. 630,"",https://rokomari.com//book/119909/linear-algebra,https://ds.rokomari.store/rokomari110/ProductNew20190903/130X186/273686d99d44_119909.gif,"",Linear Algebra,Stephen H. Friedberg, , ,Prentice Hall India Learning Private Limited,9789332549647,"4th Edition,2015",530,India,English
