Title,Author,Original Price,Discounted Price,URL,Image,Summary,Book_Title,Book_Author,Translator,Editor,Publisher,ISBN,Edition,Number Of Pages,Country,Language
"South China Sea Disputes, The: Historical, Geopolitical And Legal Studies",টসু-সাং সিএই,"TK. 15,000","",https://rokomari.com//book/176960/south-china-sea-disputes--the--historical--geopolitical-and-legal-studies,https://ds.rokomari.store/rokomari110/ProductNew20190903/130X186/1554a939f_176960.jpg,"","South China Sea Disputes,The: Historical,Geopolitical And Legal Studies",Tsu-Sung Hsieh, , ,World Scientific Publishing Ltd,9789813234888,"1st Edition,2018",210,India,English
China's Science And Technology Sector And The Forces Of Globalisation: 0 (Series on Contemporary China),ক্যাটরিন মুফ,"TK. 15,390","",https://rokomari.com//book/186845/china-s-science-and-technology-sector-and-the-forces-of-globalisation--0--series-on-contemporary-china-,https://ds.rokomari.store/rokomari110/ProductNew20190903/130X186/e752ded5e_186845.jpg,"",China's Science And Technology Sector And The Forces Of Globalisation: 0 (Series on Contemporary China),Katrin Muff, ,"Elspeth Thomson,Jon Sigurdson",World Scientific Publishing Ltd,9789812771001,"1st Edition,2007",250,India,English
Neurobiology Of Learning And Memory,জেমস এল ম্যাকগাফ,"TK. 17,278","",https://rokomari.com//book/162887/neurobiology-of-learning-and-memory,https://ds.rokomari.store/rokomari110/ProductNew20190903/130X186/eb4eeab4e_162887.jpg,"",Neurobiology Of Learning And Memory,James L McGaugh, , ,World Scientific Publishing Ltd,9789971508685,"1st Edition,1988",868,India,English
Calculus ,ন্যাখেল এইচ আস্মার,"TK. 2,741","",https://rokomari.com//book/167125/calculus,https://ds.rokomari.store/rokomari110/ProductNew20190903/130X186/book_av.png,"",Calculus,"Nakhle H. Asmar,David C. Lay,Larry J. Goldstein,David I. Schneider", , ,World Scientific Publishing Ltd,9789812778987,"3rd Revised edition,2010",540,India,English
Correlated Electrons in Quantum Matter,পিটার ফাও,"TK. 7,274","",https://rokomari.com//book/124022/correlated-electrons-in-quantum-matter,https://ds.rokomari.store/rokomari110/ProductNew20190903/130X186/abd814f28f24_124022.jpg,"",Correlated Electrons in Quantum Matter,Peter Fulde, , ,World Scientific Publishing Ltd,9789814390927,"1st Edition,2012", ,India,English
Thermal Physics: Entropy and Free Energies,ঝুন চ্যাং লি,"TK. 7,762","",https://rokomari.com//book/125065/thermal-physics--entropy-and-free-energies,https://ds.rokomari.store/rokomari110/ProductNew20190903/130X186/adea09b72204_125065.jpg,"",Thermal Physics: Entropy and Free Energies,Joon Chang Lee, , ,World Scientific Publishing Ltd,9789814340762,"2nd Revised  Edition,2011",392,India,English
"Dark Matter, Neutrinos and Our Solar System",নির্মালা প্রকাশ,"TK. 7,074","",https://rokomari.com//book/125066/dark-matter--neutrinos-and-our-solar-system,https://ds.rokomari.store/rokomari110/ProductNew20190903/130X186/1942d9ea7934_125066.jpg,"","Dark Matter,Neutrinos and Our Solar System",Nirmala Prakash, , ,World Scientific Publishing Ltd,9789814304542,"1st Edition,2012",676,India,English
Problem - Solving Strategies in Mathematics: from Common Approaches to Exemplary Strategies: 1 (Problem Solving in Mathematics and Beyond),আলফ্রেড এস,"TK. 1,791","",https://rokomari.com//book/170704/problem---solving-strategies-in-mathematics--from-common-approaches-to-exemplary-strategies--1--problem-solving-in-mathematics-and-beyond-,https://ds.rokomari.store/rokomari110/ProductNew20190903/130X186/ffea47480_170704.jpg,"",Problem - Solving Strategies in Mathematics: from Common Approaches to Exemplary Strategies: 1 (Problem Solving in Mathematics and Beyond),"Alfred S,Posamentier", , ,World Scientific Publishing Ltd,9789814651639,"1st Edition,2015",188,India,English
"First Step To Mathematical Olympiad Problems, A (Mathematical Olympiad Series)",ডেরেক অ্যালেন হল্টন,"TK. 4,678","",https://rokomari.com//book/175858/first-step-to-mathematical-olympiad-problems--a--mathematical-olympiad-series-,https://ds.rokomari.store/rokomari110/ProductNew20190903/130X186/c0fc2de36_175858.jpg,"","First Step To Mathematical Olympiad Problems,A (Mathematical Olympiad Series)",Derek Allan Holton, , ,World Scientific Publishing Ltd,9789814273879,"1st Edition,2009",292,India,English
