Title,Author,Original Price,Discounted Price,URL,Image,Summary,Book_Title,Book_Author,Translator,Editor,Publisher,ISBN,Edition,Number Of Pages,Country,Language
উড়ো প্রেসক্রিপশন,ডা. মুকিত ওসমান,TK. 150,TK. 113,https://rokomari.com//book/200499/uro-prescription,https://ds.rokomari.store/rokomari110/ProductNew20190903/130X186/56aeb8cd0_200499.jpg,"",উড়ো প্রেসক্রিপশন,ডা. মুকিত ওসমান, , ,কালধারা,9789849474852,"1st Published,2020",64,বাংলাদেশ,বাংলা
নোবেল বিজয়ীর দেশে মানবতা ভাসে,মুহম্মদ শাহাদাত হোসেন ফিরোজ,TK. 100,TK. 75,https://rokomari.com//book/200476/novel-bijoyeer-deshe-manobota-vase,https://ds.rokomari.store/rokomari110/ProductNew20190903/130X186/334e57af4_200476.jpg,"",নোবেল বিজয়ীর দেশে মানবতা ভাসে,মুহম্মদ শাহাদাত হোসেন ফিরোজ, , ,কালধারা,9789849474821,"1st Published,2020",32,বাংলাদেশ,বাংলা
আজ রাতের দেড় পৃষ্ঠা,ডা. মুকিত ওসমান,TK. 150,TK. 113,https://rokomari.com//book/200497/aj-rater-der-prishtha,https://ds.rokomari.store/rokomari110/ProductNew20190903/130X186/67ba726cc_200497.jpg,"",আজ রাতের দেড় পৃষ্ঠা,ডা. মুকিত ওসমান, , ,কালধারা,9789849364474,"1st Published,2020",68,বাংলাদেশ,বাংলা
অন্যগল্প,আজিজুল হক,TK. 220,TK. 165,https://rokomari.com//book/200496/onyogolpo,https://ds.rokomari.store/rokomari110/ProductNew20190903/130X186/60cbb241b_200496.jpg,"একজন একা যুবকের গল্প। সে এক অন্ধ বালিকার মত, যে পৃথিবীর যাবতীয় মায়া-মােহ অনুভব করে কিন্তু ছুতে পারেনা। খুব ছােটবেলা থেকে যুবকটি নানাবিধ সংকটে পারিবারিক বলয় থেকে বিক্ষিপ্ত হয়ে পড়ে। ঝরা পাতার মত খেয়ালী বাতাসে উড়ে যায় এদিক থেকে ওদিকে। এর মাঝেই নিজেকে চিনতে চেষ্টা করে, চেষ্টা করে জীবনকে চিনতে। কিন্তু চেনা আর হয়ে ওঠেনা। যুবকের জীবনে নানামুখী সংকটের সাথে প্রেম ও আসে। একসময় সংসার তাকে কাছে টানে, সংসারী হতে চায়, কিন্তু পারেনা। নিয়তি যাকে অবহেলা করে তার জন্য ভাল কিছু থাকেনা। না স্নেহ, না প্রেম, না সংসার।",অন্যগল্প,আজিজুল হক, , ,কালধারা,9789849474838,"1st Published,2020",131,বাংলাদেশ,বাংলা
দেখা যখন হল সখা,আজিজুল হক,TK. 280,TK. 210,https://rokomari.com//book/200494/dekha-jhokhon-holo-sokha,https://ds.rokomari.store/rokomari110/ProductNew20190903/130X186/3e8d89061_200494.jpg,"",দেখা যখন হল সখা,আজিজুল হক, , ,কালধারা,9789849474845,"1st Published,2020",184,বাংলাদেশ,বাংলা
বৃত্তোচ্ছেদ,নাফিজ সাদেকিন,TK. 140,TK. 105,https://rokomari.com//book/200493/brittocched,https://ds.rokomari.store/rokomari110/ProductNew20190903/130X186/31eef7e4e_200493.jpg,"",বৃত্তোচ্ছেদ,নাফিজ সাদেকিন, , ,কালধারা,9789849474876,"1st Published,2020",40,বাংলাদেশ,বাংলা
গদ্যগুলো সব ঘুমোতে চায়,তারিক হাবিব জিহান,TK. 150,TK. 113,https://rokomari.com//book/200491/godyogolo-sob-ghomote-chay,https://ds.rokomari.store/rokomari110/ProductNew20190903/130X186/b75f5393b_200491.jpg,"",গদ্যগুলো সব ঘুমোতে চায়,তারিক হাবিব জিহান, , ,কালধারা,9789849474814,"1st Published,2020",48,বাংলাদেশ,বাংলা
বুদ্ধিমতি অহনা,সালেহ রফিক,TK. 80,TK. 72,https://rokomari.com//book/12279/budhimoti-ohona,https://ds.rokomari.store/rokomari110/ProductNew20190903/130X186/book_av.png,"",বুদ্ধিমতি অহনা,সালেহ রফিক, , ,কালধারা, , , ,বাংলাদেশ,বাংলা
