Title,Author,Original Price,Discounted Price,URL,Image,Summary,Book_Title,Book_Author,Translator,Editor,Publisher,ISBN,Edition,Number Of Pages,Country,Language
ইনসেপশন বিসিএস প্রিলিমিনারি ডাইজেস্ট (৪১তম বিসিএস),মোঃ মেহেদী হাসান,TK. 500,TK. 400,https://rokomari.com//book/173995/inception-bcs-preliminary-digest--41th-bcs-,https://ds.rokomari.store/rokomari110/ProductNew20190903/130X186/43f413c4a_173995.jpg,"বিসিএস প্রিলিমিনারি প্রত্যাশীদের জন্য পরিপূর্ণ দিক নির্দেশনা! 
বইটিতে বিসিএস প্রিলিমিনারির সবচেয়ে ভালো প্রস্তুতির কথা মাথায় রেখে শিক্ষার্থীদের জন্য প্রতিটি বিষয়ে বিষয়ভিত্তিক বইয়ের বিকল্পরুপে উপস্থাপন করা হয়েছে। সিলেবাস বহির্ভূত আলোচনা মানে পরীক্ষার প্রাসঙ্গিক বিষয়বাদে অপ্রয়োজনীয় বিষয় নিয়ে আলোচনা করা হয়নি, এতে করে পড়ার সময় বিরক্তিবোধ হবেনা। বইটিতে অত্যন্ত সুন্দরভাবে সিলেবাসের সকল টপিকের মৌলিক আলোচনা করা হয়েছে। প্রয়োজনীয় ক্ষেত্রে চিত্র সংযোজন ও মানচিত্রের সমন্বয়ে কঠিন দুর্বোধ্য বিষয়ের প্রাজ্ঞল উপস্থাপন করা হয়েছে শিক্ষার্থীদের কথা মাথায় রেখে। পড়া মনে রাখার সহজ উপায় ও বিশেষ টেকনিক সংযোজন বইটিকে আরো গুরত্বপূর্ণ করেছে।


""বইটির বৈশিষ্ট্য:*
প্রতিটি বিষয়ভিত্তিক বইয়ের বিকল্পরূপে উপস্থাপন*
একক বই হিসেবে সর্বাধিক কমনের নিশ্চয়তা*
সিলেবাস বহির্ভূত আলোচনা বর্জিত*
সিলেবাসের সকল চিত্র ও মানচিত্রের সমন্বয়ে দুর্বোধ্য
বিষয়ের প্রাঞ্জল উপস্থাপন*
মনে রাখার সহজ উপায় ও বিশেষ টেকনিক সংযোজন",ইনসেপশন বিসিএস প্রিলিমিনারি ডাইজেস্ট (৪১তম বিসিএস),"মোঃ মেহেদী হাসান,জাহিদুর রহমান,মোঃ কাওছার হোসেন,মোঃ খাইরুল আলম,মোঃ নুরুল হুদা শামীম,এ. কে. এম. ফয়সল আহাম্মেদ  ডিজুজ", , ,ইনসেপশন পাবলিকেশন্স, ,"2nd Edition,2019",996,বাংলাদেশ,বাংলা
Cloud IT Solution,মোঃ মেহেদী হাসান,TK. 450,TK. 360,https://rokomari.com//book/193513/cloud-it-solution,https://ds.rokomari.store/rokomari110/ProductNew20190903/130X186/73fbb717d_193513.jpg,"আইটি ক্ষেত্রে জবের প্রস্তুতির জন্য প্রিলিমিনারি, রিটেন, ল্যাব, ভাইভা সহায়ক বই!
বইটিতে আছে বিগত বছরের আইটি রিলেটেড জব পরীক্ষার ৮০ থেকে ৯০ সেট প্রশ্নের ব্যাখ্যা সহ পূর্ণাঙ্গ সমাধান। পরীক্ষার্থীদের ভালোভাবে বুঝার জন্য টপিক চিত্রসহ সহজ ভাষায় উপস্থাপন করা হয়েছে। বইটিতে নির্ভুলভাবে প্রোগ্রামিং এর সমাধান দেয়া আছে যা পরীক্ষার্থীদের জন্য বিশেষ প্রয়োজনীয়। প্রতিটি অধ্যায়ের শেষে টপিক ওয়াইজ মডেল টেস্ট  দেয়া আছে। এই মডেল টেস্টগুলো সমাধান করে ভালো প্রস্তুতি নেয়া যাবে। প্রোগ্রামিং এর প্রশ্নগুলো C, C   এবং জাভা ল্যাঙ্গুয়েজ এর মাধ্যমে সমাধান প্রদান দেয়া আছে বইয়ে। এই বইটিতে  ডাটাবেজ এর প্রায় ৪০টি এর মত কুয়েরি চিত্রসহ সমাধান সংযোজন করা হয়েছে।  নেটওয়ার্ক সিকিউরিটি  এবং ব্যাংকিং  আইটি  টার্ম এর উপর দুটি পূর্ণাঙ্গ অধ্যায়ের বিস্তারিত আলোচনা আছে বইটিতে এবং ব্যাংকিং এর গুরুত্বপূর্ণ  টার্ম  নিয়ে টিকা আকারে আলোচনা করা হয়েছে। 
আপনি যদি প্রিলিমিনারি, রিটেন, ল্যাব, ভাইভা প্রস্তুতি একটি ভালো বই পড়ে নিতে চান, তাহলে অবশ্যাই এই বইটি আপনার জন্য।",Cloud IT Solution,"Md. Mehedi Hassan,Md. Al-Amin Nipu", , ,Inception Publications, ,"1st Edition,2020",696,Bangladesh,English
