Title,Author,Original Price,Discounted Price,URL,Image,Summary,Book_Title,Book_Author,Translator,Editor,Publisher,ISBN,Edition,Number Of Pages,Country,Language
Muhammad: His Life Based on the Earliest Sources,মার্টিন লিংগস,"","TK. 2,554",https://rokomari.com//book/175256/muhammad--his-life-based-on-the-earliest-sources,https://ds.rokomari.store/rokomari110/ProductNew20190903/130X186/08c070f4d_175256.jpg,"",Muhammad: His Life Based on the Earliest Sources,Martin Lings, , ,Inner Traditions,9781594771538,"5th Edition,2006",348,India,English
Journey to the Lord of Power,ইবন আরাবি,"","TK. 1,542",https://rokomari.com//book/118331/journey-to-the-lord-of-power,https://ds.rokomari.store/rokomari110/ProductNew20190903/130X186/702066eb50a4_118331.gif,"",Journey to the Lord of Power,Ibn Arabi,Rabia Terry Harris, ,Inner Traditions,9780892810185,"Reissue Edition,2015",128,India,English
The Complete Life of Krishna,বনমালী,"","TK. 3,778",https://rokomari.com//book/151310/the-complete-life-of-krishna,https://ds.rokomari.store/rokomari110/ProductNew20190903/130X186/b5a1852d2_151310.jpg,"",The Complete Life of Krishna,Vanamali, , ,Inner Traditions,9781594774751,"1st Edition,2012",457,India,English
The Dreamlife of Families: The Psychospiritual Connection,এডওয়ার্ড ব্রুস বাইনাম,"",TK. 882,https://rokomari.com//book/165689/the-dreamlife-of-families--the-psychospiritual-connection,https://ds.rokomari.store/rokomari110/ProductNew20190903/130X186/b06241463_165689.jpg,"",The Dreamlife of Families: The Psychospiritual Connection,Edward Bruce Bynum, , ,Inner Traditions,9781620556320,"2nd Edition,2017",288,India,English
The Heart Of Yoga,টি কে ভি দেশিক্যাচার,"",TK. 898,https://rokomari.com//book/151565/the-heart-of-yoga,https://ds.rokomari.store/rokomari110/ProductNew20190903/130X186/c002f4cfe_151565.jpg,"",The Heart Of Yoga,T K V Desikachar, , ,Inner Traditions,9780892816811,"1st Edition,2013", ,India,English
