Title,Author,Original Price,Discounted Price,URL,Image,Summary,Book_Title,Book_Author,Translator,Editor,Publisher,ISBN,Edition,Number Of Pages,Country,Language
"সহীহ্‌ নূরানী কোরআন শরীফ ৫নং (বাংলা উচ্চারণ, সহজ বাংলায় অনুবাদ, সংক্ষিপ্ত তাফসীর, শানে নুযূল এবং প্রয়োজনীয় টীকাসহ)", حكيم الامت مولانا اشرف علي تهانوي رح  ( হাকীমুল উম্মত মাওলানা আশরাফ আলী থানভী রহ.),TK. 950,TK. 570,https://rokomari.com//book/163568/sohiho-nurani-quran-sharif-5no---bangla-uccaron---sohoj-banglai-anubad--songkkhipto-tafsir--shane-nujul-and-proyojoniyo-tikasoho,https://ds.rokomari.store/rokomari110/ProductNew20190903/130X186/52da5d516_163568.jpg,"","সহীহ্‌ নূরানী কোরআন শরীফ ৫নং (বাংলা উচ্চারণ,সহজ বাংলায় অনুবাদ,সংক্ষিপ্ত তাফসীর,শানে নুযূল এবং প্রয়োজনীয় টীকাসহ)", ,মাওলানা মোহাম্মদ মোবারক করীম,حكيم الامت مولانا اشرف علي تهانوي رح  ( হাকীমুল উম্মত মাওলানা আশরাফ আলী থানভী রহ.),New Emdadiya Library, ,"Revised Edition,2016",652,Bangladesh,Bangla & Arabic
ছহীহ্‌ নূরানী হাফেজী কোরআন শরীফ,নিউ এমদাদিয়া লাইব্রেরী,TK. 250,TK. 140,https://rokomari.com//book/108530/sohiho-nurani-hafiji-quran-sharif,https://ds.rokomari.store/rokomari110/ProductNew20190903/130X186/book_av.png,"",ছহীহ্‌ নূরানী হাফেজী কোরআন শরীফ, , ,নিউ এমদাদিয়া লাইব্রেরী,New Emdadiya Library, , ,611,Bangladesh,Arabic
ছহীহ নূরানী কোরআন শরীফ (সাদা) (কলিকাতা ছাপা),নিউ এমদাদিয়া লাইব্রেরী,"",TK. 200,https://rokomari.com//book/101380/sohiho-nurani-quran-sharif--white---kalikata-print-,https://ds.rokomari.store/rokomari110/ProductNew20190903/130X186/rokimg_20150630_101380.gif,"",ছহীহ নূরানী কোরআন শরীফ (সাদা) (কলিকাতা ছাপা), , ,নিউ এমদাদিয়া লাইব্রেরী,নিউ এমদাদিয়া লাইব্রেরী, ,"1st Edition,2015",563,বাংলাদেশ,বাংলা
সহীহ্‌ নূরানী কোরআন শরীফ টপ-১০ (বাংলা উচ্চারণ ও বঙ্গানুবাদসহ), حكيم الامت مولانا اشرف علي تهانوي رح  ( হাকীমুল উম্মত মাওলানা আশরাফ আলী থানভী রহ.),TK. 750,TK. 638,https://rokomari.com//book/108529/sohiho-nurani-quran-sharif-top-10--bangla-uccharon-o-bonganubadsoho-,https://ds.rokomari.store/rokomari110/ProductNew20190903/130X186/71bb049b5_108529.jpg,"",সহীহ্‌ নূরানী কোরআন শরীফ টপ-১০ (বাংলা উচ্চারণ ও বঙ্গানুবাদসহ), ,মাওলানা মোহাম্মদ মোবারক করীম,حكيم الامت مولانا اشرف علي تهانوي رح  ( হাকীমুল উম্মত মাওলানা আশরাফ আলী থানভী রহ.),New Emdadiya Library, ,"Revised Edition,2014",788,Bangladesh,Arabic
"ছহীহ্‌ নূরানী কোরআন শরীফ ৩নং (বাংলা উচ্চারণ, বঙ্গানুবাদ, সংক্ষিপ্ত তাফসীর ও শানে নুযূলসহ)", حكيم الامت مولانا اشرف علي تهانوي رح  ( হাকীমুল উম্মত মাওলানা আশরাফ আলী থানভী রহ.),TK. 600,TK. 510,https://rokomari.com//book/163569/sohiho-nurani-quran-sharif-3no---bangla-uccaron---banganubad-songkkhipto-tafsir-o-shane-nujulsoho,https://ds.rokomari.store/rokomari110/ProductNew20190903/130X186/229b69f79_163569.jpg,"","ছহীহ্‌ নূরানী কোরআন শরীফ ৩নং (বাংলা উচ্চারণ,বঙ্গানুবাদ,সংক্ষিপ্ত তাফসীর ও শানে নুযূলসহ)", ,মাওলানা মোহাম্মদ মোবারক করীম,حكيم الامت مولانا اشرف علي تهانوي رح  ( হাকীমুল উম্মত মাওলানা আশরাফ আলী থানভী রহ.),New Emdadiya Library, ,"Revised Edition,2014",788,Bangladesh,Bangla & Arabic
Duty Towards Parents,প্রফে. মুফতী আব্দুল আহাদ হেলালী,TK. 120,TK. 106,https://rokomari.com//book/200062/duty-towards-parents,https://ds.rokomari.store/rokomari110/ProductNew20190903/130X186/739d4ee6d_200062.jpg,"",Duty Towards Parents,Professor Mufti Abdul Ahad Helaly, , ,New Emdadiya Library, ,"1st Published,2020",64,Bangladesh,English
আল্-খায়ের- ১,আ. খ. ম. ফারুক আহমদ,TK. 150,TK. 132,https://rokomari.com//book/208741/al-khayer--1,https://ds.rokomari.store/rokomari110/ProductNew20190903/130X186/6c532bbe7_208741.jpg,"",আল্-খায়ের- ১,আ. খ. ম. ফারুক আহমদ, , ,নিউ এমদাদিয়া লাইব্রেরী, ,"1st Published,2021",120,বাংলাদেশ,বাংলা
ছহীহ্‌ নূরানী কোরআন শরীফ ৭নং, حكيم الامت مولانا اشرف علي تهانوي رح  ( হাকীমুল উম্মত মাওলানা আশরাফ আলী থানভী রহ.),TK. 750,TK. 638,https://rokomari.com//book/108531/sohiho-nurani-quran-sharif-7no---arobic-bangla-uccaron--bonganubad-shanenujul-o-projoniyo-tika-,https://ds.rokomari.store/rokomari110/ProductNew20190903/130X186/a5cccc6db_108531.jpg,"",ছহীহ্‌ নূরানী কোরআন শরীফ ৭নং, ,মাওলানা মোহাম্মদ মোবারক করীম,حكيم الامت مولانا اشرف علي تهانوي رح  ( হাকীমুল উম্মত মাওলানা আশরাফ আলী থানভী রহ.),New Emdadiya Library, ,"Revised Edition,2013",678,Bangladesh,Bangla & Arabic
নূরানী কোরআন শরীফ (লাহরী টাইপ-৯নং),নিউ এমদাদিয়া লাইব্রেরী,TK. 450,TK. 383,https://rokomari.com//book/108554/nurani-quran-sharif--lahori-type-9-,https://ds.rokomari.store/rokomari110/ProductNew20190903/130X186/rok_img_20160109_108554.gif,"",নূরানী কোরআন শরীফ (লাহরী টাইপ-৯নং), , ,নিউ এমদাদিয়া লাইব্রেরী,New Emdadiya Library, , ,611,Bangladesh,Arabic
নূরানী কোরআন শরীফ (১নং ভি. আই. পি),নিউ এমদাদিয়া লাইব্রেরী,TK. 850,TK. 723,https://rokomari.com//book/108556/nurani-quran-sharif--1no-v--i--p-,https://ds.rokomari.store/rokomari110/ProductNew20190903/130X186/rok_img_20160109_108556.gif,"",নূরানী কোরআন শরীফ (১নং ভি. আই. পি), , ,নিউ এমদাদিয়া লাইব্রেরী,New Emdadiya Library, , ,733,Bangladesh,Arabic
নূরানী কোরআন শরীফ (২১নং ভি. আই. পি অপসেট),নিউ এমদাদিয়া লাইব্রেরী,TK. 850,TK. 723,https://rokomari.com//book/108564/nurani-quran-sharif--21-no-v--i--p-offset-,https://ds.rokomari.store/rokomari110/ProductNew20190903/130X186/rok_img_20160109_108564.gif,"",নূরানী কোরআন শরীফ (২১নং ভি. আই. পি অপসেট), , ,নিউ এমদাদিয়া লাইব্রেরী,New Emdadiya Library, , ,608,Bangladesh,Arabic
"সহীহ্‌ নূরানী কোরআন শরীফ ১৩নং (বাংলা উচ্চারণ, সহজ বাংলায় অনুবাদ, সংক্ষিপ্ত তাফসীর, শানে নুযূল এবং প্রয়োজনীয় টীকাসহ)", حكيم الامت مولانا اشرف علي تهانوي رح  ( হাকীমুল উম্মত মাওলানা আশরাফ আলী থানভী রহ.),TK. 950,TK. 523,https://rokomari.com//book/163567/sohiho-nurani-quran-sharif-13no---bangla-uccaron---sohoj-banglai-anubad--songkkhipto-tafsir--shane-nujul-and-proyojoniyo-tikasoho,https://ds.rokomari.store/rokomari110/ProductNew20190903/130X186/82beed1db_163567.jpg,"","সহীহ্‌ নূরানী কোরআন শরীফ ১৩নং (বাংলা উচ্চারণ,সহজ বাংলায় অনুবাদ,সংক্ষিপ্ত তাফসীর,শানে নুযূল এবং প্রয়োজনীয় টীকাসহ)", ,মাওলানা মোহাম্মদ মোবারক করীম,حكيم الامت مولانا اشرف علي تهانوي رح  ( হাকীমুল উম্মত মাওলানা আশরাফ আলী থানভী রহ.),New Emdadiya Library, ,"Revised Edition,2018",652,Bangladesh,Bangla & Arabic
কোরআন ও হাদীসের আলোকে পর্দার বিধান ও নারীর মর্যাদা, حكيم الامت مولانا اشرف علي تهانوي رح  ( হাকীমুল উম্মত মাওলানা আশরাফ আলী থানভী রহ.),TK. 180,TK. 158,https://rokomari.com//book/115911/quran-o-hadither-aloke-pordar-bidhan-o-narir-morjada,https://ds.rokomari.store/rokomari110/ProductNew20190903/130X186/884573413654_115911.gif,"",কোরআন ও হাদীসের আলোকে পর্দার বিধান ও নারীর মর্যাদা,حكيم الامت مولانا اشرف علي تهانوي رح  ( হাকীমুল উম্মত মাওলানা আশরাফ আলী থানভী রহ.), , ,নিউ এমদাদিয়া লাইব্রেরী, ,"1st Published,2016",166,বাংলাদেশ,বাংলা
দৈনন্দিন নেক আমল, حكيم الامت مولانا اشرف علي تهانوي رح  ( হাকীমুল উম্মত মাওলানা আশরাফ আলী থানভী রহ.),TK. 150,TK. 60,https://rokomari.com//book/116527/doinondin-nek-amal,https://ds.rokomari.store/rokomari110/ProductNew20190903/130X186/d968fe801aa4_116527.gif,"",দৈনন্দিন নেক আমল,حكيم الامت مولانا اشرف علي تهانوي رح  ( হাকীমুল উম্মত মাওলানা আশরাফ আলী থানভী রহ.),মাওলানা মুহাম্মদ যুবায়ের ছাহেব, ,নিউ এমদাদিয়া লাইব্রেরী, ,"1st Published,2016",384,বাংলাদেশ,বাংলা
