Title,Author,Original Price,Discounted Price,URL,Image,Summary,Book_Title,Book_Author,Translator,Editor,Publisher,ISBN,Edition,Number Of Pages,Country,Language
The Quran (with Annitated Inerpretation in Modern English) ,আলী উনাল ,"","TK. 1,500",https://rokomari.com//book/52025/the-quran--with-annitated-inerpretation-in-modern-english-,https://ds.rokomari.store/rokomari110/ProductNew20190903/130X186/book_av.png,"",The Quran (with Annitated Inerpretation in Modern English),Ali Unal, , ,New Jersey, , , ,Abroad,English
The Quran Board B (with Annitated Inerpretation in Modern English) ,আলী উনাল ,"","TK. 2,300",https://rokomari.com//book/52026/the-quran-board-b--with-annitated-inerpretation-in-modern-english-,https://ds.rokomari.store/rokomari110/ProductNew20190903/130X186/book_av.png,"",The Quran Board B (with Annitated Inerpretation in Modern English),Ali Unal, , ,New Jersey, , , ,Abroad,English
The Quran in 99 Questions ,মুহিটীন এ্যাকগুল ,"","TK. 1,195",https://rokomari.com//book/52032/the-quran-in-99-questions,https://ds.rokomari.store/rokomari110/ProductNew20190903/130X186/rokimg_2111_52032.GIF,"",The Quran in 99 Questions,Muhittin Akgul, , ,New Jersey, , , ,Abroad,English
Virtues And Mission of the Prophet ,নিউ জার্সি,"",TK. 350,https://rokomari.com//book/52552/virtues-and-mission-of-the-prophet,https://ds.rokomari.store/rokomari110/ProductNew20190903/130X186/book_av.png,"",Virtues And Mission of the Prophet,New Jersey, , ,New Jersey, , , ,Abroad,English
A Tribute to the Propeht Muhammad ,নিউ জার্সি,"",TK. 330,https://rokomari.com//book/51848/a-tribute-to-the-propeht-muhammad,https://ds.rokomari.store/rokomari110/ProductNew20190903/130X186/book_av.png,"",A Tribute to the Propeht Muhammad,New Jersey, , ,New Jersey, , , ,Abroad,English
Ramadan (The Blessed Month of Islam) ,নিউ জার্সি,"",TK. 330,https://rokomari.com//book/51945/ramadan--the-blessed-month-of-islam-,https://ds.rokomari.store/rokomari110/ProductNew20190903/130X186/rokimg_2111_51945.GIF,"",Ramadan (The Blessed Month of Islam),New Jersey, , ,New Jersey, , , ,Abroad,English
The Essentials of the Islamin Faith ,এম. ফেতুল্লাহ গুলিন ,"",TK. 750,https://rokomari.com//book/51993/the-essentials-of-the-islamin-faith,https://ds.rokomari.store/rokomari110/ProductNew20190903/130X186/rokimg_2111_51993.GIF,"",The Essentials of the Islamin Faith,M. Fethullah Gulin, , ,New Jersey, , , ,Abroad,English
