Title,Author,Original Price,Discounted Price,URL,Image,Summary,Book_Title,Book_Author,Translator,Editor,Publisher,ISBN,Edition,Number Of Pages,Country,Language
Developing National Power in Space: A Theoretical Model,ব্রেন্ট জিরনিক,"","TK. 5,546",https://rokomari.com//book/162356/developing-national-power-in-space--a-theoretical-model,https://ds.rokomari.store/rokomari110/ProductNew20190903/130X186/9f29129ff_162356.jpg,"",Developing National Power in Space: A Theoretical Model,Brent Ziarnick, , ,McFarland Publishing,9780786494996,"1st Edition,2015",277,India,English
Failing Forward: Turning Mistakes into Stepping Stones for Success,জন সি. ম্যাক্সওয়েল,"","TK. 2,677",https://rokomari.com//book/132072/failing-forward--turning-mistakes-into-stepping-stones-for-success,https://ds.rokomari.store/rokomari110/ProductNew20190903/130X186/753c46ff36f4_132072.jpg,"",Failing Forward: Turning Mistakes into Stepping Stones for Success,John C. Maxwell, , ,McFarland Publishing,9780785288572,"Reprint edition,2007",224,India,English
Becoming a Leader is Becoming Yourself,রাস এস মক্সলে,"","TK. 2,916",https://rokomari.com//book/149131/becoming-a-leader-is-becoming-yourself,https://ds.rokomari.store/rokomari110/ProductNew20190903/130X186/e0569faee_149131.jpg,"",Becoming a Leader is Becoming Yourself,Russ S. Moxley , , ,McFarland Publishing,9780786497386,"1st edition,2015 ",192,India,English
The Automobile and American Life,জন এ. হেইটম্যান,"","TK. 5,161",https://rokomari.com//book/149531/the-automobile-and-american-life,https://ds.rokomari.store/rokomari110/ProductNew20190903/130X186/c3809b189_149531.jpg,"",The Automobile and American Life,John A. Heitmann, , ,McFarland Publishing,9780786440139,"1st Edition,2009",248,India,English
War and Nature: Fighting Humans and Insects with Chemicals from World War I to Silent Spring (Studies in Environment and History),এডমন্ড রাসেল,"","TK. 4,446",https://rokomari.com//book/149532/war-and-nature--fighting-humans-and-insects-with-chemicals-from-world-war-i-to-silent-spring--studies-in-environment-and-history-,https://ds.rokomari.store/rokomari110/ProductNew20190903/130X186/368befe6d_149532.jpg,"",War and Nature: Fighting Humans and Insects with Chemicals from World War I to Silent Spring (Studies in Environment and History),Edmund Russell, , ,McFarland Publishing,9780521799379,"1st Edition,2001",334,India,English
