Title,Author,Original Price,Discounted Price,URL,Image,Summary,Book_Title,Book_Author,Translator,Editor,Publisher,ISBN,Edition,Number Of Pages,Country,Language
Elementary Statistics A Step by Step Approach with Formula Card and Cd,অ্যালান ব্লুম্যান,"","TK. 5,416",https://rokomari.com//book/187429/elementary-statistics-a-step-by-step-approach-with-formula-card-and-cd,https://ds.rokomari.store/rokomari110/ProductNew20190903/130X186/d9aa967d9_187429.jpg,"",Elementary Statistics A Step by Step Approach with Formula Card and Cd,Allan Bluman, , ,McGraw Hill Higher Education (India),9781259252099,"3rd edition,2011", ,USA,English
Killing Marketing: How Innovative Businesses Are Turning Marketing Cost Into Profit,রবার্ট রোজ,"","TK. 6,298",https://rokomari.com//book/182211/killing-marketing--how-innovative-businesses-are-turning-marketing-cost-into-profit,https://ds.rokomari.store/rokomari110/ProductNew20190903/130X186/af4240bce_182211.jpg,"",Killing Marketing: How Innovative Businesses Are Turning Marketing Cost Into Profit,"Robert Rose,Joe Pulizzi", , ,McGraw Hill Higher Education (India),9781260026429,"1st Edition,2017",272,India,English
Staffing Organizations,জন ক্যাম্ফনার,"","TK. 2,691",https://rokomari.com//book/170871/staffing-organizations,https://ds.rokomari.store/rokomari110/ProductNew20190903/130X186/f9a2c6a8d_170871.jpg,"",Staffing Organizations,"John Kampfner ,Herbert Goodheart,Timothy A. Judge,Herbert Heneman", , ,McGraw Hill Higher Education (India),9780071086479,"7th Edition,2011",768,India,English
Bank Management and Financial Services,সিলভিয়া সি হাডিংস,"","TK. 6,500",https://rokomari.com//book/170372/bank-management-and-financial-services,https://ds.rokomari.store/rokomari110/ProductNew20190903/130X186/3ecb46ca8_170372.jpg,"",Bank Management and Financial Services,"Sylvia C. Hudgins,Peter S. Rose", , ,McGraw Hill Higher Education (India),9780071267878,"8th Edition,2009",761,India,English
Shigley's Mechanical Engineering Design,রিচার্ড জি বুদ্ধনাস ,"","TK. 8,125",https://rokomari.com//book/170373/shigley-s-mechanical-engineering-design,https://ds.rokomari.store/rokomari110/ProductNew20190903/130X186/a7f84f302_170373.jpg,"",Shigley's Mechanical Engineering Design,"Richard G. Budynas,J. Keith Nisbett", , ,McGraw Hill Higher Education (India),9780071311137,"9th Edition,2011",1112,India,English
