Title,Author,Original Price,Discounted Price,URL,Image,Summary,Book_Title,Book_Author,Translator,Editor,Publisher,ISBN,Edition,Number Of Pages,Country,Language
উচ্চতর গণিত-প্রথম পত্র (একাদশ-দ্বাদশ শ্রেণি),ড. আবু জাফর খান,"",TK. 170,https://rokomari.com//book/71417/higher-math-1st-part--class-xi-xii-,https://ds.rokomari.store/rokomari110/ProductNew20190903/130X186/rokimg_20151018_71417.gif,"",উচ্চতর গণিত-প্রথম পত্র (একাদশ-দ্বাদশ শ্রেণি),ড. আবু জাফর খান, , ,জাহাঙ্গীর লাইব্রেরী, ,"3rd Published,2015",334,বাংলাদেশ,বাংলা
উচ্চতর গণিত -২য় পত্র (একাদশ-দ্বাদশ শ্রেণি) (সাদা),ড. আবু জাফর খান,"",TK. 170,https://rokomari.com//book/84226/higher-mathematics--2nd-paper--xi-and-xii---white-,https://ds.rokomari.store/rokomari110/ProductNew20190903/130X186/rokimg_20140603_84226.gif,"",উচ্চতর গণিত -২য় পত্র (একাদশ-দ্বাদশ শ্রেণি) (সাদা),ড. আবু জাফর খান, , ,জাহাঙ্গীর লাইব্রেরী, ,3rd Edition – 2016, ,বাংলাদেশ,বাংলা
উচ্চ মাধ্যমিক অর্থনীতি -১ম পত্র,সঞ্চয় বল,"",TK. 102,https://rokomari.com//book/71416/higher-secondary-economics--1st-part,https://ds.rokomari.store/rokomari110/ProductNew20190903/130X186/book_av.png,"",উচ্চ মাধ্যমিক অর্থনীতি -১ম পত্র,"সঞ্চয় বল,সঞ্চিত বল", , ,জাহাঙ্গীর লাইব্রেরী, , , ,বাংলাদেশ,বাংলা
উচ্চতর গণিত -২য় পত্র (একাদশ-দ্বাদশ শ্রেণি) (নিউজ),ড. আবু জাফর খান,TK. 94,TK. 89,https://rokomari.com//book/84227/higher-mathematics--2nd-paper--xi-and-xii---news-,https://ds.rokomari.store/rokomari110/ProductNew20190903/130X186/rokimg_20140603_84227.gif,"",উচ্চতর গণিত -২য় পত্র (একাদশ-দ্বাদশ শ্রেণি) (নিউজ),ড. আবু জাফর খান, , ,জাহাঙ্গীর লাইব্রেরী, ,2nd Edition – 2015, ,বাংলাদেশ,বাংলা
বাংলা ব্যাকরণ ও নির্মিতি-২য় পত্র (একাদশ-দ্বাদশ)(সাদা),বিভাস কুমার জয়ধর,"",TK. 131,https://rokomari.com//book/84233/bangla-bacaron-o-nirmito-2nd-part--xi-xii-class--white-,https://ds.rokomari.store/rokomari110/ProductNew20190903/130X186/rokimg_20140603_84233.gif,"",বাংলা ব্যাকরণ ও নির্মিতি-২য় পত্র (একাদশ-দ্বাদশ)(সাদা),বিভাস কুমার জয়ধর, , ,জাহাঙ্গীর লাইব্রেরী, ,2013-2014,336,বাংলাদেশ,বাংলা
বাংলা ব্যাকরণ ও নির্মিতি-২য় পত্র (একাদশ-দ্বাদশ)(নিউজ),বিভাস কুমার জয়ধর,"",TK. 105,https://rokomari.com//book/84234/bangla-bacaron-o-nirmito-2nd-part--class-xi-xii--news-,https://ds.rokomari.store/rokomari110/ProductNew20190903/130X186/rokimg_20140603_84234.gif,"",বাংলা ব্যাকরণ ও নির্মিতি-২য় পত্র (একাদশ-দ্বাদশ)(নিউজ),বিভাস কুমার জয়ধর, , ,জাহাঙ্গীর লাইব্রেরী, ,2nd Edition – 2015, ,বাংলাদেশ,বাংলা
