Title,Author,Original Price,Discounted Price,URL,Image,Summary,Book_Title,Book_Author,Translator,Editor,Publisher,ISBN,Edition,Number Of Pages,Country,Language
প্রফেসর’স সিনিয়র স্টাফ নার্স মিডওয়াইফ নিয়োগ সহায়িকা,প্রফেসর’স সম্পাদনা পরিষদ,TK. 430,TK. 288,https://rokomari.com//book/150451/senior-staff-nurse-midwife-neyog-sohayika,https://ds.rokomari.store/rokomari110/ProductNew20190903/130X186/49658e373_150451.jpg,"",প্রফেসর’স সিনিয়র স্টাফ নার্স মিডওয়াইফ নিয়োগ সহায়িকা, , ,প্রফেসর’স সম্পাদনা পরিষদ,প্রফেসর’স প্রকাশন, ,"6th Edition,2020",550,বাংলাদেশ,বাংলা
এক কথায় প্রকাশ বা বাক্য-সংকোচন ,পংকজ কুমার সিকদার,TK. 60,TK. 42,https://rokomari.com//book/20590/ek-kothay-prokash-ba-bakyo-songkuchon,https://ds.rokomari.store/rokomari110/ProductNew20190903/130X186/5d16028f4_20590.jpg,"",এক কথায় প্রকাশ বা বাক্য-সংকোচন,পংকজ কুমার সিকদার, , ,প্রফেসর’স প্রকাশন,9848524665,"9th Edition,2019",104,বাংলাদেশ,বাংলা
ডিকশনারি অব সিনোনিমস এন্ড এন্টোনিমস,এস. এম. জাকির হুসাইন,TK. 250,TK. 213,https://rokomari.com//book/20446/dictionary-of-synonyms-and-antonyms,https://ds.rokomari.store/rokomari110/ProductNew20190903/130X186/1367d3673_20446.jpg,"",ডিকশনারি অব সিনোনিমস এন্ড এন্টোনিমস,এস. এম. জাকির হুসাইন, , ,Professor's Prokashon,0,"9th Edition,2016",5420,Bangladesh,Bangla & English
জেনারেল ওয়ার্ড বুক ,গুল মোহাম্মদ মাহফুজুল্লাহ,TK. 140,TK. 123,https://rokomari.com//book/20441/general-word-book,https://ds.rokomari.store/rokomari110/ProductNew20190903/130X186/675dce240_20441.jpg,"",জেনারেল ওয়ার্ড বুক,গুল মোহাম্মদ মাহফুজুল্লাহ, , ,Professor's Prokashon, ,"14th Edition,2019",192,Bangladesh,Bangla & English
Fundamentals Of Learning English (Bangla-English),গোলাম রাব্বানী,TK. 235,TK. 200,https://rokomari.com//book/20431/fundamentals-of-learning-english--bangla-english-,https://ds.rokomari.store/rokomari110/ProductNew20190903/130X186/1edb4abf0_20431.jpg,"বর্তমান সময়ে ইংরেজি ছাড়া কোনো কিছু চিন্তাও করা যায় না।  পড়াশোনা, চাকরি, ব্যবসা সব জায়গায়তেই ইংরেজিতে ভালো দক্ষতা থাকতে হয়। বিশেষ করে ইংরেজিতে কথা বলার দক্ষতা। ইংরেজি আমাদের মাতৃভাষা না হওয়ায় অনেক ক্ষেত্রেই ইংরেজিতে কথা বলতে গিয়ে আমরা অসুবিধার সম্মুখীন হই। এসব অসুবিধার কারণ ইংরেজিতে আমাদের সীমিত জ্ঞান এবং পর্যাপ্ত অনুশীলনের অভাব। ইংরেজিতে আপনার দুর্বলতা কাটিয়ে উঠতে সংগ্রহ করুন ‘Fundamentals Of Learning English’ বইটি।
এই বইটিতে রয়েছে মাতৃভাষায় ও সহজে মডার্ন ইংলিশ আয়ত্ত করার সর্বাধুনিক পদ্ধতিসমূহ যেগুলো দৈনন্দিন কথোপকথনসহ স্পোকেন ইংলিশ এর ভিত্তিস্বরূপ।
নিজেকে ইংরেজি ভাষায় চৌকষ করে তুলতে হলে আপনার টেবিলে থাকুক ‘Fundamentals Of Learning English’ বইটি।",Fundamentals Of Learning English (Bangla-English),Golam Rabbani, , ,Professor's Prokashon, ,"14th Edition,2018",336,Bangladesh,English
Viva For Bank Job,প্রফেসরস প্রকাশন,TK. 350,TK. 210,https://rokomari.com//book/107661/viva-for-bank-job,https://ds.rokomari.store/rokomari110/ProductNew20190903/130X186/rokimg_20151213_107661.gif,"",Viva For Bank Job, , ,Professors Procation,Professor's Prokashon, ,2019,398,Bangladesh,English
প্রফেসর’স ভাইভা সহায়িকা মুক্তিযুদ্ধ ও বাংলাদেশ,প্রফেসরস প্রকাশন,TK. 280,TK. 196,https://rokomari.com//book/150414/professor-s-viva-sohayika-muktijuddho-o-bangladesh,https://ds.rokomari.store/rokomari110/ProductNew20190903/130X186/952724426_150414.jpg,"",প্রফেসর’স ভাইভা সহায়িকা মুক্তিযুদ্ধ ও বাংলাদেশ,প্রফেসরস প্রকাশন, , ,প্রফেসর’স প্রকাশন, ,"1st Published,2017",480,বাংলাদেশ,বাংলা
Easy Ways of Speaking English ,ইসলাম মোঃ হাসনাত নোবেল,TK. 120,TK. 106,https://rokomari.com//book/20440/easy-ways-of-speaking-english,https://ds.rokomari.store/rokomari110/ProductNew20190903/130X186/02c1bc450_20440.jpg,"",Easy Ways of Speaking English,Islam Md. Hasanat Noble, , ,Professor's Prokashon, ,"11th Edition,2017",190,Bangladesh,English
ফাস্ট মেড স্পোকেন ইংলিশ ,মকলেছুজ্জামান খান,TK. 180,TK. 158,https://rokomari.com//book/20426/first-made-spoken-english,https://ds.rokomari.store/rokomari110/ProductNew20190903/130X186/9f414e9dc_20426.jpg,"",ফাস্ট মেড স্পোকেন ইংলিশ,মকলেছুজ্জামান খান, , ,Professor's Prokashon, ,"17th Edition,2019",256,Bangladesh,Bangla & English
"৪১তম বিসিএস প্রিলিমিনারি: প্রফেসর্স এমসিকিউ রিভিউ ভূগোল, পরিবেশ ও দুর্যোগ ব্যবস্থাপনা",প্রফেসর’স সম্পাদনা পরিষদ,TK. 280,TK. 148,https://rokomari.com//book/183676/41th-bcs-preliminary--professors-mcq-review-bugol--poribesh-o-durjhog-byabosthapona-noitikotha--mulyobodh-o-sushoson,https://ds.rokomari.store/rokomari110/ProductNew20190903/130X186/8972ea970_183676.jpg,"","৪১তম বিসিএস প্রিলিমিনারি: প্রফেসর্স এমসিকিউ রিভিউ ভূগোল,পরিবেশ ও দুর্যোগ ব্যবস্থাপনা", , ,প্রফেসর’স সম্পাদনা পরিষদ,প্রফেসর’স প্রকাশন, ,"New Edition,2019",480,বাংলাদেশ,বাংলা
Essential Idioms Proverbs and Phrasal Verbs,মোঃ মফিজুর রহমান মাহফুজ (বিসিএস),TK. 230,TK. 196,https://rokomari.com//book/193756/essential-idioms-proverbs-and-phrasal-verbs,https://ds.rokomari.store/rokomari110/ProductNew20190903/130X186/182013685_193756.jpg,"",Essential Idioms Proverbs and Phrasal Verbs,Md. Mofizur Rahman Mahfuz (BCS), , ,Professor's Prokashon, ,"6th Edition,2019",362,Bangladesh,English
প্রফেসর’র বিসিএস মানসিক দক্ষতা (৪০তম বিসিএস লিখিত পরীক্ষা),প্রফেসরস প্রকাশন,TK. 550,TK. 330,https://rokomari.com//book/187239/professors-bcs-manosik-dokkhota--40th-bcs-likhito-porikkha--27th-theke-38th-bcs-proshno-somadhan--10-set-model-proshno-o-uttor-songjhojito-,https://ds.rokomari.store/rokomari110/ProductNew20190903/130X186/24c43265d_187239.jpg,"",প্রফেসর’র বিসিএস মানসিক দক্ষতা (৪০তম বিসিএস লিখিত পরীক্ষা), , ,প্রফেসরস প্রকাশন,প্রফেসর’স প্রকাশন, ,"19th Edition,2019",679,বাংলাদেশ,বাংলা
"প্রফেসর’স বিসিএস প্রিলিমিনারি নৈতিকতা, মূল্যবোধ ও সুশাসন",প্রফেসরস প্রকাশন,TK. 280,TK. 148,https://rokomari.com//book/20490/professor-s-bcs-preliminary-noytikotha--mullobod-o-susason,https://ds.rokomari.store/rokomari110/ProductNew20190903/130X186/f07b9da64_20490.jpg,"","প্রফেসর’স বিসিএস প্রিলিমিনারি নৈতিকতা,মূল্যবোধ ও সুশাসন",প্রফেসরস প্রকাশন, , ,প্রফেসর’স প্রকাশন, ,New Edition 2019,216,বাংলাদেশ,বাংলা
মডার্ণ ইংলিশ ফর ফ্লুয়েনসি ,মকলেছুজ্জামান খান,TK. 180,TK. 158,https://rokomari.com//book/20437/modern-english-for-fluency,https://ds.rokomari.store/rokomari110/ProductNew20190903/130X186/e165cdb07_20437.jpg,"",মডার্ণ ইংলিশ ফর ফ্লুয়েনসি,"মকলেছুজ্জামান খান,মাহফুজুল্লাহ", , ,Professor's Prokashon, ,"12th Edition,2016",221,Bangladesh,Bangla & English
অরিজিন অব ইংলিশ ওয়ার্ডস ,সারওয়ার হোসেন,TK. 120,TK. 106,https://rokomari.com//book/20438/origin-of-english-words,https://ds.rokomari.store/rokomari110/ProductNew20190903/130X186/a43b8ae51_20438.jpg,"",অরিজিন অব ইংলিশ ওয়ার্ডস,সারওয়ার হোসেন, , ,Professor's Prokashon, ,"9th Edition,2005",176,Bangladesh,Bangla & English
৪১তম বিসিএস প্রিলিমিনারি: প্রফেসর্স এমসিকিউ রিভিউ মানসিক দক্ষতা,প্রফেসর’স সম্পাদনা পরিষদ,TK. 350,TK. 165,https://rokomari.com//book/183678/41th-bcs-preliminary--professors-mcq-review-manosik-dokkhota,https://ds.rokomari.store/rokomari110/ProductNew20190903/130X186/875e14686_183678.jpg,"",৪১তম বিসিএস প্রিলিমিনারি: প্রফেসর্স এমসিকিউ রিভিউ মানসিক দক্ষতা, , ,প্রফেসর’স সম্পাদনা পরিষদ,প্রফেসর’স প্রকাশন, ,"New Edition,2019",456,বাংলাদেশ,বাংলা
ভাবসম্প্রাসারণ-সারাংশ-সারমর্ম ,প্রকৌশলী মোঃ হাফিজুর রহমান খান,TK. 190,TK. 133,https://rokomari.com//book/20581/vabsomprosaron-saransho-sarmormo,https://ds.rokomari.store/rokomari110/ProductNew20190903/130X186/7c5bd474d_20581.jpg,"",ভাবসম্প্রাসারণ-সারাংশ-সারমর্ম,প্রকৌশলী মোঃ হাফিজুর রহমান খান, , ,প্রফেসর’স প্রকাশন, , , ,বাংলাদেশ,বাংলা
উপসহকারী কৃষি কর্মকর্তা নিয়োগ সহায়িকা,প্রফেসর’স সম্পাদনা পরিষদ,TK. 430,TK. 288,https://rokomari.com//book/201857/uposohokari-krishi-kormokarta-niyog,https://ds.rokomari.store/rokomari110/ProductNew20190903/130X186/4050a6a78_201857.jpg,"",উপসহকারী কৃষি কর্মকর্তা নিয়োগ সহায়িকা,প্রফেসর’স সম্পাদনা পরিষদ, , ,প্রফেসর’স প্রকাশন, ,"Edition,2020", ,বাংলাদেশ,বাংলা
৪১তম বিসিএস প্রিলিমিনারি: প্রফেসর্স এমসিকিউ রিভিউ গাণিতিক যুক্তি (প্রিলিমিনারী),প্রফেসর’স সম্পাদনা পরিষদ,TK. 500,TK. 325,https://rokomari.com//book/152280/41th-ganitik-jukti--preliminary-,https://ds.rokomari.store/rokomari110/ProductNew20190903/130X186/52d90a32a_152280.jpg,"",৪১তম বিসিএস প্রিলিমিনারি: প্রফেসর্স এমসিকিউ রিভিউ গাণিতিক যুক্তি (প্রিলিমিনারী), , ,প্রফেসর’স সম্পাদনা পরিষদ,প্রফেসর’স প্রকাশন, ,"New Edition,2019",1112,বাংলাদেশ,বাংলা
প্রফেসর’স সহকারী জজ  নিয়োগ সহায়িকা,প্রফেসরস প্রকাশন,TK. 430,TK. 301,https://rokomari.com//book/20562/sahokari-joj-niyog-shohayika,https://ds.rokomari.store/rokomari110/ProductNew20190903/130X186/41b38bc53_20562.jpg,"",প্রফেসর’স সহকারী জজ  নিয়োগ সহায়িকা,প্রফেসরস প্রকাশন, , ,প্রফেসর’স প্রকাশন, ,"2dn Edition,2018",399,বাংলাদেশ,বাংলা
প্রফেসর’স বিসিএস বিজ্ঞান ও প্রযুক্তি (৪০তম বিসিএস লিখিত পরীক্ষা),মোহাম্মদ আবু তাহের,TK. 950,TK. 665,https://rokomari.com//book/20616/professors-bcs-biggan-o--projhukti--40th-bcs-likhito-porikkha--10th-theke-38th-bcs-proshno-somadhan--10-set-model-proshno-o-uttor-songjhojito-,https://ds.rokomari.store/rokomari110/ProductNew20190903/130X186/8cf0f818a_20616.jpg,"",প্রফেসর’স বিসিএস বিজ্ঞান ও প্রযুক্তি (৪০তম বিসিএস লিখিত পরীক্ষা),"মোহাম্মদ আবু তাহের,মো: গোলাম কিবরিয়া সরকার", , ,প্রফেসর’স প্রকাশন, ,"19th Edition,2019",944,বাংলাদেশ,বাংলা
"প্রফেসর’স অডিটর নিয়োগ সহায়িকা (এমসিকিউ, লিখিত, ভাইভা)",প্রফেসর’স সম্পাদনা পরিষদ,TK. 430,TK. 314,https://rokomari.com//book/202755/professor-s-auditor-niyog-sohayika--mcq--likhito--viva-,https://ds.rokomari.store/rokomari110/ProductNew20190903/130X186/6ff85bd9c_202755.jpg,"","প্রফেসর’স অডিটর নিয়োগ সহায়িকা (এমসিকিউ,লিখিত,ভাইভা)", , ,প্রফেসর’স সম্পাদনা পরিষদ,প্রফেসর’স প্রকাশন, ,"New Edition,2020", ,বাংলাদেশ,বাংলা
প্রফেসর’স উপসহকারী কৃষি কর্মকর্তা নিয়োগ সহায়িকা,প্রফেসর’স সম্পাদনা পরিষদ,TK. 430,TK. 288,https://rokomari.com//book/163107/professor-uposohokare-krishe-karmokorta-neyog-sohayka,https://ds.rokomari.store/rokomari110/ProductNew20190903/130X186/83432a9a8_163107.jpg,"",প্রফেসর’স উপসহকারী কৃষি কর্মকর্তা নিয়োগ সহায়িকা, , ,প্রফেসর’স সম্পাদনা পরিষদ,প্রফেসর’স প্রকাশন, ,"3rd Edition,2020",472,বাংলাদেশ,বাংলা
স্বাস্থ্য সহকারী নিয়োগ ,প্রফেসরস প্রকাশন,TK. 320,TK. 205,https://rokomari.com//book/20551/shastho-sohokai-niok,https://ds.rokomari.store/rokomari110/ProductNew20190903/130X186/4caedf76c_20551.jpg,"",স্বাস্থ্য সহকারী নিয়োগ,প্রফেসরস প্রকাশন, , ,প্রফেসর’স প্রকাশন, , , ,বাংলাদেশ,বাংলা
সমাজ গবেষনার পরিসংখ্যান ,ড. এ এস এম আতীকুর রহমান,TK. 350,TK. 298,https://rokomari.com//book/20494/somaj-gobesonar-porisonkhyan,https://ds.rokomari.store/rokomari110/ProductNew20190903/130X186/a7c18744e_20494.jpg,"",সমাজ গবেষনার পরিসংখ্যান,ড. এ এস এম আতীকুর রহমান, , ,প্রফেসর’স প্রকাশন, , , ,বাংলাদেশ,বাংলা
বেসরকারি শিক্ষক নিবন্ধন সহায়িকা-১৬তম (প্রিলিমিনারি টেস্ট),প্রফেসরস প্রকাশন,TK. 600,TK. 372,https://rokomari.com//book/75391/besarkari-shikkhak-nebondhon-sohayeka,https://ds.rokomari.store/rokomari110/ProductNew20190903/130X186/a110bf996064_75391.jpg,"",বেসরকারি শিক্ষক নিবন্ধন সহায়িকা-১৬তম (প্রিলিমিনারি টেস্ট), , ,প্রফেসরস প্রকাশন,প্রফেসর’স প্রকাশন, ,"17th,Edition,2017",784,বাংলাদেশ,বাংলা
সহকারী উপজেলা/থানা শিক্ষা অফিসার নিয়োগ সহায়িকা,প্রফেসর’স সম্পাদনা পরিষদ,TK. 360,TK. 252,https://rokomari.com//book/20545/assistant-upazela-thana-shikka-officer-niok-guide,https://ds.rokomari.store/rokomari110/ProductNew20190903/130X186/rokimg_20151005_20545.gif,"",সহকারী উপজেলা/থানা শিক্ষা অফিসার নিয়োগ সহায়িকা, , ,প্রফেসর’স সম্পাদনা পরিষদ,প্রফেসর’স প্রকাশন, ,Fourth Edition-2015,470,বাংলাদেশ,বাংলা
কমিউনিটি হেলথ কেয়ার প্রোভাইডার নিয়োগ সহায়িকা,দিব্যপ্রকাশ সম্পাদনা পরিষদ,TK. 250,TK. 160,https://rokomari.com//book/162064/community-health-care-provitor-neyog-guide,https://ds.rokomari.store/rokomari110/ProductNew20190903/130X186/6a3a06268_162064.jpg,"",কমিউনিটি হেলথ কেয়ার প্রোভাইডার নিয়োগ সহায়িকা, , ,দিব্যপ্রকাশ সম্পাদনা পরিষদ,প্রফেসর’স প্রকাশন, ,"New Edition,2018",352,বাংলাদেশ,বাংলা
প্রফেসর’স ব্যাংক ম্যাথ : গণিত প্রস্তুতির সেল্ফ কোচিং(এম সি কিউ),রাজিব হোসাইন,TK. 700,TK. 483,https://rokomari.com//book/201618/professor-s-bank-math---ginit-prostutir-self-coaching--mcq-,https://ds.rokomari.store/rokomari110/ProductNew20190903/130X186/0711abda1_201618.jpg,"",প্রফেসর’স ব্যাংক ম্যাথ : গণিত প্রস্তুতির সেল্ফ কোচিং(এম সি কিউ),রাজিব হোসাইন, , ,প্রফেসর’স প্রকাশন, ,New Edition 2020,614,বাংলাদেশ,বাংলা
Profesor's Selected Basic Essay,মাসুদুল হাসান রনি ,TK. 450,TK. 315,https://rokomari.com//book/20577/profesor-s-selected-basic-essay,https://ds.rokomari.store/rokomari110/ProductNew20190903/130X186/338a23cac_20577.jpg,"",Profesor's Selected Basic Essay,"Masudul Hasan Roni,Md. Mostafizur Rahman,Mohammod Jahidul Islam", , ,Professor's Prokashon, , , ,Bangladesh,English
আন্তর্জাতিক বিষয়াবলি,প্রফেসরস প্রকাশন,TK. 500,TK. 330,https://rokomari.com//book/20614/ineternational-bisoyaboli,https://ds.rokomari.store/rokomari110/ProductNew20190903/130X186/book_av.png,"",আন্তর্জাতিক বিষয়াবলি,প্রফেসরস প্রকাশন, , ,প্রফেসর’স প্রকাশন, ,"15th Edition,2020",844,বাংলাদেশ,বাংলা
বেসরকারী শিক্ষক নিবন্ধন সহায়িকা-১৪ তম (প্রিলিমিনারি টেস্ট),প্রফেসরস প্রকাশন,TK. 600,TK. 372,https://rokomari.com//book/20542/besorkari-shikhok-nibondhon-guide-14th--preliminary-test-,https://ds.rokomari.store/rokomari110/ProductNew20190903/130X186/0aba8438c404_20542.jpg,"",বেসরকারী শিক্ষক নিবন্ধন সহায়িকা-১৪ তম (প্রিলিমিনারি টেস্ট), , ,প্রফেসরস প্রকাশন,প্রফেসর’স প্রকাশন, ,"16th Edition,2017",816,বাংলাদেশ,বাংলা
Vocabulary Treasure,প্রফেসর’স সম্পাদনা পরিষদ,TK. 320,TK. 272,https://rokomari.com//book/202693/vocabulary-treasure,https://ds.rokomari.store/rokomari110/ProductNew20190903/130X186/6495e24a6_202693.jpg,"",Vocabulary Treasure, , ,Professors Edit Council,Professor's Prokashon, ,"", ,Bangladesh,English
প্রফেসর’স সমাজসেবা অধিদপ্তর নিয়োগ সহায়িকা,প্রফেসর’স সম্পাদনা পরিষদ,TK. 550,TK. 303,https://rokomari.com//book/202750/professor-s-somajseba-odhidoptor-niyog-sohayika,https://ds.rokomari.store/rokomari110/ProductNew20190903/130X186/01141d714_202750.jpg,"",প্রফেসর’স সমাজসেবা অধিদপ্তর নিয়োগ সহায়িকা, , ,প্রফেসর’স সম্পাদনা পরিষদ,প্রফেসর’স প্রকাশন, ,"New Edition,2020", ,বাংলাদেশ,বাংলা
তথ্য পরিক্রমা (বিশেষ সংখ্যা),প্রফেসরস প্রকাশন,TK. 200,TK. 120,https://rokomari.com//book/20609/tattho-ppricroma--bishes-sonkkha-,https://ds.rokomari.store/rokomari110/ProductNew20190903/130X186/book_av.png,"",তথ্য পরিক্রমা (বিশেষ সংখ্যা),প্রফেসরস প্রকাশন, , ,প্রফেসর’স প্রকাশন, , , ,বাংলাদেশ,বাংলা
সাব রেজিষ্টোর নিয়োগ ,প্রফেসরস প্রকাশন,TK. 360,TK. 252,https://rokomari.com//book/20550/sub-rejister-niok,https://ds.rokomari.store/rokomari110/ProductNew20190903/130X186/book_av.png,"",সাব রেজিষ্টোর নিয়োগ,প্রফেসরস প্রকাশন, , ,প্রফেসর’স প্রকাশন, , , ,বাংলাদেশ,বাংলা
প্রফেসরস জব সলিউশন,প্রফেসরস প্রকাশন,"TK. 1,250",TK. 788,https://rokomari.com//book/20514/professors-job-solution--mcq-,https://ds.rokomari.store/rokomari110/ProductNew20190903/130X186/641fc954f_20514.jpg,"শুধু বই বড় না মানেও বড়। বি সি এস, পি এস সি, বিভিন্ন মন্ত্রণালয় ও সংস্থা গৃহীত নিয়োগ, মাধ্যমিক-প্রাথমিক শিক্ষক নিয়োগ, শিক্ষক নিবন্ধন, শিক্ষা অফিসার নিয়োগ এরকম অন্যান্য অনেক পরীক্ষার বিগত বছরের গুরুত্বপূর্ণ প্রশ্ন সলভ এবং ব্যাখ্যাসহ দেয়া আছে এই বইয়ে। অনেক ভালো প্রস্তুতি নিন বা কম সময়ের স্বল্প প্রস্তুতি সবার জন্যেই মানসিক শান্তির জায়গা বইটি। বিশেষ করে নিজেকে যাচাই করতে এর প্রশ্নগুলো নিয়মিত সল্ভ করতে থাকলে আপনার প্রস্তুতি যেমনই হোক দেখবেন অনেকটা আত্মবিশ্বাস পাচ্ছেন। আর এটাই এ বইয়ের ম্যাজিক!",প্রফেসরস জব সলিউশন,প্রফেসরস প্রকাশন, , ,প্রফেসর’স প্রকাশন, ,"30th Edition,2021",1580,বাংলাদেশ,বাংলা
কারেন্ট অ্যাফেয়ার্স জুলাই ২০২০,প্রফেসর’স সম্পাদনা পরিষদ,TK. 20,"",https://rokomari.com//book/201858/current-affair-s-july-2020,https://ds.rokomari.store/rokomari110/ProductNew20190903/130X186/c9bc31ab4_201858.jpg,"",কারেন্ট অ্যাফেয়ার্স জুলাই ২০২০,প্রফেসর’স সম্পাদনা পরিষদ, , ,প্রফেসর’স প্রকাশন, , ,96,বাংলাদেশ,বাংলা
