Title,Author,Original Price,Discounted Price,URL,Image,Summary,Book_Title,Book_Author,Translator,Editor,Publisher,ISBN,Edition,Number Of Pages,Country,Language
কমন মিসটেকস ইন ইংলিশ [প্রয়োজনীয় বাংলা ব্যাখ্যা এবং অনুশীলনীর উত্তরসহ],টি জে ফিটিকাইডস ,TK. 175,TK. 159,https://rokomari.com//book/185955/common-mistakes-in-english--proyojoniyo-bangla-byakhya-ebong-onushiloni-uttorsoho-,https://ds.rokomari.store/rokomari110/ProductNew20190903/130X186/ceccc196d_185955.jpg,"",কমন মিসটেকস ইন ইংলিশ [প্রয়োজনীয় বাংলা ব্যাখ্যা এবং অনুশীলনীর উত্তরসহ],টি জে ফিটিকাইডস, ,"ড. রুহুল আমিন,মো: লায়েক আলি",SET Publication Dhaka,9847002006545,"Reprint,2019",240,Bangladesh,Bangla & English
SET Suggestion-2019 Solution to Part-A With Question Bank For 3rd Year English Honours,সেট পাবলিকেশন্স ঢাকা,TK. 195,TK. 172,https://rokomari.com//book/163896/set-suggestion-2019-solution-to-part-a-with-question-bank-for-3rd-year-english-honours,https://ds.rokomari.store/rokomari110/ProductNew20190903/130X186/cddb42e03_163896.jpg,"",SET Suggestion-2019 Solution to Part-A With Question Bank For 3rd Year English Honours, , ,SET Publication Dhaka,SET Publication Dhaka,9847002006125,Session: 2016-2017,352,Bangladesh,English
সুবচন (সংক্ষিপ্ত বাংলা-ইংরেজি উদ্ধৃতি অভিধান),কাজী মো. সিদ্দিকুর রহমান (এম.এ),TK. 495,TK. 450,https://rokomari.com//book/185954/subochon--songkhipto-bangla-english-uddhriti-ovidhan-,https://ds.rokomari.store/rokomari110/ProductNew20190903/130X186/d56df2dc6_185954.jpg,"",সুবচন (সংক্ষিপ্ত বাংলা-ইংরেজি উদ্ধৃতি অভিধান), ,কাজী মো. সিদ্দিকুর রহমান (এম.এ),কাজী মো. সিদ্দিকুর রহমান (এম.এ),SET Publication Dhaka,9847002006316,"1st Published,2019",624,Bangladesh,Bangla & English
SET Test papers English Honours (3rd Year) ,সেভেন এক্সপেরিমেন্টেড টিচারস,TK. 290,TK. 276,https://rokomari.com//book/100108/set-test-papers-english-honours--3rd-year-,https://ds.rokomari.store/rokomari110/ProductNew20190903/130X186/rokimg_20150530_100108.gif,"",SET Test papers English Honours (3rd Year), , ,Seven Experienced Teachers,SET Publication Dhaka,9847002004336,"1st Published,2018",448,Bangladesh,English
বাংলা ভাষা ও সাহিত্য পূর্ণাঙ্গ সমাধান,মোস্তফা তারিকুল আহসান,TK. 225,TK. 205,https://rokomari.com//book/185904/bangla-vasha-o-sahityo-purnango-somadhan,https://ds.rokomari.store/rokomari110/ProductNew20190903/130X186/720072b90_185904.jpg,"""বাংলা ভাষা ও সাহিত্য পূর্ণাঙ্গ সমাধান"" বইয়ের পিছনের কভারের লেখা:
বইটির বৈশিষ্ট্য 
প্রাঞ্জল ভাষায় লেখা। বাহুল্য বর্জন করার ফলে কলেবর ছােটো
হয়েছে। কিন্তু প্রয়ােজনীয় কোনাে বিষয় বাদ দেওয়া হয়নি। তাই কম সময়ে সব বিষয় জানা যাবে। 
বেশি গুরুত্বপূর্ণ বিষয়গুলাে প্রশ্ন-উত্তর আকারে এবং কম গুরুত্বপূর্ণ। বিষয় পয়েন্ট আকারে দেওয়া হয়েছে। এ কারণেও কলেবর ছােটো হয়েছে। এর ফলে সব বিষয় মুখস্থ করা সহজ হবে। 
বিভিন্ন প্রতিযােগিতামূলক প্রশ্ন উত্তরসহ দেওয়া হয়েছে। ফলে। পরীক্ষার প্রশ্ন সম্পর্কে পূর্ণাঙ্গ ধারণা পাওয়া যাবে। 
১০ থেকে সর্বশেষ বিসিএস পরীক্ষার সব প্রশ্ন উত্তরসহ সংযুক্ত করা হয়েছে।",বাংলা ভাষা ও সাহিত্য পূর্ণাঙ্গ সমাধান,মোস্তফা তারিকুল আহসান, ,ড. অমৃতলাল বালা,সেট পাবলিকেশন্স ঢাকা,9847002004282,"Reprint,2017",440,বাংলাদেশ,বাংলা
