Title,Author,Original Price,Discounted Price,URL,Image,Summary,Book_Title,Book_Author,Translator,Editor,Publisher,ISBN,Edition,Number Of Pages,Country,Language
Hajj and Tawheed,ডা. সালেহ আস  সালেহ,"",TK. 220,https://rokomari.com//book/150402/hajj-and-tawheed,https://ds.rokomari.store/rokomari110/ProductNew20190903/130X186/f35759e7a_150402.jpg,"",Hajj and Tawheed,Dr. saleh As saleh, , ,Message Of Islam,9782987459569,"1st Edition,1998",28,Saudi Arabia,English
 Branches of Faith,আব্দুল কারিম আওয়াদ,"","TK. 1,630",https://rokomari.com//book/150752/branches-of-faith,https://ds.rokomari.store/rokomari110/ProductNew20190903/130X186/5270da31b_150752.jpg,"",Branches of Faith,Abdul Karim Awad, , ,Message Of Islam,9781902570266,"1st Edition,2002", ,Saudi Arabia,English
The Role of the Mosque in 21st Century Britain,প্রফেসর ডঃ আব্দুল কারিম বাকর,"",TK. 600,https://rokomari.com//book/151075/the-role-of-the-mosque-in-21st-century-britain,https://ds.rokomari.store/rokomari110/ProductNew20190903/130X186/83ff18754_151075.jpg,"",The Role of the Mosque in 21st Century Britain,Prof. Dr. Abdul Karim Bakkar, , ,Message Of Islam,9782987458937,"1st Edition,2015",173,Saudi Arabia,English
The Fiqh of Combining the Salaah,শাইখ মাসহুর হাসান সালমান ,"",TK. 450,https://rokomari.com//book/151428/the-fiqh-of-combining-the-salaah,https://ds.rokomari.store/rokomari110/ProductNew20190903/130X186/9253b3c55_151428.jpg,"",The Fiqh of Combining the Salaah,Shaykh Mashhur Hasan Salman, , ,Message Of Islam,9781902570310,"1st Edition,2006", ,Saudi Arabia,English
What Leads to Hell ,আব্দুল কারিম আওয়াদ,"",TK. 960,https://rokomari.com//book/151429/what-leads-to-hell,https://ds.rokomari.store/rokomari110/ProductNew20190903/130X186/4894b2fec_151429.jpg,"",What Leads to Hell,Abdul Karim Awad, , ,Message Of Islam,9781902570099,"1st Edition,2005",357,Saudi Arabia,English
Understanding the Etiquettes of Differing ,সালিম ইবন সালিহ আল মারফাদে,"",TK. 520,https://rokomari.com//book/151430/understanding-the-etiquettes-of-differing,https://ds.rokomari.store/rokomari110/ProductNew20190903/130X186/f764ca260_151430.jpg,"",Understanding the Etiquettes of Differing,Saalim Ibn Saalih Al Marfadee, , ,Message Of Islam,9781902570167,"1st Edition,2000", ,Saudi Arabia,English
