Title,Author,Original Price,Discounted Price,URL,Summary,Book_Title,Book_Author,Translator,Editor,Publisher,ISBN,Edition,Number Of Pages,Country,Language
দুনিয়া ও আখেরাতে নামায পড়ার পুরস্কার এবং নামায না পড়ার শাস্তি,মাওলানা আলমগীর হুসাইন যশোরী,TK. 220,TK. 154,https://rokomari.com//book/99751/duniya-o-akherate-namaj-porar-puruskar-ebong-namaj-na-porar-shasti,"",দুনিয়া ও আখেরাতে নামায পড়ার পুরস্কার এবং নামায না পড়ার শাস্তি,"মাওলানা আলমগীর হুসাইন যশোরী,মাওলানা মুহাম্মদ ইব্রাহীম",মাওলানা আলমগীর হুসাইন যশোরী, ,Al Hikmah Publications,9847018600201,"1st Published,2015",208,Bangladesh,Bangla & Arabic
শেষ জীবনে মহানবী (স.) ও চার খলীফা (রাযি.),অধ্যক্ষ মাওঃ মুহাম্মদ রওশন আলী,TK. 120,TK. 84,https://rokomari.com//book/45496/ses-jiboner-mohanobi--sm---o-char-kholipa--ra--,"",শেষ জীবনে মহানবী (স.) ও চার খলীফা (রাযি.),"অধ্যক্ষ মাওঃ মুহাম্মদ রওশন আলী,মাওলানা আবুল কালাম আজাদ",অধ্যক্ষ মাওঃ মুহাম্মদ রওশন আলী, ,আল হিকমাহ পাবলিকেশন্স,9847018600010,"1st Published,2008",96,বাংলাদেশ,বাংলা
মরা লোক কথা বলে,অধ্যাপক আ খ ম ইউনুস,TK. 130,TK. 91,https://rokomari.com//book/44143/mora-lok-kotha-bole,"",মরা লোক কথা বলে,"অধ্যাপক আ খ ম ইউনুস,ইমাম আবু বকর বিন আবিদ্দুনিয়া",মাওলানা মোহাম্মদ নূরুল্লাহ,অধ্যাপক আ খ ম ইউনুস,আল হিকমাহ পাবলিকেশন্স,9848712046,"2nd Edition,2015",94,বাংলাদেশ,বাংলা
মনময়ূরী : এক আদর্শ মুসলিম তরুণীর কাহিনী,আনোয়ার হোসেন লালন,TK. 150,TK. 105,https://rokomari.com//book/45280/monmoyuri---ak-adorsho-muslim-torunir-kahini,"",মনময়ূরী : এক আদর্শ মুসলিম তরুণীর কাহিনী,আনোয়ার হোসেন লালন, , ,আল হিকমাহ পাবলিকেশন্স,9847018600065,"1st Published,2008",112,বাংলাদেশ,বাংলা
জাহান্নামের ভয়াবহ আযাবের বর্ণনা,অধ্যাপক আ খ ম ইউনুস,TK. 130,TK. 91,https://rokomari.com//book/45491/jahannamer-voyaboho-ajaber-bornona,"",জাহান্নামের ভয়াবহ আযাবের বর্ণনা,"অধ্যাপক আ খ ম ইউনুস,আল্লামা মুফতি এমদাদল্লাহ আনোয়ার",মাওলানা মুহাম্মদ মুজিবুর রহমান,অধ্যাপক আ খ ম ইউনুস,আল হিকমাহ পাবলিকেশন্স,9843223705,"9th Published,2013",95,বাংলাদেশ,বাংলা
আলোর রাজপথ,সাইয়েদ আবুল হাসান আলী নদভী রহ.,TK. 125,TK. 88,https://rokomari.com//book/45484/alor-rajpoth--chotoder-ithaser-golpo-,"",আলোর রাজপথ,সাইয়েদ আবুল হাসান আলী নদভী রহ.,অধ্যক্ষ মাওঃ মুহাম্মদ রওশন আলী, ,আল হিকমাহ পাবলিকেশন্স,9847018600034,"1st Published,2008",96,বাংলাদেশ,বাংলা
পর্দা নারীর অলংকার,মাওলানা আবু নিশাত মুহাম্মদ আলী মোল্লা,TK. 240,TK. 168,https://rokomari.com//book/66823/porda-narir-alangkar,"",পর্দা নারীর অলংকার,মাওলানা আবু নিশাত মুহাম্মদ আলী মোল্লা, , ,আল হিকমাহ পাবলিকেশন্স,9847018600140,"1st Published,2015",264,বাংলাদেশ,বাংলা
কারবালার কান্না,আনোয়ার হোসেন লালন,TK. 220,TK. 154,https://rokomari.com//book/66825/karbalar-kanna,"",কারবালার কান্না,আনোয়ার হোসেন লালন, , ,আল হিকমাহ পাবলিকেশন্স,9847018600180,"2nd Edition,2014",272,বাংলাদেশ,বাংলা
সওয়াবে আমল,হাফেজে হাদীস ইমাম শরফুদ্দীন দিময়াতী (রহ.),TK. 400,TK. 280,https://rokomari.com//book/9143/showabe-amal,"",সওয়াবে আমল,হাফেজে হাদীস ইমাম শরফুদ্দীন দিময়াতী (রহ.),মাওলানা মোঃ রফীকুল ইসলাম, ,আল হিকমাহ পাবলিকেশন্স,9847018600119,"2nd Published,2012",528,বাংলাদেশ,বাংলা
গুনাহ পরিত্যাগের পুরস্কার,মাওলানা আরসালান বিন আখতার মায়মন,TK. 300,TK. 210,https://rokomari.com//book/115685/gunah-poritager-puroshkar,"",গুনাহ পরিত্যাগের পুরস্কার,মাওলানা আরসালান বিন আখতার মায়মন, , ,আল হিকমাহ পাবলিকেশন্স,9847018600230,"1st Published,2016",320,বাংলাদেশ,বাংলা
নারীর ইসলামী জীবন ও আধুনিক বিজ্ঞান,মাওলানা কারামত আলী নিযামী,TK. 270,TK. 189,https://rokomari.com//book/33464/narir-islami-jibon-o-adhunik-biggan,"",নারীর ইসলামী জীবন ও আধুনিক বিজ্ঞান,"মাওলানা কারামত আলী নিযামী,ডা. মুহাম্মদ আনোয়ার আখতার",মাওলানা কারামত আলী নিযামী, ,আল হিকমাহ পাবলিকেশন্স,98432701860,"2nd Published,2016",272,বাংলাদেশ,বাংলা
মুসলিম মহীয়সী নারীদের অমর অবদান,মাওলানা জুলফিকার আহমদ নকশবন্দী,TK. 170,TK. 119,https://rokomari.com//book/106384/muslim-mohiyosi-narirder-omor-obodhan,"",মুসলিম মহীয়সী নারীদের অমর অবদান,মাওলানা জুলফিকার আহমদ নকশবন্দী,মাওলানা তোফায়েল গাজালী, ,আল হিকমাহ পাবলিকেশন্স,9847018600225,"1st Published,2015",160,বাংলাদেশ,বাংলা
ইসলাম বনাম বিজাতীয় অনুকরণ,হাকীমুল ইসলাম কারী মুহাম্মদ তৈয়ব রহ.,TK. 260,TK. 182,https://rokomari.com//book/45279/islam-bonam-bejatiyo-anukoron,"",ইসলাম বনাম বিজাতীয় অনুকরণ,হাকীমুল ইসলাম কারী মুহাম্মদ তৈয়ব রহ., ,মাওলানা কারামত আলী নিযামী,আল হিকমাহ পাবলিকেশন্স,9848712062,"1st Published,2007",272,বাংলাদেশ,বাংলা
মরণের পরে কী হবে,মাওলানা আশেক এলাহী বুলন্দশহরী রহ.,TK. 230,TK. 161,https://rokomari.com//book/45285/moroner-pore-ki-hobe,"সূচীপত্র*
কবরের অবস্থা*
মৃত্যু পরে মুমিনের সম্মান*
মৃত্যুর সময় কাফেরের অপমান*
কবরের মুমিনের নামাযের আগ্রহ*
কবরের মুমিনের কোন ভয় থাকবে না এবং তার সম্মুখে জান্নাত উপস্থাপন করা হবে*
কবরের ঈমানদার ও বেঈমানদারের অবস্থা*
কবরবাসী দুনিয়াবাসীদের সম্পর্কে জানতে চায়*
বরযখবাসীদের নিকট জীবতদের আমল পেশ করা হয়*
মোমেনের সঙ্গে কবরের আচরণ*
মোমেনের জন্য আসমারন-জমিনের ভালবাসা ও কান্না*
সদকায়ে জারিয়া এবং সন্তানদের ইস্তেগফারের সওয়াব*
মোমেনের প্রতি মালাকুল মউতের সালাম*
মুমিন দুনিয়াতে থাকতে অনাগ্রহী*
শহীদদের সঙ্গে আল্লাহ তায়ালা কথা বলবেন*
শাহাদাত বরনের কষ্ট পিঁপড়ার কামড়ের ন্যায়*
কবর আযাবের বিস্তারিত বিবরণ*
কবরের আযাবদানকারী আজগর*
আযাবের কারণে কবরবাসীর চিৎকার এবং লো্হার গুজ দিয়ে প্রহার*
একটি শিক্ষনীয় প্রশ্নের জবাব*
চোগলখোরী ও পেশাব থেকে অসতর্কতার শাস্তি*
আর কিছু গোনাহের শাস্তি*
মুর্দার সাথে কবরের কথাবার্তা*
যারা কবর আযাব থেকে নিরাপদ থাকবে*
সূরায়ে মূলক ও আলিফ-লাম সেজদা পাঠের ফযিলত*
পেটের ব্যধিতে মৃত্যুবরণকারী*
অসুস্থতায় মৃত্যুবরণকারী*
শহীদের ফযীলত*
ইসলামী রাষ্ট্র পাহারাদানকারীর মর্যাদা*
কবর লাশ গ্রহণ করেনি*
কবরবাসীকে সকাল-সন্ধ্যা জান্নাত-জাহান্নাম দেখান হয়*
নবীজীর নিকট প্রতিদিন উম্মতের আমল পেশ করা হয়*
উপর দুরূপ পাঠ করার ফযীলত*
নবীদের কবর জবিন*
দীর্ঘ দিন পরেও উহুদের শহীদের লাশ অক্ষত ছিল*
জাহান্নামের গভীরতা*
জাহান্নামের দেওয়াল ও দরজাসমূহ*
জাহান্নামের আগুন ও শাস্তি*
জাহান্নামের শ্বাস ও জ্বালানী*
জাহান্নামের স্তর*
জাহান্নামের বিশেষ গর্দান ও আগুনের খুঁটি*
জাহান্নামের নিযুক্ত ফেরেশতাদের সংখ্যা ও জাহান্নামের ক্রোধ*
দোযখ দোযখ বাসীদের*
জাহান্নামের লাগাম*
দোযখের সাপ বিচ্ছু*
জাহান্নামের মৃত্যু হবে না এবং শাস্তিও কমবে না*
দোযখ আওয়াজ দেবে আর কিছু আছে কি?*
ধৈর্য ধপারণ করলেও শাস্তি রহিত হবে না*
জাহান্নামের খাদ্য ও পানীয় সম্পর্কে আলোচনা*
গাচ্ছাক কি জিনিস*
আযাবের বিভিন্ন পদ্ধতি*
মাথায় গরম পানি ঢালা হবে*
লোহা হাতুড়ি*
শরীরের চামড়া পরিবর্তন*
ইলম গোপনকারীর শাস্তি*
মাদক সেবনকারী শাস্তি*
বে আমল ওয়ায়েজদের শাস্তি*
সোনারূপা ব্যবহার কারীর শাস্তি*
আত্মহত্যাকরীর শাস্তি*
অহংকারীর শাস্তি*
মানুষকে দেখানোর জন্য ইবাদত কারীর শাস্তি*
আগুনের পাহাড় *
জাহান্নামীদের ‍যুবান*
জাহান্নামীদের শরীর *
পুলসেরাত থেকে জাহান্নামে পতিত পবে*
জাহান্নামে প্রবেশের পদ্ধতি*
জাহান্নামীদের লক্ষ্য করে শয়তানের ভাষণ*
ভ্রান্তপথে পরিচালনাকারীদের প্রতি ক্ষোভ*
জাহান্নামের দারোগার কাছে আবেদন*
জাহান্নামীদের চিৎকার ও আযাব থেকে*
মুক্তির জন্য ফেদ্‌য়া প্রদান*
কাফেরদের নিয়ে মুমিনদের উপহাস*
চিন্তা-ভাবনা ও শিক্ষা গ্রহণ

পরিশিষ্ট*
জাহান্নাম থেকে মুক্তি লাভের কয়েকটি দু’আ*
শেষ কথা*
কিয়ামত যাদের উপর সংঘটিত হবে*
কিয়ামত হঠাৎ সংঘটিত হবে*
সমগ্র বিশ্বজগত মহাপ্রলয় হবে*
পাহাড়ের অবস্থা*
আসমান জমিনের  অবস্থা*
চন্দ্র-সূর্য-নক্ষত্ররাজীর অবস্থা*
সমস্ত মানুষ কবর থেকে বের হবে*
কবর থেকে মানুষ উলঙ্গ ও খাতনাবিহীন অবস্থায় বের হবে*
কবর থেকে উঠে হাশরের ময়দানে গমন*
কাফেরদের বোবা, বধির ও অন্ধ অবস্থায় উঠানো হবে*
কাফেরদের চোখ নীল বর্ণের হবে*
দুনিয়ায় অবস্থান*
কিয়ামতের দিবসের পেরেশানী ও অস্থিরতা*
কারও চেহারা হবে উজ্জ্বল আর কারও চেহারা হবে মলিন*
হাশরের ময়দানে ঘাম*
হাশরের ময়দানে উপস্থিত লোকদের নানাবিধ অবস্থা*
এক স্ত্রী সাথে যে অবিচার করেছে তার অবস্থা*
কুরআন শরীফ শিখে যে ভুলে যা যায় তার অবস্থা *
বেনামাযীর হাশর*
অন্যায়ভাবে হত্যার শাস্ত্রী*
হত্যায় সাহায্যকারীর অবস্থা*
ওয়াদা ভঙ্গকারীর অবস্থা

আল্লাহ তা’আলার কুদরতী পায়ের গোছার তাজাল্লী, পুলসিরাত , নূর বন্টন*

কাফের ও মুশরিক ও মুনাফিকদের কঠিন বিপদ*
নূর বন্টন*
আল্লাহর কুদরতী পায়ের গোছার তাজাল্লী*
দোজাহানের সর্দার হযরত মুহাম্মদত (সাঃ) ই*
জান্নাতের দরজা খোলাবেন*
জান্নাত ও দোযখে দলে দলে প্রবেশ করবে*
জাহান্নামীদের পরস্পর লানত করা*
দোযখবাসীদের আশ্চর্যজনক কৌতূহল*
স্বীয় অনুসারীদের সামনের শয়তানের সাফাই*
উম্মাতে মুহাম্মদী সর্বপ্রথম ও অধিক*
পরিমাণে জান্নাতে প্রবেশ করবে*
সম্পদশালীগণ হিসাবের কারণে জান্নাতে প্রবেশে বাধাগ্রস্ত হবে *
জাহান্নামের অধিকাংশ সদস্য নারী ও সম্পদশালী*
জান্নাতীদের দোযখ ও দোযখীদের জান্নাত দেখানো হবে*
জান্নাত ও জাহান্নাম উভয়টিকেই পরিপূর্ণ করে দেওয়া হবে*
কেয়ামত দিবসের পরিমাণ*
মউতের মৃত্যূ্‌*
আরাফাবাসী*
জান্নাত কি দিয়ে তৈরি?*
জান্নাতের প্রশস্ততা*
জান্নাতের দরজা*
জান্নাতে প্রবেশকারীদের দু’টি দল*
নৈকট্য প্রাপ্তদের প্রতিদিন*
সসম্মানে জান্নাতে প্রবেশ, ফেরেশতাদের অভ্যর্থনা এবং চিরশান্তি ও নিরাপত্তা ঘোষণা*
জান্নাতে প্রবেশের পর ধন্যবাদ জ্ঞাপন*
জান্নাতে প্রবেশের পর জান্নাতীদের কৃতজ্ঞতা জ্ঞাপন*
জান্নাতে প্রবেশের পর জান্নাতীদের প্রথম নাস্তা*
জান্নাতীদের দৈহিক গঠন, পরিচ্ছন্নতা ও কমনীয়তা*
জান্নাতীরা হবে দাড়িহীন এবং সুরমা মাখা নয় বিশিষ্ট*
জান্নাতীদের বয়স *
জান্নাতের উদ্যান ও বৃক্ষ*
জান্নাতের নহর সমূহ*
হাউযে কাউসার*
ঝর্ণাসমূহ, পানীয়, পাখী, তৃপ্তি ভরে খাবে কিন্তু পেশাব পায়খানা হবে না*
আরো অনেক কিছু জানতে পারবেন বইটি পড়লে",মরণের পরে কী হবে,মাওলানা আশেক এলাহী বুলন্দশহরী রহ., , ,আল হিকমাহ পাবলিকেশন্স,9847018600126,"1st Published,2015",288,বাংলাদেশ,বাংলা
শান্তির ঘরে অশান্তি কেন?,মাওলানা আহমাদ শফী,TK. 145,TK. 102,https://rokomari.com//book/45485/shantir-gore-ashanti-kano-,"",শান্তির ঘরে অশান্তি কেন?,মাওলানা আহমাদ শফী, , ,আল হিকমাহ পাবলিকেশন্স,9847018600041,"1st Published,2011",128,বাংলাদেশ,বাংলা
আছহাবুছ ছুফফাহ (রা.)দের জীবন ও খেদমত,মুফতী মুহাম্মদ আশরাফ আলী আশেকে এলাহী কাসেমী,TK. 350,TK. 245,https://rokomari.com//book/117049/ashabus-chuffa--rh--der-jibon-o-khedmot,"",আছহাবুছ ছুফফাহ (রা.)দের জীবন ও খেদমত,মুফতী মুহাম্মদ আশরাফ আলী আশেকে এলাহী কাসেমী, , ,আল হিকমাহ পাবলিকেশন্স,9847018600249,"1st Published,2011",432,বাংলাদেশ,বাংলা
মাওয়ায়েজে ইমাম ইবনে জাওযী (রহ.) (আল্লাহপ্রেম ও আত্মশুদ্ধির ভাষণসমগ্র),অধ্যক্ষ মাওলানা রওশন আলী,TK. 220,TK. 154,https://rokomari.com//book/107542/mawayaja-imam-ibn-jawzi---rh----allahprem-o-attomsuddir-vasonsamagra-,"",মাওয়ায়েজে ইমাম ইবনে জাওযী (রহ.) (আল্লাহপ্রেম ও আত্মশুদ্ধির ভাষণসমগ্র),"অধ্যক্ষ মাওলানা রওশন আলী,আল্লামা হাফেজ ইমাম ইবনে জাওযী (রহ.)",অধ্যক্ষ মাওলানা রওশন আলী,ড. মাওলানা মিজানুর রহমান কাসেমী,আল হিকমাহ পাবলিকেশন্স,9847018600164,"2nd Print,2014",288,বাংলাদেশ,বাংলা
আখেরী যামানার ভয়াবহতা এবং মৃত্যুকালে ঈমানের দৃঢ়তা,মাওলানা ইউসুফ লুধিয়ানবি,TK. 120,TK. 84,https://rokomari.com//book/101245/akhiree-jamanar-voyabohota-ebong-mirtukale-imaner-derota,"",আখেরী যামানার ভয়াবহতা এবং মৃত্যুকালে ঈমানের দৃঢ়তা,"মাওলানা ইউসুফ লুধিয়ানবি,আল্লামা হাফেজ ইমাম ইবনে জাওযী (রহ.)",অধ্যক্ষ মাওঃ মুহাম্মদ রওশন আলী,অধ্যাপক আ খ ম ইউনুস,আল হিকমাহ পাবলিকেশন্স,9847018600210,"1st Published,2015",128,বাংলাদেশ,বাংলা
আল কুরআনে মহিয়সী নারীদের জীবনকথা,আব্দুল মুনয়িম হাশেমী,TK. 150,TK. 105,https://rokomari.com//book/7523/al-qurane-mohimoyosi-narider-jibonkotha,"",আল কুরআনে মহিয়সী নারীদের জীবনকথা,আব্দুল মুনয়িম হাশেমী,আতিকুল্লাহ শহীদ, ,আল হিকমাহ পাবলিকেশন্স,9847018600003,"1st Published,2008",144,বাংলাদেশ,বাংলা
সফলতার বাণী,হাফেজ মাওলানা সাখাওয়াত হুসাইন,TK. 140,TK. 98,https://rokomari.com//book/45478/sofolotar-bani,"",সফলতার বাণী,হাফেজ মাওলানা সাখাওয়াত হুসাইন, , ,আল হিকমাহ পাবলিকেশন্স,9847018600072,"1st Published,2008",112,বাংলাদেশ,বাংলা
আল-কুরআনে মু’মিন জীবন,মাওলানা শফীকুল ইসলাম,TK. 300,TK. 210,https://rokomari.com//book/66826/al-qurane-momeen-jibon,"",আল-কুরআনে মু’মিন জীবন, , ,"মাওলানা শফীকুল ইসলাম,ড. মাওলানা মিজানুর রহমান কাসেমী",আল হিকমাহ পাবলিকেশন্স,9847018600171,"1st Published,2012",480,বাংলাদেশ,বাংলা
"মিথ্যা, ওয়াদা ভঙ্গ ও খেয়ানতের বিভিন্ন রূপ",(شيخ الاسلام مفتي محمد تقي عثماني) শাইখুল ইসলাম মুফতী মুহাম্মদ তকী উসমানী ,TK. 100,TK. 70,https://rokomari.com//book/45477/mitha--woyada-vongo-o-khaynother-bevenno-rup,"","মিথ্যা,ওয়াদা ভঙ্গ ও খেয়ানতের বিভিন্ন রূপ",(شيخ الاسلام مفتي محمد تقي عثماني) শাইখুল ইসলাম মুফতী মুহাম্মদ তকী উসমানী,মুফতি মোহাম্মদ আবু সাঈদ,অধ্যাপক আ খ ম ইউনুস,আল হিকমাহ পাবলিকেশন্স,9847018600041,"5th Published,2016",62,বাংলাদেশ,বাংলা
মরণোত্তর জীবন সম্পর্কে ইসলাম ও হিন্দুধর্ম,অধ্যাপক আ খ ম ইউনুস,TK. 100,TK. 70,https://rokomari.com//book/45489/moronottor-jibon-somporke-islam-o-hidudormo,"",মরণোত্তর জীবন সম্পর্কে ইসলাম ও হিন্দুধর্ম,অধ্যাপক আ খ ম ইউনুস, , ,আল হিকমাহ পাবলিকেশন্স, , , ,বাংলাদেশ,বাংলা
