Title,Author,Original Price,Discounted Price,URL,Summary,Book_Title,Book_Author,Translator,Editor,Publisher,ISBN,Edition,Number Of Pages,Country,Language
"ইসলামে ধন-সম্পদ অর্জনের তাগিদ, গুরুত্ব ও বিধান",মাওলানা আলমগীর হোসাইন,TK. 150,TK. 105,https://rokomari.com//book/45494/islame-dhon-sampod-orjonner-tagid--gurutto-o-bidhan,"ইসলামে ধন-সম্পদ অর্জনের তাগিদ, গুরুত্ব ও বিধান, আল কুরআনে যেখানে সালাতের কথা বলা হয়েছে ঠিক সেখানে যাকাতের কথা বলা হয়েছে। এখানে চিন্তা করার বিষয় হল মানুষের ধর্ম কর্ম করার জন্য ধন সম্পদ দরকার। ইসলাম দুনিয়াকে বর্জন করার কথা  যেমন বলেনা ঠিক তেমনি  হারাম উপায়ে ধন সম্পদ অর্জন করার কথাও বলেনা। দুনিয়াতে কিভাবে ধন সম্পদ অর্জন করতে হবে । কোন উৎস হতে উপার্জন করা যাবে । কোন উৎস হতে উপার্জন করা যাবে না । এ সব নিয়েই  ইসলামে ধন-সম্পদ অর্জনের তাগিদ, গুরুত্ব ও বিধান বইটি রচিত হয়েছে । এই বইটি পাঠে একজন মানুষ উপার্জনের সঠিক পন্থা জানতে পারবে। 


সূচিপত্র* 
অনুবাদকের কথা* 
প্রকাশকের কথা* 
ইসলামে ধন-সম্পদ অর্জনের তাগিদ , গুরুত্ব ও বিধানের বিস্তারিত বর্ণনা* 
আয়-ব্যয় ও অর্থোপার্জন প্রসঙ্গে বিস্তারিত বর্ণনা* 
হারাম রুজির ক্ষতি ও অকল্যাণের বিস্তারিত বর্ণনা* 
মহান আল্লাহ তা’য়ালাই হচ্ছেন রিযিকদাতা এর বিস্তারিত বর্ণনা* 
উপার্জনের প্রতি তাগিদ এবং বেকরাত্বের প্রতি র্ভৎসনা এর বিস্তারিত বর্ণনা* 
বিভিন্ন পেশার বিস্তারিত বর্ণনা* 
বরকত বা প্রাচুর্যের বিস্তারিত বর্ণনা* 
ব্যবসায়ীদের জন্য গুরুত্বপূর্ণ দিক -নির্দেশনার বিস্তারিত বর্ণনা* 
জমি-জমা ও স্থাবর সম্পত্তির বিস্তারিত বর্ণনা* 
দুনিয়ায় নেক আমল-বদ আমলের লাভ-লোকসান এর বিস্তারিত বর্ণনা* 
আমলের সহিত পার্থিব দুঃখ কষ্ট ও শান্তির সম্পর্কে বিস্তারিত বর্ণনা* 
এবাদতে পার্থিব উপকারিতার বিস্তারিত বর্ণনা","ইসলামে ধন-সম্পদ অর্জনের তাগিদ,গুরুত্ব ও বিধান","মাওলানা আলমগীর হোসাইন,حكيم الامت مولانا اشرف علي تهانوي رح  ( হাকীমুল উম্মত মাওলানা আশরাফ আলী থানভী রহ.)",মাওলানা আলমগীর হোসাইন, ,আল হিকমাহ পাবলিকেশন্স,9843218175,"1st Published,2004",128,বাংলাদেশ,বাংলা
নামাজ কবুল না হওয়ার গোপন রহস্য,মাওলানা আহমাদ শফী (চকরবী),TK. 150,TK. 105,https://rokomari.com//book/45492/namaz-kobul-na-houyar-gopon-rohosso,"সূচিপত্র
প্রথম অধ্যায় : আমরা কেমন মুসলমান?
দ্বিতীয় অধ্যায় : মানব দেহের গুপ্ত ক্যান্সার; নামাজ কবুলের প্রতিবন্ধক
তৃতীয় অধ্যায় : শয়তানের ওয়াছওয়াছা ও নামাজ কবুল না হওয়া
চতুর্থ অধ্যায় : উপার্জন, ছয়টি মারাত্মক গুনাহ ও নামাজ
পঞ্চম অধ্যায় : বিপদমুক্তি, নামাজ এবং নাফরমানির পরিণতি
ষষ্ঠ অধ্যায় : নামাজ ও পর্দা
সপ্তম অধ্যায় : জাহান্নামের খুঁটি স্থাপিত, নামাজ-হেলাওয়াত বিতাড়িত
অষ্টম অধ্যায় : নামাজের স্বাদ পেতে দুনিয়ার ধোঁকা থেকে বাঁচুন
নবম অধ্যায় : বিদআতীর নামাজ-রোজা কবুল হয় না
দশম অধ্যায় :  মাতা-পিতা বনাম জান্নাত-জাহান্নাম
একাদশ অধ্যায় : কবরের ভয় কেন আসে না?
দ্বাদশ অধ্যায় : নামাজী খারাপ হয় কিভাবে
ত্রয়োদশ অধ্যায় : মুসলমানের অভাবটা কি?
চতুর্দশ অধ্যায় : ঈমান ও সুখ-শান্তি",নামাজ কবুল না হওয়ার গোপন রহস্য,মাওলানা আহমাদ শফী (চকরবী), , ,আল হিকমাহ পাবলিকেশন্স,984871202X,"5th,2012",96,বাংলাদেশ,বাংলা
বিখ্যাত মুসলিম সেনাপতিদের বিজয় কাহিনী,কর্ণেল ডক্টর হাফেজ ফায়জুর রহমান,TK. 260,TK. 221,https://rokomari.com//book/1420/bikhatto-muslim-shenapotider-bejoy-kahini,"",বিখ্যাত মুসলিম সেনাপতিদের বিজয় কাহিনী,কর্ণেল ডক্টর হাফেজ ফায়জুর রহমান,অধ্যক্ষ মাওলানা রওশন আলী, ,আল হিকমাহ পাবলিকেশন্স,9848712003,"1st,2011",208,বাংলাদেশ,বাংলা
শয়তানের ওয়াসওয়াসা ও তার প্রতিকার,মাওলানা আশেক এলাহী বুলন্দশহরী রহ.,TK. 150,TK. 105,https://rokomari.com//book/45506/soytaner-waswasa-o-tar-protikar,"‘শয়তানের ওয়াসওয়াসা ও তার প্রতিকা’ বইয়ের সূচিপত্রঃ 
সম্পাদকের কথা /আট
ভূমিকা /১১
প্ৰথম অধ্যায়*
মানুষের সঙ্গে শয়তানের শক্রতার সূচনা /১৯*
শয়তান মানবজাতির চিরশত্রু /২২*
হযরত আদম ও তাঁর স্ত্রীর প্রতি নির্দেশ /২৩*
শয়তানের প্রতারণা /২৩*
হযরত আদম আ.-এর তাওবা /২৬*
শয়তান সম্পর্কে আল্লাহর সাবধান বাণী /২৯*
শয়তান শিরক ও গুনাহের কাজকে মোহনীয় করে পেশ করে /৩০*
আকৃতি বিকৃত করণ শয়তানের একটি কাজ /৩৩*
শয়তান মানুষকে প্রতিশ্রুতি দেয় /৩৫*
শয়তানের আসমানী সংবাদ সংগ্রহের অপচেষ্টা /৩৭*
শয়তান বিতাড়ণের কুরআনী দুয়া /৩৯*
কিয়ামত দিবসে আল্লাহ পূর্ব সতর্কতার কথা স্মরণ করিয়ে দিবেন /৪২*
শয়তান তার অনুসারীদের নির্বোধ বলবে /৪৩*
কুরাইশদের সভায় শয়তানের উপস্থিতি /৪৫*
বদর যুদ্ধে শয়তানের অপকৌশল ও প্ররোচনা /৪৭*
উহুদ যুদ্ধে শয়তানের প্ররোচনা /৪৯
দ্বিতীয় অধ্যায়*
মানুষের দু ধরনের সঙ্গী /৫২*
ঈমানের ডাকাত ও তার প্রতিকার /৫৪*
পায়খানা—প্রশ্রাবে শয়তান /৫৭*
শয়তানের রাত্রি যাপনের স্থান /৫৮*
ওযূতে শয়তানের ওয়াসওয়াসা /৫৮*
ওযূ নষ্ট করতে শয়তানের চেষ্টা /৫৯*
অনিয়মিত ঋতুস্রাবে শয়তানের প্ররোচনা /৬০*
আযানের ধ্বনি শয়তানকে পালাতে বাধ্য করে /৬১*
নামাযের রাকাতে শয়তানের বিভ্রান্তি ও তার প্রতিকার /৬২*
কেরাতের মধ্যে শয়তানের বিভ্রান্তি /৬৩*
ইমামের একতেদায় শয়তানের প্ররোচনা /৬৪*
ছুতরা রেখে নামায পড়বে /৬৫*
নামাযে শয়তানের ছো মারা /৬৬*
ঐক্যের তাৎপর্য /৬৬*
নামাযের কাতারে শয়তান /৬৮*
শয়তান তাসবীহ পড়া থেকে বিরত রাখে /৬৯*
শয়তান বিছানায় তিনটি গিরা দেয় /৭০*
শয়তান কানে প্রশ্রাব করে /৭১*
সূর্যোদয় ও সূর্যাস্তে শয়তান /৭২*
শয়তান কখন হাসে /৭৪*
স্বপ্নে শয়তান পেরেশান করে /৭৫*
নবী করীম স.-কে স্বপ্নে দেখা /৭৬*
নিজ গৃহ ও নিজ খানায় শয়তানকে অংশ না দেওয়া /৭৭*
অতিরিক্ত বিছানাটি শয়তানের /৭৯*
শয়তান থেকে সন্তানের রক্ষা /৭৯*
দু জনের মাঝে তৃতীয়জন শয়তান /৮০*
শয়তান থেকে হেফাযতের জন্যে রাত্রিকালীন করণীয় /৮১*
ঘরের বাহিরে শয়তান থেকে নিরাপত্তা লাভের দুয়া /৮৪*
শয়তানের সৈন্য /৮৪*
শয়তানের পতাকা কার হাতে? /৮৬*
শয়তান জালেম বিচারকের সহযোগী /৮৬*
বেপর্দা নারী শয়তানের অন্যতম বাহন /৮৭*
শয়তান নামায কায করে দেয়ার কারণ সৃষ্টি করে /৮৯*
সফরে শয়তানের সঙ্গীত্ব ত্যাগ করা /৯১*
সফরসঙ্গী কতজন হওয়া উচিত /৯২*
শয়তানের ঘণ্টি বা বাজনা /৯৩*
শয়তান মুসলমানদের পরস্পর দ্বন্দ্বে লিপ্ত রাখে /৯৬*
অস্ত্র নিয়ে তামাশা করাও শয়তানের কাজ /৯৭*
শয়তানের সর্বাপেক্ষা প্রিয় কর্ম /৯৯*
শয়তান সন্দেহের উদ্রেগ করে /১০০*
তাড়াহুড়া শয়তানের কর্ম /১০০*
শয়তানকে বন্দী করা হয় /১০১*
শয়তান কখন সবচেয়ে বেশি কান্না করে /১০২
তৃতীয় অধ্যায়*
প্রথম পরিচ্ছেদ /১০৪-১১৬*
শয়তান বিতাড়ণে সূরা বাকারা /১০৪*
দিন-রাত শয়তান থেকে মুক্ত থাকার উপায় /১০৫*
সূরা বাকারার শেষ দু আয়াত শয়তান থেকে হেফাযত রাখে /১০৭*
সূরা ফালাক ও নাস সর্বোত্তম আশ্রয় /১০৭*
নিদ্রা যাওয়ার পূর্বে করণীয় দুয়া /১০৯*
রাসূল স.-এর ঝাঁড়ফুঁক, /১০৯*
দ্বিতীয় পরিচ্ছেদ /১১৭-১২২*
শয়তানের পলায়ন /১১৭*
শয়তান ও বাদ নজর থেকে শিশুদের রক্ষার দুয়া /১১৭*
বিচলিত হওয়া থেকে মুক্তির দুয়া /১১৮*
শয়তানের যাবতীয় অনিষ্ট থেকে মুক্তি /১১৮*
শয়তান পরাস্ত হলো /১১৯*
আবু বকর রা.-কে শিক্ষা দেয়া দুয়া /১২০*
শয়তান বিতাড়নের জন্যে ফেরেশতা নিয়োগ /১২০*
ক্ৰোধের চিকিৎসা /১২১
চতুর্থ অধ্যায়*
শয়তানকে ধ্বংস করা সংক্রান্ত কয়েকটি কাহিনী /১২৩-১২৯*
হুজুর স. শয়তানটি ছেড়ে দিলেন /১২৩*
হযরত উমরের রাস্তা ছেড়ে শয়তানের অন্য রাস্তায় চলা /১২৪*
শয়তানের নাক ও মুখে আঘাত করা /১২৪*
একটি সাপ হত্যা করা /১২৫*
হযরত মুজাহিদ এবং হযরত যুবায়ের রা-এর ঘটনা /১২৫*
হযরত আহলুল্লাহর হত্যা রহিত হওয়া /১২৬*
জাহেলী যুগে এক ব্যক্তিকে জ্বীন নিয়ে গিয়েছিল /১২৭*
শয়তানের সাথে এক সাধকের লড়াই /১২৭
পরিশিষ্ট - ১ /১৩০
পরিশিষ্ট - ২ (এক নজরে শয়তানের ৫০টি প্রবঞ্চনা) /১৪০",শয়তানের ওয়াসওয়াসা ও তার প্রতিকার,মাওলানা আশেক এলাহী বুলন্দশহরী রহ.,মাওলানা এনামুল হক সন্দ্বীপী, ,আল হিকমাহ পাবলিকেশন্স,9847018600096,"1st Published,2009",139,বাংলাদেশ,বাংলা
"নারী স্বাধীনতা, পর্দা ও বুদ্ধির সীমাবদ্ধতা",(شيخ الاسلام مفتي محمد تقي عثماني) শাইখুল ইসলাম মুফতী মুহাম্মদ তকী উসমানী ,TK. 150,TK. 105,https://rokomari.com//book/45500/nari-shadinata--porda-o-buddir-shemaboddota,"","নারী স্বাধীনতা,পর্দা ও বুদ্ধির সীমাবদ্ধতা",(شيخ الاسلام مفتي محمد تقي عثماني) শাইখুল ইসলাম মুফতী মুহাম্মদ তকী উসমানী,মাওঃ মুহাম্মদ হাফিজুর রহমান যশোরী, ,আল হিকমাহ পাবলিকেশন্স,9847018600041,"2nd Edition,2015",112,বাংলাদেশ,বাংলা
জান্নাতের নেয়ামতসমুহের বর্ণনা,অধ্যাপক আ খ ম ইউনুস,TK. 150,TK. 105,https://rokomari.com//book/45490/jannater-neyamotsomuher-bornona,"",জান্নাতের নেয়ামতসমুহের বর্ণনা,"অধ্যাপক আ খ ম ইউনুস,আল্লামা মুফতি এমদাদল্লাহ আনোয়ার",মাওলানা মুহাম্মদ মুজিবুর রহমান,অধ্যাপক আ খ ম ইউনুস,আল হিকমাহ পাবলিকেশন্স,9843223691,"3rd Published,2011",144,বাংলাদেশ,বাংলা
ইবাদতের চল্লিশ মূলনীতি,হুজ্জাতুল ইসলাম ইমাম গাযযালী রহ.,TK. 260,TK. 146,https://rokomari.com//book/45498/ebadoter-chollis-mulniti,"",ইবাদতের চল্লিশ মূলনীতি,হুজ্জাতুল ইসলাম ইমাম গাযযালী রহ.,মুফতী এনামুল হক রায়পুরী, ,আল হিকমাহ পাবলিকেশন্স,9847018600027,"1st,2010",271,বাংলাদেশ,বাংলা
নাঙ্গা তলোয়ার (১ম ও ২য় খণ্ড একত্রে),এনায়েতুল্লাহ আল্‌তামাশ,TK. 250,TK. 175,https://rokomari.com//book/45493/nanga-toloyar--1st-o-2nd-part-akorte-,"",নাঙ্গা তলোয়ার (১ম ও ২য় খণ্ড একত্রে),এনায়েতুল্লাহ আল্‌তামাশ,মাওলানা মোঃ মুজিবুর রহমান, ,আল হিকমাহ পাবলিকেশন্স,9843218183,"1st Published,2009",238,বাংলাদেশ,বাংলা
নেকী লাভের সহজ আমল,(شيخ الاسلام مفتي محمد تقي عثماني) শাইখুল ইসলাম মুফতী মুহাম্মদ তকী উসমানী ,TK. 140,TK. 98,https://rokomari.com//book/45482/naki-laver-sohoj-amal,"",নেকী লাভের সহজ আমল,(شيخ الاسلام مفتي محمد تقي عثماني) শাইখুল ইসলাম মুফতী মুহাম্মদ তকী উসমানী,মাওলানা মোহাম্মদ আরিফুর রহমান, ,আল হিকমাহ পাবলিকেশন্স,9848712038,"5th Published,2016",96,বাংলাদেশ,বাংলা
এসলাহে নফস বা রূহের খোরাক,(شيخ الاسلام مفتي محمد تقي عثماني) শাইখুল ইসলাম মুফতী মুহাম্মদ তকী উসমানী ,TK. 160,TK. 112,https://rokomari.com//book/45495/akhlahe-nopes-ba-ruhar-khorak,"",এসলাহে নফস বা রূহের খোরাক,(شيخ الاسلام مفتي محمد تقي عثماني) শাইখুল ইসলাম মুফতী মুহাম্মদ তকী উসমানী,মাওলানা মোহাম্মদ নূরুল্লাহ, ,আল হিকমাহ পাবলিকেশন্স,984322907X,"1st Published,2011",144,বাংলাদেশ,বাংলা
ফিকহুন নিসা বা মহিলাদের মাসআলা-মাসয়িল,আল্লামা মুহাম্মদ আতাইয়া খামীস,TK. 340,TK. 238,https://rokomari.com//book/66824/fikhun-nisa-ba-mohilader-masyala-masayil,"",ফিকহুন নিসা বা মহিলাদের মাসআলা-মাসয়িল,আল্লামা মুহাম্মদ আতাইয়া খামীস,মাওলানা আবদুল কাইয়ূম,ড. মাওলানা মিজানুর রহমান কাসেমী,আল হিকমাহ পাবলিকেশন্স,9847018600195,"1st Published,2013",384,বাংলাদেশ,বাংলা
নাঙ্গা তলোয়ার (৩ম ও ৪য় খণ্ড একত্রে),এনায়েতুল্লাহ আল্‌তামাশ,TK. 300,TK. 210,https://rokomari.com//book/87375/nanga-toloyar--3rd-o-4th-part-akorte-,"",নাঙ্গা তলোয়ার (৩ম ও ৪য় খণ্ড একত্রে),এনায়েতুল্লাহ আল্‌তামাশ,মাওলানা আলমগীর হোসাইন, ,আল হিকমাহ পাবলিকেশন্স,9843218183,"1st Published,2009",271,বাংলাদেশ,বাংলা
নাঙ্গা তলোয়ার ৫ম খণ্ড ,এনায়েতুল্লাহ আল্‌তামাশ,TK. 260,TK. 182,https://rokomari.com//book/87853/nanga-toloyar-5th-part,"",নাঙ্গা তলোয়ার ৫ম খণ্ড,এনায়েতুল্লাহ আল্‌তামাশ,মাওলানা আলমগীর হোসাইন, ,আল হিকমাহ পাবলিকেশন্স,9843218183,"1st Published,2013",272,বাংলাদেশ,বাংলা
ঈমান ও সুখ,ড. ইউসুফ আল কারযাভী,TK. 220,TK. 154,https://rokomari.com//book/45508/eman-o-shuk,"",ঈমান ও সুখ,ড. ইউসুফ আল কারযাভী,অধ্যক্ষ মাওঃ মুহাম্মদ রওশন আলী, ,আল হিকমাহ পাবলিকেশন্স,9789847020679,"2nd Edition,2010",240,বাংলাদেশ,বাংলা
নামাজে একাগ্রতা অর্জনের উপায়,মাওলানা আরসালান বিন আখতার মায়মন,TK. 130,TK. 91,https://rokomari.com//book/45480/namaze-akagrota-orjoner-upoy,"",নামাজে একাগ্রতা অর্জনের উপায়,মাওলানা আরসালান বিন আখতার মায়মন,মাওলানা মুহাম্মদ মুজিবুর রহমান, ,আল হিকমাহ পাবলিকেশন্স,9848712070,"1st Published,2011",96,বাংলাদেশ,বাংলা
নাঙ্গা তলোয়ার ৬ষ্ঠ খণ্ড ,এনায়েতুল্লাহ আল্‌তামাশ,TK. 300,TK. 210,https://rokomari.com//book/87374/nanga-toloyar-6th-part,"",নাঙ্গা তলোয়ার ৬ষ্ঠ খণ্ড,এনায়েতুল্লাহ আল্‌তামাশ,মাওলানা আলমগীর হোসাইন, ,আল হিকমাহ পাবলিকেশন্স, ,"1st Published,2014",288,বাংলাদেশ,বাংলা
দুনিয়া কী এবং কেন?,ইমাম আবু বকর বিন আবিদ্দুনিয়া,TK. 170,TK. 119,https://rokomari.com//book/45497/duniya-ki-abong-kano-,"",দুনিয়া কী এবং কেন?,ইমাম আবু বকর বিন আবিদ্দুনিয়া,মাওলানা আলমগীর হোসাইন, ,আল হিকমাহ পাবলিকেশন্স,9847018600058,"1st Published,2011",159,বাংলাদেশ,বাংলা
শিশুর লালন-পালন ও বিকাশে প্রিয় নবী (স)-এর দিকনির্দেশনা,অধ্যক্ষ মাওঃ মুহাম্মদ রওশন আলী,TK. 150,TK. 105,https://rokomari.com//book/45488/sisur-lalon-palon-o-bekasa-preyo-nobi--sm--ar-deknedasona,"",শিশুর লালন-পালন ও বিকাশে প্রিয় নবী (স)-এর দিকনির্দেশনা,"অধ্যক্ষ মাওঃ মুহাম্মদ রওশন আলী,একরামুল্লাহ জান কাসেমী",অধ্যক্ষ মাওঃ মুহাম্মদ রওশন আলী, ,আল হিকমাহ পাবলিকেশন্স,9848712054,"2nd Published,2008",144,বাংলাদেশ,বাংলা
