Title,Author,Original Price,Discounted Price,URL,Image,Summary,Book_Title,Book_Author,Translator,Editor,Publisher,ISBN,Edition,Number Of Pages,Country,Language
বলয় ভাঙার গল্প,ড. উম্মে বুশরা সুমনা,TK. 250,TK. 150,https://rokomari.com//book/195319/boloy-bangar-golpo,https://ds.rokomari.store/rokomari110/ProductNew20190903/130X186/53e38c769_195319.png,"সমাজরে মানুষদের আরোপিত রীতি নীতি, কুসংস্কার আর কুপ্রথার হাজার বৃত্তরে শৃঙ্খলে আমরা বন্দী। সমাজ কী বলবে, লোকে কী বলবে, সইে ভয়ে আর এই অন্ধকারের বলয় ভাঙা হয়ে উঠে না। তবুও স্রোতের বিপরীতে হাঁটা কিছু মানুষ এই বলয় ভাঙতে চষ্টো করনে।
এই সমাজের মানুষের আরোপিত রীতি, প্রথা, কুসংস্কার, বভিন্নি অসংগতি, পুঁজিবাদ, ভোগবাদিতা, ভারসাম্যহীনতা, অবিচার, ভিন্ন সংস্কৃতি সহ বিভিন্ন বিষয়রে উপর গল্পরে মাধ্যমে আঘাত হানা হয়েছে।
মানুষের জীবনের দুঃখ-কষ্ট, হাসি-আনন্দ আর টানা-পোড়নের কাহিনীগুলো গদ্যশিল্পীর তুলির ছোঁয়ায় হয়ে উঠেছে প্রাণবন্ত।
প্রতিটি গল্প শেষে টীকা আকারে কুরআন আর হাদিসের কোটেশন গল্পগুলোকে শিক্ষণীয় করে তুলেছে একেকটি গল্প একেক ধরনের র্বাতা বহন করেছে।
প্রতিটি গল্প পড়া শেষে মনে দাগ কাটবে, নজিরে ভতিরেও জেগে উঠবে বলয় ভাঙার প্রয়াস। ‘বলয় ভাঙার গল্প’ এই গল্পগ্রন্থ পড়ার মাধ্যমে আপনিও এই বন্দী বলয় ভেঙে বেরিয়ে একজন আলোকতি মানুষ হতে পারনে।",বলয় ভাঙার গল্প,ড. উম্মে বুশরা সুমনা, , ,বইঘর প্রকাশনী, ,"2nd Edition,2020", ,বাংলাদেশ,বাংলা
