Title,Author,Original Price,Discounted Price,URL,Image,Summary,Book_Title,Book_Author,Translator,Editor,Publisher,ISBN,Edition,Number Of Pages,Country,Language
ক্যারিয়ার এক্সপার্ট প্রাথমিক সহকারী শিক্ষক নিয়োগের চুড়ান্ত সাজেশন (হট স্পট),সাহানুর আলম,TK. 300,TK. 179,https://rokomari.com//book/204014/career-expert-prathomik-sohkari-shikkhok-niyoger-churanto-suggesion--hot-spot-,https://ds.rokomari.store/rokomari110/ProductNew20190903/130X186/f150ded82_204014.jpg,"“Career Expert Publications” থেকে প্রকাশিত“প্রাথমিক সহকারী শিক্ষক নিয়োগের চুড়ান্ত
সাজেশন-HOT SPOT ” বইটি সুন্দরভাবে সাজনো ও গোছানো। সাজেশনটি বিগত বছরের পরিক্ষার
প্রশ্নের উপর ভিত্তি করে সাজানো হয়েছে । প্রতিটি টপিকে রয়েছে মৌলিক ধারনা, সঠিক উত্তর
এবং আপডেট তথ্য । বইয়ের প্রতিটি টপিক আমি অত্যন্ত নিখুত ভাবে কাজ করার চেষ্টা করেছি।
এই বইটিতে গুরুত্বপূর্ণ তথ্য, প্রয়োজনীয় ও উল্লেখ্যযোগ্য বিষয়াবলি নির্ভুলভাবে উপস্থাপন
করা হয়েছে। যার স্বল্প সময়ে প্রস্তুতি নিতে চান তাদের জন্য বইটি অনেক বেশি কার্যকর হবে
বলে আশা রাখছি। বাজারের অন্যান্য বইয়ের মত বইটির আকার অনেক বড় করা হয়নি বরং শুধু
পরিক্ষায় ঠিক যতটুকু দরকার ততটুকু বইটিতে সংযোজন করা হয়েছে।",ক্যারিয়ার এক্সপার্ট প্রাথমিক সহকারী শিক্ষক নিয়োগের চুড়ান্ত সাজেশন (হট স্পট),সাহানুর আলম, , ,ক্যারিয়ার এক্সপার্ট পাবলিকেশনস, ,"5th edition,2020",307,বাংলাদেশ,বাংলা
ক্যারিয়ার এক্সপার্ট: মানসিক দক্ষতা,মো: শাহানুর আলম,TK. 150,TK. 113,https://rokomari.com//book/190643/career-expert--manosik-dokkhota,https://ds.rokomari.store/rokomari110/ProductNew20190903/130X186/7b592577a_190643.jpg,"",ক্যারিয়ার এক্সপার্ট: মানসিক দক্ষতা, , ,মো: শাহানুর আলম,ক্যারিয়ার এক্সপার্ট পাবলিকেশনস, ,"1st Published,2019",286,বাংলাদেশ,বাংলা
ক্যারিয়ার এক্সপার্ট ম্যাথ (নিউ এডিশন),সাহানুর আলম,TK. 300,TK. 162,https://rokomari.com//book/202377/career-expert-math--new-edition-,https://ds.rokomari.store/rokomari110/ProductNew20190903/130X186/3e5b1f5ff_202377.jpg,"",ক্যারিয়ার এক্সপার্ট ম্যাথ (নিউ এডিশন), , ,সাহানুর আলম,Career Expert Publications, ,"1st Edition,2020",272,Bangladesh,Bangla & English
৪১ তম বিসিএস প্রিলি’র সকল বিষয়ের চূড়ান্ত সাজেশন ,সাহানুর আলম,TK. 350,TK. 270,https://rokomari.com//book/209899/41th-bcs-prelir-sokol-bishoyer-churanto-suggestions,https://ds.rokomari.store/rokomari110/ProductNew20190903/130X186/efa3a678a_209899.jpg,"",৪১ তম বিসিএস প্রিলি’র সকল বিষয়ের চূড়ান্ত সাজেশন,সাহানুর আলম, , ,Career Expert Publications, ,"5th Edition,2021",555,Bangladesh,Bangla & English
গাণিতিক যুক্তি,মো: শাহানুর আলম,TK. 150,TK. 132,https://rokomari.com//book/189435/ganitik-jhukti,https://ds.rokomari.store/rokomari110/ProductNew20190903/130X186/5756daf8e_189435.jpg,"""Career Expert Publications” থেকে প্রকাশিত“গাণিতিক যুক্তি” বইটি সুন্দরভাবে সাজনো ও গোছানো। বইটিতে রয়েছে ২৬ টি অধ্যায়। প্রতিটি অধ্যায়ে মৌলিক ধারনা, সহজ ভাষায় প্রশ্নের ব্যাখ্যা এবং প্রতিটি অংক ""Short cut I Broad” দুই পদ্ধতিতে সমাধান করা হয়েছে। বইটিতে আছে সল্প সময়ে প্রশ্ন সমাধান করার টেকনিক, পরিক্ষা উপযোগী সর্বাধিক প্রশ্ন ও তার ব্যাখ্যা, অনুশীলন অংশ,বইয়ে প্রতিটি অধ্যায় আমি অত্যন্ত নিখুত ভাবে কাজ করার চেষ্টা করেছি। এই বইটিতে গুরুত্বপূর্ণ তথ্য, প্রয়োজনীয় ও উল্লেখ্যযোগ্য বিষয়াবলি নির্ভুলভাবে উপস্থাপন করা হয়েছে। চাকুরির পরিক্ষার্থীদের মনে এমনিতেই গণিত ভীতি কাজ  করে,অনেকে আবার বাসায় অংক করতে পারেন কিন্তু পরিক্ষার হলে অল্প সময়ে গণিত সমাধান করতে পারেন না। তাদের জন্য বইটি অনেক বেশি কার্যকর হবে বলে আশা রাখছি। বাজারের অন্যান্য বইয়ের মত বইটির  আকার  অনেক বড় করা হয়নি বরং শুধু বিসিএস পরিক্ষায় ঠিক যতটুকু দরকার ততটুকু বইটিতে সংযোজন করা হয়েছে।",গাণিতিক যুক্তি, , ,মো: শাহানুর আলম,ক্যারিয়ার এক্সপার্ট পাবলিকেশনস, ,"1st Published,2019",208,বাংলাদেশ,বাংলা
