Title,Author,Original Price,Discounted Price,URL,Image,Summary,Book_Title,Book_Author,Translator,Editor,Publisher,ISBN,Edition,Number Of Pages,Country,Language
নারীর ইসলামি অধিকার,শাইখ ড. আব্দুল কাদির শাইবাতুল হামদ রহ.,TK. 160,TK. 96,https://rokomari.com//book/207622/narir-islami-odhkar,https://ds.rokomari.store/rokomari110/ProductNew20190903/130X186/ee90cd4f9_207622.jpg,"নারী মুক্তাদানার মতো, তাকে রক্ষা করা আবশ্যক, কেননা নারীর সম্মান রয়েছে, আর তা মুসলিমদের নিকট অত্যন্ত পবিত্র বিষয়, কেননা তা রক্ষা করার মাধ্যমে পরিবারের মর্যাদা উচ্চ স্তরে উপনীত হয়, আর তার অপব্যবহার ও লাঞ্ছিত হওয়ায় দ্বারা পরিবার নিম্নস্তরে অধঃপতিত হয়।
আমরা মুসলিম সমাজ জীবনের চেয়ে সম্মানকে অধিক পবিত্র মনে করি, আমরা স্বাধীনতা রক্ষা করার জন্য যে পরিমাণ আত্মত্যাগ করি তার থেকে অধিক আত্মত্যাগ করি সম্মান রক্ষা করার জন্য। আমরা আমাদের সম্পদ, আমাদের জীবন, আমাদের সন্তানদেরকে অকাতরে উৎসর্গ করে দেই যদি কেউ আমাদের সম্মানকে স্পর্শ করতে চায় তাদের বিরুদ্ধে, অথবা কেউ যদি ফিসফিস করেও আমাদের সম্মানের ব্যাপারে কিছু বলে তাদের প্রতিহত করার জন্য!
আর আমরা এ ব্যাপারে বাড়াবাড়িকারী নই, কেননা এটা তাদের একটি চারিত্রিক বৈশিষ্ট্য যারা মর্যাদার উপর বিশ্বাস স্থাপন করে এবং মনুষত্বের গুণে গুণান্বিত। আর এটা তাদের চরিত্র যারা নিজেদেরকে ইসলামের সাথে সম্পৃক্ততার দাবি করে...",নারীর ইসলামি অধিকার,শাইখ ড. আব্দুল কাদির শাইবাতুল হামদ রহ.,নাসীর উদ্দীন খন্দকার, ,দারুল আরকাম, ,"1st Published,2021",80,বাংলাদেশ,বাংলা
"নারী : নানা ধর্মে, কল্পনা ও বাস্তবতায়",কাজী আবুল কালাম সিদ্দীক,TK. 120,TK. 72,https://rokomari.com//book/149674/nari---nana-dorme--kolpona-o-bastobota,https://ds.rokomari.store/rokomari110/ProductNew20190903/130X186/a3e3cd154_149674.jpg,"","নারী : নানা ধর্মে,কল্পনা ও বাস্তবতায়","কাজী আবুল কালাম সিদ্দীক,ড. শরিফ আব্দুল আযিম",কাজী আবুল কালাম সিদ্দীক, ,দারুল আরকাম, ,"1st Published,2017",103,বাংলাদেশ,বাংলা
তারকীরে আমছিলায়ে নাহবেমীর,মাওলানা আব্দুর রহমান মোহাম্মদ হানিফ,TK. 100,TK. 60,https://rokomari.com//book/148962/tarkire-amchilaye-nahbemir,https://ds.rokomari.store/rokomari110/ProductNew20190903/130X186/8a5eeab0d_148962.jpg,"",তারকীরে আমছিলায়ে নাহবেমীর,মাওলানা আব্দুর রহমান মোহাম্মদ হানিফ, , ,দারুল আরকাম, ,"1st Published,2016",87,বাংলাদেশ,বাংলা
রমযানুল মুবারক,মাওলানা ইলিয়াস ঘুম্মান,TK. 200,TK. 120,https://rokomari.com//book/148963/ramzanul-mobarok,https://ds.rokomari.store/rokomari110/ProductNew20190903/130X186/c4770589e_148963.jpg,"",রমযানুল মুবারক,মাওলানা ইলিয়াস ঘুম্মান, , ,দারুল আরকাম, ,"1st Published,2016",160,বাংলাদেশ,বাংলা
খাদিজা রাযি. সোনালি সংসার,আব্দুল মালিক মুজাহিদ,TK. 240,TK. 144,https://rokomari.com//book/148964/khadiza-razi--sonali-songsar,https://ds.rokomari.store/rokomari110/ProductNew20190903/130X186/6ce18453f_148964.jpg,"",খাদিজা রাযি. সোনালি সংসার,আব্দুল মালিক মুজাহিদ,ছানা উল্লাহ সিরাজী, ,দারুল আরকাম, ,"1st Published,2016",208,বাংলাদেশ,বাংলা
যুবকদের ওপর রহম করুন ,ড. আলী তানতাবী,TK. 50,TK. 30,https://rokomari.com//book/155394/zubokder-opor-rohomot-korun,https://ds.rokomari.store/rokomari110/ProductNew20190903/130X186/45e119fc3_155394.jpg,"",যুবকদের ওপর রহম করুন,ড. আলী তানতাবী,কাজী আবুল কালাম সিদ্দীক, ,দারুল আরকাম, ,"1st Published,2017",40,বাংলাদেশ,বাংলা
