Title,Author,Original Price,Discounted Price,URL,Image,Summary,Book_Title,Book_Author,Translator,Editor,Publisher,ISBN,Edition,Number Of Pages,Country,Language
বাবা : আদর্শ সন্তানের কারিগর,ড. করিম আশ শাযলী,TK. 200,TK. 120,https://rokomari.com//book/207397/baba---adorsho-sontaner-karigor,https://ds.rokomari.store/rokomari110/ProductNew20190903/130X186/b40a24422_207397.jpg,"সন্তান প্রতিপালন একটি আনন্দের বিষয়। হ্যাঁ তার মধ্যে কষ্ট-পরিশ্রম আছে, কিন্তু এটা মজাদার কষ্ট। আকর্ষণীয় পরিশ্রম।
এর সারকথা হলো, মানুষের জন্য অবধারিত পরিশ্রমের একটি রূপ। তবে এর ফল কষ্ট-পরিশ্রমের সকল চি‎হ্ন মুছে দেয়।
যেহেতু যুগ পরিবর্তন হয়েছে, তাই আমরা যে প্রতিপালনে বেড়ে উঠেছি, তা এ নবপ্রজন্মের জন্য যথেষ্ট হবে না।
বরং এ পরিবর্তনকে পরিপূর্ণভাবে বিবেচনায় নেওয়া আমাদের জন্য অত্যাবশ্যক হয়ে পড়েছে। 
আজকের শিশু প্রতিপালন-বিশেষজ্ঞগণ এমনটাই তাগিদ দিয়েছেন। যেটার ব্যাপারে উমর ইবনুল খাত্তাব রাযি.ও কঠিন গুরুত্বারোপ করেছিলেন তার এ বক্তব্যের মাধ্যমে, আপনাদের সন্তানদের আপনাদের যুগ থেকে ভিন্ন একটি যুগের জন্য প্রতিপালিত করুন। এ বই এমন অনেক প্রতিপালন বিষয়ক আলোচনা করেছে, যা আমরা আমাদের সন্তানদের ক্ষেত্রে প্রয়োগ করে থাকি। আর এক্ষেত্রে আমরা যেসব ভুল প্র্যাকটিস করে থাকি, তাও উল্লেখ করেছে। এমনকিছু কৌশল ও পথ বলে দিয়েছে, যা আপনাকে সেই আনন্দদায়ক জগত, তথা প্রতিপালন জগতের গিরিপথে চলতে সাহায্য করবে।
 
কারিম আশ-শাযলী
 
লেখক ও গবেষক, মানবিক শাস্ত্র।
পরিচালক : তাহরিরু নাশরাতি আলওয়ানিত ত্বইফ লিত-তানমিয়াতিল বাশারিয়্যাহ। রিয়াদ, সৌদিআরব",বাবা : আদর্শ সন্তানের কারিগর,ড. করিম আশ শাযলী,মাওলানা সাইফুল ইসলাম, ,দারুল আরকাম, ,"1st Published,2021",128,বাংলাদেশ,বাংলা
হে যুবক : আজ তবে ফেরা হোক নিড়ে,ড. সালমান বিন ফাহাদ আল - আওদাহ,TK. 160,TK. 96,https://rokomari.com//book/148961/he-jubok---aj-tobe-fera-hok-nire,https://ds.rokomari.store/rokomari110/ProductNew20190903/130X186/39c68d2d7_148961.jpg,"",হে যুবক : আজ তবে ফেরা হোক নিড়ে,ড. সালমান বিন ফাহাদ আল - আওদাহ,কাজী আবুল কালাম সিদ্দীক, ,দারুল আরকাম, ,"3rd Published,2020",86,বাংলাদেশ,বাংলা
ফিরে এসো ক্ষমার পথে,ড. আয়েয আল-কারনী,TK. 160,TK. 96,https://rokomari.com//book/184091/fire-eso-khomar-pothe,https://ds.rokomari.store/rokomari110/ProductNew20190903/130X186/b1c9a1f57_184091.jpg,"",ফিরে এসো ক্ষমার পথে,"ড. আয়েয আল-কারনী,ড. মুহাম্মদ ইবনে আবদুর রহমান আরিফী","ফজলে রাব্বি,জহির উদ্দিন বাবর", ,দারুল আরকাম, ,"1st Published,2018",116,বাংলাদেশ,বাংলা
মনীষীদের কাছে সময়ের মূল্য,শায়খ আবদুল ফাত্তাহ আবু গুদ্দাহ রহ.,TK. 400,TK. 240,https://rokomari.com//book/155059/monishider-kache-somoyer-mullyo,https://ds.rokomari.store/rokomari110/ProductNew20190903/130X186/18ad80113_155059.jpg,"",মনীষীদের কাছে সময়ের মূল্য,শায়খ আবদুল ফাত্তাহ আবু গুদ্দাহ রহ.,কাজী আবুল কালাম সিদ্দীক, ,দারুল আরকাম, ,"1st Published,2017",336,বাংলাদেশ,বাংলা
ফিরে আসুন শেষ সময়ের আগে,শাইখ মুহাম্মদ আস সাবী,TK. 160,TK. 96,https://rokomari.com//book/207382/fire-asun-shes-somoyer-aage,https://ds.rokomari.store/rokomari110/ProductNew20190903/130X186/0be34e083_207382.jpg,"হে আমার মুসলিম ভাই ও বোনেরা আমরা অচিরেই মৃত্যুবরণ করবো। আল্লাহর শপথ: অচিরেই মৃত্যুবরণ করবো। অতিসত্বর কবরে প্রবেশ করবো। হিসাবের সম্মুখীন হবো আমরা সকলেই জিজ্ঞাসিত হবো। অচিরেই জিজ্ঞেস করা হবে, তুমি কেন পর্ন সিনেমা দেখেছো? কেন তুমি হারাম জিনিসের দিকে তাকিয়েছো? কেন তুমি সম্মানজনক মৃত্যুকে পছন্দ করোনি? কেন তুমি দুনিয়ায় চুরি করেছিলে? কেন তোমাকে দুনিয়া প্রতারিত করেছিন এবং তোমার রবের নৈকট্যতা অর্জনের ব্যাপারে ভুলিয়ে রেখেছিল? তুমি কি জন্নাতের আগ্রহী নও? তুমি কি সফলতা এবং সন্তুষ্টি চাওনা? হে বোন! তুমি উম্মাহাতুল মুমিনিনের সাহচর্য চাওনা? যদি তাই হয়, তাহলে কেন তুমি ইমানহীন হয়ে মুত্যুবরণ করবে...
হে মুসলিম ভাই ও বোনেরা! আমি আপনাদেরকে আল্লাহ তাআলার নামের শপথ দিয়ে বলছি! এখনই তাওবা করুন, কান্না করুন, মিনতি করুন, প্রার্থনা করুন, সিজদায়ে লুটিয়ে পড়ুন, এখনই প্রভুকে আহ্বান করুন। আর ফিরে আসুন শেষ সময়ের আগে...",ফিরে আসুন শেষ সময়ের আগে,শাইখ মুহাম্মদ আস সাবী,মাওলানা ফখরুল ইসলাম, ,দারুল আরকাম, ,"1st Published,2020",104,বাংলাদেশ,বাংলা
ছোটদের প্রতি উপদেশ,মাওলানা শোয়াইবুর রহমান,TK. 100,TK. 60,https://rokomari.com//book/155386/chotoder-proti-upodesh,https://ds.rokomari.store/rokomari110/ProductNew20190903/130X186/f57b9d1a8_155386.jpg,"",ছোটদের প্রতি উপদেশ,"মাওলানা শোয়াইবুর রহমান,শায়েখ মুহাম্মদ আজিম",মাওলানা শোয়াইবুর রহমান, ,দারুল আরকাম, ,"1st Published,2017",64,বাংলাদেশ,বাংলা
ইকফারুল মুলহিদিন,মাওলানা নাজমুল হুদা মিরপুরী,TK. 440,TK. 264,https://rokomari.com//book/153310/ikfarul-mulhidin--emam-o-kuforer-songghat-,https://ds.rokomari.store/rokomari110/ProductNew20190903/130X186/d7ba4ef19_153310.jpg,"",ইকফারুল মুলহিদিন,"মাওলানা নাজমুল হুদা মিরপুরী,আল্লামা আনোয়ার শাহ কাশ্মিরী (রহ.)",মাওলানা নাজমুল হুদা মিরপুরী,ছানা উল্লাহ সিরাজী,দারুল আরকাম, ,"1st Published,2016",352,বাংলাদেশ,বাংলা
পড়ালেখার কলাকৌশল,কাজী আবুল কালাম সিদ্দীক,TK. 260,TK. 156,https://rokomari.com//book/155379/poralekha-kolakoushol,https://ds.rokomari.store/rokomari110/ProductNew20190903/130X186/878ae6a30_155379.jpg,"""পড়ালেখার কলাকৌশল"" বইয়ের পিছনের কভারের লেখা কথা:
এখন ইলমের ময়দানে সবচেয়ে বড়াে সমস্যা কী? সবচেয়ে বড়ো সমস্যা হলাে, তালিবে ইলম নিজেই নিজের মর্যাদা সম্পর্কে জানে না এবং
তালিবে ইলমের সমাজও তা জানে না। তালিবে ইলমের
সমাজ তাকে অমর্যাদার চরমে নিয়ে গেছে। ... 
প্রথমে নিজের চোখেই নিজের মর্যাদা অর্জন করতে হবে। আমি যেনাে নিজেকে সম্মান করি। নিজের শিক্ষককে সম্মান করি। আমি যেনাে মাদরাসাকে সম্মান করি এবং ইলমের সাথে সম্পর্কিত প্রতিটি বিষয়কে সম্মান করি। 
যখন আমি নিজেকে সম্মান করতে শিখবাে তখন ধীরে ধীরে আমার চারপাশের লােক আমাকে সম্মান করবে। সবচেয়ে বড়াে সমস্যা এবং মর্মান্তিক সমস্যা এটাই যে, আমার চোখে আমার মর্যাদা শেষ হয়ে গেছে ।সমাজের চোখেও আমার মর্যাদা নেই। এটাকে পুনরুদ্ধার করতে হবে। ... আমাদের ভেবে ভেবে চিহ্নিত করতে হবে যে, কিরূপ করলে নিজের কাছে নিজের মর্যাদা রক্ষা পায় এবং কিরূপ করলে সমাজের কাছেও মর্যাদা পাওয়া যায়।",পড়ালেখার কলাকৌশল, , ,কাজী আবুল কালাম সিদ্দীক,দারুল আরকাম, ,"1st Published,2017",176,বাংলাদেশ,বাংলা
ইউথ’স প্রবলেমস,আল্লামা সালিহ বিন ফাওযান,TK. 100,TK. 60,https://rokomari.com//book/155381/youth-s-problems,https://ds.rokomari.store/rokomari110/ProductNew20190903/130X186/9f76aea9a_155381.jpg,"",ইউথ’স প্রবলেমস,"আল্লামা সালিহ বিন ফাওযান,শায়খ মুহাম্মাদ বিন সালিহ আল উসাইমিন",কাজী আবুল কালাম সিদ্দীক, ,দারুল আরকাম, ,"1st Published,2017",64,বাংলাদেশ,বাংলা
আত তিব্বুন নববি (সা.),আল্লামা হাফিয ইবনুল কায়্যিম আল জাওযী,TK. 900,TK. 540,https://rokomari.com//book/207313/at-tibbun-nababi--sa--,https://ds.rokomari.store/rokomari110/ProductNew20190903/130X186/deb665190_207313.jpg,"সুস্থতা মহান আল্লাহর দান। রাসূলুল্লাহ সাল্লাল্লাহু আলাইহি ওয়াসাল্লাম সুস্থতা রক্ষণের বিধান দিয়েছেন এবং অসুস্থতায় চিকিৎসা গ্রহণের গুরুত্বারোপ করেছেন। তিনি ইরশাদ করেন হে আল্লাহর বান্দাগণ তোমরা ওষুধ এর ব্যবস্থাপনা কর কেননা মহান আল্লাহ যত রোগ সৃষ্টি করেছেন প্রতিটির ওষুধও সৃষ্টি করেছে।
প্রয়োজনের তাগিদে আল্লাহর রাসুল সাল্লাল্লাহু আলাইহি ওয়াসাল্লাম নিজেও ওষুধ ব্যবহার করেছেন এবং বিভিন্ন সময় সাহাবায়ে কেরামের বিভিন্ন শারীরিক ও আত্মিক অসুস্থতার চিকিৎসা প্রদান করেছেন। আল্লামা ইবনুল কাইয়্যিম রচিত চলমান গ্রন্থটি আল্লাহর রাসূল সাল্লাল্লাহু আলাইহি ওয়াসাল্লাম এর বিভিন্ন সময়ে দেয়া বিভিন্ন চিকিৎসা পরামর্শের সামগ্রিক রূপ। যেখানে বিভিন্ন রোগের মৌলিক কারণ, অসুস্থ হওয়ার পথ রুদ্ধ করা বিভিন্ন প্রতিষেধক এবং ওষুধের সহজ পদ্ধতি স্পষ্টভাবে বর্ণনা করা হয়েছে। পাশাপাশি শারীরিক সুস্থতা ধরে রাখতে মনস্তাত্ত্বিক বিভিন্ন পদ্ধতির পরিপূর্ণ বিশ্লেষণ করা হয়েছে।
বর্তমানে আধুনিক চিকিৎসাবিজ্ঞান যথেষ্ট উন্নতি লাভ করেছে। কিন্তু আল্লাহর রাসূলের ঐশী পদ্ধতিতে প্রাপ্ত চিকিৎসা পদ্ধতির সামনে তা কোন অবস্থানই রাখে না। আল্লাহর রাসূল সাল্লাল্লাহু আলাইহি ওয়াসাল্লাম এর নির্ভুল চিকিৎসা পদ্ধতির কার্যকরিতা অনস্বীকার্য ও নজিরবিহীন। আল্লাহ রাসূলের দেখানো চিকিৎসা পদ্ধতির সম্মিলিত রূপের এই গ্রন্থটি একদিকে যেমন অসুস্থ ব্যক্তিদের হাতের নাগালে বিভিন্ন কার্যকরি ঔষধ এর সন্ধান দিবে পাশাপাশি চিকিৎসাবিজ্ঞানে অভিজ্ঞ ডাক্তার ও গবেষকগণের সামনে চিকিৎসা জগতে এক নতুন দিগন্তের উন্মোচন করবে। পাঠকদের জন্য এতে রয়েছে উন্নত চিকিৎসা চারিত্রিক উন্নত আদর্শ ও আত্মিক সাধনার এক ভান্ডার।",আত তিব্বুন নববি (সা.),আল্লামা হাফিয ইবনুল কায়্যিম আল জাওযী,শাইখ আবুল ওয়াফা শামসুদ্দিন আযহারী, ,দারুল আরকাম, ,"1st Edition,2021",624,বাংলাদেশ,বাংলা
কবিরা গোনাহ বা মহাপাপ,মাওলানা নোমান আহমদ রহ.,TK. 180,TK. 108,https://rokomari.com//book/148967/kobira-gunaho-ba-mohapap,https://ds.rokomari.store/rokomari110/ProductNew20190903/130X186/ac401e343_148967.jpg,"",কবিরা গোনাহ বা মহাপাপ, ,মাওলানা জাহিদুল ইসলাম,মাওলানা নোমান আহমদ রহ.,দারুল আরকাম, ,"1st Published,2016",144,বাংলাদেশ,বাংলা
মুখের উপর লাগাম দিন,ইমাম ইবনু আবিদ দুনিয়া রাহ.,TK. 250,TK. 150,https://rokomari.com//book/203184/mukher-uopar-lagham-din,https://ds.rokomari.store/rokomari110/ProductNew20190903/130X186/c49fedecf_203184.jpg,"নাহুমাদুহু ওয়া নুসাল্লি আলা রাসূলিহিল কারিম। মানুষকে আল্লাহ তাআলা অনন্য সৃষ্টিকুশলতার মিশ্রণে সৃষ্টি করেছেন। তিনশত ষাট জোড়া হাড়ের ওপর ত্বক ও রক্ত-মাংসের যে প্রলেপ দিয়ে তিনি এই মানবদেহ গঠন করেছেন, সেই মানবদেহটি একটি অপূর্ব বিস্ময়ের সমষ্টি। দেহের এই সমষ্টি গঠিত হয়েছে অপরূপ কিছু অঙ্গসৌষ্ঠবের নান্দনিক মিলনে। আর এই সুন্দর সুনিপুণ মানবদেহের সবচেয়ে অপরিহার্য অঙ্গটি হলো মানুষের মুখ ও তন্মধ্যকার রসনা। মুখের ব্যবহার বহুবিধ। রসনা-সিক্ত মানুষের ভাষাই সৃষ্টিকুলের মধ্যে মানবজাতিকে করেছে সম্পূর্ণ আলাদা, বৈশিষ্ট্যমণ্ডিত ও আভিজাতের অধিকারী। পৃথিবীতে মানুষের চেয়ে বহুগুণ শক্তিধর অনেক প্রাণী আছে, কিন্তু তাদের ভাষাশৈলী নেই বলে মানুষের কাছে তারা পদানত। মানুষ তার ভাষার জোরেই করেছে জগত জয়, অন্য সৃষ্টিকে করেছে পদানত। ভাষার কল্যাণেই মানুষ হয়েছে বিভক্ত নানা গোত্রে, নানা রাষ্ট্রে এবং নানা প্রাসাঙ্গিক বিভাজনে। ভাষার কল্যাণেই বহু মানুষ হয়েছে স্রষ্টার নাফরমান, ইবলিশ ও ফেরাউনের মতো ঔদ্ধ্যত এবং কিছু মানুষ ভাষার বিনম্র সতত ব্যবহারে স্রষ্টার অস্তিত্ব স্বীকার করে হয়েছে পৃথিবীর শ্রেষ্ঠ মানুষ। ভাষা মানুষকে মানষত্বের পরিচয় এনে দিলেও শ্রেষ্ঠত্বের পরিচয় দিয়েছে এর সদ্ব্যবহারে। তাই কোরআন-হাদিসে ভাষা ও রসনার সংযমী ব্যবহারের গুরুত্ব এসেছে। পরকালে মানুষের অসংযত ভাষার ব্যবহারই তাকে অধোঃমুখো করে জাহান্নামে নিক্ষিপ্ত করবে বলে হুঁশিয়ারী এসেছে। পরকালবিশ্বাসী মানুষের প্রধানতম দায়িত্ব হলো ভাষার সংযম ও মুখের ওপর লাগাম টেনে দেয়া। এই বিষয়ে হাদিসে অনেক তাগাদা এসেছে। সালফে সালেহিনগণ এর গুরুত্বের বিবরণ দিয়ে অনেক গ্রন্থ রচনা করে গেছেন। তাঁদের অন্যতম হলেন ইমাম ইবনু আবিদ দুনিয়া রহ., যিনি ছিলেন একজন প্রখ্যাত মুহাদ্দিস এবং সমাজনির্মাতা। সমাজের অধঃপতনের কারণগুলো চিহ্নিত করে তিনি যেসব অমর গ্রন্থ জাতিকে উপহার দিয়ে গেছেন তার অন্যতম হলো  الصمت وآداب اللسا ‘মুখের ওপর লাগাম দিন’ নামের অনন্য অসাধারণ গ্রন্থটি। গ্রন্থটির অনূদিতরূপকে পাঠকের টেবিলে তুলে দিচ্ছি। বইটি আশা করি পাঠকহৃদয়কে আকর্ষণ করতে সক্ষম হবে।

নাম : মুখের উপর লাগাম দিন
মূল : ইমাম ইবনু আবিদ দুনিয়া রহ.
অনুবাদ : মাসুদ কামাল
সম্পাদনা : মুফতি আবু বকর সিরাজী
ধরন : আত্মশুদ্ধি
পৃষ্ঠাসংখ্যা : ১৬০
বাইন্ডিং : হার্ডকভার
মুদ্রিত মূল্য : ২৫০
ইনশাআল্লাহ আগামীকাল থেকে বইটির প্রি-অর্ডার নেওয়া হবে।
বইটি প্রকাশের সম্ভাব্য তারিখ 17 সেপ্টেম্বর 2020 ইনশাআল্লাহ।",মুখের উপর লাগাম দিন,ইমাম ইবনু আবিদ দুনিয়া রাহ., , ,দারুল আরকাম, ,"1st Edition,2020",160,বাংলাদেশ,বাংলা
