Title,Author,Original Price,Discounted Price,URL,Image,Summary,Book_Title,Book_Author,Translator,Editor,Publisher,ISBN,Edition,Number Of Pages,Country,Language
السنة قبل التدوين (আস সুন্নাতু কাবলাত তাদবীন),মাকতাবাতুল ফাতাহ বাংলাদেশ,"",TK. 670,https://rokomari.com//book/127461/assunnatu-kabalat-tadbin,https://ds.rokomari.store/rokomari110/ProductNew20190903/130X186/4fe7abe19ad4_127461.jpg,"",السنة قبل التدوين (আস সুন্নাতু কাবলাত তাদবীন),মাকতাবাতুল ফাতাহ বাংলাদেশ, , ,Darul Fikor Boirut, , , ,Lebanon,Arabic
عمدة القارئ شرح صحيح البخاري  (উমদাতুল কারী শারহু সহীহুল বুখারী (১-১৬ খণ্ড),আল্লামা আইনী,"","TK. 18,000",https://rokomari.com//book/126522/umdatul-quri-sharhu-sahihul-bukhari--1-16-vol-,https://ds.rokomari.store/rokomari110/ProductNew20190903/130X186/book_av.png,"",عمدة القارئ شرح صحيح البخاري  (উমদাতুল কারী শারহু সহীহুল বুখারী (১-১৬ খণ্ড),আল্লামা আইনী, , ,Darul Fikor Boirut, , , ,Lebanon,Arabic
فتاوی عالمگیری   (الفتاوى الهندية ) (আল ফাতাওয়া আল আলমগিরিয়া বা ফতোয়ায়ে হিন্দিয়া (১-১২ খণ্ড),মাকতাবাতুল ফাতাহ বাংলাদেশ,"","TK. 9,000",https://rokomari.com//book/126919/al-fatawa-al-alomgiriyah-ba-fatawaye-hindiya--1-12-vol-,https://ds.rokomari.store/rokomari110/ProductNew20190903/130X186/book_av.png,"",فتاوی عالمگیری   (الفتاوى الهندية ) (আল ফাতাওয়া আল আলমগিরিয়া বা ফতোয়ায়ে হিন্দিয়া (১-১২ খণ্ড),মাকতাবাতুল ফাতাহ বাংলাদেশ, , ,Darul Fikor Boirut, , , ,Lebanon,Arabic
أطلس القرآن (আতলাসুল কুরআন),মাকতাবাতুল ফাতাহ বাংলাদেশ,"","TK. 1,400",https://rokomari.com//book/126520/atlasul-quran,https://ds.rokomari.store/rokomari110/ProductNew20190903/130X186/book_av.png,"",أطلس القرآن (আতলাসুল কুরআন),মাকতাবাতুল ফাতাহ বাংলাদেশ, , ,Darul Fikor Boirut, , , ,Lebanon,Arabic
إعلاء السنن (ইলাউস সুনান (১-২১ খণ্ড),মাওলানা জাফর আহমদ উসমানী,"","TK. 10,000",https://rokomari.com//book/126521/ilaus-sunana--1-21-vol-,https://ds.rokomari.store/rokomari110/ProductNew20190903/130X186/book_av.png,"",إعلاء السنن (ইলাউস সুনান (১-২১ খণ্ড),মাওলানা জাফর আহমদ উসমানী, , ,Darul Fikor Boirut, , , ,Lebanon,Arabic
أدب الـكـاتـب (আদাবুল কাতিব),মাকতাবাতুল ফাতাহ বাংলাদেশ,"",TK. 330,https://rokomari.com//book/127027/adabul-kitab,https://ds.rokomari.store/rokomari110/ProductNew20190903/130X186/book_av.png,"",أدب الـكـاتـب (আদাবুল কাতিব),মাকতাবাতুল ফাতাহ বাংলাদেশ, , ,Darul Fikor Boirut, , , ,Lebanon,Arabic
  كتاب الـتـاريـخ الـكـبـيـر (কিতাবুত তারীখ আল কাবীর (১-১১ খণ্ড),মাকতাবাতুল ফাতাহ বাংলাদেশ,"","TK. 5,000",https://rokomari.com//book/127151/kitabut-tarikh-al-kabir--1-11-vol-,https://ds.rokomari.store/rokomari110/ProductNew20190903/130X186/book_av.png,"",كتاب الـتـاريـخ الـكـبـيـر (কিতাবুত তারীখ আল কাবীর (১-১১ খণ্ড),মাকতাবাতুল ফাতাহ বাংলাদেশ, , ,Darul Fikor Boirut, , , ,Lebanon,Arabic
তারীখু বাগদাদ মায়ায যুয়ুল (১-২০ খণ্ড),মাকতাবাতুল ফাতাহ বাংলাদেশ,"","TK. 15,000",https://rokomari.com//book/127152/tarikhu-bagdad-mayaj-juyul--1-20-vol-,https://ds.rokomari.store/rokomari110/ProductNew20190903/130X186/book_av.png,"",তারীখু বাগদাদ মায়ায যুয়ুল (১-২০ খণ্ড),মাকতাবাতুল ফাতাহ বাংলাদেশ, , ,Darul Fikor Boirut, , , ,Lebanon,Arabic
كشف الظنون عن أسامي الكتب والفنون (কাশফুয যুনুন আন আসামিল কুতুবি ওয়াল ফুনুন ১-৬ খণ্ড),মাকতাবাতুল ফাতাহ বাংলাদেশ,"","TK. 4,500",https://rokomari.com//book/127495/kashfuz-junun-an-asamil-kutubi-wal-funun--1-6-vol-,https://ds.rokomari.store/rokomari110/ProductNew20190903/130X186/book_av.png,"",كشف الظنون عن أسامي الكتب والفنون (কাশফুয যুনুন আন আসামিল কুতুবি ওয়াল ফুনুন ১-৬ খণ্ড),মাকতাবাতুল ফাতাহ বাংলাদেশ, , ,Darul Fikor Boirut, , , ,Lebanon,Arabic
বুগয়াতুর রায়িদ ফী তাহকীকি মাজমাউয যাওয়ায়িদ (১-১০ খণ্ড) ,মাকতাবাতুল ফাতাহ বাংলাদেশ,"","TK. 10,500",https://rokomari.com//book/126575/bugyatur-rayid-fi-tahkiki-mazmauz-zawaid--1-10-vol-,https://ds.rokomari.store/rokomari110/ProductNew20190903/130X186/book_av.png,"",বুগয়াতুর রায়িদ ফী তাহকীকি মাজমাউয যাওয়ায়িদ (১-১০ খণ্ড),মাকতাবাতুল ফাতাহ বাংলাদেশ, , ,Darul Fikor Boirut, , , ,Lebanon,Arabic
আল ইনসান বিতারতীব সহীহ ইবনে হিব্বান (১-৬ খণ্ড),মাকতাবাতুল ফাতাহ বাংলাদেশ,"","TK. 4,500",https://rokomari.com//book/126578/al-insan-bitartib-sahih-ibn-hibban--1-6-vol-,https://ds.rokomari.store/rokomari110/ProductNew20190903/130X186/book_av.png,"",আল ইনসান বিতারতীব সহীহ ইবনে হিব্বান (১-৬ খণ্ড),মাকতাবাতুল ফাতাহ বাংলাদেশ, , ,Darul Fikor Boirut, , , ,Lebanon,Arabic
  شرح  فتح القدير (শরহু ফাতহিল কাদীর (১-১০ খণ্ড),মাকতাবাতুল ফাতাহ বাংলাদেশ,"","TK. 12,500",https://rokomari.com//book/126924/sharhu-fathul-kadir--1-10-vol-,https://ds.rokomari.store/rokomari110/ProductNew20190903/130X186/book_av.png,"",شرح  فتح القدير (শরহু ফাতহিল কাদীর (১-১০ খণ্ড),মাকতাবাতুল ফাতাহ বাংলাদেশ, , ,Darul Fikor Boirut, , , ,Lebanon,Arabic
الوجيز في اصول الفقه (আল ওয়াজীয ফী উসুলিল ফিকহ),আবদুল করীম যায়দান,"",TK. 690,https://rokomari.com//book/126941/al-wajiju-fi-usulil-fiqh,https://ds.rokomari.store/rokomari110/ProductNew20190903/130X186/book_av.png,"",الوجيز في اصول الفقه (আল ওয়াজীয ফী উসুলিল ফিকহ),আবদুল করীম যায়দান, , ,Darul Fikor Boirut, , , ,Lebanon,Arabic
আল বিনায়া ফী শারহিল হিদায়া (১-১২ খণ্ড),মাকতাবাতুল ফাতাহ বাংলাদেশ,"","TK. 9,000",https://rokomari.com//book/126951/al-binayah-fi-sharhil-hidaya--1-12-vol-,https://ds.rokomari.store/rokomari110/ProductNew20190903/130X186/book_av.png,"",আল বিনায়া ফী শারহিল হিদায়া (১-১২ খণ্ড),মাকতাবাতুল ফাতাহ বাংলাদেশ, , ,Darul Fikor Boirut, , , ,Lebanon,Arabic
شرح مقامات الحريري  البصري  (শারহু মাকামাতিল হারিরি আল বাসরি (১-২ খণ্ড),মাকতাবাতুল ফাতাহ বাংলাদেশ,"","TK. 1,200",https://rokomari.com//book/127000/sharhu-makamatil-hariri-al-bashri--1-2-vol--,https://ds.rokomari.store/rokomari110/ProductNew20190903/130X186/book_av.png,"",شرح مقامات الحريري  البصري  (শারহু মাকামাতিল হারিরি আল বাসরি (১-২ খণ্ড),মাকতাবাতুল ফাতাহ বাংলাদেশ, , ,Darul Fikor Boirut, , , ,Lebanon,Arabic
روح البيان في تفسير القرآن (রুহুল বায়ান ফী তাফসীরুল কুরআন (১-১০ খণ্ড),মাকতাবাতুল ফাতাহ বাংলাদেশ,"","TK. 10,500",https://rokomari.com//book/126503/ruhul-bayan-fi-tafsirul-quran--1-10-vol-,https://ds.rokomari.store/rokomari110/ProductNew20190903/130X186/book_av.png,"",روح البيان في تفسير القرآن (রুহুল বায়ান ফী তাফসীরুল কুরআন (১-১০ খণ্ড),মাকতাবাতুল ফাতাহ বাংলাদেশ, , ,Darul Fikor Boirut, , , ,Lebanon,Arabic
التبيان في إعراب القرآن (আত তিবইয়ান ফী ইরাবিল কুরআন (১-২ খণ্ড),মাকতাবাতুল ফাতাহ বাংলাদেশ,"","TK. 1,000",https://rokomari.com//book/126516/at-tibyan-fi-irabil-quran--1-2-vol-,https://ds.rokomari.store/rokomari110/ProductNew20190903/130X186/book_av.png,"",التبيان في إعراب القرآن (আত তিবইয়ান ফী ইরাবিল কুরআন (১-২ খণ্ড),মাকতাবাতুল ফাতাহ বাংলাদেশ, , ,Darul Fikor Boirut, , , ,Egypt,Arabic
ইরশাদুস সারী লি শারহি সহীহিল বুখারী (দুই কালার) (১-১০ খণ্ড),মাকতাবাতুল ফাতাহ বাংলাদেশ,"","TK. 10,000",https://rokomari.com//book/126525/irsadus-sare-li-sharhe-sahihul-bukhari--1-10-vol-,https://ds.rokomari.store/rokomari110/ProductNew20190903/130X186/book_av.png,"",ইরশাদুস সারী লি শারহি সহীহিল বুখারী (দুই কালার) (১-১০ খণ্ড),মাকতাবাতুল ফাতাহ বাংলাদেশ, , ,Darul Fikor Boirut, , , ,Lebanon,Arabic
أوجَزُالمَسَالِك إلى موطَّــــأ مــالــك (আউজাযুল মাসালিক ইলা মুয়াত্তা মালেক (১-১৫ খণ্ড),শায়খুল হাদীস হযরত মাওলানা মুহাম্মদ যাকারিয়া ছাহেব কান্ধলভী (রহ:),"","TK. 11,750",https://rokomari.com//book/126528/awjajul--masalik-ila-muwatta-malek--1-15-vol-,https://ds.rokomari.store/rokomari110/ProductNew20190903/130X186/book_av.png,"",أوجَزُالمَسَالِك إلى موطَّــــأ مــالــك (আউজাযুল মাসালিক ইলা মুয়াত্তা মালেক (১-১৫ খণ্ড),শায়খুল হাদীস হযরত মাওলানা মুহাম্মদ যাকারিয়া ছাহেব কান্ধলভী (রহ:), , ,Darul Fikor Boirut, , , ,Lebanon,Arabic
আরিযাতুল আহওয়াযী বিশারহি জামিয়াতি তিরমিযী (১-৮ খণ্ড),মাকতাবাতুল ফাতাহ বাংলাদেশ,"","TK. 4,800",https://rokomari.com//book/126533/ariyatul-ahwaji-bisarohi-jamiati-tirmiji--1-8-vol-,https://ds.rokomari.store/rokomari110/ProductNew20190903/130X186/book_av.png,"",আরিযাতুল আহওয়াযী বিশারহি জামিয়াতি তিরমিযী (১-৮ খণ্ড),মাকতাবাতুল ফাতাহ বাংলাদেশ, , ,Darul Fikor Boirut, , , ,Lebanon,Arabic
