Title,Author,Original Price,Discounted Price,URL,Image,Summary,Book_Title,Book_Author,Translator,Editor,Publisher,ISBN,Edition,Number Of Pages,Country,Language
সবরের প্রতিদান,ইমাম ইবনু আবিদ দুন্ইয়া (রহিমাহুল্লাহ) ,TK. 180,TK. 108,https://rokomari.com//book/203185/soborer-protidan,https://ds.rokomari.store/rokomari110/ProductNew20190903/130X186/2d15e4588_203185.jpg,"মহান আল্লাহ আমাদেরকে এ মাটির বসুন্ধরায় অসংখ্য অফুরান নেয়ামত দান করেছেন। আল্লাহ তাআলা আমাদেরকে যে সকল নেয়ামত দিয়েছেন তার মাঝে অন্যতম একটি নেয়ামত ‘সবর’। সবর দ্বীনের মর্যাদা সমূহ থেকে একটি সুস্পষ্ট মর্যাদা, আল্লাহ তাআলার হিদায়াত প্রাপ্ত বান্দাগণের ঘর সমূহ থেকে একটি ঘর এবং সৌভাগ্যবান ও দৃঢ় ইচ্ছার অধিকারীগণের উত্তম স্বভাব সমূহ থেকে একটি উত্তম স্বভাব। সবর একজন খাঁটি মুমিনের প্রশংসনীয় বৈশিষ্ট্য সমূহ থেকে অন্যতম একটি বৈশিষ্ট্য। একজন মুমিন-মুসলিম সবরের মাধ্যমে তার জীবনের নেক আমলের প্রতিদানকে বহুগুণ পরিমাণ বৃদ্ধি করে নিতে পারেন। কুরআনুল কারীমের অনেক আয়াতে আল্লাহ তাআলা সবরের আলোচনা করেছেন এবং সবরকারীদের সীমাহীন প্রতিদান প্রদান করার মহা প্রতিশ্রুতি দিয়েছেন। রাসুল সাল্লাল্লাহু আলাইহি ওয়াসাল্লাম তার বহু হাদীসের মাঝে সবরের নির্দেশ প্রদান করেছেন এবং সবরকারীদের দুনিয়া এবং আখিরাতে উত্তম প্রতিদানের সুসংবাদ দিয়েছেন।
‘সবরের প্রতিদান’ (الصبر والصواب عليه) কিতাবটি সংকলন করেন নির্ভরযোগ্য এবং প্রসিদ্ধ হাদীস বর্ণনাকারী আল-হাফিয আবু বকর আব্দুল্লাহ ইবনু মুহাম্মাদ ইবনু আবিদ ইবনু সুফিয়ান ইবনু ক্বইস আল-বাগদাদী আল-কুরাঈশী, ইবনু আবিদ দুনিয়া রহ. (ইন্তিকাল ২৮১ হিজরী)। এ কিতাবটি মূলত ধৈর্য বিষয়ের উপর সংকলিত একটি হাদীসের কিতাব। সংকলক রহ. তার এ কিতাবে পুনরাবৃত্তি সহকারে মোট একশত ছিয়ানব্বইটি বর্ণনা এনেছেন। সংকলক রহ. এ কিতাবে রাসুল সাল্লাল্লাহু আলাইহি ওয়াসাল্লাম-এর হাদীস ব্যতীতও এমন অনেক অনেক নান্দনিক উক্তি, অভিজ্ঞতা লব্ধ অমূল্য বাণী, মহা মূল্যবান উপদেশ এবং আকর্ষণীয় ও হৃদয় বিদারক ঘটনাবলী উল্লেখ করেছেন যা মানুষকে ধৈর্য ধারণ করতে আগ্রহী করে তোলে এবং ধৈর্য ধারণের প্রতি উদ্বুদ্ধ করে ও প্রেরণা যোগায়।",সবরের প্রতিদান,ইমাম ইবনু আবিদ দুন্ইয়া (রহিমাহুল্লাহ), , ,দারুল আরকাম, ,"1st Edition,2020",112,বাংলাদেশ,বাংলা
পুত্রের প্রতি পিতার পত্র ও উপদেশ,কাজী আবুল কালাম সিদ্দীক,TK. 300,TK. 180,https://rokomari.com//book/148966/puthrer-proti-pitar-potro-o-upodesh,https://ds.rokomari.store/rokomari110/ProductNew20190903/130X186/be9869a52_148966.jpg,"মুসলিম জাহানে এমন লোক জন্মগ্রহণ করেছেন যাঁরা অসাধারণ জ্ঞানী ও মহান। তাদেরকে আমরা আকাবির বা মনীষী বলে থাকি। ইসলামের ইতিহাসে তাঁদের অবদান অনেক। মুসলমান জাতির কাছে তাঁরা স্মরণীয় ও বরণীয়। নবী-রাসুল ও আসহাবে রাসুল থেকে শুরু করে এমনই কয়েকজন নামকরা মুসলিম মনীষীর তাঁদের পুত্রদের সাথে সংঘটিত খণ্ডিত ঘটনাবলী ও উপদেশমালা দিয়ে সাজানো হয়েছে ‘পুত্রের প্রতি পিতার পত্র উপদেশ’ গ্রন্থটি।
তাঁদের অবিস্মরণীয় আদর্শ জীবন কাহিনির ওই খন্ডিত অংশটুকু জেনে আমাদের প্রজন্ম ‍উৎসাহিত হোক, নসিহত গ্রহণ করুক-এটাই আমাদের একান্ত কামনা। গ্রন্থটির বিভিন্ন অংশে সম্মানিত পাঠকদের উদ্দেশ্যে পুত্রের প্রতি পিতার পত্র বা নসিহতের পাশাপাশি এমন কতগুলো সুরভিত নমুনা বা দৃষ্টান্ত ও চমৎকার কাহিনী পেশ করা হয়েছে-যা তার সুগন্ধ ছড়াবে যুগযুগ ধরে ওই সব পুণ্যবান ভালো মানুষের জন্য-যাদেরকে তাদের পিতামাতার সাথে সদ্ব্যবহার করার তাওফিক দেওয়া হয়েছে। আশ করা যায় এসব দৃষ্টান্ত ও কাহিনি আমাদের প্রাণে উত্তম ও কল্যাণকর দিকগুলো আন্দোলিত করবে এবং সৎকর্ম ও পিতামাতার আনুগত্যের দিকে ধাবিত করবে। আল্লাহ আমাদের তৌফিক দিন।",পুত্রের প্রতি পিতার পত্র ও উপদেশ,কাজী আবুল কালাম সিদ্দীক, , ,দারুল আরকাম, ,"2nd Published,2021",224,বাংলাদেশ,বাংলা
শুহাদায়ে কারবালা হোসাইনা আদর্শ,মুফতী মুহাম্মদ শফী রহ.,TK. 160,TK. 96,https://rokomari.com//book/148969/shuhadaye-karbala-hossaina-adorsho,https://ds.rokomari.store/rokomari110/ProductNew20190903/130X186/3385496e0_148969.jpg,"",শুহাদায়ে কারবালা হোসাইনা আদর্শ, , ,"মুফতী মুহাম্মদ শফী রহ.,মাওলানা মাকসুদুর রহমান",দারুল আরকাম, ,"1st Published,2016",104,বাংলাদেশ,বাংলা
উত্তম চরিত্র : সুবাসিত করে জীবন,ইমাম ইবনু আবিদ দুনিয়া রাহ.,TK. 260,TK. 156,https://rokomari.com//book/207314/uttom-choritro---subasito-kore-jibon,https://ds.rokomari.store/rokomari110/ProductNew20190903/130X186/0d2cd267a_207314.jpg,"উত্তম চরিত্রকে ইসলামি শিক্ষার অন্যতম একটি কোর্স হিসেবে পরিগণিত করা হয়। পবিত্র কুরআন ও সুন্নাহতে ব্যক্তি, পরিবার, সমাজ তথা সমগ্র মানব সমাজের চারিত্রিক উন্নয়নে প্রচুর নির্দেশনা বিদ্যমান। মূলত মানুষ ও অন্যান্য প্রাণীর মধ্যে মৌলিক পার্থক্য এ চরিত্রের আলোকেই হয়ে থাকে। আখলাকের মাধ্যমেই মানুষ মনুষ্যত্বের চূড়ান্ত মানে উন্নীত হতে পারে। ইসলাম একটি পরিপূর্ণ জীবন-বিধান। এ বিধানের পরিপূর্ণতার জন্য তাতে উন্নত চরিত্রের বিধান থাকা আবশ্যক। তাই ইসলামে আখলাকে হাসানাহ তথা উত্তম চরিত্রের স্থান অনেক অনেক উর্ধ্বে। আমাদের প্রিয় নবিজি সাল্লাল্লাহু আলাইহি ওয়াসাল্লাম-কে প্রেরণের অন্যতম কারণ সচ্চরিত্রের বিকাশ সাধন। নবি করিম সাল্লাল্লাহু আলাইহি ওয়াসাল্লাম বলেন, ‘আমাকে সচ্চরিত্রের পূর্ণতা সাধনের নিমিত্তেই প্রেরণ করা হয়েছে।’ অন্য এক হাদিসে বর্ণিত হয়েছে একদা জনৈক ব্যক্তি রাসুল সাল্লাল্লাহু আলাইহি ওয়াসাল্লাম-কে দীনের সংজ্ঞা জিজ্ঞেস করলে উত্তরে তিনি বলেন, ‘উত্তম চরিত্র’। এ কথা দ্বারা বুঝা যায় সচ্চরিত্রতা বা উত্তম চরিত্র দীনের অন্যতম একটি রুকন, যা ব্যতীত দীনের অস্তিত্বই কল্পনা করা যায় না। উত্তম চরিত্র জান্নাত লাভের মাধ্যম এবং জাহান্নাম হতে মুক্তির উপায়। তাই তো বলা হয়, ‘উত্তম চরিত্র :সুবাসিত করে জীবন...",উত্তম চরিত্র : সুবাসিত করে জীবন,"ইমাম ইবনু আবিদ দুনিয়া রাহ.,ইমাম তাবরানী",মাওলানা ফকরুল ইসলাম, ,দারুল আরকাম, ,"1st Edition,2021",176,বাংলাদেশ,বাংলা
তাওবার গল্প,ইবনু কুদামা মাকদিসি,TK. 520,TK. 312,https://rokomari.com//book/203183/taobar-glpo,https://ds.rokomari.store/rokomari110/ProductNew20190903/130X186/2ad7584be_203183.jpg,"",তাওবার গল্প,ইবনু কুদামা মাকদিসি, , ,দারুল আরকাম, ,"1st Edition,2020",310,বাংলাদেশ,বাংলা
আল্লাহর ওপর ভরসা রাখুন,শাইখ মুহাম্মাদ সালেহ আল মুনাজ্জিদ,TK. 180,TK. 108,https://rokomari.com//book/207373/allahur-upor-vorosha-rakhun,https://ds.rokomari.store/rokomari110/ProductNew20190903/130X186/4c7d1c21b_207373.jpg,"জীবনের কঠিনতম সময়ে তাওয়াক্কুল মানুষকে শান্তি দেয়, ধীরস্থির এবং সৎ রাখে। মহান আল্লাহ তাআলার ওপর ভরসা করা ইসলামে একটি বিরাট বিষয়। এর গুরুত্ব ও মর্যাদা অপরিসীম। মহান আল্লাহ তাআলার প্রতি ভরসা করা ছাড়া কোনো বান্দাই কোনো মুহূর্ত অতিবাহিত করতে পারে না। এটি একটি গুরুত্বপূর্ণ ইবাদতও বটে। কেননা এর মাধ্যমে মহান আল্লাহ তাআলার তাওহিদের সাথে সম্পর্ক দৃঢ় এবং গভীর হয়। আল্লাহর ওপর ভরসা বা তাওয়াক্কুল করা নিয়ে আমাদের সালাফরা  বিভিন্ন ভাষায় স্বতন্ত্র অনেক কিতাব রচনা করেছেন। কিন্তু বাংলা ভাষায় এই বিষয়ের ওপর লেখা কিতাব খুবই অপ্রতুল। আমাদের এই বইটি নিঃসন্দেহে বাংলা ভাষায় এক অনন্য সংযোজন। 
বইটিতে তাওয়াক্কুলের সংজ্ঞা, গুরুত্ব ও ফজিলত, উপকারিতা, তাওয়াক্কুল পরিপন্থি কাজ, আল্লাহর ওপর ভরসার ঘটনা প্রভৃতি বিষয়ে সংক্ষেপে সুন্দরভাবে আলোকপাত করা হয়েছে। যারা তাওয়াক্কুলের অন্তর্নিহিত তাৎপর্য জানতে চান, তাওয়াক্কুল সম্বলিত আয়াত, হাদিস, সালাফদের বাণী একত্রে পড়তে চান, বইটি হতে পারে তাদের জন্য উত্তম সহায়ক।",আল্লাহর ওপর ভরসা রাখুন,"শাইখ মুহাম্মাদ সালেহ আল মুনাজ্জিদ,ইমাম ইবনু আবিদ দুনিয়া রাহ.",মাওলানা ফখরুল ইসলাম, ,দারুল আরকাম, ,"1st Edition,2021",96,বাংলাদেশ,বাংলা
নবী নন্দিনী সাইয়েদা ফাতিমা,কাজী আবুল কালাম সিদ্দীক,TK. 200,TK. 120,https://rokomari.com//book/184092/nobi-nondini-saiyeda-fatima,https://ds.rokomari.store/rokomari110/ProductNew20190903/130X186/ae183a0c4_184092.jpg,"",নবী নন্দিনী সাইয়েদা ফাতিমা,কাজী আবুল কালাম সিদ্দীক, , ,দারুল আরকাম, ,"1st Published,2018",151,বাংলাদেশ,বাংলা
হৃদয়ের অশ্রুমালা,ইমাম ইবনু আবিদ দুনিয়া রাহ.,TK. 240,TK. 144,https://rokomari.com//book/201591/hridoyer-oshrumala,https://ds.rokomari.store/rokomari110/ProductNew20190903/130X186/17f02e68f_201591.jpg,"আলোচ্য গ্রন্থটি বিশ্বের অন্যতম প্রাচীন তাসাউফ, আত্মশুদ্ধি ও খোদাভীতি সঞ্চারক একটি গ্রন্থ। লেখক আলোচ্য গ্রন্থটিতে আল্লাহর ভয়ে ক্রন্দন করার ফজিলত, মাহাত্ম্য, সাওয়াব, এর উপকারিতা, আল্লাহভীতি অর্জনে ক্রন্দনের অপরিহার্যতা, নবী-রাসুল, ফেরেশতা, সাহাবা ও সালফে সালেহীনের রবের ভয় ক্রন্দনের বিভিন্ন ঘটনা উল্লেখ করেছেন, যা যেকোনো কঠোর হৃদয়ের অধিকারী ব্যক্তিদের ভাবতে শেখাবে। কান্না উদ্রেক করার উপায় ও পদ্ধতি সম্পর্কেও লেখক আলোচ্য গ্রন্থে আলোচনা করেছেন এবং আকাবিরগণ এক্ষেত্রে কোন পদ্ধতি ও পন্থা অবলম্বন করতেন সে সম্পর্কেও আলোচনা করেছেন। এসব আলোচনা ও ঘটনা যে কোন মুমিন ও মুসলমানকে আল্লাহভীতির গুণ অর্জনে বিপুল সহযোগিতা করবে। কেননা নিষ্পাপ ফেরেশতা, আগে পরের সকল প্রকার গুনাহ ও ত্রুটি থেকে পবিত্র নবী-রাসূলগণ, বিশেষ করে আমাদের প্রিয় নবীর ক্রন্দন, জান্নাতের সুসংবাদপ্রাপ্ত আবু বক্কর সিদ্দিক, ওমর ইবনুল খাত্তাব, ওসমান জিন্নুরাইন রাযিআল্লাহু তা'আলা আনহু প্রমুখ মহান সাহাবাগণের ক্রন্দনের ইতিহাস ও দৃশ্যগুলো কল্পনায় উত্থাপন করলে আমাদের মত হৃদয়হীন লোকেরা কিছুটা হলেও ভীতসন্ত্রস্ত হবে, তাতে কোন সন্দেহ নেই।",হৃদয়ের অশ্রুমালা,ইমাম ইবনু আবিদ দুনিয়া রাহ., , ,দারুল আরকাম, ,"1st Published,2020",160,বাংলাদেশ,বাংলা
মা সন্তানের স্বপ্নসাথী,শাইখ ড. আব্দুল কারীম বাক্কার,TK. 150,TK. 90,https://rokomari.com//book/207374/ma-sontaner-swopnosathi,https://ds.rokomari.store/rokomari110/ProductNew20190903/130X186/a5e601d08_207374.jpg,"নিশ্চয় আল্লাহ তাআলা মায়েদেরকে মহান দু’টি জিনিস দিয়েছেন যা তাদেরকে সন্তানদের জন্য সবচেয়ে বড় লালনপালনকারী এবং শিক্ষকের যোগ্য করে তুলেছে, আর সে দু’টি জিনিস হলো- সীমাহীন মমতা এবং অফুরান ধৈর্যশীলতা।
আর এ কারণেই ইসলামি দৃষ্টিকোণে নারীর মৌলিক কাজ হলো, সন্তান লালনপালন ও তত্ত্বাবধান করা এবং সন্তানের চিন্তা-চেতনা, মন ও মননে কল্যাণ, সততা ও দৃঢ়তার বীজ বপন করা...
একটি শিশু যখন জন্ম লাভ করে তখন তার মাঝে মনুষত্ব অসম্পূর্ণ থাকে, কেননা মনুষত্ব পিতা-মাতার নিকট থেকে উত্তরাধিকারসূত্রে পাওয়া যায় না, বরং শিশু তা অর্জন করে, তাকে লালনপালন করার পদ্ধতি এবং পারিবারিক ও সামাজিক মেলামেশার ক্ষেত্র থেকে...
একটি শিশু চিন্তা-চেতনা, চরিত্র, অনুভূতি, ভাষা এবং ভালো-মন্দের মানদন্ড অর্জন করে থাকে। মানুষের সন্তান তখনই মানুষ হয় যখন তাকে অন্য আরেকজন মানুষ লালনপালন করে। আর এ থেকেই মায়েদের কাজের মহত্ত্ব ও গুরুত্ব বুঝা যায়, যা তারা বাড়িতে বাস্তবায়ন করে থাকেন...",মা সন্তানের স্বপ্নসাথী,শাইখ ড. আব্দুল কারীম বাক্কার,নাসীরুদ্দীন খন্দকার, ,দারুল আরকাম, ,"1st Edition,2021",72,বাংলাদেশ,বাংলা
পৃথিবী আমার আসল ঠিকানা নয়,কাজী আবুল কালাম সিদ্দীক,TK. 320,TK. 192,https://rokomari.com//book/190731/prithibi-amar-asol-thikana-noy,https://ds.rokomari.store/rokomari110/ProductNew20190903/130X186/dc02678bc_190731.jpg,"",পৃথিবী আমার আসল ঠিকানা নয়,কাজী আবুল কালাম সিদ্দীক, , ,দারুল আরকাম, ,"1st Published,2018",288,বাংলাদেশ,বাংলা
হায়াতুল মুসলিমীন , حكيم الامت مولانا اشرف علي تهانوي رح  ( হাকীমুল উম্মত মাওলানা আশরাফ আলী থানভী রহ.),TK. 360,TK. 216,https://rokomari.com//book/190732/hayatul-muslimin,https://ds.rokomari.store/rokomari110/ProductNew20190903/130X186/82fc9b3e4_190732.jpg,মুসলিম উম্মাহর সামাজিক জীবনের হাজারো আচার-আচরণ সমৃদ্ধ নির্ভরযোগ্য সংকলন,হায়াতুল মুসলিমীন,حكيم الامت مولانا اشرف علي تهانوي رح  ( হাকীমুল উম্মত মাওলানা আশরাফ আলী থানভী রহ.),মাওলানা মাকসুদ আহমদ, ,দারুল আরকাম, ,"1st Published,2019",237,বাংলাদেশ,বাংলা
