Title,Author,Original Price,Discounted Price,URL,Image,Summary,Book_Title,Book_Author,Translator,Editor,Publisher,ISBN,Edition,Number Of Pages,Country,Language
تـاريـخ الأدب الـعـربـي(তারীখুল আদাবিল আরাবী),মাকতাবাতুল ফাতাহ বাংলাদেশ,"",TK. 600,https://rokomari.com//book/127148/tarikhul-adabil-arabi,https://ds.rokomari.store/rokomari110/ProductNew20190903/130X186/book_av.png,"",تـاريـخ الأدب الـعـربـي(তারীখুল আদাবিল আরাবী),মাকতাবাতুল ফাতাহ বাংলাদেশ, , ,"Darul Maaref,Beirut", , , ,Lebanon,Arabic
كتاب الإختيار لتعليل المختار   (কিতাবুল ইখতিয়ার লি তালীলিল মুখতার (১-৫ খণ্ড),মাকতাবাতুল ফাতাহ বাংলাদেশ,"","TK. 1,000",https://rokomari.com//book/126950/kitabul-ikhtiar-li-talilil-mukhtar--1-5-vol-,https://ds.rokomari.store/rokomari110/ProductNew20190903/130X186/book_av.png,"",كتاب الإختيار لتعليل المختار   (কিতাবুল ইখতিয়ার লি তালীলিল মুখতার (১-৫ খণ্ড),মাকতাবাতুল ফাতাহ বাংলাদেশ, , ,"Darul Maaref,Beirut", , , ,Lebanon,Arabic
 ديوان حسان بن ثابت الأنصاري (দিওয়ানু হাসসান বিন সাবিত আল আনসারী),মাকতাবাতুল ফাতাহ বাংলাদেশ,"",TK. 400,https://rokomari.com//book/127029/diwanu-hassan-bin-sabbit-al-ansari,https://ds.rokomari.store/rokomari110/ProductNew20190903/130X186/book_av.png,"", ديوان حسان بن ثابت الأنصاري (দিওয়ানু হাসসান বিন সাবিত আল আনসারী),মাকতাবাতুল ফাতাহ বাংলাদেশ, , ,"Darul Maaref,Beirut", , , ,Lebanon,Arabic
 الامام عبد القادر الجيلاني (আল ইমাম আবদুল কাদের আল জিলানী),মাকতাবাতুল ফাতাহ বাংলাদেশ,"",TK. 250,https://rokomari.com//book/127250/al-imam-abdul-kadir-al-jilani,https://ds.rokomari.store/rokomari110/ProductNew20190903/130X186/book_av.png,"",الامام عبد القادر الجيلاني (আল ইমাম আবদুল কাদের আল জিলানী),মাকতাবাতুল ফাতাহ বাংলাদেশ, , ,"Darul Maaref,Beirut", , , ,Lebanon,Arabic
رد المحتار على الدر المختار (حاشية ابن عابدين) ويليه قرة عيون الأخيار وتقريرات الرافعي (রদ্দুল মুহতার আলা দুররিল মুখতার বা হাশিয়ায়ে ইবনে আবেদীন (১-১২ খণ্ড),মাকতাবাতুল ফাতাহ বাংলাদেশ,"","TK. 10,100",https://rokomari.com//book/126922/raddul-muhatar-ala-durril-mukhtar-ba-hasiyeh-ibn-abedin--1-12-vol-,https://ds.rokomari.store/rokomari110/ProductNew20190903/130X186/book_av.png,"",رد المحتار على الدر المختار (حاشية ابن عابدين) ويليه قرة عيون الأخيار وتقريرات الرافعي (রদ্দুল মুহতার আলা দুররিল মুখতার বা হাশিয়ায়ে ইবনে আবেদীন (১-১২ খণ্ড),মাকতাবাতুল ফাতাহ বাংলাদেশ, , ,"Darul Maaref,Beirut", , , ,Lebanon,Arabic
