Title,Author,Original Price,Discounted Price,URL,Image,Summary,Book_Title,Book_Author,Translator,Editor,Publisher,ISBN,Edition,Number Of Pages,Country,Language
অভিশপ্ত রঙধনু,আসিফ আদনান,TK. 354,TK. 301,https://rokomari.com//book/200104/ovishopto-rongdhonu,https://ds.rokomari.store/rokomari110/ProductNew20190903/130X186/587f15943_200104.jpg,"",অভিশপ্ত রঙধনু,"আসিফ আদনান,ডা. শামসুল আরেফীন,মাওলানা জাফিরুদ্দিন,ড্যানিয়েল হাকিকাতজু", , ,দারুল ইহদা, ,"1st Published,2020",248,বাংলাদেশ,বাংলা
আহলুস সুন্নাহ ওয়াল জামাআ'হ,সাইয়্যেদ সুলাইমান নদভী রাহ.,TK. 135,TK. 119,https://rokomari.com//book/203142/ahlus-sunnah-oyal-jamaah,https://ds.rokomari.store/rokomari110/ProductNew20190903/130X186/c630d69a3_203142.jpg,"ইসলামের আবির্ভাব হয়েছে পৃথিবীর সকল বিচ্ছিন্নতাকে বিলুপ্ত করে বিশ্বময় ব্যাপকভাবে ভ্রাতৃত্ব স্থাপন করার জন্য। ইসলাম তার এই লক্ষ্যে সফল হয়েছে পারষ্পরিক শত্রুতার ভিত্তিতে বিভক্ত আরবের গোত্রগুলোকে ইসলামি জামা'আর বন্ধনে আবদ্ধ করার মাধ্যমে। মুহাজির ও আনসারদের মাঝে এমন ভ্রাতৃত্ব জাগ্রত করে দিলো, যা বংশীয় ভ্রাতৃত্বকেও হার মানায়।

কোন জাতির উন্নতি তখনই সম্ভব হবে, যখন সে জাতির সর্বস্তরের মানুষ একই লক্ষ্য ও কেন্দ্রে একীভূত হবে। এই লক্ষ্য ও কেন্দ্রকে অটুট ও স্থায়ী রাখাই হবে তাদের জীবনের প্রধান উদ্দেশ্য। আর তখনই তাদেরকে একটি জাতি হিসেবে গণ্য করা হবে এবং ঐক্যের এই লক্ষ্য ও কেন্দ্রটাই হবে তাদের জাতীয়তার সূত্র। এভাবে কোন জাতির পতন ঘটে তখনই, যখন জাতীয়তার এই বন্ধন ছিন্ন হয়ে যায়। ফলে সে জাতির প্রতিটি মানুষ এমনভাবে ছন্নছাড়া হয়ে পড়ে, যেন বাতাসের সামান্য ঝাপটা তাদেরকে উড়িয়ে নিয়ে যাবে।

পানির উপর নকশা যেমন পরক্ষণে মুছে যায়, অনুরুপ মুসলমানদের মাঝে সৃষ্টি হওয়া হাজারো ফেরকা উত্থানের পর পতিত হয়েছে। তবে যে দলটি অধিক ও ব্যাপকভাবে মুসলিম ভূখণ্ডের সিংহভাগজুড়ে পৃথিবীর আনাচে কানাচে ছড়িয়ে আছে তা হলো, “আহলুস সুন্নাহ ওয়াল জামাআ’হ”।",আহলুস সুন্নাহ ওয়াল জামাআ'হ,সাইয়্যেদ সুলাইমান নদভী রাহ.,মাসউদ ইয়াসিন,মিজানুর রহমান,দারুল ইহদা, ,"1st Published,2020", ,বাংলাদেশ,বাংলা
সূরা আসর : সফলতার মাপকাঠি,ডা. ইসরার আহমাদ রাহিমাহুল্লাহ,TK. 120,TK. 90,https://rokomari.com//book/203141/surah-asor---sopolotar-mapkathi,https://ds.rokomari.store/rokomari110/ProductNew20190903/130X186/feaabdc0b_203141.jpg,"ক্ষতি। এই নামটাকে সবাই ভয় পায়। দুনিয়ার কোন মানুষই ক্ষতিগ্রস্ত হতে চায় না। পক্ষান্তরে সফলতা এবং মুক্তি- এই দুটি নামকে আপন করতে চায় না, এমন মানুষ খুঁজে পাওয়া দায়। প্রতিটি মানুষের জীবনভর দৌড়ঝাঁপ থাকে সফলতা আর মুক্তির কামনায়। কিন্তু অধিকাংশ মানুষই জানে না সফলতার মাপকাঠি কী। চিনে না তাদের মুক্তির পথকে। ফলে মুক্তির নেশায় তারা ছুটে চলছে ক্ষতির দিকে। নিশ্চয় সকল মানুষ ক্ষতিগ্রস্ত। তবে.....

তবে কারা ক্ষতিগ্রস্ত নয় এবং সফলতার মাপকাঠি কী, কোন পথে রয়েছে মানবজাতির মুক্তি- অতি জীবনঘনিষ্ট এই প্রশ্নগুলোর উত্তর দিয়েছেন আমাদের রব। সূরা আসরে। আর এই সূরারই তাদাব্বুর এবং তাযাক্কুর হল বক্ষমান বইটি।",সূরা আসর : সফলতার মাপকাঠি,ডা. ইসরার আহমাদ রাহিমাহুল্লাহ,মুহাম্মাদ শাকিল হোসাইন,ইফতেখার সিফাত,দারুল ইহদা, ,"1st Published,2020", ,বাংলাদেশ,বাংলা
