Title,Author,Original Price,Discounted Price,URL,Image,Summary,Book_Title,Book_Author,Translator,Editor,Publisher,ISBN,Edition,Number Of Pages,Country,Language
Good Night: The Sleep Doctor's 4-Week Program to Better Sleep and Better Health,মাইকেল জে ব্রাস,"","TK. 3,506",https://rokomari.com//book/138055/good-night--the-sleep-doctor-s-4-week-program-to-better-sleep-and-better-health,https://ds.rokomari.store/rokomari110/ProductNew20190903/130X186/6078b464c_138055.jpg,"",Good Night: The Sleep Doctor's 4-Week Program to Better Sleep and Better Health,Michael J. Breus, , ,Dutton Adult,9780525949794,"1st Edition,2006",336,India,English
This Is Your Brain on Music: The Science of a Human Obsession,ড্যানিয়েল জে লেভেথিন,"","TK. 5,764",https://rokomari.com//book/134314/this-is-your-brain-on-music--the-science-of-a-human-obsession,https://ds.rokomari.store/rokomari110/ProductNew20190903/130X186/edab40443624_134314.jpg,"",This Is Your Brain on Music: The Science of a Human Obsession,Daniel J. Levitin, , ,Dutton Adult,9780525949695,"1st Edition,2006",320,India,English
Wife Beating: The Silent Crisis ,রোগার ল্যানগ্লে,"","TK. 25,375",https://rokomari.com//book/109469/wife-beating--the-silent-crisis-,https://ds.rokomari.store/rokomari110/ProductNew20190903/130X186/8e1c7c005_109469.jpg,"",Wife Beating: The Silent Crisis ,Roger Langley , , ,Dutton Adult,9780876902318,"1st Edition,1977",242,USA,English
"African Kaiser: General Paul von Lettow-Vorbeck and the Great War in Africa, 1914-1918",রবার্ট গাউডি,"","TK. 2,547",https://rokomari.com//book/154792/african-kaiser--general-paul-von-lettow-vorbeck-and-the-great-war-in-africa--1914-1918,https://ds.rokomari.store/rokomari110/ProductNew20190903/130X186/53ee45477_154792.jpg,"","African Kaiser: General Paul von Lettow-Vorbeck and the Great War in Africa,1914-1918",Robert Gaudi, , ,Dutton Adult,9780425283714,"1st Edition,2017",448,India,English
The Dollhouse: A Novel,ফিওনা ডেভিস,"","TK. 1,404",https://rokomari.com//book/147212/the-dollhouse--a-novel,https://ds.rokomari.store/rokomari110/ProductNew20190903/130X186/78c9c2233_147212.jpg,"",The Dollhouse: A Novel,Fiona Davis, , ,Dutton Adult,9781101984994,"1st Edition,2016",304,India,English
