Title,Author,Original Price,Discounted Price,URL,Image,Summary,Book_Title,Book_Author,Translator,Editor,Publisher,ISBN,Edition,Number Of Pages,Country,Language
"Rebuilt: Awakening the Faithful, Reaching the Lost, and Making Church Matter",মিচেল জে. হোয়াইট,"","TK. 3,278",https://rokomari.com//book/189536/rebuilt--awakening-the-faithful--reaching-the-lost--and-making-church-matter,https://ds.rokomari.store/rokomari110/ProductNew20190903/130X186/c1e83c79e_189536.jpg,"","Rebuilt: Awakening the Faithful,Reaching the Lost,and Making Church Matter",Michael J. White, , ,AVE Maria Press,9781594713866,"12th Edition,2013",320,India,English
In Times of Caregiving: Prayers of Renewal and Restoration,রবার্ট এম হামমা,"","TK. 1,121",https://rokomari.com//book/162004/in-times-of-caregiving--prayers-of-renewal-and-restoration,https://ds.rokomari.store/rokomari110/ProductNew20190903/130X186/da44820e8_162004.jpg,"",In Times of Caregiving: Prayers of Renewal and Restoration,Robert M Hamma, , ,AVE Maria Press,9781594710155,"1st Edition,2004",123,India,English
This Is Our Church: A History of Catholicism ,মাইকেল পিনক  ,"","TK. 4,763",https://rokomari.com//book/164215/this-is-our-church--a-history-of-catholicism,https://ds.rokomari.store/rokomari110/ProductNew20190903/130X186/20c3eaf78_164215.jpg,"",This Is Our Church: A History of Catholicism,Michael Pennock, , ,AVE Maria Press,9781594711695,"2nd Edition,2008",384,India,English
Can you Drink the Cup? ,হেনরি জে. এম. নউইন,"","TK. 1,464",https://rokomari.com//book/86472/can-you-drink-the-cup-,https://ds.rokomari.store/rokomari110/ProductNew20190903/130X186/rokimg_20141105_86472.gif,"",Can you Drink the Cup?,Henri J.M. Nouwen, , ,AVE Maria Press,9781594710995, , ,Abroad,English
Catholic Essentials: An Overview of the Faith,মাইকেল আমোডি,"","TK. 3,208",https://rokomari.com//book/153219/catholic-essentials--an-overview-of-the-faith,https://ds.rokomari.store/rokomari110/ProductNew20190903/130X186/ae23a66aa_153219.jpg,"",Catholic Essentials: An Overview of the Faith,Michael Amodei, , ,AVE Maria Press,9781594711459,"1st Edition,2009",379,India,English
