Title,Author,Original Price,Discounted Price,URL,Image,Summary,Book_Title,Book_Author,Translator,Editor,Publisher,ISBN,Edition,Number Of Pages,Country,Language
The Girl With the Dragon Tattoo ,স্টিগ লারসন,"TK. 1,217","",https://rokomari.com//book/84489/the-girl-with-the-dragon-tattoo,https://ds.rokomari.store/rokomari110/ProductNew20190903/130X186/780566965_84489.jpg,"Summary of the Book

The Girl with the Dragon Tattoo will certainly keep you on your toes and make sure that you won’t be able to put it down until you flip the last page. Harriet Vanger disappeared from a family gathering held on an island forty years ago. Her uncle believes that she was murdered by someone belonging the the Vanger clan.

Mikael Blomkvist a disgraced financial journalist and Lisbeth Salander a tattooed computer hacker are called upon by Harriet’s uncle to solve the case. As they start investigating one thing leads to another until Blomkvist and Salander find themselves in a situation wherein protecting themselves becomes more important.",The Girl With the Dragon Tattoo,Stieg larsson, , ,Quirecuss,9781847245458,"1st Edition,2008",542,India,English
The Girl Who Played With Fire,স্টিগ লারসন,TK. 718,"",https://rokomari.com//book/84491/the-girl-who-played-with-fire,https://ds.rokomari.store/rokomari110/ProductNew20190903/130X186/e92828a5ccd4_84491.jpg,"Summary of the Book

Lisbeth Salander thinks that her life is calmer now. She is developing an interest in maths and has a lusty albeit questionable affair with a student. However when Inspector Bublanski and his team discover the bodies of a couple in Stockholm, the murder weapon points to Lisbeth. The dead worked for none other than Millennium publisher Mikael Blomkvist and he knows that if there's one thing he can't trust the police to do it's finding the elusive Lisbeth Salander. She's an expert at hiding her trail and leaving no cyber footprint. However he needs to find her if he has to unmask the perpetuators of the murders. Murders which point directly at a sex trafficking ring that the Millennium will risk all to unveil.

About Steig Larsson

Karl Stif-Erland ""Steig"" Larsson was a Swedish writer and journalist. He is best remembered as the author of the Millennium Trilogy which begins with The Girl with the Dragon Tattoo and ends with The Girl Who Kicked the Hornets' Nest. The trilogy was published posthumously.

A strong activist, Larsson's work speaks against sexual violence against women. The trilogy was made into hit Swedish films. The first novel was adapted into a hit movie by David Fincher starring Daniel Craig as Mikael Blomkvist and Rooney Mara as Lisbeth Salander. The other movies in the series are due to be released in the short future.",The Girl Who Played With Fire,Stieg larsson, , ,Quirecuss,9781906694180,"1st Edition,2009",608,India,English
The Girl Who Kicked The Hornets Nest ,স্টিগ লারসন,TK. 898,"",https://rokomari.com//book/84490/the-girl-who-kicked-the-hornets-nest,https://ds.rokomari.store/rokomari110/ProductNew20190903/130X186/33d749bcd024_84490.jpg,"Salander is plotting her revenge - against the man who tried to kill her, and against the government institutions that very nearly destroyed her life. But it is not going to be a straightforward campaign. After taking a bullet to the head, Salander is under close supervision in Intensive Care, and is set to face trial for three murders and one attempted murder on her eventual release. With the help of journalist Mikael Blomkvist and his researchers at Millennium magazine, Salander must not only prove her innocence, but identify and denounce the corrupt politicians that have allowed the vulnerable to become victims of abuse and violence. Once a victim herself, Salander is now ready to fight back.

About The Author
Stieg Larsson was the editor-in-chief of the magazine Expo. He was a leading expert on anti-democratic, right-wing extremist organisations. He died in 2004, soon after delivering the text of the novels that make up the Millennium Trilogy. Reg Keeland is the translator of many fine writers from Swedish.",The Girl Who Kicked The Hornets Nest,Stieg larsson, , ,Quirecuss,9781849163439,"1st Edition,2010",602,India,English
