Title,Author,Original Price,Discounted Price,URL,Image,Summary,Book_Title,Book_Author,Translator,Editor,Publisher,ISBN,Edition,Number Of Pages,Country,Language
Arabic Course for English Speaking Students  (3 Vols. Set) ,ড. ভি. আবদুর রহিম ,"TK. 3,240","",https://rokomari.com//book/116577/arabic-course-for-english-speaking-students---3-vols--set-,https://ds.rokomari.store/rokomari110/ProductNew20190903/130X186/df4e808dc_116577.jpg,"",Arabic Course for English Speaking Students  (3 Vols. Set),Dr. V. Abdur Rahim, , ,U.K. Islamic Academy,9781872531687, , ,India,English
Al-Adab Al-Mufrad : A Code For Everyday Living: The Example Of The Early Muslims,ইমাম মুহাম্মদ ইবনে ইসমাইল বোখারী (র),"TK. 1,950","",https://rokomari.com//book/150726/al-adab-al-mufrad---a-code-for-everyday-living--the-example-of-the-early-muslims,https://ds.rokomari.store/rokomari110/ProductNew20190903/130X186/b7f84d9c8_150726.jpg,"",Al-Adab Al-Mufrad : A Code For Everyday Living: The Example Of The Early Muslims,Emam Muhammod Ibne Esmail Bokhari (R), , ,U.K. Islamic Academy,9785640010084,"3rd Edition,2012",274,Saudi Arabia,English
Tahdhib Al-Akhlaq: A Hadith Guide for Personal and Social Conduct ,শায়খ আব্দুল মুহসিন বিন হামাদ আল আবাদ আল বদর,TK. 890,"",https://rokomari.com//book/150985/tahdhib-al-akhlaq--a-hadith-guide-for-personal-and-social-conduct,https://ds.rokomari.store/rokomari110/ProductNew20190903/130X186/3219505ca_150985.jpg,"",Tahdhib Al-Akhlaq: A Hadith Guide for Personal and Social Conduct,Shaykh  Abdul Muhsin Bin Hamad al Abbaad al Badr, , ,U.K. Islamic Academy,9781872531205,"1st Edition,2003",184,Saudi Arabia,English
Stories of the Prophets,সাইয়েদ আবুল হাসান আলী নদভী রহ.,TK. 540,"",https://rokomari.com//book/152398/stories-of-the-prophets,https://ds.rokomari.store/rokomari110/ProductNew20190903/130X186/973cb81c0_152398.jpg,"",Stories of the Prophets,sayed abul hasan ali nadavi Rh.,Iqbal Ahmad Azami, ,U.K. Islamic Academy,9781872531090,"2nd Edition,1994",179,India,English
Al-Adab Al-Mufrad,ইমাম মুহাম্মদ ইবনে ইসমাইল বোখারী (র),"TK. 50,926","",https://rokomari.com//book/152402/al-adab-al-mufrad,https://ds.rokomari.store/rokomari110/ProductNew20190903/130X186/309e7873f_152402.jpg,"",Al-Adab Al-Mufrad,Emam Muhammod Ibne Esmail Bokhari (R), , ,U.K. Islamic Academy,9781872531182,"1st Edition,2006",273,USA,English
Islamic Belief (Al-Aquidah At-Tahawiah),ইকবাল আহমেদ আজমী,"TK. 5,200","",https://rokomari.com//book/152403/islamic-belief--al-aquidah-at-tahawiah-,https://ds.rokomari.store/rokomari110/ProductNew20190903/130X186/f55e05638_152403.jpg,"",Islamic Belief (Al-Aquidah At-Tahawiah),Iqbal Ahmad Azami, , ,U.K. Islamic Academy,9781872531427,"Revised  edition,2002",40,USA,English
Shaikh-ul-Islam Ibn Taimiyah Life and Achievements,সাইয়েদ আবুল হাসান আলী নদভী রহ.,"TK. 1,040","",https://rokomari.com//book/151496/shaikh-ul-islam-ibn-taimiyah-life-and-achievements,https://ds.rokomari.store/rokomari110/ProductNew20190903/130X186/603246e42_151496.jpg,"",Shaikh-ul-Islam Ibn Taimiyah Life and Achievements,sayed abul hasan ali nadavi Rh., , ,U.K. Islamic Academy,9781872531724,"1st Edition,2005",167,Saudi Arabia,English
Muhammad the Last Prophet: A Model for All Time,সাইয়েদ আবুল হাসান আলী নদভী রহ.,TK. 594,"",https://rokomari.com//book/152400/muhammad-the-last-prophet--a-model-for-all-time,https://ds.rokomari.store/rokomari110/ProductNew20190903/130X186/4ea5652ce_152400.jpg,"",Muhammad the Last Prophet: A Model for All Time,sayed abul hasan ali nadavi Rh., , ,U.K. Islamic Academy,9781872531106,"2nd Edition,1993",216,India,English
Islam and the World: The Rise and Decline of the Muslims and Its Effect on Mankind,সাইয়েদ আবুল হাসান আলী নদভী রহ.,TK. 750,"",https://rokomari.com//book/150832/islam-and-the-world--the-rise-and-decline-of-the-muslims-and-its-effect-on-mankind,https://ds.rokomari.store/rokomari110/ProductNew20190903/130X186/2b587b146_150832.jpg,"",Islam and the World: The Rise and Decline of the Muslims and Its Effect on Mankind,sayed abul hasan ali nadavi Rh., , ,U.K. Islamic Academy,9781872531328,"1st Edition,2003",240,Saudi Arabia,English
