Title,Author,Original Price,Discounted Price,URL,Image,Summary,Book_Title,Book_Author,Translator,Editor,Publisher,ISBN,Edition,Number Of Pages,Country,Language
আবার একটা ফুঁ দিয়ে দাও,নির্মলেন্দু গুণ,TK. 160,TK. 96,https://rokomari.com//book/82599/abar-akta-fu-diye-dau,https://ds.rokomari.store/rokomari110/ProductNew20190903/130X186/5812c9312_82599.jpg,"ফ্ল্যাপে লিখা কথা
আমি বিষ খাচ্ছি অনন্ত, আমি বিষ খাচ্ছি । তু্ই একটু অপেক্ষা কর । বাইরে এমন চাঁদ, এমন জ্যোৎস্না, তোর বুঝি ভালো লাগছে না? কী যে ভালো লাগছে আমার! অনন্ত, তুই তার কিছুই জানলি নে, কিচ্ছু জানলি নে। বড় সুখ, বড় ব্যথা। আচ্ছা, তুই যে ফিরতে বলিস্ কোথা যাবি? ঘর কোথা? কোথা পাবি এরকম পল্লবিত বিষের ভান্ডার? কোথাও পাবি না। চলে যাস্ নে অনন্ত, শোন্, এই দ্যাখ আর মাত্র একটি গেলাস… আর মাত্র একটি চুমুক। এ-চুমুকে নেশা হবে, তারপর, তারপর, তারপর আমরা দু’জনে মিলে ফিরে যাবো। সত্যি ফিরে যাবো। ঘরে বুঝি খুব শান্তি? খুব ভালোবাসা? সেই ভালো, একটু তাড়াতাড়ি পা চালা অনন্ত; একটু তাড়াতাড়ি  চল …। 

সূচিপত্র
আমি বিষ খাচ্ছি অনন্ত (আমি বিষ খাচ্ছি অনন্ত)০৭ 
খেলা (ধর্ম ও দেবীর মতো তুমি আসো, তুমি যাও)০৮
তোমার উড়াল (তোমাকে একটি পাখির উড়ে যাবার সঙ্গে)০৯
চাই জলপথে (স্থলপথে চাই না তোমাকে, চাই জলপথে)১০ 
ছলনা (হঠাৎ যদি হারিয়ে যাই)১১
গ্রহণ (ঘরের দেয়াল জুড়ে ছায়া ফেলে চাঁদের গ্রহণ)১২
অথচ কাঁটি না (গাছের নিষ্পত্র শাখা কেঁপে ওঠে জানি)১৩
রাতের উৎসব (জ্বালাও ধুম্রশিখা, এই অপাপবিদ্ধ রাতে)১৪
এই চৈত্রে তোমাকে ভুলিব (একন আকাশ জুড়ে একদল)১৫
ভালোবাসার পথ (ঐ রাস্তাটা খুব কি বড়ো)১৬ 
আমার অন্বিষ্ট প্রেম (একটি নতুন খেলা শিখে গেছি)১৭
তিতিক্ষা (অনন্তে অনীহা নেই, তবু এক ক্লান্তি ঘিরে রাখে)১৮
আবার একটা ফুঁ দিয়ে দাও(আবার একটা ফুঁ দিয়ে দাও)১৯
সময় (ফেলে আসা এমনি কোনো দিনে)২০
ভালোবাসা, ঘুমন্ত পাথর (যদি বিরহকে সত্য বলে মানি)২১
প্রতারণা (পা দুটো পদ্মের স্মৃদি, তা না হরে ময়ূর বলতাম)২২
এপিটাফ (করতলভরা এ্ই ম্লান রেখাগুলো তোমাদের জন্য)২৩
অভিমান (এত যে তুই মূল্য দাবি করিস)২৪
ভেনাস (মেয়েটি হেঁটে যাচ্ছে)২৫
একটি প্রেমের গল্প (ওরা দীর্ঘদিন আসতো দু’জনে মিলে)২৬
ফেরানো যায় নি (যায়া থাকলে ফেরানো যায়)২৭
তোমার দুটো অমৃতফল (আমি তো গেছিই, তুমিও যাবে)২৮
বদলে যাচ্ছি (আমি এখন অন্যরকম, আস্তে আস্তে বদলে যাচ্ছি)২৯
হাঁটছে স্বভাব (হাঁটছি কোথায়? কে বলেছে আমরা হাঁটছি?)৩১
মাকড়সা (আগুন জ্বালাতে চাই, অগ্নি নিভে যায়)৩২
পদ্ম-মৃত্যু (পদ্ম-ফোটানোর জন্য একটা পুকুর কেটেছিলাম)৩৩
শব্দ (শব্দ এখন হাঁটতে পারে, পথের মধ্যে রুখে দাঁড়ায়)৩৪
চন্দ্রাহত (একটু পরেই ভেঙে যাবে চাঁদ)৩৫
কবি (জল জমতে জমতে হবে জলাশয়)৩৬
বাংলাদেশ বিমান (‘আপনাদের মনোযোগ আকর্ষণ করছি’)৩৭
যদি পাই তিনটি পাথর (যদি পাই এটি পাথর কোনোদিন)৩৮
একজন স্তাবকের অপেক্ষায় (জন্মের সময় ঈশ্বরের সঙ্গে আমার)৩৯
দৃষ্টিগ্রাহ্য কছুই চাই না (আমিই তখন ভুল করেছি, ভুল বলেছি) ৪০
অক্ষমতা (কাগজ কলমের যুগল উপহাসের মেধ্য আমার কবিতাগুলো)৪১
ক্ষতির সুন্দর ঘ্রাণ (পকেট থেকে টাকা হারালে)৪২
আবেগ সংক্রান্ত কবিতা (আবেগকে বলি:সংযত থাক)৪৩
প্রতিদ্বন্দ্বী (তুমি জানারার পর্দা তুলে দিলে, সকালের আলো)৪৪
সাহস থেকে প্রেম (আমার শুধু ইচ্ছে করে সঙ্গে বসে থাকি।)৪৫
পাখা চাই (শরীর খুলবে কী করে, পাখা চাই।)৪৬
জানে মৌন মহাকাল (এই বৃষ্টি আমাকে দেবে না জলধারা) ৪৭
তোমার নাম লিখতে লিখাতে (এ পর্যন্ত তেত্রিশ কোটি বার)৪৮
কোন কাব্যে রাখি নি তোমাকে (দাঁড়ি, কমা, কোলনের মতো মিশে)৪৯
এককালীন কবি বন্ধুদের প্রতি (পেরিয়ে এসছি ক্রমে কবিতার)৫০
পুরোহিত (মাথার উপরে কালোচুলে কিছু লাল ফুল, কিছু দুর্বা)৫১
একটি কবিতা লেখা হবে (তোমার অবহেলা নিয়ে একটি কবিতা)৫২
আলো হাওয়ার রাজ্যে (আরো একটি জানালা খুলে দিতে মন চায়)৫৩
নিজের মুখে চুমু (কী ব্যাকুল আহ্বান ছিল, মনে পড়ে?)৫৪
অচেনা পাখির জন্য (বাড়ির পেছনের পুকুরে দুপুরের স্নান করতে)৫৫
না বলে যাবো না (না বলে যাবো না, মেঘ যেরকম আকাশকে)৫৬
এখনো (আমাদের একটি চুম্বন এখনো রাত্রির বুকে)৫৭
ঘাসের ঘটনা (রাতের আঁধার এস আমাদের প্রথিবীকে ঢেকে)৫৮
ঝিনুক (বড় হলে আর কী করতে হয়?)৫৯
তোমাতে আর আবদ্ধ নেই (তোমাতে আর আবদ্ধ নেই)৬০
বোষ্টমী (এত সাজানো গোছানো কেন, চলে যাবে না তো?)৬১
সেই আঁধারে (আলোটা নিভিয়ে দাও, তোমাকে পরান ভরে দেখি।)৬৩
রবিবার (আমাদের গভীর নদীতে হঠাৎ ভাসিয়ে দিয়ে গেলো)৬৪
হঠাৎ ঢাকার কথা (হৃদয় দিয়ে হৃদয় করে হৃদয়ে ভরে রাখা)৬৫
ময়মনসিংহ জং (‘তুমি কি যাবে না? তুমি কি যাবে না’?)৬৬
ঘরের বর্ণনা (মাঝখানে দুই ভাগ করে দুটো দুটো চারটে জানালা)৬৭
ছিন্নপত্র (১-৫) ৬৮
সমর্পণ (ছিলাম বনের পাখি হয়েছি খাঁচায় বাঁধা টিয়ে)৭১",আবার একটা ফুঁ দিয়ে দাও,নির্মলেন্দু গুণ, , ,প্রিয়মুখ,9879849025030,"2nd Published,2017",71,বাংলাদেশ,বাংলা
বডি বিল্ডিং : বাইসেপ এক্সটেনশন,ওস্তাদ দিলদার হাসান দিলু,TK. 180,TK. 108,https://rokomari.com//book/83284/body-building---bicep-extension,https://ds.rokomari.store/rokomari110/ProductNew20190903/130X186/80ac860ae_83284.jpg,"মানব জীবনে সুস্বাস্থ্য একটি গুরুত্বপূর্ন অধ্যায় যা ব্যতিত মানব জীবন অসস্পূর্ন। আমাদের সকলেরই উচিত সুস্বাস্থ্য রাক্ষা করার জন্য সুচিকিৎসার পাশাপাশি চিকিৎসা বিজ্ঞানের সহায়ক কিছু প্রয়োজনীয় পদ্ধতি গ্রহন করা। কোন পদ্ধতি সঠিক তা কিন্তু আমরা জানিনা। যদি সঠিক পদ্ধতি জানতে পারি তাহলে কাঙ্খিত সাফল্যে পৌঁছতে পারবো। প্রাচীন কাল থেকেই মানুষ সুস্থ্য ও সুন্দর শরীর গঠনে বিভিন্ন পদ্ধতি আবিস্কার করে আসছে এবং ক্রমেই তা বিভিন্ন গবেষনার ফলে আধুনিকতর হয়েছে এবং হচ্ছে। বিভিন্ন ইনষ্ট্রুমেন্ট এর সাহায্যে বিজ্ঞান সম্মত শরীর চর্চা আজ সমধিক পরিচিত ও জনপ্রিয়। আমি একজন বডি বিল্ডিং প্রশিক্ষক, সুদীর্ঘ ২৬ বৎসর যাবৎ এই বিষয় নিয়ে গবেষনা করছি। বাংলাদেশে এর প্রচার ও প্রসার ঘটুক এর সুফল দেশের আবাল, বৃদ্ধ, বণিতা, উপভোগ করুক এই চিন্তা থেকেই বইটি লেখা। আমাদের দেশে বাংলায় বডিবিল্ডিং এর ইতিহাস, ঐতিহ্য, প্রয়োজনীয়তা, উপকারীতা ইত্যাদি নিয়ে পূর্নাঙ্গ কোন বই প্রকাশ হয়নি। আমি বহু দিন ধরে বডিবিল্ডিং বা ফিটনেসের উপর বাংলা দেশের বিভিন্ন জাতীয় দৈনিক পত্রিকায় ফিচার ও কলাম লিখেছি, যাতে এর উপকারীতা ফিটনেস শিক্ষার্থীরা জানতে পারে। এটিই ফিটনেস বা বডি বিল্ডিং এর উপর দেখে সরাসরি একমাত্র পুস্তক।",বডি বিল্ডিং : বাইসেপ এক্সটেনশন,ওস্তাদ দিলদার হাসান দিলু, , ,প্রিয়মুখ,9789849045419,"1st Published,2014",112,বাংলাদেশ,বাংলা
বিষন্ন জলের কারিকা,কাজী লাবণ্য,TK. 110,TK. 66,https://rokomari.com//book/127813/bishonno-joler-karika,https://ds.rokomari.store/rokomari110/ProductNew20190903/130X186/01bc06ac8b94_127813.jpg,"",বিষন্ন জলের কারিকা,কাজী লাবণ্য, , ,প্রিয়মুখ,9789849239505,"1st Published,2017",56,বাংলাদেশ,বাংলা
স্টোরি অব দ্য থার্ড জেন্ডার,ফারহানা হোসেন,TK. 135,TK. 81,https://rokomari.com//book/112065/story-of-the-third-gender,https://ds.rokomari.store/rokomari110/ProductNew20190903/130X186/5a2c7e33e784_112065.gif,"",স্টোরি অব দ্য থার্ড জেন্ডার,ফারহানা হোসেন, , ,প্রিয়মুখ,9789849199960,"1st Published,2016",64,বাংলাদেশ,বাংলা
চন্দ্রগ্রহণ,রাজীব হোসাইন সরকার,TK. 200,TK. 120,https://rokomari.com//book/178384/chondrogrohon,https://ds.rokomari.store/rokomari110/ProductNew20190903/130X186/64359ee49_178384.jpg,"",চন্দ্রগ্রহণ,রাজীব হোসাইন সরকার, , ,প্রিয়মুখ,9879848078082,"1st Published,2019",94,বাংলাদেশ,বাংলা
গাধা কম ছাগল বেশি,আহসান কবির,TK. 160,TK. 96,https://rokomari.com//book/94346/gadha-kom-chagol-beshi,https://ds.rokomari.store/rokomari110/ProductNew20190903/130X186/rokimg_20150207_94346.gif,"",গাধা কম ছাগল বেশি,আহসান কবির, , ,প্রিয়মুখ,9789849139058,"1st,2015",76,বাংলাদেশ,বাংলা
প্রেম মেলে না,শামা কবীর,TK. 200,TK. 120,https://rokomari.com//book/196158/prem-mele-na,https://ds.rokomari.store/rokomari110/ProductNew20190903/130X186/4c175cd28_196158.jpg,"এ গল্প শায়না, সাগর, ইমরান, অয়ন, তৌহিদ, নাজিয়া, লীনা, নিলয়, সীমান্ত এবং আরাে অনেকের। নব্বই দশকের বিশ্ববিদ্যালয়ে পড়ুয়া কয়েকজন তরুণ-তরুণীর চাওয়া, না-চাওয়া, পাওয়া, না-পাওয়া, প্রেম- অপ্রেম, মিলন-বিরহ, আনন্দ-দুঃখ নিয়ে আবর্তিত এই উপন্যাসের কাহিনি। ওদের মধ্যে কেউ কেউ জানে না তারা কী চায়, কেউ হয়তাে খুব তীব্রভাবে জানে সে কী চায়, কিন্তু পাওয়ার কোনাে উপায় নেই। কারাে কাছে প্রেমের চেয়ে বন্ধুত্ব বড়, কেউ ভালােবাসা চায়, কিন্তু তা পাওয়া যাবে না বলে বন্ধুত্বই ভরসা। প্রেম-ভালােবাসা কি অধরা হয়েই রইল এদের জীবনে? নাকি, কেউ কেউ পেয়েছে সেই সুখের সন্ধান?",প্রেম মেলে না,শামা কবীর, , ,প্রিয়মুখ,9789848078419,"1st Published,2020",96,বাংলাদেশ,বাংলা
ঠিকানা রাত্রিপুর,লুৎফর হাসান,TK. 160,TK. 96,https://rokomari.com//book/93299/thikana-ratripur,https://ds.rokomari.store/rokomari110/ProductNew20190903/130X186/rokimg_20150202_93299.gif,"",ঠিকানা রাত্রিপুর,লুৎফর হাসান, , ,প্রিয়মুখ, , , ,বাংলাদেশ,বাংলা
প্রোডাক্টিভ হ্যাপিনেস উইথ ইসলাম,জোবায়ের রুবেল,TK. 560,TK. 364,https://rokomari.com//book/209211/productive-happiness-with-islam,https://ds.rokomari.store/rokomari110/ProductNew20190903/130X186/664f1a8d6_209211.jpg,"বই থেকে যে ১০টি বিষয় শিখবেন?
১. বরকতময় জীবনযাপনের সহজ কৌশল 
২. ইসলাম ভিত্তিক জীবনের উদ্দেশ্য নির্ধারণ 
৩. সুখী পরিবার ও ক্যারিয়ারের সন্ধান 
৪. দুনিয়া ও আখেরাতে মহাকল্যনময় সাফল্য : আত্মসন্তুষ্টি, কনফিডেন্ট, মানসিক শান্তি ও সচেতনতা বৃদ্ধি 
৫. মেডিটেশন এবং প্রজ্ঞা 
৬. মানসিক চাপ, ভয় ও উদ্বেগ দূর করার উপায় 
৭. মানসিক চাপমুক্ত জীবন যা দীর্ঘস্থায়ী অসুস্থতা দূর করতে পারে 
৮. আনন্দ, প্রশান্তি ও পরিপূর্ণতা অর্জন 
৯. মানসিক স্বচ্ছতা, আবেগের ভারসাম্য এবং প্রোডাক্টিভিটি বৃদ্ধি
 ১০. নিজের সাথে এবং অন্যের সাথে সম্পর্ক উন্নয়ন",প্রোডাক্টিভ হ্যাপিনেস উইথ ইসলাম,জোবায়ের রুবেল, , ,প্রিয়মুখ, ,"1st Published,2021",304,বাংলাদেশ,বাংলা
পরনর,তানভীর তারেক,TK. 200,TK. 120,https://rokomari.com//book/93296/poronor,https://ds.rokomari.store/rokomari110/ProductNew20190903/130X186/rokimg_20150211_93296.gif,"",পরনর,তানভীর তারেক, , ,প্রিয়মুখ,9789849139034,"1st,2015",92,বাংলাদেশ,বাংলা
দ্য মিরাকল মর্নিং,হ্যাল এলরড,TK. 300,TK. 180,https://rokomari.com//book/206545/the-miracle-morning,https://ds.rokomari.store/rokomari110/ProductNew20190903/130X186/658667efd_206545.jpg,"আপনি কি প্রস্তুত জীবনকে পরের ধাপে উন্নীত করার জন্য? 
আপনার ব্যক্তিগত কিংবা পেশাগত জীবনের পরবর্তী ধাপ কোনটা? জীবনের ঠিক কোন পরিবর্তন আনলে আপনি সেই ধাপে উন্নীত হবেন? মাত্র ৩০ দিনে কাক্সিক্ষত দৃশ্যমান পরিবর্তন আনার সুযোগ নিজেকে উপহার দিন। এক দিন এক দিন করে শুরু করুন। আপনার অতীত যা-ই হোক না কেন, আপনি আপনার ভবিষ্যতে পরিবর্তন আনতে পারবেন বর্তমানকে পরিবর্তন করার মাধ্যমে। 
বর্তমানে আপনি আপনার অতীতের কর্মফলের প্রতিচ্ছবি। ঠিক তেমনি আপনার ভবিষ্যৎ সম্পূর্ণরূপে নির্ভর করছে আপনি কী হতে চান সে ব্যাপারে এই মুহূর্তের সিদ্ধান্তের ওপর।
এই মুহূর্তটা আপনার। পরবর্তী দিনের সুখ, স্বাস্থ্য, সম্পদ, সাফল্য, ভালোবাসা - যা আপনার প্রাপ্য তা থেকে নিজেকে বঞ্চিত করবেন না। অপেক্ষা করবেন না, শুরু করুন। কালই। আগামীকালই হোক সেই স্মরণীয় দিন - যেদিন আপনি এতদিনের কাঙ্ক্ষিত সাফল্য লাভের যাত্রা শুরু করবেন।",দ্য মিরাকল মর্নিং,হ্যাল এলরড,রাওয়াইফ জানান, ,প্রিয়মুখ,9789848078365,"1st Published,2020",174,বাংলাদেশ,বাংলা
ফিরে আসা,সাকিব রায়হান,TK. 150,TK. 90,https://rokomari.com//book/112074/firee-asa,https://ds.rokomari.store/rokomari110/ProductNew20190903/130X186/96a59dd3eb14_112074.gif,"""ফিরে আসা"" বইয়ের ফ্ল্যাপের লেখা:

জীবন চলতে থাকে। কখনাে নদীর মতাে বহমান, কখনাে পাহাড়ের আঁকাবাকা বন্ধুর পথের মতাে। আমাদের ঘটনাপ্রবাহে থাকে উদ্ভাসিত আলাে, আবার রাতের নীরব কান্নার মতাে অন্ধকার। ছােটবেলায় পিতৃহারা সাফওয়ান বড় হতে থাকে। লুকিয়ে রাখা হাজারাে অনুভুতির মাঝে। সমাজের প্রতিকূলতা, নিজের সাথে নিজের যুদ্ধে যেন আর পেরে উঠে না। বাস্তবতার কঠিন আবর্তে একসময় নিজেকে আবিষ্কার করে অন্ধকার পথে; যেখানে আবেগ মলিন, ভালােবাসা ধূসর। সৎ এবং মেধাবী বাবার ফেলে আসা পথে হাঁটার শক্তি হারিয়ে ফেলে অসহায় আত্মসমর্পণ করবে নাকি। কোন এক নতুন চেতনায় সাফওয়ান নিজের পথ চিনে নেবে?",ফিরে আসা,সাকিব রায়হান, , ,প্রিয়মুখ,9789849199985,"1st Published,2016",80,বাংলাদেশ,বাংলা
