Title,Author,Original Price,Discounted Price,URL,Image,Summary,Book_Title,Book_Author,Translator,Editor,Publisher,ISBN,Edition,Number Of Pages,Country,Language
Brand Management 101: 101 Lessons From Real World Marketing ,মৈনাক ধর,TK. 772,"",https://rokomari.com//book/100181/brand-management-101--101-lessons-from-real-world-marketing,https://ds.rokomari.store/rokomari110/ProductNew20190903/130X186/rokimg_20150620_100181.gif,"Brand Management 101 offers 101 lessons into the real world application of marketing principles. Broadly structured around the Ps of marketing, it offers provocative insights into how marketing challenges can be dealt with in the marketplace.",Brand Management 101: 101 Lessons From Real World Marketing,Mainak Dhar, , ,Wiley India Pvt. Ltd,9788126513185,"1st Edition,2007",224,India,English
Common Stocks And Uncommon Profits And Other Writings (Paperback),ফিলিপ এ ফিশার,"TK. 1,170","",https://rokomari.com//book/118476/common-stocks-and-uncommon-profits-and-other-writings--paperback-,https://ds.rokomari.store/rokomari110/ProductNew20190903/130X186/026b65dcb_118476.jpg,"",Common Stocks And Uncommon Profits And Other Writings (Paperback),Philip A. Fisher, , ,Wiley India Pvt. Ltd,9788126528615,2010,320,India,English
Statistical Procedures for Agricultural Research,কাঞ্চাই এ গোমেজ,"TK. 4,491","",https://rokomari.com//book/154152/statistical-procedures-for-agricultural-research,https://ds.rokomari.store/rokomari110/ProductNew20190903/130X186/d66c27a2a_154152.jpg,"",Statistical Procedures for Agricultural Research,"Kwanchai A. Gomez,Arturo A. Gomez", , ,Wiley India Pvt. Ltd,9788126523795,"2nd Edition,2009",696,India,English
Analytical Chemistry,"খ্রিটিয়ান, গেরী ডি","TK. 1,375","",https://rokomari.com//book/54491/analytical-chemistry,https://ds.rokomari.store/rokomari110/ProductNew20190903/130X186/rokimg_2111_54491.GIF,"",Analytical Chemistry,"Christian,Gary D", , ,Wiley India Pvt. Ltd,9788126511136, ,856,India,English
Project Management Case Studies ,হ্যারন্ড কের্জনার,"TK. 9,799","",https://rokomari.com//book/54607/project-management-case-studies,https://ds.rokomari.store/rokomari110/ProductNew20190903/130X186/imgrok_54607.gif,"Book Summary of Project Management Case Studies,Second Edition
The revised edition of the single-best source of project management case studies 
Project Management Case Studies, Second Edition presents the most comprehensive collection of project management case studies available today. Compiled by Harold Kerzner, the leading authority on project management, it offers more than ninety case studies that illustrate both successful implementation of project management by actual companies and pitfalls to avoid in a variety of real-world situations. 
Now with twenty-five new case studies, this new edition: 
* Represents a wide range of industries, including medical and pharmaceutical, aerospace, manufacturing, automotive, finance and banking, and telecommunications
* Covers cutting-edge areas of construction and international project management
* Presents best practices and pitfalls of project management implementation in the real world
* Follows and supports preparation for the Project Management Professional (PMP(r)) Certification Exam 
Whether used with the latest edition of Harold Kerzner's landmark reference, Project Management: A Systems Approach to Planning, Scheduling, and Controlling, or on its own, Project Management Case Studies, Second Edition is a valuable resource for students, as well as practicing engineers and managers. 
Other powerful tools by Harold Kerzner: 
Project Management: A Systems Approach to Planning, Scheduling, and Controlling, Ninth Edition (0-471-74187-6) 
Project Management Workbook and PMP(r)/CAPM(r) Exam Study Guide, Ninth Edition (0-471-76076-5)",Project Management Case Studies,Harold Kerzner, , ,Wiley India Pvt. Ltd,9780470278710,"3rd Edition,2009",696,India,English
Introductory Nuclear Physics,কানেথ ক্রান ,"TK. 2,152","",https://rokomari.com//book/124015/introductory-nuclear-physics,https://ds.rokomari.store/rokomari110/ProductNew20190903/130X186/56f7776b2b64_124015.jpg,"",Introductory Nuclear Physics,Kenneth Krane, , ,Wiley India Pvt. Ltd,9788126517855,"1st Edition,2008", ,India,English
Introduction to Medicinal Chemistry: How Drugs Act and Why,আলেক্স গ্রিংউজ,"TK. 2,331","",https://rokomari.com//book/165043/introduction-to-medicinal-chemistry--how-drugs-act-and-why,https://ds.rokomari.store/rokomari110/ProductNew20190903/130X186/bd3502bb0_165043.jpg,"",Introduction to Medicinal Chemistry: How Drugs Act and Why,Alex Gringauz, , ,Wiley India Pvt. Ltd,9788126528561,"1st Edition,2011",736,India,English
Commercial Banking: The Management of Risk ,বেন্‌টন ই. গুপ,"TK. 1,330","",https://rokomari.com//book/54602/commercial-banking--the-management-of-risk,https://ds.rokomari.store/rokomari110/ProductNew20190903/130X186/rokimg_2111_54602.GIF,"",Commercial Banking: The Management of Risk,Benton E. Gup, , ,Wiley India Pvt. Ltd,9788126510443,"3rd Edition,2006",584,India,English
Antennas and Propagation for wireless Communication Systems ,সায়মন আর. সান্ডারস্‌,"TK. 1,456","",https://rokomari.com//book/54572/antennas-and-propagation-for-wireless-communication-systems,https://ds.rokomari.store/rokomari110/ProductNew20190903/130X186/rokimg_2111_54572.GIF,"Book Summary of Antennas and Propagation for Wireless Communication Systems
Antennas and propagation are the key factors influencing the robustness and quality of the wireless communication channel. This book introduces the basic concepts and specific applications of antennas and propagation to wireless systems, covering terrestrial and satellite radio systems in both mobile and fixed contexts. It is a vital source of information for wireless communication engineers as well as for students at postgraduate or senior undergraduate levels. 


Table of contents : 
Preface to the First Edition
Preface to the Second Edition
• Introduction: The Wireless Communication Channel
• Properties of Electromagnetic Waves 
• Propagation Mechanisms
• Antenna Fundamentals
• Basic Propagation Models
• Terrestrial Fixed Links
• Satellite Fixed Links
• Macrocells
• Shadowing
• Narrowband Fast Fading
• Wideband Fast Fading
• Microcells
• Picocells
• Megacells 
• Antennas for Mobile Systems
• Overcoming Narrowband Fading via Diversity
• Overcoming Wideband Fading
• Adaptive Antennas
• Channel Measurements for Mobile Systems
• Future Developments in the Wireless Communication Channel
Appendix A Statistics, Probability and Stochastic Processes
Appendix B Tables and Data
Index",Antennas and Propagation for wireless Communication Systems,Simon R. Saunders, , ,Wiley India Pvt. Ltd,9788126518333,"2nd Edition,2008",546,India,English
Death By Meeting ,প্যাট্রিক লিঞ্চিওনি,TK. 898,"",https://rokomari.com//book/113707/death-by-meeting,https://ds.rokomari.store/rokomari110/ProductNew20190903/130X186/aee7c78e4894_113707.gif,"",Death By Meeting,Patrick Lencioni, , ,Wiley India Pvt. Ltd,9788126506767,1st Edition,260,India,English
Linux Command Line and Shell Scripting Bible,রিচার্ড ব্লাম্ববের্গ,"TK. 6,300","",https://rokomari.com//book/123332/linux-command-line-and-shell-scripting-bible,https://ds.rokomari.store/rokomari110/ProductNew20190903/130X186/e441ca4de2c4_123332.jpg,"",Linux Command Line and Shell Scripting Bible,"Richard Blumberg,Christine Bresnahan", , ,Wiley India Pvt. Ltd,9788126554980,"3rd Edition,2015", ,India,English
Radiation Detection And Measurement,গ্লেন এফ. নল,"TK. 2,698","",https://rokomari.com//book/176655/radiation-detection-and-measurement,https://ds.rokomari.store/rokomari110/ProductNew20190903/130X186/e8b242d9b_176655.jpg,"",Radiation Detection And Measurement,Glenn F. Knoll, , ,Wiley India Pvt. Ltd,9788126567720,"Reprinted,2017",830,India,English
Operating System Concepts,পিটার বর গলভিন,"TK. 1,170","",https://rokomari.com//book/172842/operating-system-concepts,https://ds.rokomari.store/rokomari110/ProductNew20190903/130X186/ef907dc3d_172842.jpg,"",Operating System Concepts,"Peter Baer Galvin,Abraham Silberschatz", , ,Wiley India Pvt. Ltd,9788126520510,"8th Edition,2009",992,India,English
Textbook of Polymer Science,ফ্রেড ডব্লিউ. বিলমেয়ার,"TK. 1,055","",https://rokomari.com//book/54490/textbook-of-polymer-science,https://ds.rokomari.store/rokomari110/ProductNew20190903/130X186/rokimg_2111_54490.GIF,"",Textbook of Polymer Science,Fred W. Billmeyer, , ,Wiley India Pvt. Ltd,9788126511105, ,600,India,English
Business Data Communications And Networking  ,জেরী ফিটজেরান্ড,TK. 935,"",https://rokomari.com//book/54557/business-data-communications-and-networking,https://ds.rokomari.store/rokomari110/ProductNew20190903/130X186/rokimg_2111_54557.GIF,"",Business Data Communications And Networking,Jerry Fitzgerald, , ,Wiley India Pvt. Ltd,9788126513406,"8th Edition,2007",560,India,English
Foundations for Microwave Engineering ,রবার্ট ই. কলিন্স,"TK. 1,620","",https://rokomari.com//book/54563/foundations-for-microwave-engineering,https://ds.rokomari.store/rokomari110/ProductNew20190903/130X186/rokimg_2111_54563.GIF,"Book Summary of Foundations for Microwave Engineering, (Wiley-Asia Edition) (IEEE Press Series on Electromagnetic Wave Theory)
FOUNDATIONS FOR MICROWAVE ENGINEERING, Second Edition, covers the major topics of microwave engineering. Its presentation defines the accepted standard for both advanced undergraduate and graduate level courses on microwave engineering. An essential reference book for the practicing microwave engineer, it features:
•	Planar transmission lines, as well as an appendix that describes in detail conformal mapping methods for their analysis and attenuation characteristics
•	Small aperture coupling and its application in practical components such as directional couplers and cavity coupling
•	Printed circuit components with an emphasis on techniques such as even and odd mode analysis and the use of symmetry properties
•	Microwave linear amplifier and oscillator design using solid-state circuits such as varactor devices and transistors
FOUNDATIONS FOR MICROWAVE ENGINEERING, Second Edition, has extensive coverage of transmission lines, waveguides, microwave circuit theory, impedance matching and cavity resonators. It devotes an entire chapter to fundamental microwave tubes, in addition to chapters on periodic structures, microwave filters, small signal solid-state microwave amplifier and oscillator design, and negative resistance devices and circuits. Completely updated in 1992, it is being reissued by the IEEE Press in response to requests from our many members, who found it an invaluable textbook and an enduring reference for practicing microwave engineers.

Sponsored by:
IEEE Antennas and Propagation Society, IEEE Microwave Theory and Techniques Society
An Instructor's Manual presenting detailed solutions to all the problems in the book is available upon request from the Wiley Makerting Department.",Foundations for Microwave Engineering,Robert E. Collin, , ,Wiley India Pvt. Ltd,9788126515288,"2nd Edition,2007",944,India,English
Analysis and Design of Analog Integrated Circuits ,গ্রে,"TK. 1,025","",https://rokomari.com//book/54566/analysis-and-design-of-analog-integrated-circuits,https://ds.rokomari.store/rokomari110/ProductNew20190903/130X186/rokimg_2110_54566.GIF,"Book Summary of Analysis and Design of Analog Integrated Circuits
The text provides a comprehensive treatment of analog integrated circuit analysis and design starting from the basics and through current industrial practices. The authors combine bipolar, CMOS and BiCMOS analog integrated-circuit design into a unified treatment that stresses their commonalities and highlights their differences. The book provides the reader with valuable insights into the relative strengths and weaknesses of these important technologies.

Table of Contents

•	Models For Integrated-Circuit Active Devices
•	Bipolar, MOS, And Bicmos Integrated-Circuit Technology
•	Single-Transistor And Multiple-Transistor Amplifiers
•	Current Mirrors, Active Loads, And References
•	Output Stages
•	Operational Amplifiers With Single-Ended Outputs
•	Frequency Response Of Integrated Circuits
•	Feedback
•	Frequency Response And Stability Of Feedback Amplifiers
•	Nonlinear Analog Circuits
•	Noise In Integrated Circuits
•	Fully Differential Operational Amplifiers
•	Index",Analysis and Design of Analog Integrated Circuits,Gray, , ,Wiley India Pvt. Ltd,9788126515691,"4th Edition,2008",896,India,English
Digital Telephony ,জন সি. বেলামী,"TK. 1,080","",https://rokomari.com//book/54571/digital-telephony,https://ds.rokomari.store/rokomari110/ProductNew20190903/130X186/rokimg_2111_54571.GIF,"Book Summary of Digital Telephony
From the reviews of the Second Edition . ""The book stresses how systems operate and the rationale behind their design, rather than presenting rigorous analytical formulations . [It provides] the practicality and breadth essential to mastering the concepts of modern communications systems."" -Telecommunication Journal In this expanded new edition of his bestselling book, telephony expert John Bellamy continues to provide telecommunications engineers with practical, comprehensive coverage of all aspects of digital telephone systems, while addressing the rapid changes the field has seen in recent years. Bellamy discusses the near-complete conversion to digital technology in telephone networks worldwide, examines both existing and emerging technologies, and explores the intricacies of carrying voice over data networks as well as the use of telephone networks for carrying data for Internet access. He emphasizes system design, implementation, and application, but also correlates the practice to communications theory. With 30 percent new material, Digital Telephony, Third Edition features:
* Clear explanations on how to overcome problems associated with the replacement of old analog technology with new digital technology
* A new chapter on digital mobile telephone technology
* New material on how, data networks support voice communication
* A new chapter on digital subscriber access technologies
* More than 300 graphs illustrating concepts
* Examples from the U.S. network as well as ITU public telephone networks
*An Instructor's Manual presenting detailed solutions to all the problems in the book is available from the Wiley editorial department.",Digital Telephony,John C. Bellamy, , ,Wiley India Pvt. Ltd,9788126509294,"3rd Edition,2010",672,India,English
Remote Sensing and Image Interpretation ,থমাস এম. লিলেসান্ড ,"TK. 1,798","",https://rokomari.com//book/54573/remote-sensing-and-image-interpretation,https://ds.rokomari.store/rokomari110/ProductNew20190903/130X186/rokimg_2111_54573.GIF,"",Remote Sensing and Image Interpretation,Thomas M. Lillesand, , ,Wiley India Pvt. Ltd,9788126513352,"5th Edition,2007",820,India,English
Introduction to Electric Circuits ,রিচেন্ড সি. ডর্ফ,"TK. 1,170","",https://rokomari.com//book/54575/introduction-to-electric-circuits,https://ds.rokomari.store/rokomari110/ProductNew20190903/130X186/rokimg_2111_54575.gif,"Book Summary of Introduction to Electric Circuits
Praised for its highly accessible, real-world approach, the 6th Edition demonstrates how the analysis and design of electric circuits are inseparably intertwined with the ability of the engineer to design complex electronic, communication, computer, and control systems as well as consumer products. The book offers numerous design problems and MATLAB examples, and focuses on the circuits that we encounter everyday.",Introduction to Electric Circuits,Richard C. Dorf, , ,Wiley India Pvt. Ltd,9788126508174,"6th Edition,2010",836,India,English
Statistical Digital Signal Processing and Modeling ,জিম হেইস ,TK. 970,"",https://rokomari.com//book/54576/statistical-digital-signal-processing-and-modeling,https://ds.rokomari.store/rokomari110/ProductNew20190903/130X186/rokimg_2111_54576.gif,"",Statistical Digital Signal Processing and Modeling,Jim Hayes, , ,Wiley India Pvt. Ltd,9788126516100,"1st Edition,2008",624,India,English
The Leadership Challenge: How to Make Extraordinary Things Happen in Organizations,জেমস এম. কৌজেস,"TK. 1,078","",https://rokomari.com//book/149594/the-leadership-challenge--how-to-make-extraordinary-things-happen-in-organizations,https://ds.rokomari.store/rokomari110/ProductNew20190903/130X186/5fda15985_149594.jpg,"",The Leadership Challenge: How to Make Extraordinary Things Happen in Organizations,James M. Kouzes, , ,Wiley India Pvt. Ltd,9788126538164,"1st Edition,2017",400,India,English
Managing Investment Portfolios : A Dynamic Process,ডেনিস ডব্লিউ ম্যাকলিভি,"TK. 1,901","",https://rokomari.com//book/174802/managing-investment-portfolios---a-dynamic-process,https://ds.rokomari.store/rokomari110/ProductNew20190903/130X186/ba4ba2055_174802.jpg,"",Managing Investment Portfolios : A Dynamic Process,"Dennis W. McLeavey,Donald L. Tuttle,John L. Maginn,Peter L. Bernstein", , ,Wiley India Pvt. Ltd,9788126564446,"3rd Edition,2016",960,India,English
Automatic Flight Control,ইএইচজে প্যালেট,"TK. 1,440","",https://rokomari.com//book/196866/automatic-flight-control,https://ds.rokomari.store/rokomari110/ProductNew20190903/130X186/860cc185a_196866.jpg,"",Automatic Flight Control,"E.H.J. Pallett,Shawn Coyle", , ,Wiley India Pvt. Ltd,9788126519323,"4th Edition,2009",336,India,English
Environment,পিটার এইচ রাভেন,"TK. 2,511","",https://rokomari.com//book/186800/environment,https://ds.rokomari.store/rokomari110/ProductNew20190903/130X186/81970b436_186800.jpg,"",Environment,"Peter H. Raven,David M. Hassenzahl,Mary Catherine Hager", , ,Wiley India Pvt. Ltd,9788126574254,"1st Edition,2018", ,India,English
Advanced Engineering Electromagnetics,কনস্টানটাইন এ. বালানিস,"TK. 2,691","",https://rokomari.com//book/188826/advanced-engineering-electromagnetics,https://ds.rokomari.store/rokomari110/ProductNew20190903/130X186/8e71cb4f6_188826.jpg,"",Advanced Engineering Electromagnetics,Constantine A. Balanis, , ,Wiley India Pvt. Ltd,9788126518562,2008,1002,India,English
Marketing Analytics: Data-Driven Techniques with Microsoft Excel,উইনি এল উইনস্টন,"TK. 1,438","",https://rokomari.com//book/172794/marketing-analytics--data-driven-techniques-with-microsoft-excel,https://ds.rokomari.store/rokomari110/ProductNew20190903/130X186/811618a21_172794.jpg,"",Marketing Analytics: Data-Driven Techniques with Microsoft Excel,Wayne L. Winston, , ,Wiley India Pvt. Ltd,9788126548620,"1st Edition,2014",720,India,English
"Applied Cryptography Protocols, Algorithms, and Source Code in C (Second Edition)",ব্রুস স্কনিয়ের,"TK. 1,420","",https://rokomari.com//book/54526/applied-cryptography-protocols--algorithms--and-source-code-in-c--second-edition-,https://ds.rokomari.store/rokomari110/ProductNew20190903/130X186/7c7f798e1_54526.jpg,"""Applied Cryptography"" Summary of the Book:
This new edition of the cryptography classic provides you with a comprehensive survey of modern cryptography. The book details how programmers and electronic communications professionals can use cryptography—the technique of enciphering and deciphering messages-to maintain the privacy of computer data. It describes dozens of cryptography algorithms, gives practical advice on how to implement them into cryptographic software, and shows how they can be used to solve security problems. Covering the latest developments in practical cryptographic techniques, this new edition shows programmers who design computer applications, networks, and storage systems how they can build security into their software and systems. 
What's new in the Second Edition?
* New information on the Clipper Chip, including ways to defeat the key escrow mechanism
* New encryption algorithms, including algorithms from the former Soviet Union and South Africa, and the RC4 stream cipher
* The latest protocols for digital signatures, authentication, secure elections, digital cash, and more
* More detailed information on key management and cryptographic implementations","Applied Cryptography Protocols,Algorithms,and Source Code in C (Second Edition)",Bruce Schneier , , ,Wiley India Pvt. Ltd,9788126513680,"2nd Edition,2007",760,India,English
Design of Prestressed Concrete Structures  ,টি. ওয়াই. লিন,"TK. 1,060","",https://rokomari.com//book/70861/design-of-prestressed-concrete-structures,https://ds.rokomari.store/rokomari110/ProductNew20190903/130X186/17d87baf9_70861.gif,"",Design of Prestressed Concrete Structures,"T. Y. Lin,Ned H. Burns", , ,Wiley India Pvt. Ltd,9788126528035,"Reprinted,2015",646,India,English
Sampling Techniques,উইলিয়াম জি কোচরান,"TK. 1,276","",https://rokomari.com//book/54665/sampling-techniques,https://ds.rokomari.store/rokomari110/ProductNew20190903/130X186/af3845c36_54665.jpg,"Book Summary of Sampling Techniques, 3Rd Edition
Clearly demonstrates a wide range of sampling methods now in use by governments, in business, market and operations research, social science, medicine, public health, agriculture, and accounting. Gives proofs of all the theoretical results used in modern sampling practice. New topics in this edition include the approximate methods developed for the problem of attaching standard errors or confidence limits to nonlinear estimates made from the results of surveys with complex plans. • Simple Random Sampling • Sampling for Proportions and Percentages • The Estimation of Sample Size • Stratified Random Sampling • Further Aspects of Stratified Sampling • Ratio Estimators • Regression Estimates • Systematic Sampling • Single-Stage Cluster Sampling: Clusters of Equal Sizes • Single-Stage Cluster Sampling: Clusters of Unequal Sizes • Sub Sampling with Units of Equal Size • Sub Sampling with Units of Unequal Sizes • Double Sampling • Sources of Error in Surveys",Sampling Techniques,William G Cochran, , ,Wiley India Pvt. Ltd,9788126515240,"Reprinted,2018",432,India,English
OCA: Oracle Certified Associate Java SE 8 Programmer I Study Guide,জেন বয়ারস্কি,"TK. 1,798","",https://rokomari.com//book/129525/oca--oracle-certified-associate-java-se-8-programmer-i-study-guide,https://ds.rokomari.store/rokomari110/ProductNew20190903/130X186/64e7259f6_129525.jpg,"",OCA: Oracle Certified Associate Java SE 8 Programmer I Study Guide,Jeanne Boyarsky, , ,Wiley India Pvt. Ltd,9788126554652,"1st Edition,2015",424,India,English
Wireless Communications ,অ্যানড্রিয়াস এফ. মলিস,"TK. 1,312","",https://rokomari.com//book/54555/wireless-communications,https://ds.rokomari.store/rokomari110/ProductNew20190903/130X186/628df6880_54555.jpg,"Book Summary of Wireless Communications
Wireless Communications provides a self-contained all encompassing current treatment of the area and topics covered will include directional channel modelling, multi-user detection, MIMO systems, and 3G standards. In addition, the author has combined mathematical derivations with intuitive explanations of the physical facts in order to help students (including self-study readers) to acquire a deeper understanding of the facts. 

Table of Contents
Preface List of abbreviations List of symbols Part I Introduction
o	Applications and requirements of wireless services
o	Technical challenges of wireless communications
o	Noise- and interference-limited systems
Part II Wireless Propagation Channels
o	Propagation mechanisms
o	Statistical description of the wireless channel
o	Wideband and directional channel characterization
o	Channel models
o	Channel sounding
o	Antennas
Part III Transceivers And Signal Processing
o	Structure of a wireless communication link
o	Modulation formats
o	Demodulation
o	Diversity
o	Channel coding
o	Speech coding
o	Equalizers
Part IV Multiple Access And Advanced Transceiver Schemes
o	Multiple access and the cellular principle
o	Spread spectrum systems
o	Orthogonal frequency division multiplexing (OFDM)
o	Multi-antenna systems
Part V Standardized Wireless Systems
•	GSM - Global System for Mobile communications
•	IS-95 and CDMA 2000
•	WCDMA/UMTS
•	Wireless Local Area Networks
•	Exercises
•	References
•	Index",Wireless Communications,Andreas F. Molisch, , ,Wiley India Pvt. Ltd,9788126510566,"Reprint,2013",622,India,English
Applied Regression Analysis,নরম্যান আর. ড্রাপের,"TK. 2,331","",https://rokomari.com//book/187428/applied-regression-analysis,https://ds.rokomari.store/rokomari110/ProductNew20190903/130X186/6f29667a7_187428.jpg,"",Applied Regression Analysis,"Norman R. Draper,Harry Smit", , ,Wiley India Pvt. Ltd,9788126531738,"3rd edition,2011",728,India,English
Beginning IOS Programming for Dummies ,রাজীভ রামনাথ,TK. 900,"",https://rokomari.com//book/99622/beginning-ios-programming-for-dummies,https://ds.rokomari.store/rokomari110/ProductNew20190903/130X186/rokimg_20150506_99622.gif,"",Beginning IOS Programming for Dummies,Rajiv Ramnath, , ,Wiley India Pvt. Ltd,9788126550531,"1st edition,2014",456,India,English
