Title,Author,Original Price,Discounted Price,URL,Summary,Book_Title,Book_Author,Translator,Editor,Publisher,ISBN,Edition,Number Of Pages,Country,Language
স্বপ্নচক্র,ধ্রুব নীল (শিশু-কিশোর সাহিত্যিক),TK. 200,TK. 176,https://rokomari.com//book/162194/swapnachakra,"",স্বপ্নচক্র,ধ্রুব নীল (শিশু-কিশোর সাহিত্যিক), , ,আলেকজান্দ্রিয়া পাবলিশার, ,"1st Published,2018",44,বাংলাদেশ,বাংলা
"বিলু, কালু আর গিলুর রোমাঞ্চকর অভিযান (এইচএসবিসি-কালি ও কলম সাহিত্য পুরস্কার ২০১৩) ",মাশুদুল হক,TK. 250,TK. 213,https://rokomari.com//book/62917/bilu--kalu-ar-gilur-romanchokor-avijan--h-s-b-c---kali-o-kalam-literary-award-,"রাজার ছেলে বিলু, সহিসপুত্র কালু আর দুবছর বয়সী দাঁতছাড়া হাতি গিলু একদিন রাজপুরী ফেলে বেরিয়ে পড়ে গল্প-বলিয়ে পলাতক জল্লাদের খোঁজে, ওদের সাথে রওনা দেয় রাজবন্দি বীরপুরুষ গুরুৎও। শুরু হয় ওদের দারুণ রোমাঞ্চকর এক অভিযান। এ রাজ্য থেকে ও রাজ্য, মায়াবন থেকে নীলগিরি, কত না রাজপুরী আর বন-বাদাড় ঘুরে বেড়ায় আর কত কত অবাক-করা, মনে-ধরা জিনিসপত্তর দেখে বেড়ায় তার ইয়ত্তা নেই। সাথে বীরপুরুষ গুরুৎ আছে বলেই ওরা যে চলার পথের বিপদ-আপদগুলো সহজে উৎরে যায় তা কিন্তু নয়, বরঞ্চ সেসব কাটিয়ে ওরা শেষমেশ ঘরে ফিরতে পারবে কিনা সেটাই হয়ে দাঁড়ায় বিরাট এক প্রশ্ন। তবে ওদের দিন কাটে এমন এক উত্তেজনা আর ভালো লাগায় যে বাকি জীবনে চাইলেও আর ভুলতে পারবে না। ওদের সেই ভালো লাগার এতটুকুও যদি তোমাদের স্পর্শ করে, তবেই না লেখাটা সার্থক।","বিলু,কালু আর গিলুর রোমাঞ্চকর অভিযান (এইচএসবিসি-কালি ও কলম সাহিত্য পুরস্কার ২০১৩)",মাশুদুল হক, , ,আলেকজান্দ্রিয়া পাবলিশার, , , ,বাংলাদেশ,বাংলা
নিমিদের শহরে কোলা মিয়া ও রাজকুমারী রাতাতা,মাশুদুল হক,TK. 300,TK. 255,https://rokomari.com//book/113516/nimider-shohore-kola-miya-o-rajkumari-ratata,"কাহিনী সংক্ষেপ: জলার ধারে পদ্মপাতায় রোদ পোহাচ্ছিলো কোলা মিয়া, এমন সময় নীল পাখা রাজ্যের রাজকুমারী রাতাতা এলো তার কাছে এক বিপদে পড়ে। কিন্তু আলাপ করে রাতাতা জানলো, কোলা মিয়াও কম বিপদে নেই। তখন তারা ভেবে দেখলো তাদের সমস্যার সমাধান করতে হলে যাওয়া চাই ছোট্ট মেয়ে নিমিদের শহরে।
কিন্তু সেখানে গিয়ে ওদের যে নতুন এক মস্ত ঝামেলায় পড়তে হবে সেটা ওরা ভাবেইনি। নিমির দাদু, পাশের বাড়ির মিনকু, পুলিশ অফিসার জাঁদরেল খা একে একে সবাই জড়িয়ে গেল সে ভজকটে। দুর্দান্ত শিকারী কর্নেল কাকন্দও কোথা থেকে যেন হাজির হল বন্দুক বাগিয়ে, ওদিকে রাতাতাদের পক্ষে টিটি আর ইন্দুমিয়ার দলবলও উঠেপড়ে লাগলো কিছু একটা করতে। শুরু হল বিরাট এক গোলমেলে ব্যাপার। 
কোলা মিয়া আর রাতাতার সে রোমহর্ষক অভিযানে তোমাকে স্বাগতম!",নিমিদের শহরে কোলা মিয়া ও রাজকুমারী রাতাতা,মাশুদুল হক, , ,আলেকজান্দ্রিয়া পাবলিশার,9789843382192,"1st Published,2016",96,বাংলাদেশ,বাংলা
অদ্ভুতুড়ে বইঘর (এইচ এস বি সি - কালি ও কলম সাহিত্য পুরস্কার),শরীফুল হাসান,TK. 250,TK. 213,https://rokomari.com//book/113517/odvuture-boighor--h-s-b-c---kali-o-kalam-literary-award-,"কাহিনী সংক্ষেপ: সীমান্তের শান্ত নিরিবিলি এক শহর নিশ্চিন্তপুর। নামটাকে সার্থক করে এতদিন সেখানে নিশ্চিন্তেই ছিল লোকজন। হঠাৎ করে কোথা থেকে সেখানে এসে হাজির হলো এক বুড়ো, বয়সের তার কোন গাছপাথর নেই। শহরের একপ্রান্তে রাতারাতি একটা বইয়ের দোকান খুলে বসলো সেই বুড়ো। তারপর থেকেই একের পর নিখোঁজ হতে থাকলো শহরের লোকজন। রহস্য সমাধানে নামল মামা-ভাগ্নের গোয়েন্দা দল।",অদ্ভুতুড়ে বইঘর (এইচ এস বি সি - কালি ও কলম সাহিত্য পুরস্কার),শরীফুল হাসান, , ,আলেকজান্দ্রিয়া পাবলিশার,9789843382193,"1st Published,2016",150,বাংলাদেশ,বাংলা
