Title,Author,Original Price,Discounted Price,URL,Image,Summary,Book_Title,Book_Author,Translator,Editor,Publisher,ISBN,Edition,Number Of Pages,Country,Language
Simply Rich: Life and Lessons from the Cofounder of Amway,রিচ ডেভস,"TK. 2,979","",https://rokomari.com//book/191155/simply-rich--life-and-lessons-from-the-cofounder-of-amway,https://ds.rokomari.store/rokomari110/ProductNew20190903/130X186/589c896dc_191155.jpg,"",Simply Rich: Life and Lessons from the Cofounder of Amway,Rich Devos, , ,Howard Books,9781476751771,"1st Edition,2014", ,India,English
Believe Bigger: Discover the Path to Your Life Purpose,মার্শাওন এভান্স ড্যানিয়েলস,"TK. 3,105","",https://rokomari.com//book/170011/believe-bigger--discover-the-path-to-your-life-purpose,https://ds.rokomari.store/rokomari110/ProductNew20190903/130X186/7ffb363cb_170011.jpg,"",Believe Bigger: Discover the Path to Your Life Purpose,Marshawn Evans Daniels, , ,Howard Books,9781501165689,"1st Edition,2018",352,India,English
Eve: A Novel,ডব্লিউ এম পল ইয়ং,"TK. 1,800","",https://rokomari.com//book/164394/eve--a-novel,https://ds.rokomari.store/rokomari110/ProductNew20190903/130X186/afd37a124_164394.jpg,"",Eve: A Novel,Wm. Paul Young, , ,Howard Books,9781501101427,"Reprint edition,2015",320,India,English
Mom Set Free: Find Relief from the Pressure to Get It All Right,জেইনি স্নানন,"TK. 1,393","",https://rokomari.com//book/151804/mom-set-free--find-relief-from-the-pressure-to-get-it-all-right,https://ds.rokomari.store/rokomari110/ProductNew20190903/130X186/835b07e3a_151804.jpg,"",Mom Set Free: Find Relief from the Pressure to Get It All Right,Jeannie Cunnion, , ,Howard Books,9781501156441,"1st Edition,2017",288,India,English
A Baxter Family Christmas,ক্যারেন কিংসবারি,"TK. 1,360","",https://rokomari.com//book/124215/a-baxter-family-christmas,https://ds.rokomari.store/rokomari110/ProductNew20190903/130X186/fba051f25934_124215.jpg,"",A Baxter Family Christmas,Karen Kingsbury, , ,Howard Books,9781451687569,"1st Edition,2016",272,USA,English
