Title,Author,Original Price,Discounted Price,URL,Image,Summary,Book_Title,Book_Author,Translator,Editor,Publisher,ISBN,Edition,Number Of Pages,Country,Language
সর্বশেষ নবী মুহাম্মাদ ﷺ হৃদয়ের বাদশাহ কালেকশন ,রাশীদ হাইলামায,"TK. 2,400","TK. 1,440",https://rokomari.com//book/194040/last-prophet-muhammad---hridoyer-badshah-collection,https://ds.rokomari.store/rokomari110/ProductNew20190903/130X186/464aefb1f_194040.jpg,"""সর্বশেষ নবী মুহাম্মাদ (সা:) হৃদয়ের বাদশা -১ম খণ্ড"" বইয়ের পিছনের কভারের লেখা:

যুদ্ধ-বিগ্রহের বাইরে সমাজের একজন সক্রিয় সদস্য হিসেবে রাসূলুল্লাহ সাল্লাল্লাহু আলাইহি ওয়া সাল্লামের ভূমিকা ও উদ্দেশ্যকে এখানে গুরুত্ব দেওয়া হয়েছে। উল্লেখ্য তার জীবদ্দশায় যতগুলাে যুদ্ধ সংঘটিত হয়েছে, তেষট্টি বছরে সেগুলাের ব্যাপ্তি দুমাসেরও বেশি নয়।
 এ গ্রন্থে রাসূলুল্লাহ সাল্লাল্লাহু আলাইহি ওয়া সাল্লামের জীবনের ক্রমধারার প্রতিই কেবল দৃষ্টি নিবদ্ধ করা হয়নি, বরং সাহাবায়ে কেরাম, পরিবার ও নিকটস্থ সদস্যদের দৃষ্টিতে তার চরিত্র, আচরণ ও গুণাবলীর প্রতি সবিশেষ দৃষ্টি নিবদ্ধ করা হয়েছে।
 একদিকে গ্রন্থটিতে একজন আদর্শ স্বামী, স্নেহময় পিতা এবং বিশ্বস্ত বন্ধুর অন্তরঙ্গ চিত্র তুলে ধরা হয়েছে, অন্যদিকে একজন সাহসী যােদ্ধা ও সামরিক বিশেষজ্ঞের নাটকীয় অভিযান বর্ণনা করা হয়েছে। সমাজে অন্যায়-অত্যাচার ও দাসত্বের মােকাবেলা থেকে শুরু করে মানুষের অধিকার ও স্বাধীনতা রক্ষায় রণক্ষেত্রে সংগ্রাম—এ গ্রন্থে এমন এক জীবনী তুলে ধরা হয়েছে যা একইসঙ্গে গুরুত্বপূর্ণ, চিত্তাকর্ষক এবং উদ্দীপক।
 এ গ্রন্থটি পাঠককে প্রচণ্ড আবেগ ও গভীর নিমগ্নতায় সময় ও স্থানের বাধা অতিক্রম করে শতাব্দি পুরােনাে আরব উপত্যকায় নিয়ে যাবে এবং অবাক বিস্ময়। ও আনন্দে তাদের নতুন তথ্য আবিষ্কার ও অনুসন্ধানের সুযােগ করে দিবে।

""মুহাম্মাদ সা. : হৃদয়ের বাদশাহ (দ্বিতীয় খণ্ড)"" বইয়ের সংক্ষিপ্ত কথা:
 ‎
এ গ্রন্থে রাসূলুল্লাহ সাল্লাল্লাহু আলাইহি ওয়া সাল্লামের জীবনের ক্রমধারার প্রতিই ‎‎কেবল দৃষ্টি নিবদ্ধ করা হয়নি, বরং সাহাবায়ে কেরাম, পরিবার ও নিকটস্থ ‎সদস্যদের দৃষ্টিতে তার চরিত্র, আচরণ ও গুণাবলীর প্রতি সবিশেষ দৃষ্টি নিবদ্ধ ‎করা হয়েছে। ‎
একদিকে গ্রন্থটিতে একজন আদর্শ স্বামী, স্নেহময় পিতা এবং বিশ্বস্ত বন্ধুর অন্তরঙ্গ ‎চিত্র তুলে ধরা হয়েছে, অন্যদিকে একজন সাহসী যোদ্ধা ও সামরিক বিশেষজ্ঞের ‎নাটকীয় অভিযান বর্ণনা করা হয়েছে। সমাজে অন্যায়-অত্যাচার ও দাসত্বের ‎‎মোকাবেলা থেকে শুরু করে মানুষের অধিকার ও স্বাধীনতা রক্ষায় রণক্ষেত্রে ‎সংগ্রাম—এ গ্রন্থে এমন এক জীবনী তুলে ধরা হয়েছে যা একইসঙ্গে গুরুত্বপূর্ণ, ‎চিত্তাকর্ষক এবং উদ্দীপক। ‎
এ গ্রন্থটি পাঠককে প্রচণ্ড আবেগ ও গভীর নিমগ্নতায় সময় ও স্থানের বাধা ‎অতিক্রম করে শতাব্দি পুরোনো আরব উপত্যকায় নিয়ে যাবে এবং অবাক বিস্ময় ‎ও আনন্দে তাদের নতুন তথ্য আবিষ্কার ও অনুসন্ধানের সুযোগ করে দিবে। ‎
রাশীদ হাইলামায ইস্তাম্বুলে কাইনাক প্রকাশনা গ্রুপের প্রধান সম্পাদক। সাহাবায়ে কেরাম ‎ও রাসূলুল্লাহ সা. এর জীবনীর উপর তার অনেক গ্রন্থ রয়েছে। তার্কিস ভাষায় রচিত মূল ‎গ্রন্থটি তুরস্কে সবচেয়ে বেশি বিক্রিত বই। ইতোমধ্যে মাকতাবাতুল ফুরকান থেকে তার ‎‎দুটি বই অনূদিত হয়ে প্রকাশিত হয়েছে; খাদিজা : প্রথম মুসলমান এবং শেষ নবী মুহাম্মাদ ‎সা.-এর বিবি এবং জীবন ও কর্ম : আয়েশা রা. (উম্মুল মুমিনিন, সঙ্গীনী, ফকীহ)।‎
ফাতিহ হারপসি তুরস্কে জন্মেছেন এবং এখানেই বেড়ে উঠেছেন। তিনি মারমারা ‎বিশ্ববিদ্যালয়, ইস্তাম্বুল থেকে গ্রাজুয়েশন এবং ফিলাডেলফিয়ারের টেম্পল বিশ্ববিদ্যালয়ের ‎ডিপার্টমেন্ট অব রিলিজিয়ন থেকে পিএইচডি অর্জন করেছেন।
""মুহাম্মাদ সা. : হৃদয়ের বাদশাহ  ৩য় খণ্ড বইয়ের সংক্ষিপ্ত কথা:
সর্বশেষ নবী মুহাম্মাদ সা. : হৃদয়ের বাদশাহ গ্রন্থটি রাসূলুল্লাহ সাল্লাল্লাহু আলাইহি ‎ওয়া সাল্লামের অনুপম আদর্শময় জীবনের বিস্তারিত উপখ্যান। ‎
যুদ্ধ-বিগ্রহের বাইরে সমাজের একজন সক্রিয় সদস্য হিসেবে রাসূলুল্লাহ সাল্লাল্লাহু ‎আলাইহি ওয়া সাল্লামের ভূমিকা ও উদ্দেশ্যকে এখানে গুরুত্ব দেওয়া হয়েছে। ‎উল্লেখ্য তার জীবদ্দশায় যতগুলো যুদ্ধ সংঘটিত হয়েছে, তেষট্টি বছরে সেগুলোর ‎ব্যাপ্তি দুমাসেরও বেশি নয়।
এ গ্রন্থে রাসূলুল্লাহ সাল্লাল্লাহু আলাইহি ওয়া সাল্লামের জীবনের ক্রমধারার প্রতিই ‎‎কেবল দৃষ্টি নিবদ্ধ করা হয়নি, বরং সাহাবায়ে কেরাম, পরিবার ও নিকটস্থ ‎সদস্যদের দৃষ্টিতে তার চরিত্র, আচরণ ও গুণাবলীর প্রতি সবিশেষ দৃষ্টি নিবদ্ধ ‎করা হয়েছে। ‎
একদিকে গ্রন্থটিতে একজন আদর্শ স্বামী, স্নেহময় পিতা এবং বিশ্বস্ত বন্ধুর অন্তরঙ্গ ‎চিত্র তুলে ধরা হয়েছে, অন্যদিকে একজন সাহসী যোদ্ধা ও সামরিক বিশেষজ্ঞের ‎নাটকীয় অভিযান বর্ণনা করা হয়েছে। সমাজে অন্যায়-অত্যাচার ও দাসত্বের ‎‎মোকাবেলা থেকে শুরু করে মানুষের অধিকার ও স্বাধীনতা রক্ষায় রণক্ষেত্রে ‎সংগ্রাম—এ গ্রন্থে এমন এক জীবনী তুলে ধরা হয়েছে যা একইসঙ্গে গুরুত্বপূর্ণ, ‎চিত্তাকর্ষক এবং উদ্দীপক। ‎
এ গ্রন্থটি পাঠককে প্রচ- আবেগ ও গভীর নিমগ্নতায় সময় ও স্থানের বাধা ‎অতিক্রম করে শতাব্দি পুরোনো আরব উপত্যকায় নিয়ে যাবে এবং অবাক বিস্ময় ‎ও আনন্দে তাদের নতুন তথ্য আবিষ্কার ও অনুসন্ধানের সুযোগ করে দিবে। ‎
রাশীদ হাইলামায ইস্তাম্বুলে কাইনাক প্রকাশনা গ্রুপের প্রধান সম্পাদক। সাহাবায়ে কেরাম ‎ও রাসূলুল্লাহ সা. এর জীবনীর উপর তার অনেক গ্রন্থ রয়েছে। তার্কিস ভাষায় রচিত মূল ‎গ্রন্থটি তুরস্কে সবচেয়ে বেশি বিক্রিত বই। ইতোমধ্যে মাকতাবাতুল ফুরকান থেকে তার ‎‎দুটি বই অনূদিত হয়ে প্রকাশিত হয়েছে; খাদিজা : প্রথম মুসলমান এবং শেষ নবী মুহাম্মাদ ‎সা.-এর বিবি এবং জীবন ও কর্ম : আয়েশা রা. (উম্মুল মুমিনিন, সঙ্গীনী, ফকীহ)।‎
ফাতিহ হারপসি তুরস্কে জন্মেছেন এবং এখানেই বেড়ে উঠেছেন। তিনি মারমারা ‎বিশ্ববিদ্যালয়, ইস্তাম্বুল থেকে গ্রাজুয়েশন এবং ফিলাডেলফিয়ারের টেম্পল বিশ্ববিদ্যালয়ের ‎ডিপার্টমেন্ট অব রিলিজিয়ন থেকে পিএইচডি অর্জন করেছেন।",সর্বশেষ নবী মুহাম্মাদ ﷺ হৃদয়ের বাদশাহ কালেকশন,"রাশীদ হাইলামায,ফাতিহ হারপসি",মুহাম্মাদ আদম আলী, ,Maktabatul Furqan, ,"1st Published,2020",1488,Bangladesh,Bangla & Arabic
হাদীসের দুআ দুআর হাদীস ,মুফতী মুহাম্মাদ আব্দুল হালীম ,TK. 300,TK. 180,https://rokomari.com//book/164648/hadiser-duya-duyar-hadis,https://ds.rokomari.store/rokomari110/ProductNew20190903/130X186/5057579e8_164648.jpg,"""হাদীসের দুআ দুআর হাদীস"" বইয়ের পিছনের কভারের লেখা:

সুনান আত-তিরমিযী থেকে দুআর হাদীসের এক অনবদ্য সংকলন হাদীসের দুআ দুআর হাদীস। এ কিতাবের অন্যতম বৈশিষ্ট্য হচ্ছে, এতে কেবল দুআ উল্লেখ করা হয়নি, বরং মূল হাদীসটিই তুলে ধরা হয়েছে। নির্ভরযােগ্য এসব দুআর সঙ্গে মূল হাদীস পড়ার অভিজ্ঞতা পাঠকের মননকে এক ভিন্ন মাত্রায় উন্নীত করবে। তখন তার দুআ সত্যিকার অর্থেই আল্লাহর সঙ্গে কথােপকথনের রূপ লাভ করবে। পাঠকদের জন্য এমন একটি কিতাব এর আগে সংকলন করা হয়েছে কিনা, আমাদের জানা নেই। অধিকন্তু এ কিতাবে অধিকাংশ দুআর সঙ্গে বিশিষ্ট ও বিজ্ঞ অনুবাদক কর্তৃক প্রয়ােজনীয় টীকা ও ব্যাখ্যা সংযােজন করা হয়েছে। আশা করা যায়, কিতাবটি সকলের জন্যই দ্বীনের পথে অগ্রসর হতে সহায়তা করবে ইনশাআল্লাহ।",হাদীসের দুআ দুআর হাদীস, ,মুফতী মুহাম্মাদ আব্দুল হালীম, ,মাকতাবাতুল ফুরকান,9789849229261,"1st Published,2018",198,বাংলাদেশ,বাংলা
তাফসীরে মুযিহুল কুরআন (দ্বিতীয় খণ্ড),শাহ আব্দুল কাদির দেহলভী রহ.,TK. 800,TK. 480,https://rokomari.com//book/194386/tafseere-mujihul-quran--2nd-part-,https://ds.rokomari.store/rokomari110/ProductNew20190903/130X186/a070ad5e9_194386.jpg,"""তাফসীরে মুযিহুল কুরআন (দ্বিতীয় খণ্ড)"" বইয়ের সংক্ষিপ্ত কথা:
তাফসীরে মুযিহুল কুরআন প্রায় দুশ বছরের পুরোনো তাফসীর গ্রন্থ। এর মূল ‎‎লেখক মুসলিম জাহানের একজন প্রসিদ্ধ ইসলামী ব্যক্তিত্ব—হযরত শাহ ‎আব্দুল কাদের দেহলভী রহ. (১৭৫৩-১৮৫৪)—এ উপমহাদেশে ইসলামের ‎ঝাণ্ডা বহনে অন্যতম আলোর দিশারী। দীর্ঘ চল্লিশ বছর ধরে তিনি কুরআনের ‎এই তাফসীর লিখেছেন যা ইলহামী তাফসীর হিসেবে বিখ্যাত হয়ে আছে। ‎এর অন্যতম বৈশিষ্ট্য হলো, এর তরজমা পারিভাষিক হলেও বিস্ময়কর ‎আঙ্গিকে মূলানুগ। অধিকন্তু তরজমার ক্ষেত্রে কুরআনের সমঝ ও মর্মার্থ ‎রক্ষায় আপ্রাণ চেষ্টা করা হয়েছে; বিশেষজ্ঞদের মতে, এক্ষেত্রে সহসা কোনো ‎‎দুর্বলতা কিংবা ঘাটতি পরিলক্ষিত হয় না এবং কুরআনের মূল অর্থের বাইরে ‎অতিরিক্ত কোনো শব্দও এতে যোগ করা হয়নি। বলা যায়, কুরআনের ‎শব্দসংখ্যা আর উর্দু তরজমার শব্দসংখ্যা সমান না হলেও কাছাকাছি তো ‎বটেই। তাছাড়া আরবী ব্যাকরণের বিষয়গুলো অনূদিত ভাষায়ও ফুটিয়ে ‎‎তোলার চেষ্টা করা হয়েছে। ‎

এ উপমহাদেশে তাফসীরে মুযিহুল কুরআন ছাপানোর পর দীর্ঘ সময় পর্যন্ত ‎উলামায়ে কেরাম কুরআন মাজীদের নতুন কোনো তরজমা লেখার ‎প্রয়োজনবোধ করেননি। তবে ভাষার প্রাচীনতার কারণে কোথাও কোথাও ‎শব্দের আধুনিক ব্যাখ্যা প্রয়োজন ছিল। এ কাজটিও সুচারুভাবে সম্পন্ন ‎করেছেন মাওলানা আখলাক হুসাইন কাসেমী সাহেব। তিনি এ গ্রন্থের কঠিন ‎শব্দের বিশ্লেষণ ও জটিলতা সমাধানে সুবিশেষ মেহনত-পরিশ্রম করেছেন। ‎‎দীর্ঘ বারো বছর ধরে পুরো গ্রন্থটিকে নতুনভাবে সাজিয়েছেন এবং ‎প্রায়াজনীয় টীকা ও ব্যাখ্যা সংযোজন করেছেন। এ তরজমা ও তাফসীর যদি ‎নিবিষ্টচিত্তে গভীর মনোযোগ ও আগ্রহ নিয়ে পড়া যায়, তবে অবশ্যই ‎পাঠকমাত্রই এর জ্ঞানগত, ভাষাগত ও আত্মিক সৌন্দর্য উপলব্ধি করতে ‎সক্ষম হবেন এবং কুরআন মাজীদের জ্ঞান-বিজ্ঞান, নিগূঢ় রহস্য, প্রজ্ঞা ও ‎বিস্ময়কর সূক্ষ্ম বিষয়াদি জানার এক অনির্বচনীয় সুযোগ লাভ করবেন। ‎",তাফসীরে মুযিহুল কুরআন (দ্বিতীয় খণ্ড),শাহ আব্দুল কাদির দেহলভী রহ.,মাওলানা মুহাম্মাদ আব্দুল হালীম, ,মাকতাবাতুল ফুরকান,9789849432203,"1st Published,2020",496,বাংলাদেশ,বাংলা
"সারাবছর, প্রতিদিন সাহাবীদের গল্প",মুহাম্মাদ খালিদ পারভেজ,TK. 500,TK. 325,https://rokomari.com//book/202771/sarabochor--protidin-sahabider-golpo,https://ds.rokomari.store/rokomari110/ProductNew20190903/130X186/103811122_202771.jpg,"সারাবছর, প্রতিদিন―সাহাবীদের গল্প এক অনন্য ‎গল্পের বই, যা শিশু-কিশোরদের সাহাবায়ে ‎‎কেরাম অর্থাৎ সর্বশেষ নবী ও রাসূল মুহাম্মাদ ‎সাল্লাল্লাহু আলাইহি ওয়া সাল্লামের সহচরদের ‎‎রোমাঞ্চকর এবং মজাদার জীবনে নিয়ে যাবে। ‎এতে সাবলীল ও তেজস্বী ভাষায় সাহাবীদের ‎জীবন ও আচরণের বিভিন্ন ঘটনা বর্ণনা করা ‎হয়েছে। দ্বীনের জন্য অপূর্ব আত্মত্যাগ এবং ‎কঠোর সংগ্রাম-সাধনার কারণেই সারা বিশ্ব জুড়ে ‎মানুষ ভালোবাসা ও শ্রদ্ধার সাথে তাদের লালন ‎করে। প্রতিদিন শিশু-কিশোররা এতে রাসূল ‎সাল্লাল্লাহু আলাইহি ওয়া সাল্লাম এবং তাঁর ‎সাহাবীদের প্রজ্ঞা সম্বলিত একটি নতুন গল্প পড়ার ‎সুযোগ পাবে। এগুলো তারা তাদের দৈনন্দিন ‎জীবনে প্রয়োগ করতে পারলে তাদের জীবনও ‎হয়ে উঠবে অনুসরণীয় ও অনুকরণীয়। ‎

‎৩৬৫টি গল্পের সমন্বয়ে এই বই শিশু-‎কিশোরদেরকে সাহাবায়ে কেরাম এবং রাসূল ‎সাল্লাল্লাহু আলাইহি ওয়া সাল্লামের বিস্ময়কর ‎‎দুনিয়ার সাথে পরিচয় করিয়ে দিবে। এটি ‎এদেশের প্রতিটি মুসলিম ঘরেই থাকা প্রয়োজন। ‎ইনশাআল্লাহ, এ বইটি শিশু-কিশোরদের চরিত্র ‎গঠনে ব্যাপক ভূমিকা রাখবে। ‎","সারাবছর,প্রতিদিন সাহাবীদের গল্প",মুহাম্মাদ খালিদ পারভেজ, , ,মাকতাবাতুল ফুরকান,9789849432388,"1st Published,2020",336,বাংলাদেশ,বাংলা
নির্ভরযোগ্য তাফসীরে মুযিহুল কুরআন -১ম খণ্ড,শাহ আব্দুল কাদির দেহলভী রহ.,TK. 800,TK. 480,https://rokomari.com//book/187500/nirvorjhogyo-tafsire-mujhihul-quran--1st-khondo--sura-fatiha-sura-taoba-,https://ds.rokomari.store/rokomari110/ProductNew20190903/130X186/84368cd3b_187500.jpg,"",নির্ভরযোগ্য তাফসীরে মুযিহুল কুরআন -১ম খণ্ড,শাহ আব্দুল কাদির দেহলভী রহ.,মাওলানা মুহাম্মদ আব্দুল হালীম কাসেমী,মাওলানা আখলাক হুসাইন কাসেমী দেহলভী,Maktabatul Furqan,9789849229210,"1st Published,2019",504,Bangladesh,Bangla & Arabic
