Title,Author,Original Price,Discounted Price,URL,Image,Summary,Book_Title,Book_Author,Translator,Editor,Publisher,ISBN,Edition,Number Of Pages,Country,Language
পাশ্চাত্যের শিক্ষায় দ্বীনি অনুভূতি  প্রফেসর হযরতের বয়ান সংকলন-৫,প্রফেসর মুহাম্মাদ হামীদুর রহমান,TK. 300,TK. 180,https://rokomari.com//book/103934/parcatar-shikkay-dini-onuvuti--professor-hazrater-boyan-songkolon-5,https://ds.rokomari.store/rokomari110/ProductNew20190903/130X186/54e5858fa_103934.jpg,"এটি একটি ব্যতিক্রমী সংকলন। এখানে ইংরেজি শিক্ষিত দ্বীনদারদের উদ্দেশ্যে হযরতের কয়েকটি বয়ান একত্রিত করা হয়েছে। মাওলানা আশরাফ আলী থানভী রহমাতুল্লাহি আলাইহি মুসলমানদেরকে দু’টি দলে ভাগ করেছেন। এটা সারা পৃথিবীর ক্ষেত্রেই প্রযোজ্য। তিনি মুসলিম জাতির একদলকে বলেছেন ‘ইংরেজি শিক্ষিত দ্বীনদার সম্প্রদায়’ এবং আরেক দলকে বলেছেন ‘আলেম সম্প্রদায়’। এ দু’দলের চিন্তা-ভাবনা যেমন আলাদা, কর্ম ক্ষেত্রও ভিন্ন। তবে এদের মধ্যে মিল-মহব্বতই মুসলিম জাতির উন্নতির পথে একমাত্র সহায়ক। আলেম সম্প্রদায়ের প্রতি ইংরেজি শিক্ষিত দ্বীনদারের সাধারণভাবে অবহেলা এবং অবজ্ঞা সমাজে বহুল প্রচলিত, বরং বলা যায় প্রতিষ্ঠিত সত্য। অথচ দ্বীনের পথে আগে বাড়ার ক্ষেত্রে উলামায়ে কেরামকে যথাযথ সম্মান প্রদর্শন করা যেমন জরুরী, তেমনি তাদের নিবিড় সানিড়বধ্য এবং জীবনের প্রতিটি ক্ষেত্রে তাদের পরামর্শও খুবই প্রয়োজন। এটা নিশ্চিত সত্য যে, বর্তমানে দ্বীনের পথে একাকী চলা, সুনড়বাতের উপর মজবুত থাকা প্রায় অসম্ভব। প্রফেসর হযরত এ দু’দলের মধ্যে সম্পর্ক স্থাপনে এক বিশেষ ভূমিকা রেখে যাচ্ছেন। তিনি নিজেই এ ধারার এক বাস্তব উদাহরণ এবং সবার জন্যই একজন মহান আদর্শ। ইংরেজি শিক্ষিত দ্বীনদাররা উলামায়ে কেরামের সানিড়বধ্যে থেকে এ যুগেও একজন সত্যিকার আল্লাহওয়ালা হতে পারেন, এ বয়ানগুলো সেদিকেই পাঠককে উৎসাহিত করবে। আল্লাহ তা’আলা এ কাজকে কবুল করুন। সবাইকে এ উসিলায় হেদায়েত নসীব করুন।",পাশ্চাত্যের শিক্ষায় দ্বীনি অনুভূতি  প্রফেসর হযরতের বয়ান সংকলন-৫,প্রফেসর মুহাম্মাদ হামীদুর রহমান, ,মুহাম্মদ আদম আলী,মাকতাবাতুল ফুরকান,9789849117599,"2nd Published,2015",320,বাংলাদেশ,বাংলা
পরিবর্তন ও প্রত্যাবর্তন,মুহাম্মাদ আদম আলী,TK. 300,TK. 180,https://rokomari.com//book/183344/poriborton-protyaborton,https://ds.rokomari.store/rokomari110/ProductNew20190903/130X186/d94ecaf3a_183344.jpg,"",পরিবর্তন ও প্রত্যাবর্তন,মুহাম্মাদ আদম আলী, , ,মাকতাবাতুল ফুরকান,9789849229247,"1st Published,2019",144,বাংলাদেশ,বাংলা
একা একা আমেরিকা,মুহাম্মদ আদম আলী,TK. 300,TK. 180,https://rokomari.com//book/160853/eka-eka-america,https://ds.rokomari.store/rokomari110/ProductNew20190903/130X186/be74fb3da_160853.jpg,"একা একা আমেরিকা কিতাবটি একটি সফরনামা। ‎তুরস্ক এবং আমেরিকা সফরের কিছু চমকপ্রদ ঘটনা ‎সহজ-সুন্দর ও সাবলীল ভাষায় এতে বর্ণনা করা ‎হয়েছে। তবে এ কিতাবের সবচেয়ে উল্লেখযোগ্য দিক ‎হচ্ছে, সমকালীন দু-জন প্রসিদ্ধ ইসলামী ব্যক্তিত্ব এবং ‎হরদুই হযরত মাওলানা আবরারুল হক সাহেব রহ.-এর ‎খলীফা—প্রফেসর হযরত মুহাম্মাদ হামীদুর রহমান ‎‎দামাত বারাকাতুহুম এবং হযরত মুফতী শামসুদ্দীন ‎জিয়া দামাত বারাকাতুহুম—আমেরিকায় আয়োজিত ‎ঘরোয়া মাহফিলে এদেশ থেকেই টেলিফোনে বয়ান ‎করেছিলেন যা এখানে সন্নিবেশিত হয়েছে। তাছাড়া এ ‎কিতাবে আমেরিকার মুসলমানদের বর্তমান অবস্থা তুলে ‎ধরা হয়েছে যা এক কথায় অসাধারণ। আশা করা যায়, ‎সব শ্রেণির পাঠকই এ কিতাব থেকে উপকৃত হবেন ‎এবং এটি সকলের জন্য দ্বীনের পথে অগ্রসর হওয়ার ‎‎ক্ষেত্রে সহায়ক হবে।  ‎",একা একা আমেরিকা,মুহাম্মদ আদম আলী, , ,মাকতাবাতুল ফুরকান,9789849229193‎,"1st Published,2018",158,বাংলাদেশ,বাংলা
জীবন ও কর্ম : হাসান ইবনে আলী রা.,ডঃ আলী মুহাম্মাদ সাল্লাবী,TK. 600,TK. 360,https://rokomari.com//book/201579/jibon-o-kormo---hasan-ibn-ali-ra-,https://ds.rokomari.store/rokomari110/ProductNew20190903/130X186/1ff75e626_201579.jpg,"হাসান ইবনে আলী রাযিয়াল্লাহু আনহুর ব্যাপ্তিময় জীবন সম্পর্কে জানা প্রবীণ ও তরুণ―উভয়ের জন্যই সমভাবে ‎‎গুরুত্বপূর্ণ। তিনি তার নানা রাসূলুল্লাহ সাল্লাল্লাহু আলাইহি ওয়া সাল্লামের সান্নিধ্যেই বেড়ে ওঠেন। এছাড়া তার লালন-‎পালনে তার মহৎ মাতা ফাতিমা রাযিয়াল্লাহু আনহা ও মহান পিতা আলী ইবনে আবি তালিব রাযিয়াল্লাহু আনহুর অবদান ‎অনস্বীকার্য।‎

হাসান ইবনে আলী রাযিয়াল্লাহু আনহুর জীবন ও কর্ম প্রমাণ করে, একজন মুসলিমের উচিত উম্মাহর ঐক্যকে সর্বাধিক ‎অগ্রাধিকার দেওয়া। এতে সর্বকালের ও সর্বস্তরের সকল নেতৃস্থানীয় ব্যক্তিবর্গের জন্য রয়েছে শিক্ষার উপাদান। উম্মাহর ‎বৃহত্তর স্বার্থে কখনো কখনো অনুগ্রহপূর্বক দাবি ছেড়ে দেওয়া এবং মর্যাদা ও কর্তৃত্বের পদ ত্যাগ করা অপরিহার্য।‎

মুয়াবিয়া রাযিয়াল্লাহু আনহুকে খিলাফাতের আসন ছেড়ে দিয়ে হাসান রাযিয়াল্লাহু আনহু প্রমাণ করেছেন যে, মুসলিমদের ‎মাঝে যে মতানৈক্য ছিল, তা নিতান্তই রাজনৈতিক। যদিও মুসলিমদের একে অপরের মাঝে দ্বন্দ¦-সংঘাত ছিল, তবুও ‎তারা একে অপরকে দ্বীনী ভাইবোন হিসেবেই বিবেচনা করতেন।‎

হাসান রাযিয়াল্লাহু আনহুর জীবনী সকল মুসলমানের জন্য একটি দৃষ্টান্ত স্থাপন করেছে। বিশেষত, মুসলিম শাসকদের ‎জন্য এটি একটি গুরুত্বপূর্ণ পাঠ। মহাপরাক্রমশালী আল্লাহ তাআলার সন্তুষ্টির জন্য এই ক্ষণস্থায়ী দুনিয়ার চাকচিক্য ‎কীভাবে বিসর্জন দিতে হয়, হাসান রাযিয়াল্লাহু আনহুর জীবন থেকে আমরা সেই শিক্ষাই লাভ করি। বক্ষ্যমাণ বইটিতে ‎হাসান ইবনে আলী রাযিয়াল্লাহু আনহুর জীবনী বিশদভাবে বর্ণিত হয়েছে। প্রকৃতপক্ষেই তিনি আমাদের যুবসমাজ ও ‎প্রাপ্তবয়স্কদের জন্য এক উত্তম আদর্শ, ব্যক্তিগত ও সামাজিক জীবনের জন্য এক অনুকরণীয় ব্যক্তিত্ব। ‎",জীবন ও কর্ম : হাসান ইবনে আলী রা.,ডঃ আলী মুহাম্মাদ সাল্লাবী,জোজন আরিফ, ,মাকতাবাতুল ফুরকান,9789849432258,"1st Published,2020",424,বাংলাদেশ,বাংলা
প্রফেসর হযরতের সাথে আমেরিকা সফর,মুহাম্মদ আদম আলী,TK. 240,TK. 144,https://rokomari.com//book/103941/professor-hazrater-sathe-america-sofor,https://ds.rokomari.store/rokomari110/ProductNew20190903/130X186/922172fdf_103941.jpg,"আমেরিকা সফর ছিল একটা ব্যতিক্রমী সফর। নিউইয়র্ক, বাফেলো, নায়াগ্রা, মিশিগান, আটলান্টা, ফ্লোরিডা, লস এঞ্জেলস, সান ফ্রান্সিসকো, ডালাস, হিউস্টন এবং অস্টিনে হযরতের প্রোগ্রাম হয়েছে। পাশ্চাত্যের প্রসঙ্গ এলেই আমাদের সামনে এক ভিনড়ব ছবি ভেসে উঠে। সে ছবি জৌলুসের, প্রাচুর্যের আর অহমিকার। দ্বীনি কোন ভাবনা আসে না। আমেরিকা সম্পর্কেও একই রকম। অথচ সেখানে অনেক মুসলমান আছেন। তারা যথাসাধ্য ইসলামের অনুসরণ করার চেষ্টা করেন। তারা দ্বীনের জন্যও খুব কাজ করছেন। তবে সেটা জৌলুস, প্রাচুর্য আর অহমিকার প্রভাবমুক্ত নয়। এখন ইন্টারনেটে তথ্য পাওয়া অনেক সহজ। আর এর উপর ভিত্তি করে মুসলমানদের জীবনও নিয়ন্ত্রিত হচ্ছে। এটাই সবচেয়ে মারাত্মক। খাঁটি উলামায়ে কেরামের কাছ থেকে দ্বীন না শেখাতে সমাজে ভিন্ন এক মুসলিম গোষ্ঠী গড়ে উঠছে। তাদের কাছে আল্লাহওয়ালা নতুন শব্দ। এ শ্রেণীর মানুষ অপরিচিত। পরিপূর্ণভাবে রাসূল (সাঃ)-এর সুন্নাতের অনুসরণ করার আগ্রহ নেই। এরকম এক কঠিন সময়ে হযরত আমেরিকা সফর করেছেন। সে দেশের মানুষের কাছে তিনি এক আশ্চর্য প্রদীপ। যাকে সবাই ছুঁয়ে দেখতে চেয়েছে। এ অনুভূতির কথাই সফরনামায় লেখার চেষ্টা করা হয়েছে।",প্রফেসর হযরতের সাথে আমেরিকা সফর,মুহাম্মদ আদম আলী, , ,মাকতাবাতুল ফুরকান,9789849117551,"1st Edition,2014",198,বাংলাদেশ,বাংলা
সূর্যালোকিত মধ্যরাত্রি,মুহাম্মদ আদম আলী,TK. 230,TK. 138,https://rokomari.com//book/103947/surjolokit-modhoratri--professor-hozroter-sathe-turkey--america-o-canada-sofor-,https://ds.rokomari.store/rokomari110/ProductNew20190903/130X186/rokimg_20150920_103947.gif,"""সূর্যালোকিত মধ্যরাত্রি"" বইয়ের সংক্ষিপ্ত কথা:
হযরত প্রফেসর মুহাম্মাদ হামীদুর রহমান সাহেব দামাত বারাকাতুহুম ৫ - ২৯ মে ২০১৫ পর্যন্ত তুরস্ক, আমেরিকা এবং কানাডা সফর করেছেন। আলহামদুলিল্লাহ, আল্লাহ তা’আলা আমাকে তার খাদেম হিসেবে সঙ্গে থাকার তাওফীক দিয়েছেন। এটা ছিল অন্যান্য সফরের তুলনায় ব্যতিক্রমী সফর। মূল সফর ছিল কানাডা। তার্কিস এয়ারলাইনসে ভ্রমণ করার সুবাদে তুরস্কে সফর হয়েছে। আর মূল সফরের সুবিধার জন্য আমেরিকা যুক্ত হয়েছে। তুরস্কে কোন দ্বীনি প্রোগ্রাম হয়নি। বিশ্রামই ছিল মূল উদ্দেশ্য। তথাপি ইস্তাম্বুল শহরের পুরোনো ঐতিহ্য, তোপকাপি যাদুঘরে রাসূলুল্লাহ (সা.)-এর যুগের বিভিন্ন নিদর্শন দেখার তাওফীক হয়েছে। নিউইয়র্কে দু’দিন অবস্থানে দু’টি প্রোগ্রাম হয়েছে। কানাডায় প্রথম এগার দিন টরেন্টো শহরের বিভিন্ন জায়গায় প্রোগ্রাম হয়েছে। কিন্তু সফরের মাঝামাঝি হযরত অসুস্থ হয়ে পড়েন। আমেরিকার ফ্লোরিডা, ডালাসসহ আরও কয়েকটি শহরে প্রোগ্রাম করার কথা ছিল। সেগুলো আর সম্ভব হয়নি। হযরতের অসুস্থতা বেড়ে গেলে দ্রুত দেশে ফিরে আসতে হয়েছে। এ সফরে কষ্ট এবং সৌভাগ্য পাশাপাশি এসেছে। আমি আমার সেই অভিজ্ঞতার কথা এখানে বর্ণনা করার চেষ্টা করেছি। আল্লাহ এ চেষ্টাকে কবুল করুন।",সূর্যালোকিত মধ্যরাত্রি, , ,মুহাম্মদ আদম আলী,মাকতাবাতুল ফুরকান,9789849117629,"1st Published,2015",160,বাংলাদেশ,বাংলা
