Title,Author,Original Price,Discounted Price,URL,Image,Summary,Book_Title,Book_Author,Translator,Editor,Publisher,ISBN,Edition,Number Of Pages,Country,Language
গল্পে গল্পে হযরত আবু বকর রাদিয়াল্লাহু আনহুর ১০০ ঘটনা,মাওলানা মুহাম্মদ সিদ্দিক মিনশাবি,TK. 160,TK. 96,https://rokomari.com//book/203859/golpe-golpe-hazrat-abu-bokor-radiyallahu-anohur-100-ghotona,https://ds.rokomari.store/rokomari110/ProductNew20190903/130X186/6e9528b5c_203859.jpg,"",গল্পে গল্পে হযরত আবু বকর রাদিয়াল্লাহু আনহুর ১০০ ঘটনা,মাওলানা মুহাম্মদ সিদ্দিক মিনশাবি, , ,মাকতাবাতুল হিজায, , ,112,বাংলাদেশ,বাংলা
গল্পে গল্পে হযরত আলী রাদিয়াল্লাহু আনহুর ১০০ ঘটনা,মাওলানা মুহাম্মদ সিদ্দিক মিনশাবি,TK. 160,TK. 93,https://rokomari.com//book/203865/golpe-golpe-hazrat-ali-radiyallahu-anohur-100-ghotona,https://ds.rokomari.store/rokomari110/ProductNew20190903/130X186/97e566801_203865.jpg,"",গল্পে গল্পে হযরত আলী রাদিয়াল্লাহু আনহুর ১০০ ঘটনা,মাওলানা মুহাম্মদ সিদ্দিক মিনশাবি, , ,মাকতাবাতুল হিজায, , ,112,বাংলাদেশ,বাংলা
বিষয়ভিত্তিক আয়াত ও হাদিস,মাওলানা আবু হোরায়রা,TK. 700,TK. 385,https://rokomari.com//book/203876/bishoybhittik-ayat-o-hadis,https://ds.rokomari.store/rokomari110/ProductNew20190903/130X186/4038f80a6_203876.jpg,"উলামায়ে কেরাম, ওয়ায়েজ, মাদরাসা ও স্কুলের ছাত্র, শিক্ষক এবং সাধারণ শিক্ষিত সব শ্রেণীর পাঠকের কথা বিবেচনায় রেখেই বইটি সংকলন করা হয়েছে। আপনি যদি সরাসরি কুরআন-হাদিস থেকে খুব সংক্ষেপে জীবনের প্রতিটি অধ্যায়ের সাথে সম্পৃক্ত করণীয় সম্পর্কে জানতে চান তাহলে অনায়াসে এই বইটি নির্বাচন করতে পারেন। মুমিন হিসেবে আমাদের করণীয় সম্পর্কে জানা, যেকোনাে বিষয়ে আয়াত ও হাদিস অনুসন্ধান, জুমার বয়ান তৈরি, বিষয়ভিত্তিক গবেষণা, হাদিসের ছাত্রদের পরীক্ষার প্রস্তুতিসহ জ্ঞানগত যেকোনাে কাজের জন্য বইটি হতে পারে আপনার নিত্য সঙ্গী বইটির কিছু বৈশিষ্ট্য উল্লেখ করা হলাে-
১. প্রতিটি আয়াত ও হাদিসের সাথে বিস্তারিত রেফারেন্স সংযােজন।
২. অর্থগত অস্পষ্টতা দূরিকরণ, একই বিষয়ের দুই হাদিসের বাহ্যিক বিরােধ নিরসন ও ইখতিলাফী মাসআলা সম্বলিত হাদিসসমূহে গুরুত্বপূর্ণ টীকা সংযোজন।
৩. প্রতিটি অধ্যায়ের শুরুতে সংশ্লিষ্ট বিষয়ে প্রাসঙ্গিক আলােচনা সংযােজন।
৪. আয়াত ও হাদিসের সংখ্যা না বাড়িয়ে বিষয়ের সংখ্যা বাড়ানাের প্রতি বেশি গুরুত্ব প্রদান। যাতে পাঠক কুরআন-হাদিসের জ্ঞানের সব শাখার সাথে পরিচিত হতে পারেন।
৫. বিষয় নির্বাচনের ক্ষেত্রে ইতিহাস-ঐতিহ্য ও ঘটনার চেয়ে আকিদা-বিশ্বাস ও দৈনন্দিন জীবনের আমলের সাথে সম্পৃক্ত বিষয়গুলােতে বেশি গুরুত্ব প্রদান।
৬. বাজারে প্রচলিত এ বিষয়ের বইসমূহে যেসব বিষয় বাদ পড়েছে সেসব বিষয়ের আয়াত ও হাদিস একত্র করার প্রতি বিশেষ গুরুত্ব প্রদান।
৭. বইটি শুরু থেকে শেষ পর্যন্ত পড়লে পাঠক যেনাে ইসলামী জীবনের একটি পূর্ণাঙ্গ রূপ সামনে পেয়ে যান, সেদিকে খেয়াল রেখেই বইটি সংকলন করা হয়েছে।",বিষয়ভিত্তিক আয়াত ও হাদিস, , ,"মাওলানা আবু নাঈম ফয়জুল্লাহ,মাওলানা আবু হোরায়রা",মাকতাবাতুল হিজায, , ,720,বাংলাদেশ,বাংলা
যোগ্য আলেম হতে হলে,শাইখুল ইসলাম আল্লামা তাকি উসমানী,TK. 240,TK. 139,https://rokomari.com//book/204719/jogyo-alem-hote-hole,https://ds.rokomari.store/rokomari110/ProductNew20190903/130X186/9a58bb6a3_204719.jpg,"",যোগ্য আলেম হতে হলে,"শাইখুল ইসলাম আল্লামা তাকি উসমানী,حكيم الامت مولانا اشرف علي تهانوي رح  ( হাকীমুল উম্মত মাওলানা আশরাফ আলী থানভী রহ.),মুফতী মুহাম্মদ শফি রাহ.", , ,মাকতাবাতুল হিজায, ,"1st Published,2020",160,বাংলাদেশ,বাংলা
রাসূল সা. এর রাষ্ট্রনীতি ও বর্তমান রাষ্ট্রব্যবস্থা,মাওলানা হাবীবুর রহমান কাসেমী,TK. 160,TK. 93,https://rokomari.com//book/203853/rasul-sm--ar-rastroniti-o-bortoman-rastrobybostha,https://ds.rokomari.store/rokomari110/ProductNew20190903/130X186/d0ef2925d_203853.jpg,"",রাসূল সা. এর রাষ্ট্রনীতি ও বর্তমান রাষ্ট্রব্যবস্থা,মাওলানা হাবীবুর রহমান কাসেমী, ,হাফেজ মাওলানা রেজা হাসান,মাকতাবাতুল হিজায, , ,112,বাংলাদেশ,বাংলা
আদাবুল মুআশারাত, حكيم الامت مولانا اشرف علي تهانوي رح  ( হাকীমুল উম্মত মাওলানা আশরাফ আলী থানভী রহ.),TK. 350,TK. 203,https://rokomari.com//book/203874/adabul-muasharat,https://ds.rokomari.store/rokomari110/ProductNew20190903/130X186/e76540af7_203874.jpg,"",আদাবুল মুআশারাত,حكيم الامت مولانا اشرف علي تهانوي رح  ( হাকীমুল উম্মত মাওলানা আশরাফ আলী থানভী রহ.), , ,মাকতাবাতুল হিজায, , ,240,বাংলাদেশ,বাংলা
গল্পে গল্পে হযরত হাসান-হুসাইন রাদিয়াল্লাহু আনহুর ১০০ ঘটনা,উওয়াইস সরওয়ার,TK. 160,TK. 96,https://rokomari.com//book/207063/golpe-golpe-hojrot-hassain-hussain-radiallahu-anhur-100-ghotona,https://ds.rokomari.store/rokomari110/ProductNew20190903/130X186/e78dba2c8_207063.jpg,"",গল্পে গল্পে হযরত হাসান-হুসাইন রাদিয়াল্লাহু আনহুর ১০০ ঘটনা,উওয়াইস সরওয়ার, , ,মাকতাবাতুল হিজায, ,"1st Published,2020",108,বাংলাদেশ,বাংলা
মহানবী মহান শিক্ষক,শায়খ আবদুল ফাত্তাহ আবু গুদ্দাহ রহ.,TK. 300,TK. 174,https://rokomari.com//book/203869/mohanobi-mohan-shikkhok,https://ds.rokomari.store/rokomari110/ProductNew20190903/130X186/798bd8407_203869.jpg,"",মহানবী মহান শিক্ষক,শায়খ আবদুল ফাত্তাহ আবু গুদ্দাহ রহ., , ,মাকতাবাতুল হিজায, , ,208,বাংলাদেশ,বাংলা
স্মরণ শক্তি কেন বাড়ে ও কেন কমে,মুফতী শরীফুল ইসলাম,TK. 160,TK. 96,https://rokomari.com//book/207062/sworon-shokti-keno-bare-o-keno-kome,https://ds.rokomari.store/rokomari110/ProductNew20190903/130X186/0752ff4fa_207062.jpg,"",স্মরণ শক্তি কেন বাড়ে ও কেন কমে,মুফতী শরীফুল ইসলাম, , ,মাকতাবাতুল হিজায, ,"1st Published,2020",112,বাংলাদেশ,বাংলা
নেক সন্তান ও আদর্শ পিতা- মাতা,হাফেজ মুফতী মিজান বিন মোতাহার,TK. 200,TK. 116,https://rokomari.com//book/204718/nek-sontan-o-adorsh-pita-mata,https://ds.rokomari.store/rokomari110/ProductNew20190903/130X186/a0cc80336_204718.jpg,"পৃথিবীর সবচেয়ে সুমধুর ডাক 'মা-বাবা'। মা-বাবা ডাকের মধ্যেই স্বর্গসুধা রয়েছে। অকৃত্রিম ভালোবাসার প্রতিচ্ছবি মা-বাবা। মা-বাবার সঙ্গে ভালোবাসা যেন অবিচ্ছেদ্য এক সুর তরঙ্গ। সেই সুরে বোনা প্রতিটি সন্তানের জীবন। মা-বাবার কাছে তাই আবেগের পুরো ঝুলি নিয়ে ছোটা। আনন্দ, বেদনা আর কল্পনা রাজ্যের যতসব অনুভূতির আলোড়ন সবই মা-বাবাকে ঘিরে। মা-বাবার আদর-স্নেহ ভালোবাসার ছায়ায় প্রতিটি সন্তানই থাকে পরম আনন্দে। যেন বটবৃক্ষের ছায়ায় পথিকের ক্লান্তি নিবারণ।
.
 সন্তানের কারণে মা-বাবার মুখে যেন ""উহ!"" উচ্চারিত না হয়- এটা মহান আল্লাহ তাআলার নির্দেশ। আমরা কি আল্লাহর এ নির্দেশ পালন করতে পারছি? নেক সন্তান হতে পারছি? শ্রদ্ধা ও ভালোবাসার মা-বাবার যথাযথ কদর করতে পারছি? না, পারছি না। আমরা অনেকেই এ ব্যাপারে অসচেতন। আমাদের চেতনাকে নাড়া দিতে, বিবেককে জাগ্রত করতে এবং হৃদয়কে আলোড়িত করতে ""নেক সন্তান ও আদর্শ পিতা মাতা"" শীর্ষক গ্রন্থটি রচনা করেছেন মুফতি মিজান বিন মোতাহার। নেক সন্তানের গুণাবলি অর্জন এবং পিতা-মাতার সেবা-যত্নে উদ্ভুদ্ধকরণ ও অভ্যস্তকরণের জন্য গ্রন্থটি অনন্য ভূমিকা পালন করবে ইনশাআল্লাহ।
.
সন্তানের জন্য মা-বাবার মুখে হাসি থাকুক প্রতিটি মুহূর্তে। অটুট থাকুক মা-বাবার জন্য সন্তানের ভালোবাসার বন্ধন।",নেক সন্তান ও আদর্শ পিতা- মাতা,হাফেজ মুফতী মিজান বিন মোতাহার, , ,মাকতাবাতুল হিজায, ,"1st Published,2020",160,বাংলাদেশ,বাংলা
বিশ্বনবির (সা) জীবনী (সমকালীন পরিবেশ),শায়খ সালেহ আহমদ আশ-শামী,TK. 600,TK. 348,https://rokomari.com//book/204720/bishwonobir--sm---jiboni--somokalin-poribesh-,https://ds.rokomari.store/rokomari110/ProductNew20190903/130X186/d1b4e166d_204720.jpg,"মানব-জীবনে সীরাত-চর্চার গুরুত্ব অপরিসীম। জীবনের প্রতিটি পদক্ষেপে রাসূলুল্লাহ (স.) এর আদর্শের অনুসরণ-অনুকরণ প্রতিটি মুসলমানের জন্য অতীব জরুরী। এ কারণেই পবিত্র কুরআনের প্রায় চল্লিশেরও অধিক জায়গায় নবীজী (স.)এর আনুগত্যের নির্দেশ দেওয়া হয়েছে। পৃথিবীতে যত জ্ঞান-বিজ্ঞান আবিষ্কার হয়েছে এবং আগামীতে হবে সকল কিছুর উৎস পবিত্র মহাগ্রন্থ আল-কুরআন। আর এই কুরআন বুঝতে হলে সীরাত তথা মহানবী (স.) এর জীবনী পর্যালোচনার বিকল্প নেই। আম্মাজান হযরত আয়েশা ( রা.) কে জিজ্ঞেস করা হয়েছিল রাসূলুল্লাহ স. এর সীরাত ও আখলাক সম্পর্কে। তিনি বলেছিলেন, “তাঁর আখলাক (সীরাত) ছিল আল-কুরআন।” অর্থাৎ কুরআনে কারীম হলো নবীজী স. এর জীবন-চরিতের সংরক্ষিত ও লিখিত নমুনা।  এ ছাড়া মুমিনের যে কোন আমলের নিক্তি বা মাপযন্ত্র হবে সীরাত। অর্থাৎ যা কিছু এর সঙ্গে সামঞ্জস্যপূর্ণ হবে, তা সত্য। আর যা সামঞ্জস্য রাখবে না, তা অসত্য। তাই সঠিক ও শুদ্ধরূপে আমলের ধারা চালু রাখতেও সীরাত পাঠের বিকল্প নেই।
আমাদের বক্ষমাণ গ্রন্থটি ব্যাপক সাড়া জাগানো আরবি শামায়েল গ্রন্থ মিম্ মায়িনিশ্ শামায়িল’-এর সাবলিল ও সুখপাঠ্য অনুবাদ। এর লেখক ১৯৩৪ সালে দামেস্কের উত্তর-পূর্বাঞ্চলের দুমা নগরীতে জন্ম নেওয়া সালেহ আহমদ আশ-শামি। মোট দশটি অধ্যায়ে অত্যন্ত সুনিপুণ ও বিশ্বস্ত হাতে তুলে ধরেছেন নবি-চরিত্রের প্রায় সব কটা দিক। ইমাম তিরমিযি, ইমাম বাগাভি, ইবনে কাসিরের মতো বিশ্ববিখ্যাত রচয়িতাদের সিরাত বা শামায়েল গ্রন্থ গুলোও এতটা পূর্ণতা পায়নি। গ্রন্থটির গ্রহণযোগ্যতার আরেকটি দিক হলো, এতে বর্ণিত প্রায় সব কটা হাদিস সহিহ ও হাসান পর্যায়ের। কোথাও দুর্বল হাদিস উল্লেখ থাকলে সেটা চি‎হ্নিত। 
আমরা আশাবাদী, বইটি বাংলা ভাষাভাষীদের মাঝে ব্যাপক জনপ্রিয়তা অর্জন করবে। (ইনশাআল্লাহ)",বিশ্বনবির (সা) জীবনী (সমকালীন পরিবেশ),শায়খ সালেহ আহমদ আশ-শামী, , ,মাকতাবাতুল হিজায, ,"1st Published,2020",608,বাংলাদেশ,বাংলা
সুখময় জীবনকে উপভোগ করুন ,ড. শায়খ মুহাম্মদ বিন আব্দুর রহমান আরিফী,TK. 500,TK. 275,https://rokomari.com//book/203843/sukhomoy-jibonke-upovog-korun,https://ds.rokomari.store/rokomari110/ProductNew20190903/130X186/c00b3cdb1_203843.jpg,"",সুখময় জীবনকে উপভোগ করুন,ড. শায়খ মুহাম্মদ বিন আব্দুর রহমান আরিফী,মুফতি জিয়াউর রহমান কাসেমী মাজাহেরী, ,মাকতাবাতুল হিজায, , ,568,বাংলাদেশ,বাংলা
আল ইলমু ওয়াল উলামা (পূর্নাঙ্গ অনুবাদ), حكيم الامت مولانا اشرف علي تهانوي رح  ( হাকীমুল উম্মত মাওলানা আশরাফ আলী থানভী রহ.),TK. 520,TK. 302,https://rokomari.com//book/203845/al-elmu-wyal-ulama--purnango-onubad-,https://ds.rokomari.store/rokomari110/ProductNew20190903/130X186/5035dcd20_203845.jpg,"",আল ইলমু ওয়াল উলামা (পূর্নাঙ্গ অনুবাদ),حكيم الامت مولانا اشرف علي تهانوي رح  ( হাকীমুল উম্মত মাওলানা আশরাফ আলী থানভী রহ.),মুফতি নজরুল ইসলাম তাহের, ,মাকতাবাতুল হিজায, , ,448,বাংলাদেশ,বাংলা
নারীর পর্দা ও সুন্দর পৃথিবী,মাওলানা জসীম উদ্দীন কাসেমী নদভী,TK. 120,TK. 72,https://rokomari.com//book/207061/narir-porda-o-sundor-prithibi,https://ds.rokomari.store/rokomari110/ProductNew20190903/130X186/d3e856ec2_207061.jpg,"পর্দা - প্রতিটি মুসলিম নারীর ওপর ফরজ একটি বিধান। বর্তমান সময়ে পর্দা সম্পর্কিত মনগড়া অনেক কথা প্রচলিত আছে, যা নারীদের মূল পথ থেকে সরিয়ে আনে। অনেকসময় এসব প্রচলিত মনগড়া কথা শুনে অনেকেই সঠিকভাবে পর্দা করে উঠতে পারে না। তাই প্রতিটি নারীর জানা উচিত পর্দা কী? পর্দা ঠিক কেমনটা হওয়া উচিত, পর্দা করার প্রয়োজনীয়তা, পর্দা না করার কুফল , পর্দা কি ফ্যাশন নাকি নারীদের সুরক্ষা ব্যবস্থা, আল্লাহর হুকুম? ইত্যাদি সম্পর্কে। 
বইটিতে কুরআন এবং হাদিসের আলোকে সুন্দরভাবে সঠিক পর্দার ব্যাখা দেওয়া হয়েছে। পবিত্রতা রক্ষার মাধ্যম হিসেবে পর্দার গুরুত্ব, পর্দা সংক্রান্ত গুরুত্বপূর্ণ এবং শিক্ষণীয় কিছু ঘটনা, কু-দৃষ্টি এবং এর পরিণতি, তাহারাত, গায়রত ইত্যাদি সম্পর্কে সবিস্তারে আলোচনা করা হয়েছে। প্রতিটি মেয়ের উচিত বইটি পড়ে দেখা।",নারীর পর্দা ও সুন্দর পৃথিবী,মাওলানা জসীম উদ্দীন কাসেমী নদভী, , ,মাকতাবাতুল হিজায, ,"1st Published,2020",80,বাংলাদেশ,বাংলা
হতাশ হবেন না ,ড. আয়েয আল-কারনী,TK. 600,TK. 330,https://rokomari.com//book/203842/hotash-hoben-na,https://ds.rokomari.store/rokomari110/ProductNew20190903/130X186/9a9cb7e25_203842.jpg,"",হতাশ হবেন না,ড. আয়েয আল-কারনী,মুফতি আশেক হাসান কাসেমী, ,মাকতাবাতুল হিজায, , ,624,বাংলাদেশ,বাংলা
বাংলা বানান ও উচ্চারণ রীতি,মাসউদ বিন আতহার,TK. 240,TK. 139,https://rokomari.com//book/203844/bangla-banan-o-uccharon-riti,https://ds.rokomari.store/rokomari110/ProductNew20190903/130X186/db57cca29_203844.jpg,"",বাংলা বানান ও উচ্চারণ রীতি, , ,মাসউদ বিন আতহার,মাকতাবাতুল হিজায, , ,157,বাংলাদেশ,বাংলা
মঞ্চে দাঁড়িয়ে,হাফেজ মাওলানা ইসমাঈল হুসাইন রাহমানী,TK. 290,TK. 168,https://rokomari.com//book/203846/monche-dariye,https://ds.rokomari.store/rokomari110/ProductNew20190903/130X186/c5df859b0_203846.jpg,"",মঞ্চে দাঁড়িয়ে,হাফেজ মাওলানা ইসমাঈল হুসাইন রাহমানী, , ,মাকতাবাতুল হিজায, , ,290,বাংলাদেশ,বাংলা
প্রিয় নবীর প্রিয় সুন্নাত,আরেফ বিল্লাহ মাওলানা শাহ হাকিম মোহাম্মদ আখতার রহ.,TK. 140,TK. 98,https://rokomari.com//book/203852/priyo-nobir-priyo-sunnat,https://ds.rokomari.store/rokomari110/ProductNew20190903/130X186/36f717f0d_203852.jpg,"",প্রিয় নবীর প্রিয় সুন্নাত,আরেফ বিল্লাহ মাওলানা শাহ হাকিম মোহাম্মদ আখতার রহ.,মুহাম্মদ আব্দুল্লাহ খান, ,মাকতাবাতুল হিজায, , ,110,বাংলাদেশ,বাংলা
জান্নাত জাহান্নামের বর্ণনা,মুহাম্মদ ইবনে ইব্রাহিম আত-তুওয়াইজরী,TK. 160,TK. 93,https://rokomari.com//book/203854/jannat-jahannamer-bornona,https://ds.rokomari.store/rokomari110/ProductNew20190903/130X186/717b323bf_203854.jpg,"",জান্নাত জাহান্নামের বর্ণনা,মুহাম্মদ ইবনে ইব্রাহিম আত-তুওয়াইজরী,মুফতি মাসুম বিল্লাহ খান, ,মাকতাবাতুল হিজায, , ,127,বাংলাদেশ,বাংলা
আধুনিক আরবী বলার সহজ উপায়,মাওলানা বদরুজ্জামান কিরানভী,TK. 280,TK. 162,https://rokomari.com//book/203866/adhunik-arbi-bolar-sohoz-upay,https://ds.rokomari.store/rokomari110/ProductNew20190903/130X186/91c9edcd4_203866.jpg,"",আধুনিক আরবী বলার সহজ উপায়,মাওলানা বদরুজ্জামান কিরানভী, , ,মাকতাবাতুল হিজায, , ,225,বাংলাদেশ,বাংলা
