Title,Author,Original Price,Discounted Price,URL,Image,Summary,Book_Title,Book_Author,Translator,Editor,Publisher,ISBN,Edition,Number Of Pages,Country,Language
পবিত্র কুরআন ও সহীহ হাদীসের আলোকে ইমামের পিছনে কেরাত পড়া নিষিদ্ধ,হাফেয মুফতী অকিল উদ্দিন যশোরী,TK. 30,TK. 18,https://rokomari.com//book/112861/pobitro-quran-o-sohih-hadiser-aloke-imamer-pisone-qirat-pora-nishiddho,https://ds.rokomari.store/rokomari110/ProductNew20190903/130X186/0ef90219f2c4_112861.gif,"",পবিত্র কুরআন ও সহীহ হাদীসের আলোকে ইমামের পিছনে কেরাত পড়া নিষিদ্ধ,হাফেয মুফতী অকিল উদ্দিন যশোরী, , ,مكتبة الاتحاد (মাকতাবাতুল ইত্তিহাদ), ,"1st Published,2016",24,বাংলাদেশ,বাংলা
আল মুসাম্মাতু শরহে আল মুসাইয়ারাতু ফিল আকাইদ মুঞ্জিয়াতু ফিল আখেরাত,কামাল উদ্দিন মুহাম্মাদ বিন আবী বাকর আলী বিন আবী শারীফ,"",TK. 300,https://rokomari.com//book/116650/al-musammatu-sharhe-al-musaiaratu-fil-akayed-munjiatu-fil-akherat,https://ds.rokomari.store/rokomari110/ProductNew20190903/130X186/2947e3079a04_116650.gif,"",আল মুসাম্মাতু শরহে আল মুসাইয়ারাতু ফিল আকাইদ মুঞ্জিয়াতু ফিল আখেরাত,কামাল উদ্দিন মুহাম্মাদ বিন আবী বাকর আলী বিন আবী শারীফ, , ,Maktabatul Ettihad, , ,334,Bangladesh,Arabic
হাশীয়াতু ত্বাহতাবী আলা মারাকেল ফালাহ শরহে নুরুল ইজাহ,শায়খ হাসান বিন আম্মার বিন আলী সারানবালী,TK. 600,TK. 546,https://rokomari.com//book/116651/hasiatul-tahavi-ala-marakel-falah-sharhe-nurul-ijah,https://ds.rokomari.store/rokomari110/ProductNew20190903/130X186/56502d1ac064_116651.gif,"",হাশীয়াতু ত্বাহতাবী আলা মারাকেল ফালাহ শরহে নুরুল ইজাহ,শায়খ হাসান বিন আম্মার বিন আলী সারানবালী, , ,Maktabatul Ettihad, , ,758,Bangladesh,Arabic
জাওয়াহিরুল ফাতাওয়া -(১ম -৫মখণ্ড),মাওলানা মুফতী মুহাম্মাদ আব্দুস সালাম,"TK. 2,000","TK. 1,900",https://rokomari.com//book/116652/jawahirul-fatawa--1-5-volume-,https://ds.rokomari.store/rokomari110/ProductNew20190903/130X186/9394f44d7514_116652.gif,"",জাওয়াহিরুল ফাতাওয়া -(১ম -৫মখণ্ড),মাওলানা মুফতী মুহাম্মাদ আব্দুস সালাম, , ,Maktabatul Ettihad, , , ,Bangladesh,Urdu
ফাতাওয়া সিরাজীয়া ,সিরাজ উদ্দিন আবী মুহাম্মাদ আলী বিন মুহাম্মাদ তাইমি ,"",TK. 500,https://rokomari.com//book/116653/fatawa-sirajia,https://ds.rokomari.store/rokomari110/ProductNew20190903/130X186/037df9d17654_116653.gif,"",ফাতাওয়া সিরাজীয়া,সিরাজ উদ্দিন আবী মুহাম্মাদ আলী বিন মুহাম্মাদ তাইমি, , ,Maktabatul Ettihad, , ,690,Bangladesh,Arabic
আল-জাওহিরাতুন-নাইরাতু-আলা-মুখতাসারুল-কুদুরী,للامام العللام شيخ الاسلام ابي بكر علي بن محمد الحداد اليمني (ইমাম আল্লামা শাইখুল ইসলাম আবী বকর আলী বিন মুহাম্মাদ হিদাদ ইয়ামানী),"",TK. 200,https://rokomari.com//book/116656/al-jaohiratun-nairatu-ala-mukhtasarul-kuduri,https://ds.rokomari.store/rokomari110/ProductNew20190903/130X186/7930fd425164_116656.gif,"",আল-জাওহিরাতুন-নাইরাতু-আলা-মুখতাসারুল-কুদুরী,للامام العللام شيخ الاسلام ابي بكر علي بن محمد الحداد اليمني (ইমাম আল্লামা শাইখুল ইসলাম আবী বকর আলী বিন মুহাম্মাদ হিদাদ ইয়ামানী), , ,Maktabatul Ettihad, , ,382,Bangladesh,Arabic
হানাফী ও আহলে হাদীস সমাচার,হাফেয মুফতী অকিল উদ্দিন যশোরী,TK. 90,TK. 54,https://rokomari.com//book/116818/hanafi-o-ahe-hadis-shomasar,https://ds.rokomari.store/rokomari110/ProductNew20190903/130X186/399a8aa35cc4_116818.gif,"",হানাফী ও আহলে হাদীস সমাচার,"হাফেয মুফতী অকিল উদ্দিন যশোরী,শায়খ মুহাম্মাদ ইসমাঈল মুহাম্মাদী", ,হাফেয মুফতী অকিল উদ্দিন যশোরী,مكتبة الاتحاد (মাকতাবাতুল ইত্তিহাদ), ,"1st Published,2016",80,বাংলাদেশ,বাংলা
মানবাঙ্গ সংযোজন ও তার শরয়ী বিধান,মুহাম্মদ আলী হোসাইন,TK. 200,TK. 120,https://rokomari.com//book/116877/manbang-songjujon-o-tar-shoroyi-shoroyi-bidhan,https://ds.rokomari.store/rokomari110/ProductNew20190903/130X186/ae6f8c18b604_116877.gif,"",মানবাঙ্গ সংযোজন ও তার শরয়ী বিধান, ,মুহাম্মদ আলী হোসাইন, ,مكتبة الاتحاد (মাকতাবাতুল ইত্তিহাদ), ,"3rd Print,2015",215,বাংলাদেশ,বাংলা
সুন্নাহর আলোকে তারাবীহ পর্যালোচনা ও সমাধান,মুফতী খাইরুল ইসলাম নোমানী,TK. 100,TK. 60,https://rokomari.com//book/102598/sunnahor-aloke-tarabiho-porjalochona-o-somadhan,https://ds.rokomari.store/rokomari110/ProductNew20190903/130X186/9db206b16_102598.jpg,"",সুন্নাহর আলোকে তারাবীহ পর্যালোচনা ও সমাধান,মুফতী খাইরুল ইসলাম নোমানী, , ,مكتبة الاتحاد (মাকতাবাতুল ইত্তিহাদ), ,"1st Edition,2015",96,বাংলাদেশ,বাংলা
ফাজায়েলে আমাল ও আমালে আহনাফ সম্পর্কে এক আহলে হাদীসের সত্যানুসন্ধান,মাওলানা আমীন সফদার উখাড়ভী রহ.,TK. 110,TK. 66,https://rokomari.com//book/102600/fajayele-amal-o-amale-ahonaf-somporke-ek-ahole-hadiser-sotanusondhan,https://ds.rokomari.store/rokomari110/ProductNew20190903/130X186/8d933fce3_102600.jpg,"",ফাজায়েলে আমাল ও আমালে আহনাফ সম্পর্কে এক আহলে হাদীসের সত্যানুসন্ধান,মাওলানা আমীন সফদার উখাড়ভী রহ., , ,مكتبة الاتحاد (মাকতাবাতুল ইত্তিহাদ), ,"1st Edition,2015",112,বাংলাদেশ,বাংলা
সহীহ হাদীস ও ইসলামী ফিক্‌হের আলোকে নামাযে নারী ও পুরুষের ব্যবধান,আল্লামা মুফতী আব্দুস সালাম চাটগামী দা. বা.,TK. 70,TK. 42,https://rokomari.com//book/102601/sohih-hadis-o-islami-fikher-aloke-namaze-nari-o-puruser-babodhan,https://ds.rokomari.store/rokomari110/ProductNew20190903/130X186/4631b35df0b4_102601.gif,"",সহীহ হাদীস ও ইসলামী ফিক্‌হের আলোকে নামাযে নারী ও পুরুষের ব্যবধান,"আল্লামা মুফতী আব্দুস সালাম চাটগামী দা. বা.,হাফেয মুফতী অকিল উদ্দিন যশোরী", , ,مكتبة الاتحاد (মাকতাবাতুল ইত্তিহাদ), ,"1st Edition,2013",64,বাংলাদেশ,বাংলা
সহীহ হাদীসের আলোকে নামাযে নাভীর নিচে হাত বাঁধা সুন্নাত,আল্লামা মুফতী আব্দুস সালাম চাটগামী দা. বা.,TK. 30,TK. 18,https://rokomari.com//book/102602/sohih-hadiser-aloke-namaze-navir-nice-hat-badha-sunnat,https://ds.rokomari.store/rokomari110/ProductNew20190903/130X186/b26cf8267_102602.jpg,"",সহীহ হাদীসের আলোকে নামাযে নাভীর নিচে হাত বাঁধা সুন্নাত,"আল্লামা মুফতী আব্দুস সালাম চাটগামী দা. বা.,হাফেয মুফতী অকিল উদ্দিন যশোরী", , ,مكتبة الاتحاد (মাকতাবাতুল ইত্তিহাদ), ,"1st Edition,2015",31,বাংলাদেশ,বাংলা
সহীহ হাদীসের আলোকে বিতির নামায ও রাকাত সংখ্যা,আল্লামা মুফতী আব্দুস সালাম চাটগামী দা. বা.,TK. 30,TK. 18,https://rokomari.com//book/102604/sohih-sadiser-aloke-bitir-namaz-o-rakat-shonkha,https://ds.rokomari.store/rokomari110/ProductNew20190903/130X186/f1ecbc528_102604.jpg,"",সহীহ হাদীসের আলোকে বিতির নামায ও রাকাত সংখ্যা,"আল্লামা মুফতী আব্দুস সালাম চাটগামী দা. বা.,হাফেয মুফতী অকিল উদ্দিন যশোরী", , ,مكتبة الاتحاد (মাকতাবাতুল ইত্তিহাদ), ,"1st Edition,2015",32,বাংলাদেশ,বাংলা
তথাকথিত আহলে হাদীস ও ডা. জাকির নায়েক কর্তৃক প্রচারিত ভুল তথ্যের জবাবে সঠিক তথ্য,মুফতী মামুনুর রশিদ বিন মুফতী আমিনুল ইসলাম কাসেমী,TK. 24,TK. 14,https://rokomari.com//book/102605/tothakothito-ahole-hadis-o-dr--jakir-nayak-korttk-procarito-vul-totther-jobabe-sothik-tottho,https://ds.rokomari.store/rokomari110/ProductNew20190903/130X186/5181f3e62_102605.jpg,"",তথাকথিত আহলে হাদীস ও ডা. জাকির নায়েক কর্তৃক প্রচারিত ভুল তথ্যের জবাবে সঠিক তথ্য,মুফতী মামুনুর রশিদ বিন মুফতী আমিনুল ইসলাম কাসেমী, , ,مكتبة الاتحاد (মাকতাবাতুল ইত্তিহাদ), ,"2nd Edition,2015",31,বাংলাদেশ,বাংলা
ইসলামের দৃষ্টিতে দাড়ি ও তার পরিমাণ,সাঈদ আহমদ,TK. 220,TK. 132,https://rokomari.com//book/122179/islamer-drristite-dari-o-tar-poriman,https://ds.rokomari.store/rokomari110/ProductNew20190903/130X186/04370fa2a384_122179.jpg,"",ইসলামের দৃষ্টিতে দাড়ি ও তার পরিমাণ,সাঈদ আহমদ, , ,مكتبة الاتحاد (মাকতাবাতুল ইত্তিহাদ), ,"1st Published,2012",248,বাংলাদেশ,বাংলা
 ‍সহীহ হাদীসের আলোকে রাফউল ইয়াদাইন না করার বিধান,হাফেয মুফতী অকিল উদ্দিন যশোরী,TK. 30,TK. 18,https://rokomari.com//book/112858/sohih-hadiser-aloke-raful-yadayn-na-korar-bidhan,https://ds.rokomari.store/rokomari110/ProductNew20190903/130X186/f7d518407ea4_112858.gif,"",‍সহীহ হাদীসের আলোকে রাফউল ইয়াদাইন না করার বিধান,হাফেয মুফতী অকিল উদ্দিন যশোরী, , ,مكتبة الاتحاد (মাকতাবাতুল ইত্তিহাদ), ,"1st Published,2016",32,বাংলাদেশ,বাংলা
সহীহ হাদীসের আলোকে পবিত্রতাবিহীন কুরআন স্পর্শ করা হারাম,হাফেয মুফতী অকিল উদ্দিন যশোরী,TK. 30,TK. 18,https://rokomari.com//book/112859/pobitro-quran-o-shih-hadiser-aloke-pobitrotabihin-quran-sporsho-kora-haram,https://ds.rokomari.store/rokomari110/ProductNew20190903/130X186/11f522dba284_112859.gif,"",সহীহ হাদীসের আলোকে পবিত্রতাবিহীন কুরআন স্পর্শ করা হারাম,হাফেয মুফতী অকিল উদ্দিন যশোরী, , ,مكتبة الاتحاد (মাকতাবাতুল ইত্তিহাদ), ,"1st Published,2016",24,বাংলাদেশ,বাংলা
সহীহ হাদীসের আলোকে তাবিজ ব্যবহার ও তার হুকুম,হাফেয মুফতী অকিল উদ্দিন যশোরী,TK. 24,TK. 22,https://rokomari.com//book/112860/sohih-hadiser-aloke-tabij-babohar-o-tar-hukum,https://ds.rokomari.store/rokomari110/ProductNew20190903/130X186/4fba5ec604b4_112860.gif,"",সহীহ হাদীসের আলোকে তাবিজ ব্যবহার ও তার হুকুম,হাফেয মুফতী অকিল উদ্দিন যশোরী, , ,مكتبة الاتحاد (মাকতাবাতুল ইত্তিহাদ), ,"1st Published,2016",16,বাংলাদেশ,বাংলা
পবিত্র কুরআন ও সহীহ হাদীসের আলোকে নামাযে আস্তে আমীন বলা উত্তম,হাফেয মুফতী অকিল উদ্দিন যশোরী,TK. 30,TK. 18,https://rokomari.com//book/112862/pobitro-quran-o-sohih-hadiser-aloke-namaje-aste-amin-bola-uttom,https://ds.rokomari.store/rokomari110/ProductNew20190903/130X186/4185654a4a84_112862.gif,"",পবিত্র কুরআন ও সহীহ হাদীসের আলোকে নামাযে আস্তে আমীন বলা উত্তম,হাফেয মুফতী অকিল উদ্দিন যশোরী, , ,مكتبة الاتحاد (মাকতাবাতুল ইত্তিহাদ), ,"1st Published,2016",32,বাংলাদেশ,বাংলা
আমি আহলে হাদীস থেকে যেভাবে হানাফী হলাম,সাঈদ আহমদ,TK. 24,TK. 14,https://rokomari.com//book/110066/ami-ahole-hadith-theke-jevabe-hanafi-holam,https://ds.rokomari.store/rokomari110/ProductNew20190903/130X186/cd421097c_110066.jpg,"",আমি আহলে হাদীস থেকে যেভাবে হানাফী হলাম,"সাঈদ আহমদ,আল্লামা আমীন ছফদর রহ.",সাঈদ আহমদ, ,مكتبة الاتحاد (মাকতাবাতুল ইত্তিহাদ), ,"1st Published,2014",24,বাংলাদেশ,বাংলা
