Title,Author,Original Price,Discounted Price,URL,Image,Summary,Book_Title,Book_Author,Translator,Editor,Publisher,ISBN,Edition,Number Of Pages,Country,Language
সোনালী শাহজাদা,আবু উসামা মোহাম্মদ হাবিবুল্লাহ,TK. 140,TK. 81,https://rokomari.com//book/203867/sonali-shahojada,https://ds.rokomari.store/rokomari110/ProductNew20190903/130X186/96ea34a21_203867.jpg,"",সোনালী শাহজাদা,আবু উসামা মোহাম্মদ হাবিবুল্লাহ, , ,মাকতাবাতুল হিজায, , ,88,বাংলাদেশ,বাংলা
একশত মুসলিম সাধকের জীবন ইতিহাস,শায়খ সিদ্দিক আল মিনশাবি,TK. 300,TK. 174,https://rokomari.com//book/203868/ekshoto-muslim-sadhoker-jibon-itihas,https://ds.rokomari.store/rokomari110/ProductNew20190903/130X186/bd81703a0_203868.jpg,"",একশত মুসলিম সাধকের জীবন ইতিহাস,শায়খ সিদ্দিক আল মিনশাবি,তাফাজ্জল হক আল হাসানী, ,মাকতাবাতুল হিজায, , ,404,বাংলাদেশ,বাংলা
তাবেঈদের আলোকিত জীবন,ড. আব্দুর রহমান রাফাত পাশা রহ.,TK. 480,TK. 278,https://rokomari.com//book/203870/tabeider-alokito-jibon,https://ds.rokomari.store/rokomari110/ProductNew20190903/130X186/772a9be71_203870.jpg,"",তাবেঈদের আলোকিত জীবন,ড. আব্দুর রহমান রাফাত পাশা রহ.,মাসউদ বিন আতহার, ,মাকতাবাতুল হিজায, , ,468,বাংলাদেশ,বাংলা
আবু হানিফা রহ. মুসলমানদের নন্দিত ঈমান,আবু উসামা মোহাম্মদ হাবিবুল্লাহ,TK. 320,TK. 186,https://rokomari.com//book/203873/abu-hanifa-rh--muslomander-nondito-eman,https://ds.rokomari.store/rokomari110/ProductNew20190903/130X186/48c624804_203873.jpg,"",আবু হানিফা রহ. মুসলমানদের নন্দিত ঈমান,আবু উসামা মোহাম্মদ হাবিবুল্লাহ, , ,মাকতাবাতুল হিজায, , ,240,বাংলাদেশ,বাংলা
মাযহাব মানবো কেন?,মুফতী মাওলানা সাঈদ আহমদ পালনপুরী,TK. 160,TK. 93,https://rokomari.com//book/203875/majohab-manobo-ken-,https://ds.rokomari.store/rokomari110/ProductNew20190903/130X186/dba96ef42_203875.jpg,"",মাযহাব মানবো কেন?,মুফতী মাওলানা সাঈদ আহমদ পালনপুরী, , ,মাকতাবাতুল হিজায, , ,128,বাংলাদেশ,বাংলা
গল্প হতে রবের পথে,হিজাযী সিস্টার্স কাফেলা ,TK. 360,TK. 216,https://rokomari.com//book/212379/golpo-hote-rober-pothe,https://ds.rokomari.store/rokomari110/ProductNew20190903/130X186/a3ba39c83_212379.jpg,"আপনি গল্প পড়তে ভালোবাসেন। আচ্ছা, গল্প পড়ে যদি বিনোদনের পাশাপাশি রবের সন্ধান পাওয়া যায়, তবে কেমন হয়?  খুবই ভালো, তাইতো? হ্যাঁ, আপনার মতো গল্পপ্রেমিক পাঠকদের জন্যই হিজাযী সিস্টার্স কাফেলা  এর ১১ জন দ্বীনি বোনের লেখা মোট ৩৩ টি জীবনঘনিষ্ঠ  অনন্যসাধারণ গল্প নিয়ে সাজানো হয়েছে ‘গল্প হতে রবের পথে’ নামক অনবদ্য বইটি। বইয়ের প্রতিটি গল্পই এমন যা আমাদের চেতনাকে নাড়া দিবে, বিবেককে জাগ্রত করবে এবং হৃদয়কে করবে আলোড়িত। গল্পগুলো পড়ে আপনি হবেন শিহরিত। হয়তো মনের অজান্তেই বলে উঠবেন, আরে! এ তো আমার জীবনেরই গল্প! বইটি হতে পারে আপনার জীবন সফরের শ্রেষ্ঠ পাথেয়, হতে পারে আপনার প্রিয়জনকে দেয়া সেরা উপহার।",গল্প হতে রবের পথে,হিজাযী সিস্টার্স কাফেলা, , ,মাকতাবাতুল হিজায, , ,224,বাংলাদেশ,বাংলা
দু'আ ও আমল,আফরোজা হোসেন,TK. 300,TK. 174,https://rokomari.com//book/203850/duya-o-amol,https://ds.rokomari.store/rokomari110/ProductNew20190903/130X186/e774095e0_203850.jpg,"",দু'আ ও আমল, , ,আফরোজা হোসেন,মাকতাবাতুল হিজায, , ,320,বাংলাদেশ,বাংলা
আলেম সমাজের সময়ের মূল্যায়ন,শায়খ আবদুল ফাত্তাহ আবু গুদ্দাহ রহ.,TK. 300,TK. 174,https://rokomari.com//book/203871/alem-somajer-somoyer-mulyayon,https://ds.rokomari.store/rokomari110/ProductNew20190903/130X186/3e23c37bc_203871.jpg,"",আলেম সমাজের সময়ের মূল্যায়ন,শায়খ আবদুল ফাত্তাহ আবু গুদ্দাহ রহ., , ,মাকতাবাতুল হিজায, , ,240,বাংলাদেশ,বাংলা
