Title,Author,Original Price,Discounted Price,URL,Image,Summary,Book_Title,Book_Author,Translator,Editor,Publisher,ISBN,Edition,Number Of Pages,Country,Language
বাড়াবাড়ি ছাড়াছাড়ির কবলে শবে বরাত,সাঈদ আহমদ,TK. 40,TK. 24,https://rokomari.com//book/116816/barabari-characharir-kobole-shobe-borat,https://ds.rokomari.store/rokomari110/ProductNew20190903/130X186/e47280734534_116816.gif,"",বাড়াবাড়ি ছাড়াছাড়ির কবলে শবে বরাত,সাঈদ আহমদ, ,মাওলানা জুনায়েদ বাবুনগরী,مكتبة الاتحاد (মাকতাবাতুল ইত্তিহাদ), ,3rd Published,48,বাংলাদেশ,বাংলা
বিকৃতি ও বিভ্রান্তির কবলে তারাবীহর নামায,সাঈদ আহমদ,TK. 60,TK. 36,https://rokomari.com//book/116817/bikrriti-o-bivrantir-kobole-tarabihor-namaz,https://ds.rokomari.store/rokomari110/ProductNew20190903/130X186/5b058be9eef4_116817.gif,"",বিকৃতি ও বিভ্রান্তির কবলে তারাবীহর নামায,সাঈদ আহমদ, , ,مكتبة الاتحاد (মাকতাবাতুল ইত্তিহাদ), ,"1st Published,2016",80,বাংলাদেশ,বাংলা
রহমতে আলম (সা.) এর মকবূল দুআ,আল্লামা মুফতী আব্দুস সালাম চাটগামী দা. বা.,TK. 250,TK. 150,https://rokomari.com//book/116819/rohomote-alom--sm----er-mokobul-duya,https://ds.rokomari.store/rokomari110/ProductNew20190903/130X186/c331baee5c34_116819.gif,"",রহমতে আলম (সা.) এর মকবূল দুআ,আল্লামা মুফতী আব্দুস সালাম চাটগামী দা. বা.,মাওলানা মুহাম্মাদ হিফজুর রাহমান সাহেব,মুফতী হাবীবুল্লাহ সোহাইল রায়পুরী,مكتبة الاتحاد (মাকতাবাতুল ইত্তিহাদ), ,"Edition,2013",223,বাংলাদেশ,বাংলা
আমাদের অনুপম সভ্যতা,ড. মুসতফা আস-সিবাঈ,TK. 280,TK. 168,https://rokomari.com//book/174040/amader-onupom-sovvota,https://ds.rokomari.store/rokomari110/ProductNew20190903/130X186/2909f9305_174040.jpg,"ড. মুসতফা আস-সিবাঈ রচিত ‘আমাদের অনুপম সভ্যতা’ বইটিতে উঠে এসেছে ইসলামী সভ্যতার মৌলিক দিকগুলো। মুসলিম মানস যখন ইউরোপীয় সভ্যতার প্রশংসায় হাবুডুবু খাচ্ছে। নিজের সভ্যতার কোন দিক আর সে দেখতে পায়না তখন লেখক এই বইয়ের মাধ্যমে ফুটিয়ে তুলেছেন এমন কতিপয় চিত্র যা আজো সভ্যতার ধারকদেরকে ভাবিয়ে তুলবে । অর্থনীতি , আইন , চিকিৎসা , ভাষা সাহিত্য, নীতি নৈতিকতা , উদারতা, বিচার ব্যাবস্থা যা ছিল এক কালের মুসলিম সভ্যতার বিষয়। যা কেবল শুধু মুসলিমকে নয় গোটা ইউরোপকে আলো জ্বালিয়ে ছিল । সেই সভ্যতার অবদান হারিয়ে যায়নি আজো । ইসলামী সভ্যতা এমন নেতা তৈরি করেছিল যাদের শাসনে মানবতা ধন্য হয়েছিল। যাদের ন্যাচবিচারের কথা জনতার মুখে মুখে  ছিল। পাশ্চাত্য সভ্যতার উন্নতি মানুষকে শান্তি দিতে পারেনি তাও লেখক বিভিন্ন ঘটনা তুলেধরেছেন বইটিতে।",আমাদের অনুপম সভ্যতা,ড. মুসতফা আস-সিবাঈ,মাহফূযু রহমান, ,مكتبة الاتحاد (মাকতাবাতুল ইত্তিহাদ), ,"1st Published,2018",272,বাংলাদেশ,বাংলা
তাজাল্লিয়াতে সফদার ১ম থেকে ৬ষ্ঠ খণ্ড (৬টি বইয়ের সেট),মাওলানা আমীন সফদার উখাড়ভী রহ.,"TK. 3,200","TK. 1,920",https://rokomari.com//book/184564/tajalliyate-sofodar-1st-to-6th-part--6-book-set-,https://ds.rokomari.store/rokomari110/ProductNew20190903/130X186/7060b6ec5_184564.jpg,"জীবনের চলতি পথে আমরা হাজারো জিজ্ঞাসার মুখোমুখী হই। অসংখ্য প্রশ্ন উড়ে বেড়ায় মনের আকাশে। এই প্রশ্নঘুড়ির নাটাই টেনে ধরা দায়। কখনো কখনো এসব প্রশ্ন নামক ঘুড়ি সুতো ছিড়ে হারিয়ে যায় দূর দিগন্তে। কখনো বা নানা সংশয়, সন্দেহ ও অবিশ্বাস জন্ম দেয় মনের গহীনে। এমন আশঙ্কা যদি জাগতিক বা বৈষয়িক কোনো ব্যাপারে ঘটে, তাহলে সমস্যা ততটা তীব্র হয় না; কিন্তু সংশয়, সন্দেহ ও অবিশ্বাস যদি দেখা দেয় দীনের ব্যাপারে, ধর্মের ব্যাপারে, বিপত্তি ঘটে তখনই। ঈমান নিয়ে বেঁচে থাকা তখন বড্ড দুষ্কর হয়ে পড়ে। ভাটা পড়ে যায় আমলের আগ্রহে। ফলে দুনিয়াও শেষ, আখিরাতও শূন্য। তো, এ থেকে নিস্তার পেতে হলে কী করতে হবে? ধর্মীয় নানা বিষয়ে মাথায় প্রশ্নের উদ্রেক হলে করণীয় কী? জবাব পাবো কোথায়? আর এসবের সমাধানের প্রক্রিয়াই বা কী? এক কথায় জবাব আপনাকে পড়তে হবে ‘তাজাল্লিয়াতে সফদার’। যদি বলেন কী আছে এই বইটিতে? তাহলে নৈবৃত্তিক পাল্টা প্রশ্ন করবো আপনাকে, কী নেই এই বইটিতে?  ৩ হাজার পৃষ্ঠাসমৃদ্ধ গ্রন্থটিতে হাজারো জিজ্ঞাসার জবাব দেওয়া হয়েছে কুরআন-সুন্নাহ আর যুক্তির আলোকে। সুবিশাল এই গ্রন্থটি আপনার জ্ঞানজগতকে আরও সমৃদ্ধ করবে।",তাজাল্লিয়াতে সফদার ১ম থেকে ৬ষ্ঠ খণ্ড (৬টি বইয়ের সেট),মাওলানা আমীন সফদার উখাড়ভী রহ.,"রুহুল্লাহ নোমানী,কাজী আবুল কালাম সিদ্দীক,মাওলানা আবু আফফান নূরুজ্জামান", ,مكتبة الاتحاد (মাকতাবাতুল ইত্তিহাদ), ,"1st Published,2019",3619,বাংলাদেশ,বাংলা
নবীজীর প্রিয় নামায,মুফতী আবদুল্লাহ নাজীব,TK. 180,TK. 108,https://rokomari.com//book/182517/nobijir-priyo-namaj-quran-sunnahor-aloke-namajer-songkhipto-biboron-,https://ds.rokomari.store/rokomari110/ProductNew20190903/130X186/88bf0aaac_182517.jpg,"",নবীজীর প্রিয় নামায,মুফতী আবদুল্লাহ নাজীব, , ,مكتبة الاتحاد (মাকতাবাতুল ইত্তিহাদ), ,"3rd Edition,2018",184,বাংলাদেশ,বাংলা
একটি পর্যালোচনা: ধর্ম যার যার উৎসব সবার!,মুফতী মুহাম্মাদ আল-আমীন নূরী,TK. 80,TK. 48,https://rokomari.com//book/182555/ekti-porjalochona--dhormo-jar-jar-utsob-sobar-,https://ds.rokomari.store/rokomari110/ProductNew20190903/130X186/974348eef_182555.jpg,"",একটি পর্যালোচনা: ধর্ম যার যার উৎসব সবার!,মুফতী মুহাম্মাদ আল-আমীন নূরী, ,মুফতী মাহমুদ হাসান বিন আবুল কালাম আযাদ,مكتبة الاتحاد (মাকতাবাতুল ইত্তিহাদ), ,"1st Published,2019",63,বাংলাদেশ,বাংলা
কাওয়ানিনে ছরফ,মাকতাবাতুল ইত্তিহাদ,"",TK. 200,https://rokomari.com//book/186518/kawanine-sorof,https://ds.rokomari.store/rokomari110/ProductNew20190903/130X186/book_av.png,"",কাওয়ানিনে ছরফ,মাকতাবাতুল ইত্তিহাদ, , ,Maktabatul Ettihad, , , ,Bangladesh,"Arabic,Urdu"
শবে মি‘রাজ শবে বরাত শবে কদর আশুরা ও ঈদে মীলাদুন্নবী,মুফতী নুরউদ্দিন নূরী ,TK. 140,TK. 84,https://rokomari.com//book/174046/shobe-miraj-shobe-borat-shobe-kodor-ashura-o-ede-miladunnobi,https://ds.rokomari.store/rokomari110/ProductNew20190903/130X186/9a44ed053_174046.jpg,"",শবে মি‘রাজ শবে বরাত শবে কদর আশুরা ও ঈদে মীলাদুন্নবী,মুফতী নুরউদ্দিন নূরী, ,হযরত আল্লাম মুফতী জাফর আহমদ দা. বা.,مكتبة الاتحاد (মাকতাবাতুল ইত্তিহাদ), ,"1st Published,2016",112,বাংলাদেশ,বাংলা
আদাবুল মু‘আশারাত, حكيم الامت مولانا اشرف علي تهانوي رح  ( হাকীমুল উম্মত মাওলানা আশরাফ আলী থানভী রহ.),TK. 280,TK. 168,https://rokomari.com//book/174041/adabul-muasharat--adob-muminer-vushon-,https://ds.rokomari.store/rokomari110/ProductNew20190903/130X186/cdb1b2cf8_174041.jpg,"",আদাবুল মু‘আশারাত,حكيم الامت مولانا اشرف علي تهانوي رح  ( হাকীমুল উম্মত মাওলানা আশরাফ আলী থানভী রহ.),মাওলানা আবু আফফান নূরুজ্জামান, ,مكتبة الاتحاد (মাকতাবাতুল ইত্তিহাদ), ,"1st Published,2018",240,বাংলাদেশ,বাংলা
জুহুদে  কসির,মাকতাবাতুল ইত্তিহাদ,"",TK. 160,https://rokomari.com//book/186516/juhude-kosir,https://ds.rokomari.store/rokomari110/ProductNew20190903/130X186/book_av.png,"",জুহুদে  কসির,মাকতাবাতুল ইত্তিহাদ, , ,Maktabatul Ettihad, , , ,Bangladesh,"Arabic,Urdu"
ফয়জে মনির,মাকতাবাতুল ইত্তিহাদ,"",TK. 75,https://rokomari.com//book/186517/foyze-monir,https://ds.rokomari.store/rokomari110/ProductNew20190903/130X186/book_av.png,"",ফয়জে মনির,মাকতাবাতুল ইত্তিহাদ, , ,Maktabatul Ettihad, , , ,Bangladesh,"Arabic,Urdu"
ইরশাদুস ছরফ মাআ মারিফুস ছরফ,মাকতাবাতুল ইত্তিহাদ,"",TK. 220,https://rokomari.com//book/186519/irsadus-sorof-ma-marifus-sorof,https://ds.rokomari.store/rokomari110/ProductNew20190903/130X186/book_av.png,"",ইরশাদুস ছরফ মাআ মারিফুস ছরফ,মাকতাবাতুল ইত্তিহাদ, , ,Maktabatul Ettihad, , , ,Bangladesh,"Arabic,Urdu"
ইসলামের দৃষ্টিতে গান-বাজনা,মুফতী মুহাম্মাদ আল-আমীন   ,TK. 140,TK. 84,https://rokomari.com//book/174049/islamer-drishtite-gan-bajna,https://ds.rokomari.store/rokomari110/ProductNew20190903/130X186/ac4fbbf15_174049.jpg,"",ইসলামের দৃষ্টিতে গান-বাজনা,মুফতী মুহাম্মাদ আল-আমীন, , ,مكتبة الاتحاد (মাকতাবাতুল ইত্তিহাদ), ,"1st Published,2018",94,বাংলাদেশ,বাংলা
আসহাবে রাসূলের আলোকিত জীবন,খালিদ মুহাম্মাদ,TK. 700,TK. 420,https://rokomari.com//book/182513/ashabe-rasuler-alokito-jibon,https://ds.rokomari.store/rokomari110/ProductNew20190903/130X186/ee4e23313_182513.jpg,"",আসহাবে রাসূলের আলোকিত জীবন,"খালিদ মুহাম্মাদ,আতিফ সাবির",কাজী আবুল কালাম সিদ্দীক, ,مكتبة الاتحاد (মাকতাবাতুল ইত্তিহাদ), ,"1st Published,2019",512,বাংলাদেশ,বাংলা
কুরআন সুন্নাহর আলোকে আপনার নামায-১,আল্লামা শাহ আহমদ শফী দা.বা.,TK. 480,TK. 288,https://rokomari.com//book/156040/quran-sunnahor-aloke-aponar-namaz-1,https://ds.rokomari.store/rokomari110/ProductNew20190903/130X186/b29e0c9a8_156040.jpg,"",কুরআন সুন্নাহর আলোকে আপনার নামায-১,আল্লামা শাহ আহমদ শফী দা.বা., ,মূফতী আবদুল্লাহ নাজীব,مكتبة الاتحاد (মাকতাবাতুল ইত্তিহাদ), ,"1st Published,2018",560,বাংলাদেশ,বাংলা
তাহকীকাত শরহে উর্দু মিরকাত,মুফতী জুফার আলিম বিন মুবীন আলিম কাসেমী,"",TK. 170,https://rokomari.com//book/116649/tahkikat-sharhe-urdu-mirkat,https://ds.rokomari.store/rokomari110/ProductNew20190903/130X186/da9e29123814_116649.gif,"",তাহকীকাত শরহে উর্দু মিরকাত,মুফতী জুফার আলিম বিন মুবীন আলিম কাসেমী, , ,Maktabatul Ettihad, , ,304,Bangladesh,Urdu
جنك صرف (জংগে সরফ),মাকতাবাতুল ইত্তিহাদ,"",TK. 200,https://rokomari.com//book/116672/jonge-sarf,https://ds.rokomari.store/rokomari110/ProductNew20190903/130X186/0156fcd531d4_116672.gif,"",جنك صرف (জংগে সরফ),মাকতাবাতুল ইত্তিহাদ, , ,Maktabatul Ettihad, , ,305,Bangladesh,Farsi
নাফ নদীর এপার ওপার,আব্দুল্লাহ আল মুনীর,TK. 250,TK. 150,https://rokomari.com//book/153542/naf-nodir-epar-ober,https://ds.rokomari.store/rokomari110/ProductNew20190903/130X186/c2d80e774_153542.jpg,"",নাফ নদীর এপার ওপার, , ,"আব্দুল্লাহ আল মুনীর,ওয়ালী উল্লাহ নোমানী,মাওলানা জাকারিয়া নোমান ফয়জী",مكتبة الاتحاد (মাকতাবাতুল ইত্তিহাদ), ,"1st Published,2017",256,বাংলাদেশ,বাংলা
নামাযে রফয়ে ইয়াদাইনের বিধান,রুহুল্লাহ নোমানী,TK. 300,TK. 180,https://rokomari.com//book/182521/namaje-rofoye-yeadainer-bidhan,https://ds.rokomari.store/rokomari110/ProductNew20190903/130X186/6ae5b228a_182521.jpg,"",নামাযে রফয়ে ইয়াদাইনের বিধান, , ,রুহুল্লাহ নোমানী,مكتبة الاتحاد (মাকতাবাতুল ইত্তিহাদ), ,"1st Edition,2018",273,বাংলাদেশ,বাংলা
শায়খুল হাদীস আল্লামা জুনায়েদ বাবুনগরীর: নির্বাচিত বয়ান শান্তিময় দেশ গড়ার পথ ও পাথেয়,মুফতী মুহাম্মাদ আল-আমীন নূরী,TK. 80,TK. 48,https://rokomari.com//book/182544/shaikhul-hadis-allahma-junayed-babunogorir--nirbachito-boyan-shantimoy-desh-gorar-poth-o-pathey,https://ds.rokomari.store/rokomari110/ProductNew20190903/130X186/703c957fb_182544.jpg,"",শায়খুল হাদীস আল্লামা জুনায়েদ বাবুনগরীর: নির্বাচিত বয়ান শান্তিময় দেশ গড়ার পথ ও পাথেয়, ,মুফতী মুহাম্মাদ আল-আমীন নূরী, ,مكتبة الاتحاد (মাকতাবাতুল ইত্তিহাদ), ,"1st Published,2019",56,বাংলাদেশ,বাংলা
নিদায়ে মিম্বার (১-৮ খণ্ড),মাওলানা মুহাম্মদ আসলাম শেখোপুরী,"TK. 3,600","TK. 2,160",https://rokomari.com//book/202191/nidaye-membar--1-8-khondo-,https://ds.rokomari.store/rokomari110/ProductNew20190903/130X186/6c39819ec_202191.jpg,"",নিদায়ে মিম্বার (১-৮ খণ্ড),মাওলানা মুহাম্মদ আসলাম শেখোপুরী,"মাওলানা আবুজারীর আবদুল ওয়াদুদ,মাওলানা সিরাজুল ইসলাম,মাওলানা মুহাম্মদ নুরুয্‌যামান,আবু শিফা মুহাম্মদ আবদুল কুদ্দুস", ,مكتبة الاتحاد (মাকতাবাতুল ইত্তিহাদ), , ,3136,বাংলাদেশ,বাংলা
মাওসুয়াতুন-নাহবি-ওয়াস-সরফি-ওয়াল-ইরাবি,الدكتور رافيل بريع يعقوب (ডঃ রাফেল বারীই ইয়াকুব),"",TK. 500,https://rokomari.com//book/116657/maosuyatun-nahbi-waas-sorofi-waal-irabi,https://ds.rokomari.store/rokomari110/ProductNew20190903/130X186/745c19d7a2c4_116657.gif,"",মাওসুয়াতুন-নাহবি-ওয়াস-সরফি-ওয়াল-ইরাবি,الدكتور رافيل بريع يعقوب (ডঃ রাফেল বারীই ইয়াকুব), , ,Maktabatul Ettihad, , ,722,Bangladesh,Arabic
আব কাই সুওয়ালাত আওরান কাহেল (১ম-৪র্থ খণ্ড),মাওলানা মুফতী মুহাম্মাদ আব্দুস সালাম,"TK. 1,200","TK. 1,020",https://rokomari.com//book/116660/ab-kai-suwalat-awran-kahel--1-4-volume-,https://ds.rokomari.store/rokomari110/ProductNew20190903/130X186/d1883ce52754_116660.gif,"",আব কাই সুওয়ালাত আওরান কাহেল (১ম-৪র্থ খণ্ড),মাওলানা মুফতী মুহাম্মাদ আব্দুস সালাম, , ,Maktabatul Ettihad, , ,504,Bangladesh,Urdu
জামীউল গুমুজ শরহে কাফীয়াহ ,মুহাম্মদ হানীফ খান,"",TK. 300,https://rokomari.com//book/203138/jamiul-ghumooz-sharah-kafia,https://ds.rokomari.store/rokomari110/ProductNew20190903/130X186/book_av.png,"",জামীউল গুমুজ শরহে কাফীয়াহ,"মুহাম্মদ হানীফ খান,আবদুন নাবী উসমানী", , ,Maktabatul Ettihad, , , ,Bangladesh,"Arabic,Urdu"
শাইখুল হাদীস আল্লামা জুনায়েদ বাবুনগরী’র: নির্বাচিত বয়ান- ১,মুফতী মুহাম্মাদ আল-আমীন নূরী,TK. 200,TK. 120,https://rokomari.com//book/182526/shaikhul-hadis-allahma-junayed-babunogorir--nirbachito-boyan--1,https://ds.rokomari.store/rokomari110/ProductNew20190903/130X186/c9de19747_182526.jpg,"",শাইখুল হাদীস আল্লামা জুনায়েদ বাবুনগরী’র: নির্বাচিত বয়ান- ১, ,মুফতী মুহাম্মাদ আল-আমীন নূরী,মুফতী মাহমুদ হাসান বিন আবুল কালাম আযাদ,مكتبة الاتحاد (মাকতাবাতুল ইত্তিহাদ), ,"1st Published,2019",144,বাংলাদেশ,বাংলা
শায়খুল হাদীস আল্লামা জুনায়েদ বাবুনগরীর: নির্বাচিত বয়ান দ্বীনের জন্য সীমাহীন ভালোবাসা,মুফতী মুহাম্মাদ আল-আমীন নূরী,TK. 70,TK. 42,https://rokomari.com//book/182548/shaikhul-hadis-allahma-junayed-babunogorir--nirbachito-boyan-dwiner-jonno-simahin-valobasha,https://ds.rokomari.store/rokomari110/ProductNew20190903/130X186/60e9c9ee7_182548.jpg,"",শায়খুল হাদীস আল্লামা জুনায়েদ বাবুনগরীর: নির্বাচিত বয়ান দ্বীনের জন্য সীমাহীন ভালোবাসা, ,মুফতী মুহাম্মাদ আল-আমীন নূরী, ,مكتبة الاتحاد (মাকতাবাতুল ইত্তিহাদ), ,"1st Published,2019",48,বাংলাদেশ,বাংলা
اسلام كا اقتصادى نظام (ইসলাম কা ইকতেসাদী নেজাম),মাওলানা মুহাম্মাদ হিফজুর রাহমান সাহেব,"",TK. 300,https://rokomari.com//book/116671/islam-ka-iktesadi-nejam,https://ds.rokomari.store/rokomari110/ProductNew20190903/130X186/f740e1e409b4_116671.gif,"",اسلام كا اقتصادى نظام (ইসলাম কা ইকতেসাদী নেজাম),মাওলানা মুহাম্মাদ হিফজুর রাহমান সাহেব, , ,Maktabatul Ettihad, , ,352,Bangladesh,Urdu
رياض الفقه شرح اردو مالا بد منه (রিয়াদুল ফিকহ শরাহ উর্দু মাল বুদ্দা মিনহু),حضرة مولانا مفتي محمد علي صاحب (হজরত মাওলানা মুফতী মুহাম্মাদ আলী সাহেব),"",TK. 95,https://rokomari.com//book/102764/riadul-fiqh-sharah-urdu-mala-budda-minhu,https://ds.rokomari.store/rokomari110/ProductNew20190903/130X186/7043be206_102764.jpg,"",رياض الفقه شرح اردو مالا بد منه (রিয়াদুল ফিকহ শরাহ উর্দু মাল বুদ্দা মিনহু),حضرة مولانا مفتي محمد علي صاحب (হজরত মাওলানা মুফতী মুহাম্মাদ আলী সাহেব), , ,Maktabatul Ettihad, , ,208,Bangladesh,Urdu
বিতর নামায ও রাকাত সংখ্যা,আল্লামা মুফতী আব্দুস সালাম চাটগামী দা. বা.,TK. 30,TK. 18,https://rokomari.com//book/174042/bitor-namaz-o-rakat-songkha,https://ds.rokomari.store/rokomari110/ProductNew20190903/130X186/4425c6073_174042.jpg,"",বিতর নামায ও রাকাত সংখ্যা,"আল্লামা মুফতী আব্দুস সালাম চাটগামী দা. বা.,হাফেয মুফতী অকিল উদ্দিন যশোরী", ,আল্লামা মুফতী আব্দুস সালাম চাটগামী দা. বা.,مكتبة الاتحاد (মাকতাবাতুল ইত্তিহাদ), ,"2nd Edition,2015",32,বাংলাদেশ,বাংলা
কুরআন সুন্নাহর আলোকে: মহানবী(সাঃ) নূর ও বশর,আল্লামা হাফেয মুফতি হুমায়ুন কবীর উখিয়ভী,TK. 80,TK. 48,https://rokomari.com//book/182552/quran-sunnahor-aloke--mohanobi-sm---nur-o-boshor,https://ds.rokomari.store/rokomari110/ProductNew20190903/130X186/dad54c6d9_182552.jpg,"",কুরআন সুন্নাহর আলোকে: মহানবী(সাঃ) নূর ও বশর,আল্লামা হাফেয মুফতি হুমায়ুন কবীর উখিয়ভী, , ,مكتبة الاتحاد (মাকতাবাতুল ইত্তিহাদ), ,"2nd Published,2015",64,বাংলাদেশ,বাংলা
