Title,Author,Original Price,Discounted Price,URL,Image,Summary,Book_Title,Book_Author,Translator,Editor,Publisher,ISBN,Edition,Number Of Pages,Country,Language
الناسخ والمنسوخ في القرآن الكريم (আন নাসিখ ওয়াল মানসুখ ফিল কুরানিল কারীম ),মাকতাবাতুল ফাতাহ বাংলাদেশ,"",TK. 450,https://rokomari.com//book/126517/an-nasikh-wal-mansukh-fil-quranil-karim,https://ds.rokomari.store/rokomari110/ProductNew20190903/130X186/book_av.png,"",الناسخ والمنسوخ في القرآن الكريم (আন নাসিখ ওয়াল মানসুখ ফিল কুরানিল কারীম ),মাকতাবাতুল ফাতাহ বাংলাদেশ, , ,"Maktabatul Asaria,Boitut", , , ,Lebanon,Arabic
কাশফুল খাফা ওয়া মুযীলুল ইলবাস আম্মাশতাহারা মিনাল আহাদীসি আলা আলসিনাতিন নাস (১-২ খণ্ড),মাকতাবাতুল ফাতাহ বাংলাদেশ,"","TK. 1,800",https://rokomari.com//book/126595/kashful-khafa-wa-muyulul-ilbas-ammashtahara-minal--ahadisa-ala-alsinatin-nas--1-2-vol-,https://ds.rokomari.store/rokomari110/ProductNew20190903/130X186/book_av.png,"",কাশফুল খাফা ওয়া মুযীলুল ইলবাস আম্মাশতাহারা মিনাল আহাদীসি আলা আলসিনাতিন নাস (১-২ খণ্ড),মাকতাবাতুল ফাতাহ বাংলাদেশ, , ,"Maktabatul Asaria,Boitut", , , ,Lebanon,Arabic
حياتي (হায়াতী (১-৪ খণ্ড),মাকতাবাতুল ফাতাহ বাংলাদেশ,"",TK. 350,https://rokomari.com//book/127001/hayati--1-4-vol-,https://ds.rokomari.store/rokomari110/ProductNew20190903/130X186/book_av.png,"",حياتي (হায়াতী (১-৪ খণ্ড),মাকতাবাতুল ফাতাহ বাংলাদেশ, , ,"Maktabatul Asaria,Boitut", , , ,Lebanon,Arabic
النهاية في غريب الحديث والأثر  (আন নিহায়া ফী গারীবিল হাদীসি ওয়াল আসার ),মাকতাবাতুল ফাতাহ বাংলাদেশ,"","TK. 3,000",https://rokomari.com//book/126585/an-nihaya-fi-garibil-hadisi-wal-asar,https://ds.rokomari.store/rokomari110/ProductNew20190903/130X186/book_av.png,"",النهاية في غريب الحديث والأثر  (আন নিহায়া ফী গারীবিল হাদীসি ওয়াল আসার ),মাকতাবাতুল ফাতাহ বাংলাদেশ, , ,"Maktabatul Asaria,Boitut", , , ,Lebanon,Arabic
تهذيب الكتمال في أسماء الرجال (তাহযীবুল কামাল ফী আসমাইর রিজাল (১-২২ খণ্ড),মাকতাবাতুল ফাতাহ বাংলাদেশ,"","TK. 20,000",https://rokomari.com//book/126910/tahjibul-kamal-fi-asmair-rijal--1-22-vol-,https://ds.rokomari.store/rokomari110/ProductNew20190903/130X186/book_av.png,"",تهذيب الكتمال في أسماء الرجال (তাহযীবুল কামাল ফী আসমাইর রিজাল (১-২২ খণ্ড),মাকতাবাতুল ফাতাহ বাংলাদেশ, , ,"Maktabatul Asaria,Boitut", , , ,Lebanon,Arabic
আল ইস্তিযকারুল জামে লিমাযাহিবি ফুকাহায়িল আমসার ওয়া ওলামায়িল আকতার (১-৭ খণ্ড),মাকতাবাতুল ফাতাহ বাংলাদেশ,"","TK. 9,500",https://rokomari.com//book/126933/al-istijkarul-jame-limajhibi-fuqahil-amsar-wa-olamayel-akhtar--1-7-vol-,https://ds.rokomari.store/rokomari110/ProductNew20190903/130X186/book_av.png,"",আল ইস্তিযকারুল জামে লিমাযাহিবি ফুকাহায়িল আমসার ওয়া ওলামায়িল আকতার (১-৭ খণ্ড),মাকতাবাতুল ফাতাহ বাংলাদেশ, , ,"Maktabatul Asaria,Boitut", , , ,Lebanon,Arabic
الادب المفرد (আল আদাবুল মুফরাদ),ইমাম মুহাম্মদ ইবনে ইসমাইল বোখারী (র),"",TK. 350,https://rokomari.com//book/126596/al-adabul-mufrad,https://ds.rokomari.store/rokomari110/ProductNew20190903/130X186/book_av.png,"",الادب المفرد (আল আদাবুল মুফরাদ),ইমাম মুহাম্মদ ইবনে ইসমাইল বোখারী (র), , ,"Maktabatul Asaria,Boitut", , , ,Egypt,Arabic
