Title,Author,Original Price,Discounted Price,URL,Image,Summary,Book_Title,Book_Author,Translator,Editor,Publisher,ISBN,Edition,Number Of Pages,Country,Language
মাহবুব নবীর (সা.) মাহবুব সুন্নাত,মাওলানা হাকীম মুহাম্মদ আখতার ছাহেব (রহ.),TK. 100,TK. 60,https://rokomari.com//book/201583/msjbub-nobir---sm---mahbub-sunnat,https://ds.rokomari.store/rokomari110/ProductNew20190903/130X186/eb540eac4_201583.jpg,"মাহবুব নবীর সা. মাহবুব সুন্নাত মূলত বিশ্ববিখ্যাত বুযুর্গ ‎করাচীর হযরত আরিফ-বিল্লাহ মাওলানা শাহ মুহাম্মাদ হাকীম ‎আখতার রহ.-এর রচিত। প্রিয় নবী সাল্লাল্লাহু আলাইহি ওয়া ‎সাল্লামের সুন্নাতের উপর এটি একটি মাকবুল ও জনপ্রিয় ‎কিতাব। বিভিন্ন ভাষায় এটি অনূদিত হয়েছে। বক্ষ্যমাণ গ্রন্থটি ‎এর ইংরেজী সংস্করণ Beautiful Sunnat of the Beloved Prophet-‎-এর বাংলা অনুবাদ। এ কিতাবে একজন ‎মুসলমানের সকালে ঘুম থেকে উঠে আবার রাতে বিছানায় ‎যাওয়া পর্যন্ত যাবতীয় কাজের সুন্নাত তরীকা উল্লেখ করা ‎হয়েছে। এর পাশাপাশি সন্তান, বিবাহ, সফর, মৃত্যু ইত্যাদি ‎প্রসঙ্গে আরও কিছু প্রয়োজনীয় সুন্নাত বর্ণনা করা হয়েছে। ‎

‘নকশে কদম নবী কে হ্যায় জান্নাত কে রাস্তে বা আল্লাহ সে ‎মিলাতে হ্যায় সুন্নত কে রাস্তে (নবীর সুন্নাতই জান্নাতে নিয়ে ‎যাবে, এ সুন্নাতই তোমাকে আল্লাহর সঙ্গে সাক্ষাত করিয়ে ‎দিবে)’―করাচীর হযরত রহ.-এর কবিতায় ফুটে উঠেছে, সুন্নাত ‎অনুসরণের মাধ্যমেই লুকায়িত আছে মুসলমানদের দুনিয়া ও ‎আখেরাতের সফলতা। আল্লাহ তাআলা আমাদের এসব ‎সুন্নাতের উপর আমল করার তাওফীক নসীব করুন।  ‎",মাহবুব নবীর (সা.) মাহবুব সুন্নাত,মাওলানা হাকীম মুহাম্মদ আখতার ছাহেব (রহ.),মোঃ আজিজুল বারী, ,মাকতাবাতুল ফুরকান,9789849432326,"1st Published,2020",64,বাংলাদেশ,বাংলা
জীবন ও কর্ম: আবু বকর আস-সিদ্দীক রাযি. (১ম খণ্ড) - ১ম খণ্ড,ডঃ আলী মুহাম্মাদ সাল্লাবী,TK. 600,TK. 360,https://rokomari.com//book/146808/jibon-o-kormo--abu-bakr-as-siddeeq--ra----1st-part-,https://ds.rokomari.store/rokomari110/ProductNew20190903/130X186/e906c4345_146808.jpg,"""জীবন ও কর্ম: আবু বকর আস-সিদ্দীক রাযি. (১ম খণ্ড)"" বইয়ের সংক্ষিপ্ত কথা: 

ইসলাম গ্রহণ করার দিন থেকে আমতা আবু বকর রা. জীবনের প্রতিটি ক্ষেত্রে অন্য সকল সাহাবী থেকে অগ্রগামী ছিলেন। রাসূল সা. এর জীবদ্দশায় যুদ্ধক্ষেত্রে তিনি ছিলেন একজন আদর্শ সৈনিক আর রাসূল সা.-এর মৃত্যুর পরও তিনি একইভাবে ইসলামের উপর দৃঢ় থাকেন এবং আল্লাহর অনুগ্রহে মুসলিম জাতিকে একতাবদ্ধ রাখতে সক্ষম হন। তাকে অন্যান্য সাহাবীরা যেখানে উসামা রা.- এর সৈন্যদলকে ফিরিয়ে আনার পরামর্শ দিচ্ছিলেন, সেখানে তিনি সঠিক ও দ্ব্যর্থহীনভাবে রাসুল সা. এর ইচ্ছাকে অনুসরণ করে সেটা অব্যাহত রাখেন। যখন মুসলমানরা যাকাত দিতে অস্বীকার করল এবং যখন ভণ্ড নবীরা পুরাে মুসলিম জাতির জন্য হুমকি হয়ে দাড়াল, আবু বকর রা. তখন খুবই কাটতার পরিচয় দেন এবং তাদের বিরুদ্ধে চরম আক্রমণাত্বক ব্যবস্থা গ্রহণ করেন। এরকম আরও অসংখ্য প্রাপ্তিতে সমৃদ্ধ ছিল আবু বকর রা.-এর জীবন। আমি সেগুলােকে পরিষ্কার এবং ক্রমানুসারে বর্ণনা করার চেষ্টা করেছি। তবে আমার মূল চেষ্টা ছিল এটা বর্ণনা করা যে, একজন মুসলমান এবং শাসক হিসেবে আবু বকর রা. কতৃক গৃহীত নীতিসমূহ কিভাবে একটি শক্তিশালী, দৃঢ় এবং উন্নয়নশীল দেশ প্রতিষ্ঠায় সাহায্য করে- যা মদীনা থেকে আরব উপত্যকা ছাড়িয়ে বহির্বিশ্বে বিস্তার লাভ করে।",জীবন ও কর্ম: আবু বকর আস-সিদ্দীক রাযি. (১ম খণ্ড) - ১ম খণ্ড,ডঃ আলী মুহাম্মাদ সাল্লাবী, ,মাওলানা মুহাম্মাদ আবু বকর,মাকতাবাতুল ফুরকান,9789849117636,"1st Published,2015",407,বাংলাদেশ,বাংলা
জীবন ও কর্ম: উমর ইবনুল খাত্তাব-১ম খণ্ড,ডঃ আলী মুহাম্মাদ সাল্লাবী,TK. 800,TK. 480,https://rokomari.com//book/170451/jibon-o-kormo--umor-ebnul-khattab-1st-part,https://ds.rokomari.store/rokomari110/ProductNew20190903/130X186/ce2e1de0a_170451.jpg,"""জীবন ও কর্ম: উমর ইবনুল খাত্তাব-১ম খণ্ড"" বইয়ের পিছনের কভারের কথা:
আমরা বর্তমানে এক বিশৃঙ্খল পৃথিবীতে বসবাস করছি। তবে তা উমর রা.-এর সমকালীন যুগের বিশৃঙ্খলতা থেকে বেশি নয়। উমর রা.-এর জীবন শুরু হয়েছিল। জাহেলিয়াতের যুগে এবং শেষ হয়েছিল ইসলামের স্বর্ণযুগে। শিক্ষা গ্রহণের জন্য ইসলামের দ্বিতীয় খলীফার জীবন-ইতিহাস এক অমূল্য সম্পদ। তিনি এমন সব চ্যালেঞ্জের সম্মুখীন হয়েছিলেন যেগুলাে এর আগে কাউকে মােকাবেলা করতে হয়নি। আর তিনি এসব চ্যালেঞ্জ ইসলামের সঠিক মূল্যবােধ এবং শরীয়তের সীমারেখায় থেকেই সফলভাবে মােকাবেলা করতে সমর্থ হয়েছিলেন।
যারা এ সমস্যাসঙ্কল পরিবেশে জাতিকে নেতত্ব দিতে চান তাদের জন্য এ গ্রন্থটিতে একজন আদর্শ মুসলিম নেতার দৃষ্টান্ত উপস্থাপন করা হয়েছে যিনি তার অধীনস্থ সৈন্য, মহিলা, শিশু, অমুসলিম জাতি-গােষ্ঠি এবং এমনকি পশু-পাখিসহ সকলের ব্যাপারে আল্লাহর সামনে জবাবদিহিতার ভয় করতেন। উমর রা. এমন একজন সফল ও দূরদর্শী নেতা ছিলেন যিনি রাষ্ট্রের সকল বিষয়ে খোঁজখবর রাখতেন এবং যে কোনাে কঠিন সিদ্ধান্ত নেওয়ার পূর্বে সমাজের বিজ্ঞ ও দক্ষ ব্যক্তিদের সঙ্গে পরামর্শ করতেন।
অন্য সকলের জন্য এ গ্রন্থ ইসলামী ইতিহাসের এক চমকপ্রদ এবং তাৎপর্যপূর্ণ অংশকে জানার পথকে উন্মুক্ত করবে। একই সাথে এটি এক গুরুত্বপূর্ণ শিক্ষাকেও তুলে ধরবে যে, প্রাচুর্য কিংবা অর্থ-বিত্তের মাধ্যমে আমাদের শক্তি ও সাহস অর্জিত হয় না, বরং সেটি আসে আল্লাহর নিকট পরিপূর্ণভাবে নিজেকে সমর্পণ এবং ইসলামের রজ্জুকে দৃঢ়ভাবে আঁকড়ে ধরার মাধ্যমে ।",জীবন ও কর্ম: উমর ইবনুল খাত্তাব-১ম খণ্ড,ডঃ আলী মুহাম্মাদ সাল্লাবী,উম্মে মুহাম্মাদ আমিনাহ আস সামি,মাওলানা জাবির মুহাম্মদ হাবীব,মাকতাবাতুল ফুরকান,9789849229186,"1st Published,2018",560,বাংলাদেশ,বাংলা
জীবন ও কর্ম: আবু বকর আস-সিদ্দীক রাযি. (২য় খণ্ড),মুহাম্মদ আদম আলী,TK. 600,TK. 360,https://rokomari.com//book/177371/jibon-o-kormo--abu-bakr-as-siddeeq--ra----2nd-part-,https://ds.rokomari.store/rokomari110/ProductNew20190903/130X186/6f39fea71_177371.jpg,"""জীবন ও কর্ম: আবু বকর আস-সিদ্দীক রাযি. (২য় খণ্ড)"" বইয়ের সংক্ষিপ্ত কথা:
ইসলাম গ্রহণ করার দিন থেকে আমতা আবু বকর রা. জীবনের প্রতিটি ক্ষেত্রে অন্য সকল সাহাবী থেকে অগ্রগামী ছিলেন। রাসূল সা. এর জীবদ্দশায় যুদ্ধক্ষেত্রে তিনি ছিলেন একজন আদর্শ সৈনিক আর রাসূল সা.-এর মৃত্যুর পরও তিনি একইভাবে ইসলামের উপর দৃঢ় থাকেন এবং আল্লাহর অনুগ্রহে মুসলিম জাতিকে একতাবদ্ধ রাখতে সক্ষম হন। তাকে অন্যান্য সাহাবীরা যেখানে উসামা রা.- এর সৈন্যদলকে ফিরিয়ে আনার পরামর্শ দিচ্ছিলেন, সেখানে তিনি সঠিক ও দ্ব্যর্থহীনভাবে রাসুল সা. এর ইচ্ছাকে অনুসরণ করে সেটা অব্যাহত রাখেন। যখন মুসলমানরা যাকাত দিতে অস্বীকার করল এবং যখন ভণ্ড নবীরা পুরাে মুসলিম জাতির জন্য হুমকি হয়ে দাড়াল, আবু বকর রা. তখন খুবই কাটতার পরিচয় দেন এবং তাদের বিরুদ্ধে চরম আক্রমণাত্বক ব্যবস্থা গ্রহণ করেন। এরকম আরও অসংখ্য প্রাপ্তিতে সমৃদ্ধ ছিল আবু বকর রা.-এর জীবন। আমি সেগুলােকে পরিষ্কার এবং ক্রমানুসারে বর্ণনা করার চেষ্টা করেছি। তবে আমার মূল চেষ্টা ছিল এটা বর্ণনা করা যে, একজন মুসলমান এবং শাসক হিসেবে আবু বকর রা. কতৃক গৃহীত নীতিসমূহ কিভাবে একটি শক্তিশালী, দৃঢ় এবং উন্নয়নশীল দেশ প্রতিষ্ঠায় সাহায্য করে- যা মদীনা থেকে আরব উপত্যকা ছাড়িয়ে বহির্বিশ্বে বিস্তার লাভ করে।",জীবন ও কর্ম: আবু বকর আস-সিদ্দীক রাযি. (২য় খণ্ড),"মুহাম্মদ আদম আলী,ডঃ আলী মুহাম্মাদ সাল্লাবী",মুহাম্মদ আদম আলী,মাওলানা মুহাম্মাদ আবু বকর,মাকতাবাতুল ফুরকান,9789849117674,"2nd Published,2018",437,বাংলাদেশ,বাংলা
পবিত্র কুরআনের ভাষা শিক্ষা,প্রফেসর মুহাম্মাদ হামীদুর রহমান,TK. 240,TK. 144,https://rokomari.com//book/146801/pobitro-quraner-bhasha-shikkha,https://ds.rokomari.store/rokomari110/ProductNew20190903/130X186/30c9b832a364_146801.jpg,"""পবিত্র কুরআনের ভাষা শিক্ষা"" বইয়ের সংক্ষিপ্ত কথা: 

কুরআন মাজীদ আল্লাহ তাআলার পক্ষ থেকে বান্দার সঙ্গে কথােপকথন, আসমানী চিঠি। এ চিঠির বক্তব্য প্রত্যেক মুসলমানেরই বােঝা উচিত। এমনিতে উলামায়ে কেরাম বয়ান, নসিহত এবং কিতাবাদির মাধ্যমে সেটা আমাদের মতো সাধারণ শিক্ষিতদের বােঝানাের চেষ্টা করে যাচ্ছেন। তবে এতে সাধারণ মুসলমানদের দায়িত্ব শেষ হয়ে যায় না। কুরআন মাজীদ শুদ্ধ করে তিলাওয়াত করার সময় যদি এর সাদাসিধে অর্থও জানা থাকে, তবে ইবাদত ও আমলে ঐশ্বরিক অনুভূতি লাভ করা যায়। এ অনুভূতির মূল্য অনেক। এ কাজকে সহজ করার জন্য এ কিতাবটি সহায়ক হবে ইনশাআল্লাহ। বর্তমান সময়ের অন্যতম দ্বীনি ব্যক্তিত্ব হযরত প্রফেসর মুহাম্মাদ হামীদুর রহমান সাহেব সামাত বারাকাতুহুমের নির্দেশনায় কিতাবটি রচনা করা হয়েছে। এতে এমন কোন আরবী শব্দ কিংবা উদাহরণ ব্যবহার করা হয়নি যা কুরআন মাজীদে নেই। এখানে আরবী ব্যাকরণ সম্পর্কে জ্ঞান লাভ করার পাশাপাশি সরাসরি কুরআন মাজীদের আয়াতে তার প্রতিফলন দেখে অনির্বচনীয় আনন্দ আপনাকে আপুত করবে। আরবী ব্যাকরণের কঠিন পরিভাষা পরিহার করে বাংলা বা ইংরেজির সহজবােধ্য শব্দ ব্যবহার করা হয়েছে। এ কিতাবে মােট দু’শর বেশি আয়াত সন্নিবেশিত করা হয়েছে। সবশেষে সংক্ষিপ্ত একটি শব্দকোষ দেয়া হয়েছে যা আপনাকে শব্দ ভাণ্ডার বৃদ্ধিতে উদ্বুদ্ধ করবে। এটি ব্যতিক্রমী প্রয়াস। আশা করি সব শ্রেণির পাঠকরাই এতে উপকৃত হবেন ইনশাআল্লাহ।",পবিত্র কুরআনের ভাষা শিক্ষা, , ,প্রফেসর মুহাম্মাদ হামীদুর রহমান,মাকতাবাতুল ফুরকান,9789849229100,"1st Published,2017",192,বাংলাদেশ,বাংলা
জীবন ও কর্ম: উমর ইবনুল খাত্তাব-২য় খণ্ড,ডঃ আলী মুহাম্মাদ সাল্লাবী,TK. 600,TK. 360,https://rokomari.com//book/177232/jibon-o-kormo--umor-ebnul-khattab-2nd-part,https://ds.rokomari.store/rokomari110/ProductNew20190903/130X186/2b7d83bb1_177232.jpg,"""জীবন ও কর্ম: উমর ইবনুল খাত্তাব-২য় খণ্ড"" বইয়ের পিছনের কভার:

আমরা বর্তমানে এক বিশৃঙ্খল পৃথিবীতে বসবাস করছি। তবে তা উমর রা.-এর সমকালীন যুগের বিশৃঙ্খলতা থেকে বেশি নয়। উমর রা.-এর জীবন শুরু হয়েছিল। জাহেলিয়াতের যুগে এবং শেষ হয়েছিল ইসলামের স্বর্ণযুগে। শিক্ষা গ্রহণের জন্য ইসলামের দ্বিতীয় খলীফার জীবন-ইতিহাস এক অমূল্য সম্পদ। তিনি এমন সব চ্যালেঞ্জের সম্মুখীন হয়েছিলেন যেগুলাে এর আগে কাউকে মােকাবেলা করতে হয়নি। আর তিনি এসব চ্যালেঞ্জ ইসলামের সঠিক মূল্যবােধ এবং শরীয়তের সীমারেখায় থেকেই সফলভাবে মােকাবেলা করতে সমর্থ হয়েছিলেন।
যারা এ সমস্যাসঙ্কল পরিবেশে জাতিকে নেতত্ব দিতে চান তাদের জন্য এ গ্রন্থটিতে একজন আদর্শ মুসলিম নেতার দৃষ্টান্ত উপস্থাপন করা হয়েছে যিনি তার অধীনস্থ সৈন্য, মহিলা, শিশু, অমুসলিম জাতি-গােষ্ঠি এবং এমনকি পশু-পাখিসহ সকলের ব্যাপারে আল্লাহর সামনে জবাবদিহিতার ভয় করতেন। উমর রা. এমন একজন সফল ও দূরদর্শী নেতা ছিলেন যিনি রাষ্ট্রের সকল বিষয়ে খোঁজখবর রাখতেন এবং যে কোনাে কঠিন সিদ্ধান্ত নেওয়ার পূর্বে সমাজের বিজ্ঞ ও দক্ষ ব্যক্তিদের সঙ্গে পরামর্শ করতেন।
অন্য সকলের জন্য এ গ্রন্থ ইসলামী ইতিহাসের এক চমকপ্রদ এবং তাৎপর্যপূর্ণ অংশকে জানার পথকে উন্মুক্ত করবে। একই সাথে এটি এক গুরুত্বপূর্ণ শিক্ষাকেও তুলে ধরবে যে, প্রাচুর্য কিংবা অর্থ-বিত্তের মাধ্যমে আমাদের শক্তি ও সাহস অর্জিত হয় না, বরং সেটি আসে আল্লাহর নিকট পরিপূর্ণভাবে নিজেকে সমর্পণ এবং ইসলামের রজ্জুকে দৃঢ়ভাবে আঁকড়ে ধরার মাধ্যমে ।",জীবন ও কর্ম: উমর ইবনুল খাত্তাব-২য় খণ্ড,ডঃ আলী মুহাম্মাদ সাল্লাবী,উম্মে মুহাম্মাদ আমিনাহ আস সামি,মাওলানা জাবির মুহাম্মদ হাবীব,মাকতাবাতুল ফুরকান,9789849229185,"1st Published,2018",464,বাংলাদেশ,বাংলা
