Title,Author,Original Price,Discounted Price,URL,Image,Summary,Book_Title,Book_Author,Translator,Editor,Publisher,ISBN,Edition,Number Of Pages,Country,Language
Eleventh Hour CISSP®: Study Guide,সেথ মিজেনার,"TK. 2,943","",https://rokomari.com//book/166907/eleventh-hour-cissp---study-guide,https://ds.rokomari.store/rokomari110/ProductNew20190903/130X186/ca13a9b2b_166907.jpg,"",Eleventh Hour CISSP®: Study Guide,"Seth Misenar,Eric Conrad", , ,Syngress,9780128112489,"3rd edition,2016",238,India,English
"Applied Network Security Monitoring: Collection, Detection, and Analysis",জাসন স্মিথ,"TK. 5,624","",https://rokomari.com//book/174829/applied-network-security-monitoring--collection--detection--and-analysis,https://ds.rokomari.store/rokomari110/ProductNew20190903/130X186/9c0068ab1_174829.jpg,"","Applied Network Security Monitoring: Collection,Detection,and Analysis","Jason Smith,Chris Sanders", , ,Syngress,9780124172081,"1st Edition,2015",496,United Kingdom,English
Cloud Storage Forensics,রেমন্ড চু,"TK. 10,156","",https://rokomari.com//book/160031/cloud-storage-forensics,https://ds.rokomari.store/rokomari110/ProductNew20190903/130X186/a7e427592_160031.jpg,"",Cloud Storage Forensics,"Raymond Choo,Darren Quick,Ben Martini", , ,Syngress,9780124199705,"1st edition,2014",208,India,English
Information Hiding in Speech Signals for Secure Communication,ঝিজুন উ,"TK. 7,625","",https://rokomari.com//book/160664/information-hiding-in-speech-signals-for-secure-communication,https://ds.rokomari.store/rokomari110/ProductNew20190903/130X186/415b26ec5_160664.jpg,"",Information Hiding in Speech Signals for Secure Communication,Zhijun Wu, , ,Syngress,9780128013281,"1st edition,2014",200,India,English
The Basics of Hacking and Penetration Testing: Ethical Hacking and Penetration Testing Made Easy,প্যাট্রিক এনগেব্রিটসন,"TK. 3,832","",https://rokomari.com//book/134249/the-basics-of-hacking-and-penetration-testing--ethical-hacking-and-penetration-testing-made-easy,https://ds.rokomari.store/rokomari110/ProductNew20190903/130X186/abe61d802164_134249.jpg,"",The Basics of Hacking and Penetration Testing: Ethical Hacking and Penetration Testing Made Easy,Patrick Engebretson, , ,Syngress,9780124116443,"2nd edition,2013",225,India,English
