Title,Author,Original Price,Discounted Price,URL,Image,Summary,Book_Title,Book_Author,Translator,Editor,Publisher,ISBN,Edition,Number Of Pages,Country,Language
"মনের দুয়ার খোল, বিশাল পৃথিবীটা দেখ",মাসুদুর রহমান,TK. 200,TK. 176,https://rokomari.com//book/184724/moner-duyar-kholo--bishal-prithibita-dekho--bishwokhyato-toyotar-swopnodroshta-sakici-toyodor-golpo-,https://ds.rokomari.store/rokomari110/ProductNew20190903/130X186/e98b9879d_184724.jpg,"বিখ্যাত টয়োটা (Toyota) কর্পোরেশণের স্বপ্নদর্শী …“সাকিচি টয়োডার” বিস্ময়কর জীবনের গল্প
জাপানের ইতিহাসের সেরা দশ জন উদ্ভাবকের একজন। যাঁর লালিত স্বপ্নের উপর দাঁড়িয়ে আছে আজকের
বিশ্বখ্যাত টয়োটা (Toyota) গ্রুপ। তাঁর বিস্ময়কর জীবনের গল্প নিয়ে জাপানিজ লেখক Minoru Nashuda
এর লেখা বই “OPEN YOUR MIND, AND LOOK AT THE GREAT WORLD OUTSIDE” জাপানের এক
নম্বর মোটিভেশনাল বই হিসাবে পাঠকের কাছে সমাদৃত। 
মূল লেখক ও টয়োডা মেমোরিয়াল হাউজের অনুমোদন নিয়ে প্রথমবারের মত বাংলা ভাষায় বইটি যৌথভাবে
অনুবাদ করেছেন আশিনুর রেজা ও মাসুদুর রহমান।","মনের দুয়ার খোল,বিশাল পৃথিবীটা দেখ", ,"মাসুদুর রহমান,আশিনুর রেজা", ,সোসাইটি ফর ইনোভেশন এন্ড সাসটেইনেবল ডেভেলপমেন্ট (এসআইএসডি),97899059264,"1st Published,2019",60,বাংলাদেশ,বাংলা
