Title,Author,Original Price,Discounted Price,URL,Image,Summary,Book_Title,Book_Author,Translator,Editor,Publisher,ISBN,Edition,Number Of Pages,Country,Language
"জামিন, জবানবন্দি, জেরা ও যুক্তিতর্কের কলাকৌশল ",মোঃ আবুল কালাম আজাদ,"TK. 1,100",TK. 660,https://rokomari.com//book/47659/jamin--jobanbondi--jera-o-jhuktitorker-kolakoushol,https://ds.rokomari.store/rokomari110/ProductNew20190903/130X186/7821d9f9c_47659.jpg,"","জামিন,জবানবন্দি,জেরা ও যুক্তিতর্কের কলাকৌশল",মোঃ আবুল কালাম আজাদ, , ,লিপি ‘ল’ বুক হাউজ, ,"11th Edition,2019",794,বাংলাদেশ,বাংলা
ক্রিমিনাল কেস্ ড্রাফটিং এন্ড প্র্যাকটিস,মোঃ আবুল কালাম আজাদ,TK. 900,TK. 630,https://rokomari.com//book/47661/criminal-case-drafting-and-practice,https://ds.rokomari.store/rokomari110/ProductNew20190903/130X186/img_47661.gif,"",ক্রিমিনাল কেস্ ড্রাফটিং এন্ড প্র্যাকটিস,মোঃ আবুল কালাম আজাদ, , ,লিপি ‘ল’ বুক হাউজ,0, , ,বাংলাদেশ,বাংলা
"অর্পিত সম্পত্তি প্রত্যর্পণ আইন, ২০০১ ও অর্পিত সম্পত্তি প্রত্যর্পণ বিধিমালা, ২০১২",মোঃ আবুল কালাম আজাদ,TK. 350,TK. 210,https://rokomari.com//book/104578/orpoto-somporti-protarpon-ain--2001-oorpoto-somporti-protarpon-bhidimala-2012,https://ds.rokomari.store/rokomari110/ProductNew20190903/130X186/rokimg_20151014_104578.gif,"","অর্পিত সম্পত্তি প্রত্যর্পণ আইন,২০০১ ও অর্পিত সম্পত্তি প্রত্যর্পণ বিধিমালা,২০১২",মোঃ আবুল কালাম আজাদ, , ,লিপি ‘ল’ বুক হাউজ, ,"2nd Edition,2011",206,বাংলাদেশ,বাংলা
নামজারীর বিধানসহ জমিজমা সংক্রান্ত আইন ও আলোচনা,মোঃ আবুল কালাম আজাদ,TK. 500,TK. 300,https://rokomari.com//book/155431/namjarir-bidhansoho-jomijoma-songkranto-ayin-o-alochona,https://ds.rokomari.store/rokomari110/ProductNew20190903/130X186/a390f517a_155431.jpg,"",নামজারীর বিধানসহ জমিজমা সংক্রান্ত আইন ও আলোচনা,মোঃ আবুল কালাম আজাদ, , ,লিপি ‘ল’ বুক হাউজ, ,"8th Edition,2015",380,বাংলাদেশ,বাংলা
দেওয়ানী মামলার সমস্যা ও সমাধান,মোঃ আবুল কালাম আজাদ,TK. 700,TK. 490,https://rokomari.com//book/49131/dewani-mamlar-somosha-o-somadhan,https://ds.rokomari.store/rokomari110/ProductNew20190903/130X186/book_av.png,"",দেওয়ানী মামলার সমস্যা ও সমাধান,মোঃ আবুল কালাম আজাদ, , ,লিপি ‘ল’ বুক হাউজ, ,"5th Edition,2013",512,বাংলাদেশ,বাংলা
"লিগ্যাল নোটিশ, এফিডেভিট এ্যান্ড পার্টনারশিপ ডিড ",মোঃ আবুল কালাম আজাদ,TK. 350,TK. 245,https://rokomari.com//book/47660/ligal-notice--afidevit-and-partnarship-deed,https://ds.rokomari.store/rokomari110/ProductNew20190903/130X186/74ab14f0f_47660.jpg,"","লিগ্যাল নোটিশ,এফিডেভিট এ্যান্ড পার্টনারশিপ ডিড",মোঃ আবুল কালাম আজাদ, , ,লিপি ‘ল’ বুক হাউজ, ,"6th Edition,2014",148,বাংলাদেশ,বাংলা
