Title,Author,Original Price,Discounted Price,URL,Image,Summary,Book_Title,Book_Author,Translator,Editor,Publisher,ISBN,Edition,Number Of Pages,Country,Language
Travel Agency and Tour Operation: Concepts and Principles,জগমোহন নেজি,"","TK. 1,001",https://rokomari.com//book/121934/travel-agency-and-tour-operation--concepts-and-principles,https://ds.rokomari.store/rokomari110/ProductNew20190903/130X186/bf05ab49d_121934.jpg,"",Travel Agency and Tour Operation: Concepts and Principles,Jagmohan Negi, , ,Kanishka Pub.,9788173911712,"1st Edition,2006",498,India,English
Conversion: Constitutional and Legal Implications,ফাইজান মুস্তফা,"",TK. 810,https://rokomari.com//book/171102/conversion--constitutional-and-legal-implications,https://ds.rokomari.store/rokomari110/ProductNew20190903/130X186/bd5799c3a_171102.jpg,"",Conversion: Constitutional and Legal Implications,"Faizan Mustafa,Anurag Sharma", , ,Kanishka Pub.,9788173915444,"1st Edition,2003",196,India,English
Advanced Educational Administration,তারা চাঁদ,"",TK. 196,https://rokomari.com//book/167729/advanced-educational-administration,https://ds.rokomari.store/rokomari110/ProductNew20190903/130X186/book_av.png,"",Advanced Educational Administration,Tara Chand, , ,Kanishka Pub.,9788173915871, , ,India,English
Cash Flow As Detector And Predictor Of Corporate Sickness (Hardcover),ডি ডি সাহু,"",TK. 895,https://rokomari.com//book/71332/cash-flow-as-detector-and-predictor-of-corporate-sickness--hardcover-,https://ds.rokomari.store/rokomari110/ProductNew20190903/130X186/rokimg_20150115_71332.gif,"",Cash Flow As Detector And Predictor Of Corporate Sickness (Hardcover),D D Sahu, , ,Kanishka Pub.,9788185475790,1993, ,India,English
Management of Quality Control and Standardisation (Hard cover),অতুল জাইসয়াল,"",TK. 810,https://rokomari.com//book/70747/management-of-quality-control-and-standardisation--hard-cover-,https://ds.rokomari.store/rokomari110/ProductNew20190903/130X186/rokimg_20150807_70747.gif,"",Management of Quality Control and Standardisation (Hard cover),Atul Jaiswal, , ,Kanishka Pub.,9788173912597,1998,263,India,English
Investment Policy and Mutual Funds (Hardcover) ,এম. জয়াদেব,"","TK. 1,070",https://rokomari.com//book/59019/investment-policy-and-mutual-funds--hardcover-,https://ds.rokomari.store/rokomari110/ProductNew20190903/130X186/rokimg_20150807_59019.gif,"",Investment Policy and Mutual Funds (Hardcover),M. Jayadev, , ,Kanishka Pub.,9788173912436,1998,316,India,English
Marketing and Sales management,ওয়াধা ভী.,"","TK. 1,100",https://rokomari.com//book/59020/marketing-and-sales-management,https://ds.rokomari.store/rokomari110/ProductNew20190903/130X186/rokimg_20150418_59020.gif,"",Marketing and Sales management,Wadhwa V., , ,Kanishka Pub.,9788173912290,1998, ,India,English
