Title,Author,Original Price,Discounted Price,URL,Image,Summary,Book_Title,Book_Author,Translator,Editor,Publisher,ISBN,Edition,Number Of Pages,Country,Language
সোনালি ডানার চিল,মমিনুল ইসলাম,TK. 160,TK. 141,https://rokomari.com//book/61563/sonali-danar-chil,https://ds.rokomari.store/rokomari110/ProductNew20190903/130X186/imgrok2_61563.GIF,"ফ্ল্যাপে লিখা কথা 
একদিন রুমী বলল, ওর বাসায় নাকি বিয়ের তোড় জোড় শুরু হয়ে গেছে। এখন সে কি করবে? রায়হান রুমীকে বলল, চিন্তা কর না সব ঠিক করে নেব।

রায়হান শুধু রুমীকে আশ্বস্ত করতে পারল কিন্তু নিজে আশ্বস্ত হতে পারল না। বাড়িতে তো আর অবস্থান ভালো না। বাবা থেকেও নেই। আর খালা বা সৎ মা, ওখানেও খুব একটা সুবিধা হবে বলে মনে হয় না। রায়হান সাত-পাঁচ ভাবতে ভাবতে শেষ পর্যন্ত বন্ধু রিয়াজের শরণাপণ্ন হলো। দুই বন্ধু মিলে বুদ্ধি বের করে সিদ্ধান্ত নিয়ে ফেলল। সোজা কাজী অফিস তার পর সবাইকে জানিয়ে দেবে তখন যা হয় হবে......",সোনালি ডানার চিল,মমিনুল ইসলাম, , ,হেরিটেজ পাবলিশার্স ইড. কে. লিঃ, , , ,বাংলাদেশ,বাংলা
রূপসী শূন্যতা,মোঃ ছাইফুল্লাহ,TK. 80,TK. 72,https://rokomari.com//book/12980/ruposhi-sunnota,https://ds.rokomari.store/rokomari110/ProductNew20190903/130X186/book_av.png,"",রূপসী শূন্যতা,মোঃ ছাইফুল্লাহ, , ,হেরিটেজ পাবলিশার্স ইড. কে. লিঃ, , , ,বাংলাদেশ,বাংলা
হলিডে ইন ইউরোপ এন্ড এশিয়া,মমিনুল ইসলাম,TK. 175,TK. 154,https://rokomari.com//book/12982/holiday-in-europ---asia,https://ds.rokomari.store/rokomari110/ProductNew20190903/130X186/book_av.png,"",হলিডে ইন ইউরোপ এন্ড এশিয়া,মমিনুল ইসলাম, , ,হেরিটেজ পাবলিশার্স ইড. কে. লিঃ, , , ,বাংলাদেশ,বাংলা
